;"Generated by FINAN XBRL Taxonomy Viewer v4.4.1"
;"Taxonomy: BT20151(BankRptIhzAangifte2014)"

"Sort";"ID";"Level";"Label nl";"Label en";"PreferredLabelRole";"ElementName";"NamespaceAlias";"FinanVarName";"Url";"SubstitutionGroup";"UseCount";"IsTuple";"IsTupleKey";"IsInThisTuple";"TupleDepth";"TupleInstanceOrder";"MinTupleInstances";"MaxTupleInstances";"ElementType";"ShortElementType";"BaseType";"DataType (FMT4)";"InputRequired";"Pattern";"Enumeration";"FractionDigits";"TotalDigits";"Length";"MinLength";"MaxLength";"MinInclusive";"MaxInclusive";"MinExclusive";"MaxExclusive";"PeriodType";"Balance";"Abstract";"Nillable";"Documentation nl";"Documentation en";"Ddef.Guidance nl";"Ddef.Guidance en";"References"
1;"bank-abstracts:ReportTitle";1;"Rapportage";"Report";"";"ReportTitle";"bank-abstracts";"ReportTitle";"https://www.sbrbanken.nl/BT2015.1/report/bank/abstracts/bank-abstracts#ReportTitle";"xbrli:item";1;0;0;;"0";"0";"0";"0";"xbrli:stringItemType";"string";"xbrli:stringItemType";"Abstract";"0";;;;;;;;;;;;"Duration";"None";1;0;"";"";"";"";""
2;"bank-abstracts:BankingIncomeTaxTitle";2;"   Bancaire inkomstenbelasting";"   Banking income tax";"";"BankingIncomeTaxTitle";"bank-abstracts";"BankingIncomeTaxTitle";"https://www.sbrbanken.nl/BT2015.1/report/bank/abstracts/bank-abstracts#BankingIncomeTaxTitle";"xbrli:item";1;0;0;;"0";"0";"0";"0";"xbrli:stringItemType";"string";"xbrli:stringItemType";"Abstract";"0";;;;;;;;;;;;"Duration";"None";1;0;"";"";"";"";""
3;"bank-abstracts:BankCommonDataTitle";1;"Algemene gegevens";"Bank common data title";"";"BankCommonDataTitle";"bank-abstracts";"BankCommonDataTitle";"https://www.sbrbanken.nl/BT2015.1/report/bank/abstracts/bank-abstracts#BankCommonDataTitle";"xbrli:item";1;0;0;;"0";"0";"0";"0";"xbrli:stringItemType";"string";"xbrli:stringItemType";"Abstract";"0";;;;;;;;;;;;"Duration";"None";1;0;"";"";"";"";""
4;"kvk-abstr:DocumentInformationTitle";2;"   Informatie over de rapportage";"   Document information";"urn:bank:preflabel:label";"DocumentInformationTitle";"kvk-abstr";"DocumentInformationTitle";"http://www.nltaxonomie.nl/9.0/report/kvk/abstracts/kvk-abstracts#DocumentInformationTitle";"sbr:presentationItem";1;0;0;;"0";"0";"0";"0";"xbrli:stringItemType";"string";"xbrli:stringItemType";"Abstract";"0";;;;;;;;;;;;"Duration";"None";1;0;"";"";"";"";""
5;"bank-cd:ReasonDelivery";3;"      Reden levering";"      Reason delivery";"";"ReasonDelivery";"bank-cd";"ReasonDelivery";"https://www.sbrbanken.nl/BT2015.1/basis/bank/items/bank-common-data#ReasonDelivery";"xbrli:item";1;0;0;;"0";"0";"0";"0";"bank-codes:ReasonDeliveryItemType";"ReasonDelivery";"xbrli:stringItemType";"Enumeration";"0";"";"Bijzonder Beheer|Juridische omzetting|Kredietwijziging|Nieuwe Aanvraag|Revisie|Overig";"";"";"";"";"";"";"";"";"";"Duration";"None";0;0;"De reden waarom de kredietrapportage wordt aangeleverd.";"";"De reden waarom de kredietrapportage wordt aangeleverd.";"";""
6;"nl-cd:StartDateForFinancialPeriod";3;"      Begindatum rapportageperiode";"      Start date for financial period";"";"StartDateForFinancialPeriod";"nl-cd";"StartDateForFinancialPeriod";"http://www.nltaxonomie.nl/9.0/basis/sbr/items/nl-common-data#StartDateForFinancialPeriod";"xbrli:item";1;0;0;;"0";"0";"0";"0";"xbrli:dateItemType";"date";"xbrli:dateItemType";"Date";"0";;;;;;;;;;;;"Duration";"None";0;0;"De startdatum van de financiële periode waarover wordt gerapporteerd volgens ISO 8601 in het formaat: jjjj-mm-dd.";"The date of the start of the financial period being reported, according to ISO 8601 with the format: yyyy-mm-dd.";"De begindatum van de rapportageperiode";"";"Article: 362, Name: Burgerlijk Wetboek Boek 2, Paragraph: 3"
7;"nl-cd:EndDateForFinancialPeriod";3;"      Einddatum rapportageperiode";"      End date for financial period";"";"EndDateForFinancialPeriod";"nl-cd";"EndDateForFinancialPeriod";"http://www.nltaxonomie.nl/9.0/basis/sbr/items/nl-common-data#EndDateForFinancialPeriod";"xbrli:item";1;0;0;;"0";"0";"0";"0";"xbrli:dateItemType";"date";"xbrli:dateItemType";"Date";"0";;;;;;;;;;;;"Duration";"None";0;0;"De einddatum van de financiële periode waarover wordt gerapporteerd volgens ISO 8601 in het formaat: jjjj-mm-dd.";"The date of the end of the financial period being reported, according to ISO 8601 with the format: yyyy-mm-dd.";"De einddatum van de rapportageperiode";"";"Article: 362, Name: Burgerlijk Wetboek Boek 2, Paragraph: 2|Article: 362, Name: Burgerlijk Wetboek Boek 2, Paragraph: 3"
8;"bank-ihz-tuples:PartyFilingTaxReturnTitle";2;"   Belastingplichtige";"   Party filing tax return title";"";"PartyFilingTaxReturnTitle";"bank-ihz-tuples";"PartyFilingTaxReturnTitle";"https://www.sbrbanken.nl/BT2015.1/domein/bank/tuples/bank-ihz-tuples#PartyFilingTaxReturnTitle";"xbrli:tuple";1;1;0;;"0";"0";"0";"-1";"";"";"";"Abstract";"0";;;;;;;;;;;;"Other";"None";0;0;"";"";"";"";""
9;"bd-alg:Initials";3;"      Voorletters";"      Initials";"";"Initials";"bd-alg";"Initials";"http://www.nltaxonomie.nl/9.0/basis/bd/items/bd-algemeen#Initials";"xbrli:item";2;0;0;"bank-ihz-tuples:PartyFilingTaxReturnTitle";"1";"0";"0";"0";"bd-types:anstring10VItemType";"anstring10V";"xbrli:tokenItemType";"String";"1";"";"";"";"";"";"1";"10";"";"";"";"";"Duration";"None";0;0;"";"";"De voorletters van een natuurlijk persoon.";"";"Name: belastingdienst taxonomie definities.pdf, Paragraph: 9, Chapter: mda definities"
10;"bd-alg:Prefix";3;"      Tussenvoegsel";"      Prefix";"";"Prefix";"bd-alg";"Prefix";"http://www.nltaxonomie.nl/9.0/basis/bd/items/bd-algemeen#Prefix";"xbrli:item";2;0;0;"bank-ihz-tuples:PartyFilingTaxReturnTitle";"1";"1";"0";"0";"bd-types:anstring10VItemType";"anstring10V";"xbrli:tokenItemType";"String";"0";"";"";"";"";"";"1";"10";"";"";"";"";"Duration";"None";0;0;"";"";"Met tussenvoegsel wordt het eerste deel van de achternaam bedoeld (Bijvoorbeeld ""De"" in ""De Vries"").";"";"Name: belastingdienst taxonomie definities.pdf, Paragraph: 10, Chapter: mda definities"
11;"bd-alg:Surname";3;"      Achternaam";"      Surname";"";"Surname";"bd-alg";"Surname";"http://www.nltaxonomie.nl/9.0/basis/bd/items/bd-algemeen#Surname";"xbrli:item";2;0;0;"bank-ihz-tuples:PartyFilingTaxReturnTitle";"1";"2";"0";"0";"bd-types:anstring200VItemType";"anstring200V";"xbrli:tokenItemType";"String";"1";"";"";"";"";"";"1";"200";"";"";"";"";"Duration";"None";0;0;"";"";"De familienaam van een natuurlijk persoon.";"";"Name: belastingdienst taxonomie definities.pdf, Paragraph: 11, Chapter: mda definities"
12;"nl-cd:DateOfBirth";3;"      Geboortedatum";"      Date of birth";"";"DateOfBirth";"nl-cd";"DateOfBirth";"http://www.nltaxonomie.nl/9.0/basis/sbr/items/nl-common-data#DateOfBirth";"xbrli:item";2;0;0;"bank-ihz-tuples:PartyFilingTaxReturnTitle";"1";"3";"0";"0";"xbrli:dateItemType";"date";"xbrli:dateItemType";"Date";"1";;;;;;;;;;;;"Duration";"None";0;0;"De datum waarop de persoon is geboren.";"The date on which a person is born.";"De datum waarop de persoon, waarover de rapportage gaat, is geboren.";"";"Name: LO3.7, Page: 240, Publisher: Gemeentelijke basisadministratie"
13;"bank-ihz-tuples:HomeAddressTitle";3;"      Huisadres belastingplichtige";"      Home address title";"";"HomeAddressTitle";"bank-ihz-tuples";"HomeAddressTitle";"https://www.sbrbanken.nl/BT2015.1/domein/bank/tuples/bank-ihz-tuples#HomeAddressTitle";"xbrli:tuple";1;1;0;"bank-ihz-tuples:PartyFilingTaxReturnTitle";"1";"4";"0";"-1";"";"";"";"Abstract";"0";;;;;;;;;;;;"Other";"None";0;0;"";"";"";"";""
14;"nl-cd:DescriptionLocationNL";4;"         Locatieomschrijving NL";"         Description of location NL";"";"DescriptionLocationNL";"nl-cd";"DescriptionLocationNL";"http://www.nltaxonomie.nl/9.0/basis/sbr/items/nl-common-data#DescriptionLocationNL";"xbrli:item";2;0;0;"bank-ihz-tuples:PartyFilingTaxReturnTitle#bank-ihz-tuples:HomeAddressTitle";"2";"0";"0";"0";"xbrli:stringItemType";"string";"xbrli:stringItemType";"String";"0";;;;;;;;;;;;"Duration";"None";0;0;"Een nadere aanduiding bij de adresgegevens om de plaats aan te duiden waar de persoon dan wel een organisatie bereikbaar is.";"More information on address to identify the location where the person or organisation is located.";"Hier dienen de zakelijke adresgegevens te worden opgegeven.";"";"IssueDate: 2002, Name: NEN5825"
15;"nl-cd:StreetNameNL";4;"         Straatnaam NL";"         Street name NL";"";"StreetNameNL";"nl-cd";"StreetNameNL";"http://www.nltaxonomie.nl/9.0/basis/sbr/items/nl-common-data#StreetNameNL";"xbrli:item";2;0;0;"bank-ihz-tuples:PartyFilingTaxReturnTitle#bank-ihz-tuples:HomeAddressTitle";"2";"1";"0";"0";"xbrli:stringItemType";"string";"xbrli:stringItemType";"String";"0";;;;;;;;;;;;"Duration";"None";0;0;"De officiële door de gemeente vastgestelde naam van een straat.";"The official registered name of a street as determined by the city council.";"De officiële straatnaam.";"";"IssueDate: 2002, Name: NEN5825|Chapter: 300, Name: Richtlijnen voor de Jaarverslaggeving, Paragraph: 105, Subparagraph: a|Chapter: B18, Name: Richtlijnen voor de Jaarverslaggeving voor kleine rechtspersonen, Paragraph: 104"
16;"nl-cd:HouseNumberNL";4;"         Huisnummer";"         House number";"";"HouseNumberNL";"nl-cd";"HouseNumberNL";"http://www.nltaxonomie.nl/9.0/basis/sbr/items/nl-common-data#HouseNumberNL";"xbrli:item";2;0;0;"bank-ihz-tuples:PartyFilingTaxReturnTitle#bank-ihz-tuples:HomeAddressTitle";"2";"2";"0";"0";"nl-types:nonNegativeItemType";"nonNegative";"xbrli:stringItemType";"String";"1";"([0-9]*)";"";"";"";"";"";"";"";"";"";"";"Duration";"None";0;0;"De numerieke aanduiding zoals deze door de gemeente aan het object is toegekend.";"The numeric part of the object as designated by the municipality.";"Het huisnummer.";"";"IssueDate: 2002, Name: NEN5825|Chapter: 300, Name: Richtlijnen voor de Jaarverslaggeving, Paragraph: 105, Subparagraph: a|Chapter: B18, Name: Richtlijnen voor de Jaarverslaggeving voor kleine rechtspersonen, Paragraph: 104"
17;"nl-cd:HouseNumberAddition";4;"         Huisnummer toevoeging";"         House number addition";"";"HouseNumberAddition";"nl-cd";"HouseNumberAddition";"http://www.nltaxonomie.nl/9.0/basis/sbr/items/nl-common-data#HouseNumberAddition";"xbrli:item";2;0;0;"bank-ihz-tuples:PartyFilingTaxReturnTitle#bank-ihz-tuples:HomeAddressTitle";"2";"3";"0";"0";"xbrli:stringItemType";"string";"xbrli:stringItemType";"String";"0";;;;;;;;;;;;"Duration";"None";0;0;"De huisnummertoevoeging zoals deze door de gemeente aan het object is toegekend.";"The house number addition as designated by the municipality.";"De toevoeging aan het huisnummer, bijvoorbeeld ""A"" of ""2 hoog"".";"";"IssueDate: 2002, Name: NEN5825|Chapter: 300, Name: Richtlijnen voor de Jaarverslaggeving, Paragraph: 105, Subparagraph: a|Chapter: B18, Name: Richtlijnen voor de Jaarverslaggeving voor kleine rechtspersonen, Paragraph: 104"
18;"nl-cd:PostalCodeNL";4;"         Postcode NL";"         Postal code NL";"";"PostalCodeNL";"nl-cd";"PostalCodeNL";"http://www.nltaxonomie.nl/9.0/basis/sbr/items/nl-common-data#PostalCodeNL";"xbrli:item";2;0;0;"bank-ihz-tuples:PartyFilingTaxReturnTitle#bank-ihz-tuples:HomeAddressTitle";"2";"4";"0";"0";"nl-types:nlzipItemType";"nlzip";"xbrli:stringItemType";"String";"1";"([1-9]{1}[0-9]{3}[A-Z]{2})";"";"";"";"";"";"";"";"";"";"";"Duration";"None";0;0;"De officiële codering van PostNL voor een Nederlands postadres, bestaande uit een numeriek deel en een alfabetisch deel.";"The official coding of PostNL for a Dutch postal address, consisting of a numeric part and an alphabetic part.";"De postcode van het adres.";"";"IssueDate: 2002, Name: NEN5825|Chapter: 300, Name: Richtlijnen voor de Jaarverslaggeving, Paragraph: 105, Subparagraph: a|Chapter: B18, Name: Richtlijnen voor de Jaarverslaggeving voor kleine rechtspersonen, Paragraph: 104|Article: 37, Name: Wet op de omzetbelasting 1968, Paragraph: a"
19;"nl-cd:PlaceOfResidenceNL";4;"         Woonplaats NL";"         Place of residence NL";"";"PlaceOfResidenceNL";"nl-cd";"PlaceOfResidenceNL";"http://www.nltaxonomie.nl/9.0/basis/sbr/items/nl-common-data#PlaceOfResidenceNL";"xbrli:item";2;0;0;"bank-ihz-tuples:PartyFilingTaxReturnTitle#bank-ihz-tuples:HomeAddressTitle";"2";"5";"0";"0";"xbrli:stringItemType";"string";"xbrli:stringItemType";"String";"0";;;;;;;;;;;;"Duration";"None";0;0;"De officiële door de gemeente vastgestelde gemeentenaam.";"The official municipality name as designated by the municipality.";"De plaats van vestiging van de onderneming.";"";"Name: LO3.7, Page: 255, Publisher: Gemeentelijke basisadministratie|IssueDate: 2002, Name: NEN5825|Chapter: 300, Name: Richtlijnen voor de Jaarverslaggeving, Paragraph: 105, Subparagraph: a|Chapter: B18, Name: Richtlijnen voor de Jaarverslaggeving voor kleine rechtspersonen, Paragraph: 104|Article: 37, Name: Wet op de omzetbelasting 1968, Paragraph: a"
20;"nl-cd:NameRegion";4;"         Regionaam";"         Name region";"";"NameRegion";"nl-cd";"NameRegion";"http://www.nltaxonomie.nl/9.0/basis/sbr/items/nl-common-data#NameRegion";"xbrli:item";2;0;0;"bank-ihz-tuples:PartyFilingTaxReturnTitle#bank-ihz-tuples:HomeAddressTitle";"2";"6";"0";"0";"xbrli:stringItemType";"string";"xbrli:stringItemType";"String";"0";;;;;;;;;;;;"Duration";"None";0;0;"Adres element dat het geografische of administratieve gebied specificeert waarin een stad is opgenomen.";"Address element specifying the geographic or administrative area of the country in which the town is situated.";"De naam van de provincie.";"";"IssueDate: 2011, Name: NEN14142-1|Chapter: 300, Name: Richtlijnen voor de Jaarverslaggeving, Paragraph: 105, Subparagraph: a|Chapter: B18, Name: Richtlijnen voor de Jaarverslaggeving voor kleine rechtspersonen, Paragraph: 104"
21;"nl-cd:CountryName";4;"         Landnaam, ISO";"         Country name, ISO";"";"CountryName";"nl-cd";"CountryName";"http://www.nltaxonomie.nl/9.0/basis/sbr/items/nl-common-data#CountryName";"xbrli:item";2;0;0;"bank-ihz-tuples:PartyFilingTaxReturnTitle#bank-ihz-tuples:HomeAddressTitle";"2";"7";"0";"0";"xbrli:tokenItemType";"token";"xbrli:tokenItemType";"String";"0";;;;;;;;;;;;"Duration";"None";0;0;"Adres element gebruik makend van de ISO 3166-1 code voor landen, territorium of gebied met geopolitieke belangen, waarin een leveringspunt is gelokaliseerd of hoe het leveringspunt bereikt kan worden.";"Address element designating the country, dependency or area of geopolitical interest, in which a delivery point is located or via which the delivery point is accessed.";"De code voor het betreffende land. Dit is een codering waar voor elk land een code van drie tekens van toepassing is. Voor bijvoorbeeld Nederland is dat NLD.";"";"IssueDate: 2011, Name: NEN14142-1|Chapter: 300, Name: Richtlijnen voor de Jaarverslaggeving, Paragraph: 105, Subparagraph: a|Chapter: B18, Name: Richtlijnen voor de Jaarverslaggeving voor kleine rechtspersonen, Paragraph: 104"
22;"bd-abstr:EnterpriseGeneralInformationTitle";2;"   Algemene gegevens onderneming";"   Enterprise general information";"urn:bank:preflabel:label";"EnterpriseGeneralInformationTitle";"bd-abstr";"EnterpriseGeneralInformationTitle";"http://www.nltaxonomie.nl/9.0/report/bd/abstracts/bd-abstracts#EnterpriseGeneralInformationTitle";"sbr:presentationItem";1;0;0;;"0";"0";"0";"0";"xbrli:stringItemType";"string";"xbrli:stringItemType";"Abstract";"0";;;;;;;;;;;;"Duration";"None";1;0;"";"";"";"";""
23;"bank-cd:RegistrationChamberOfCommerce";3;"      Inschrijfnummer KvK";"      Registration chamber of commerce";"";"RegistrationChamberOfCommerce";"bank-cd";"RegistrationChamberOfCommerce";"https://www.sbrbanken.nl/BT2015.1/basis/bank/items/bank-common-data#RegistrationChamberOfCommerce";"xbrli:item";1;0;0;;"0";"0";"0";"0";"xbrli:stringItemType";"string";"xbrli:stringItemType";"String";"0";;;;;;;;;;;;"Duration";"None";0;0;"Het KvK-inschrijfnummer van de onderneming.";"";"Het KvK-inschrijfnummer van de onderneming.";"";""
24;"nl-cd:NameBusiness";3;"      Handelsnaam van de onderneming";"      Trade name of the company";"";"NameBusiness";"nl-cd";"NameBusiness";"http://www.nltaxonomie.nl/9.0/basis/sbr/items/nl-common-data#NameBusiness";"xbrli:item";1;0;0;;"0";"0";"0";"0";"xbrli:stringItemType";"string";"xbrli:stringItemType";"String";"0";;;;;;;;;;;;"Duration";"None";0;0;"De naam waaronder de onderneming wordt gedreven.";"The name under which a company is run.";"De handelsnaam van de onderneming.";"";"Article: 1, Name: Handelsnaamwet|Chapter: 110, Name: Richtlijnen voor de Jaarverslaggeving, Paragraph: 103, Subparagraph: a"
25;"bank-cd:DateEstablishmentEntity";3;"      Oprichtingsdatum onderneming";"      Date establishment entity";"";"DateEstablishmentEntity";"bank-cd";"DateEstablishmentEntity";"https://www.sbrbanken.nl/BT2015.1/basis/bank/items/bank-common-data#DateEstablishmentEntity";"xbrli:item";1;0;0;;"0";"0";"0";"0";"xbrli:dateItemType";"date";"xbrli:dateItemType";"Date";"0";;;;;;;;;;;;"Duration";"None";0;0;"Oprichtingsdatum van de onderneming.";"";"Oprichtingsdatum van de onderneming.";"";""
26;"nl-cd:TelephoneNumber";3;"      Telefoonnummer";"      Telephone number";"";"TelephoneNumber";"nl-cd";"TelephoneNumber";"http://www.nltaxonomie.nl/9.0/basis/sbr/items/nl-common-data#TelephoneNumber";"xbrli:item";1;0;0;;"0";"0";"0";"0";"xbrli:stringItemType";"string";"xbrli:stringItemType";"String";"0";;;;;;;;;;;;"Duration";"None";0;0;"Het nummer waaronder een persoon of organisatie telefonisch te bereiken is, bestaande uit een netnummer en een abonneenummer.";"The number on which a person or organisation can be reached by telephone, consisting of an area code and a subscriber number.";"Het telefoonnummer.";"";"IssueDate: 2002, Name: NEN5825|Article: 37, Name: Wet op de omzetbelasting 1968, Paragraph: a"
27;"nl-cd:EmailAddressFull";3;"      E-mailadres";"      Email address";"http://www.xbrl.org/2003/role/terseLabel";"EmailAddressFull";"nl-cd";"EmailAddressFull";"http://www.nltaxonomie.nl/9.0/basis/sbr/items/nl-common-data#EmailAddressFull";"xbrli:item";1;0;0;;"0";"0";"0";"0";"nl-types:emailItemType";"email";"xbrli:stringItemType";"String";"0";"[^@]+@[^@]+";"";"";"";"";"6";"254";"";"";"";"";"Duration";"None";0;0;"Het adres waaronder een persoon of organisatie via het internet per elektronische post te bereiken is.";"The address with which the person or organisation is contacted through the internet electronic mail.";"Het (volledige) email adres.";"";"IssueDate: 2002, Name: NEN5825"
28;"bank-tuples:LocationActualActivitiesAddressNLSpecification";3;"      Vestigingsadres in Nederland";"      Address of actual establishment in the Netherlands specification";"";"LocationActualActivitiesAddressNLSpecification";"bank-tuples";"LocationActualActivitiesAddressNLSpecification";"https://www.sbrbanken.nl/BT2015.1/domein/bank/tuples/bank-tuples#LocationActualActivitiesAddressNLSpecification";"xbrli:tuple";1;1;0;;"0";"0";"0";"-1";"";"";"";"Abstract";"0";;;;;;;;;;;;"Other";"None";0;0;"";"";"";"";""
29;"nl-cd:DescriptionLocationNL";4;"         Locatieomschrijving NL";"         Description of location NL";"";"DescriptionLocationNL";"nl-cd";"DescriptionLocationNL";"http://www.nltaxonomie.nl/9.0/basis/sbr/items/nl-common-data#DescriptionLocationNL";"xbrli:item";2;0;0;"bank-tuples:LocationActualActivitiesAddressNLSpecification";"1";"0";"0";"0";"xbrli:stringItemType";"string";"xbrli:stringItemType";"String";"0";;;;;;;;;;;;"Duration";"None";0;0;"Een nadere aanduiding bij de adresgegevens om de plaats aan te duiden waar de persoon dan wel een organisatie bereikbaar is.";"More information on address to identify the location where the person or organisation is located.";"Hier dienen de zakelijke adresgegevens te worden opgegeven.";"";"IssueDate: 2002, Name: NEN5825"
30;"nl-cd:StreetNameNL";4;"         Straatnaam NL";"         Street name NL";"";"StreetNameNL";"nl-cd";"StreetNameNL";"http://www.nltaxonomie.nl/9.0/basis/sbr/items/nl-common-data#StreetNameNL";"xbrli:item";2;0;0;"bank-tuples:LocationActualActivitiesAddressNLSpecification";"1";"1";"0";"0";"xbrli:stringItemType";"string";"xbrli:stringItemType";"String";"0";;;;;;;;;;;;"Duration";"None";0;0;"De officiële door de gemeente vastgestelde naam van een straat.";"The official registered name of a street as determined by the city council.";"De officiële straatnaam.";"";"IssueDate: 2002, Name: NEN5825|Chapter: 300, Name: Richtlijnen voor de Jaarverslaggeving, Paragraph: 105, Subparagraph: a|Chapter: B18, Name: Richtlijnen voor de Jaarverslaggeving voor kleine rechtspersonen, Paragraph: 104"
31;"nl-cd:HouseNumberNL";4;"         Huisnummer";"         House number";"";"HouseNumberNL";"nl-cd";"HouseNumberNL";"http://www.nltaxonomie.nl/9.0/basis/sbr/items/nl-common-data#HouseNumberNL";"xbrli:item";2;0;0;"bank-tuples:LocationActualActivitiesAddressNLSpecification";"1";"2";"0";"0";"nl-types:nonNegativeItemType";"nonNegative";"xbrli:stringItemType";"String";"0";"([0-9]*)";"";"";"";"";"";"";"";"";"";"";"Duration";"None";0;0;"De numerieke aanduiding zoals deze door de gemeente aan het object is toegekend.";"The numeric part of the object as designated by the municipality.";"Het huisnummer.";"";"IssueDate: 2002, Name: NEN5825|Chapter: 300, Name: Richtlijnen voor de Jaarverslaggeving, Paragraph: 105, Subparagraph: a|Chapter: B18, Name: Richtlijnen voor de Jaarverslaggeving voor kleine rechtspersonen, Paragraph: 104"
32;"nl-cd:HouseNumberAddition";4;"         Huisnummer toevoeging";"         House number addition";"";"HouseNumberAddition";"nl-cd";"HouseNumberAddition";"http://www.nltaxonomie.nl/9.0/basis/sbr/items/nl-common-data#HouseNumberAddition";"xbrli:item";2;0;0;"bank-tuples:LocationActualActivitiesAddressNLSpecification";"1";"3";"0";"0";"xbrli:stringItemType";"string";"xbrli:stringItemType";"String";"0";;;;;;;;;;;;"Duration";"None";0;0;"De huisnummertoevoeging zoals deze door de gemeente aan het object is toegekend.";"The house number addition as designated by the municipality.";"De toevoeging aan het huisnummer, bijvoorbeeld ""A"" of ""2 hoog"".";"";"IssueDate: 2002, Name: NEN5825|Chapter: 300, Name: Richtlijnen voor de Jaarverslaggeving, Paragraph: 105, Subparagraph: a|Chapter: B18, Name: Richtlijnen voor de Jaarverslaggeving voor kleine rechtspersonen, Paragraph: 104"
33;"nl-cd:POBoxNumber";4;"         Postbusnummer";"         PO box number";"";"POBoxNumber";"nl-cd";"POBoxNumber";"http://www.nltaxonomie.nl/9.0/basis/sbr/items/nl-common-data#POBoxNumber";"xbrli:item";1;0;0;"bank-tuples:LocationActualActivitiesAddressNLSpecification";"1";"4";"0";"0";"nl-types:nonNegativeItemType";"nonNegative";"xbrli:stringItemType";"String";"0";"([0-9]*)";"";"";"";"";"";"";"";"";"";"";"Duration";"None";0;0;"De numerieke aanduiding zoals vastgesteld voor een Nederlandse postbus.";"The numeric part as designated for a Dutch Post Office Box.";"De numerieke aanduiding zoals deze door TPG Post is vastgesteld voor een Nederlandse postbus.";"";"IssueDate: 2002, Name: NEN5825"
34;"nl-cd:PostalCodeNL";4;"         Postcode NL";"         Postal code NL";"";"PostalCodeNL";"nl-cd";"PostalCodeNL";"http://www.nltaxonomie.nl/9.0/basis/sbr/items/nl-common-data#PostalCodeNL";"xbrli:item";2;0;0;"bank-tuples:LocationActualActivitiesAddressNLSpecification";"1";"5";"0";"0";"nl-types:nlzipItemType";"nlzip";"xbrli:stringItemType";"String";"1";"([1-9]{1}[0-9]{3}[A-Z]{2})";"";"";"";"";"";"";"";"";"";"";"Duration";"None";0;0;"De officiële codering van PostNL voor een Nederlands postadres, bestaande uit een numeriek deel en een alfabetisch deel.";"The official coding of PostNL for a Dutch postal address, consisting of a numeric part and an alphabetic part.";"De postcode van het adres.";"";"IssueDate: 2002, Name: NEN5825|Chapter: 300, Name: Richtlijnen voor de Jaarverslaggeving, Paragraph: 105, Subparagraph: a|Chapter: B18, Name: Richtlijnen voor de Jaarverslaggeving voor kleine rechtspersonen, Paragraph: 104|Article: 37, Name: Wet op de omzetbelasting 1968, Paragraph: a"
35;"nl-cd:PlaceOfResidenceNL";4;"         Woonplaats NL";"         Place of residence NL";"";"PlaceOfResidenceNL";"nl-cd";"PlaceOfResidenceNL";"http://www.nltaxonomie.nl/9.0/basis/sbr/items/nl-common-data#PlaceOfResidenceNL";"xbrli:item";2;0;0;"bank-tuples:LocationActualActivitiesAddressNLSpecification";"1";"6";"0";"0";"xbrli:stringItemType";"string";"xbrli:stringItemType";"String";"0";;;;;;;;;;;;"Duration";"None";0;0;"De officiële door de gemeente vastgestelde gemeentenaam.";"The official municipality name as designated by the municipality.";"De plaats van vestiging van de onderneming.";"";"Name: LO3.7, Page: 255, Publisher: Gemeentelijke basisadministratie|IssueDate: 2002, Name: NEN5825|Chapter: 300, Name: Richtlijnen voor de Jaarverslaggeving, Paragraph: 105, Subparagraph: a|Chapter: B18, Name: Richtlijnen voor de Jaarverslaggeving voor kleine rechtspersonen, Paragraph: 104|Article: 37, Name: Wet op de omzetbelasting 1968, Paragraph: a"
36;"nl-cd:NameRegion";4;"         Regionaam";"         Name region";"";"NameRegion";"nl-cd";"NameRegion";"http://www.nltaxonomie.nl/9.0/basis/sbr/items/nl-common-data#NameRegion";"xbrli:item";2;0;0;"bank-tuples:LocationActualActivitiesAddressNLSpecification";"1";"7";"0";"0";"xbrli:stringItemType";"string";"xbrli:stringItemType";"String";"0";;;;;;;;;;;;"Duration";"None";0;0;"Adres element dat het geografische of administratieve gebied specificeert waarin een stad is opgenomen.";"Address element specifying the geographic or administrative area of the country in which the town is situated.";"De naam van de provincie.";"";"IssueDate: 2011, Name: NEN14142-1|Chapter: 300, Name: Richtlijnen voor de Jaarverslaggeving, Paragraph: 105, Subparagraph: a|Chapter: B18, Name: Richtlijnen voor de Jaarverslaggeving voor kleine rechtspersonen, Paragraph: 104"
