143;"bd-abstr:Box2SubstantialBenefitIncomeTitle";2;"   Box 2, inkomen uit aanmerkelijk belang";"   Box 2 income substantial interest";"";"Box2SubstantialBenefitIncomeTitle";"bd-abstr";"Box2SubstantialBenefitIncomeTitle";"http://www.nltaxonomie.nl/9.0/report/bd/abstracts/bd-abstracts#Box2SubstantialBenefitIncomeTitle";"sbr:presentationItem";1;0;0;;"0";"0";"0";"0";"xbrli:stringItemType";"string";"xbrli:stringItemType";"Abstract";"0";;;;;;;;;;;;"Duration";"None";1;0;"";"";"";"";""
144;"bd-burg-tuple:SharesSubstantialInterestSpecification";3;"      Aandelen en dergelijke die tot het aanmerkelijk belang behoorden van u of uw fiscale partner";"      Shares substantial interest";"";"SharesSubstantialInterestSpecification";"bd-burg-tuple";"SharesSubstantialInterestSpecification";"http://www.nltaxonomie.nl/9.0/domein/bd/tuples/bd-burg-tuples#SharesSubstantialInterestSpecification";"sbr:specificationTuple";1;1;0;;"0";"0";"0";"-1";"";"";"";"Abstract";"0";;;;;;;;;;;;"Other";"None";0;0;"";"";"";"";"Article: 4.6, Name: Wet IB2001"
145;"bd-burg:SharesSubstantialInterestCount";4;"         Aantal aandelen en dergelijke aanmerkelijk belang";"         Shares substantial interest count";"";"SharesSubstantialInterestCount";"bd-burg";"SharesSubstantialInterestCount";"http://www.nltaxonomie.nl/9.0/basis/bd/items/bd-burgers#SharesSubstantialInterestCount";"xbrli:item";1;0;0;"bd-burg-tuple:SharesSubstantialInterestSpecification";"1";"1";"0";"0";"bd-types:anstring12VItemType";"anstring12V";"xbrli:tokenItemType";"String";"0";"";"";"";"";"";"1";"12";"";"";"";"";"Duration";"None";0;0;"";"";"Het aantal aandelen en dergelijke, die tot een aanmerkelijk belang (belang van meer dan 5% per onderneming waarin wordt deelgenomen) behoren.";"";"Article: 4.6, Name: Wet IB2001|Article: 4.11, Name: Wet IB2001|Article: 4.10, Name: Wet IB2001|Article: 4.7, Name: Wet IB2001|Article: 4.9, Name: Wet IB2001|Article: 4.8, Name: Wet IB2001|Name: belastingdienst taxonomie definities.pdf, Paragraph: 117543, Chapter: gsp definities"
146;"bd-burg:SharesSubstantialInterestAndSuchDescription";4;"         Omschrijving aandelen en dergelijke aanmerkelijk belang";"         Shares substantial interest and such description";"";"SharesSubstantialInterestAndSuchDescription";"bd-burg";"SharesSubstantialInterestAndSuchDescription";"http://www.nltaxonomie.nl/9.0/basis/bd/items/bd-burgers#SharesSubstantialInterestAndSuchDescription";"xbrli:item";1;0;0;"bd-burg-tuple:SharesSubstantialInterestSpecification";"1";"0";"0";"0";"bd-types:anstring60VItemType";"anstring60V";"xbrli:tokenItemType";"String";"0";"";"";"";"";"";"1";"60";"";"";"";"";"Duration";"None";0;0;"";"";"Omschrijving van de aandelen en dergelijke die op 1 januari van het belastingjaar, al dan niet samen met zijn partner, direct of indirect, tot een aanmerkelijk belang (belang van meer dan 5% per onderneming waarin wordt deelgenomen) van de belastingplichtige behoorden.";"";"Article: 4.11, Name: Wet IB2001|Article: 4.6, Name: Wet IB2001|Article: 4.9, Name: Wet IB2001|Article: 4.8, Name: Wet IB2001|Article: 4.10, Name: Wet IB2001|Article: 4.7, Name: Wet IB2001|Name: belastingdienst taxonomie definities.pdf, Paragraph: 117542, Chapter: gsp definities"
147;"bd-burg:SubstantialInterestRegularBenefitsGrossTotal";3;"      Reguliere voordelen uit het aanmerkelijk belang";"      Substantial interest regular benefits gross total";"";"SubstantialInterestRegularBenefitsGrossTotal";"bd-burg";"SubstantialInterestRegularBenefitsGrossTotal";"http://www.nltaxonomie.nl/9.0/basis/bd/items/bd-burgers#SubstantialInterestRegularBenefitsGrossTotal";"xbrli:item";1;0;0;;"0";"0";"0";"0";"nl-types:monetaryNoDecimalsItemType";"monetaryNoDecimals";"xbrli:monetaryItemType";"Monetary";"0";"";"";"0";"";"";"";"";"";"";"";"";"Duration";"None";0;0;"";"";"Het totaal van de reguliere voordelen uit aanmerkelijk belang, (belang van meer dan 5% per onderneming waarin wordt deelgenomen) voordat dit is verminderd met de aftrekbare kosten. Reguliere voordelen zijn onder andere dividend en andere winstuitkeringen.";"";"Article: 4.13, Name: Wet IB2001|Name: belastingdienst taxonomie definities.pdf, Paragraph: 117560, Chapter: gsp definities"
148;"bd-burg:SubstantialInterestRegularBenefitsDeductibleCostsTotal";3;"      Aftrekbare kosten bij reguliere voordelen uit aanmerkelijk belang";"      Substantial interest regular benefits deductible costs total";"";"SubstantialInterestRegularBenefitsDeductibleCostsTotal";"bd-burg";"SubstantialInterestRegularBenefitsDeductibleCostsTotal";"http://www.nltaxonomie.nl/9.0/basis/bd/items/bd-burgers#SubstantialInterestRegularBenefitsDeductibleCostsTotal";"xbrli:item";1;0;0;;"0";"0";"0";"0";"nl-types:nonNegativeMonetaryNoDecimalsItemType";"nonNegativeMonetaryNoDecimals";"xbrli:monetaryItemType";"Monetary";"0";"";"";"0";"";"";"";"";"0";"";"";"";"Duration";"None";0;0;"";"";"Totaal aftrekbare kosten bij reguliere voordelen uit aanmerkelijk belang (belang van meer dan 5% per onderneming waarin wordt deelgenomen).";"";"Name: belastingdienst taxonomie definities.pdf, Paragraph: 117557, Chapter: gsp definities|Article: 4.15, Name: Wet IB2001"
149;"bd-burg:SubstantialInterestTransferPriceTotal";3;"      Overdrachtsprijs bij verkoop en dergelijke van het aanmerkelijk belang";"      Substantial interest transfer price total";"";"SubstantialInterestTransferPriceTotal";"bd-burg";"SubstantialInterestTransferPriceTotal";"http://www.nltaxonomie.nl/9.0/basis/bd/items/bd-burgers#SubstantialInterestTransferPriceTotal";"xbrli:item";1;0;0;;"0";"0";"0";"0";"nl-types:monetaryNoDecimalsItemType";"monetaryNoDecimals";"xbrli:monetaryItemType";"Monetary";"0";"";"";"0";"";"";"";"";"";"";"";"";"Duration";"None";0;0;"";"";"De totale overdrachtsprijs van het aanmerkelijk belang (belang van meer dan 5% per onderneming waarin wordt deelgenomen)  waarbij de kosten van de overdracht mogen worden afgetrokken van het bedrag.";"";"Article: 4.20, Name: Wet IB2001|Name: belastingdienst taxonomie definities.pdf, Paragraph: 117553, Chapter: gsp definities|Article: 4.22, Name: Wet IB2001"
150;"bd-burg:SubstantialInterestAcquisitionPrice";3;"      Verkrijgingsprijs aanmerkelijk belang";"      Substantial interest acquisition price";"";"SubstantialInterestAcquisitionPrice";"bd-burg";"SubstantialInterestAcquisitionPrice";"http://www.nltaxonomie.nl/9.0/basis/bd/items/bd-burgers#SubstantialInterestAcquisitionPrice";"xbrli:item";1;0;0;;"0";"0";"0";"0";"nl-types:monetaryNoDecimalsItemType";"monetaryNoDecimals";"xbrli:monetaryItemType";"Monetary";"0";"";"";"0";"";"";"";"";"";"";"";"";"Duration";"None";0;0;"";"";"De kosten die gemaakt zijn voor het verkrijgen van het meerderheidsbelang, inclusief notariskosten en dergelijke.";"";"Article: 4.22, Name: Wet IB2001|Article: 4.21, Name: Wet IB2001|Article: 4.23, Name: Wet IB2001|Name: belastingdienst taxonomie definities.pdf, Paragraph: 117552, Chapter: gsp definities"
151;"bd-burg:SubstantialInterestBenefitsSharePartyFilingTaxReturn";3;"      Aandeel voordelen uit aanmerkelijk belang";"      Substantial interest benefits share party filing tax return";"";"SubstantialInterestBenefitsSharePartyFilingTaxReturn";"bd-burg";"SubstantialInterestBenefitsSharePartyFilingTaxReturn";"http://www.nltaxonomie.nl/9.0/basis/bd/items/bd-burgers#SubstantialInterestBenefitsSharePartyFilingTaxReturn";"xbrli:item";1;0;0;;"0";"0";"0";"0";"nl-types:monetaryNoDecimalsItemType";"monetaryNoDecimals";"xbrli:monetaryItemType";"Monetary";"0";"";"";"0";"";"";"";"";"";"";"";"";"Duration";"None";0;0;"";"";"Het aandeel van het aanmerkelijke belang (belang van meer dan 5% per onderneming waarin wordt deelgenomen) dat voorkomt uit de verdeling met een partner gemaakt zijn.";"";"Name: belastingdienst taxonomie definities.pdf, Paragraph: 117549, Chapter: gsp definities|Article: 2.17, Name: Wet IB2001|Article: 4.12, Name: Wet IB2001"
152;"bd-burg:PreservedIncomeFromSubstantialInterestTotal";3;"      Totaal te conserveren inkomen uit aanmerkelijk belang";"      Preserved income from substantial interest total";"";"PreservedIncomeFromSubstantialInterestTotal";"bd-burg";"PreservedIncomeFromSubstantialInterestTotal";"http://www.nltaxonomie.nl/9.0/basis/bd/items/bd-burgers#PreservedIncomeFromSubstantialInterestTotal";"xbrli:item";1;0;0;;"0";"0";"0";"0";"nl-types:monetaryNoDecimalsItemType";"monetaryNoDecimals";"xbrli:monetaryItemType";"Monetary";"0";"";"";"0";"";"";"";"";"";"";"";"";"Duration";"None";0;0;"";"";"Voordelen die worden behaald bij de vervreemding van tot een aanmerkelijk belang (belang van meer dan 5% per onderneming waarin wordt deelgenomen) behorende aandelen of winstbewijzend en die niet doorgeschoven kunnen worden omdat:de vennootschap die de aandelen of winstbewijzen verwerft of verkrijgt niet in Nederland is gevestigd of de werkelijke leiding van een vennootschap uit Nederland wordt verplaatst.";"";"Name: belastingdienst taxonomie definities.pdf, Paragraph: 117544, Chapter: gsp definities|Article: 2.8, Name: Wet IB2001"
153;"bd-burg-tuple:PreservedIncomeFromSubstantialInterestSpecification";3;"      Te conserveren inkomen aanmerkelijk belang";"      Preserved income from substantial interest";"urn:bank:preflabel:label";"PreservedIncomeFromSubstantialInterestSpecification";"bd-burg-tuple";"PreservedIncomeFromSubstantialInterestSpecification";"http://www.nltaxonomie.nl/9.0/domein/bd/tuples/bd-burg-tuples#PreservedIncomeFromSubstantialInterestSpecification";"sbr:specificationTuple";1;1;0;;"0";"0";"0";"-1";"";"";"";"Abstract";"0";;;;;;;;;;;;"Other";"None";0;0;"";"";"";"";""
154;"bd-burg:PreservedIncomeFromSubstantialInterestDescription";4;"         Omschrijving te conserveren inkomen aanmerkelijk belang";"         Preserved income from substantial interest description";"";"PreservedIncomeFromSubstantialInterestDescription";"bd-burg";"PreservedIncomeFromSubstantialInterestDescription";"http://www.nltaxonomie.nl/9.0/basis/bd/items/bd-burgers#PreservedIncomeFromSubstantialInterestDescription";"xbrli:item";1;0;0;"bd-burg-tuple:PreservedIncomeFromSubstantialInterestSpecification";"1";"1";"0";"0";"bd-types:anstring70VItemType";"anstring70V";"xbrli:tokenItemType";"String";"0";"";"";"";"";"";"1";"70";"";"";"";"";"Duration";"None";0;0;"";"";"De omschrijving van het te conserverend inkomen aanmerkelijk belang, het vervreemdingsvoordeel bij emigratie van belastingplichtige of omschrijving van het te conserven inkomen uit aanmerkelijk belang over de periode in het migratiejaar dat belastingplichtige in het buitenland woonde.";"";"Article: 2.8, Name: Wet IB2001|Name: belastingdienst taxonomie definities.pdf, Paragraph: 389, Chapter: mda definities"
155;"bd-burg:PreservedIncomeFromSubstantialInterestAmount";4;"         Te conserveren inkomen aanmerkelijk belang";"         Preserved income from substantial interest amount";"";"PreservedIncomeFromSubstantialInterestAmount";"bd-burg";"PreservedIncomeFromSubstantialInterestAmount";"http://www.nltaxonomie.nl/9.0/basis/bd/items/bd-burgers#PreservedIncomeFromSubstantialInterestAmount";"xbrli:item";1;0;0;"bd-burg-tuple:PreservedIncomeFromSubstantialInterestSpecification";"1";"0";"0";"0";"nl-types:monetaryNoDecimalsItemType";"monetaryNoDecimals";"xbrli:monetaryItemType";"Monetary";"0";"";"";"0";"";"";"";"";"";"";"";"";"Duration";"None";0;0;"";"";"Het te conserverend inkomen aanmerkelijk belang, het vervreemdingsvoordeel bij emigratie van belastingplichtige of het te conserven inkomen uit aanmerkelijk belang over de periode in het migratiejaar dat belastingplichtige in het buitenland woonde.";"";"Article: 2.8, Name: Wet IB2001|Name: belastingdienst taxonomie definities.pdf, Paragraph: 390, Chapter: mda definities"
156;"bd-abstr:Box3IncomeSavingsStocksTitle";2;"   Box 3, voordeel uit sparen en beleggen";"   Box 3 income savings stocks";"";"Box3IncomeSavingsStocksTitle";"bd-abstr";"Box3IncomeSavingsStocksTitle";"http://www.nltaxonomie.nl/9.0/report/bd/abstracts/bd-abstracts#Box3IncomeSavingsStocksTitle";"sbr:presentationItem";1;0;0;;"0";"0";"0";"0";"xbrli:stringItemType";"string";"xbrli:stringItemType";"Abstract";"0";;;;;;;;;;;;"Duration";"None";1;0;"";"";"";"";""
157;"bd-abstr:AssetsPrivateTitle";3;"      Saldi bezittingen";"      Assets private";"";"AssetsPrivateTitle";"bd-abstr";"AssetsPrivateTitle";"http://www.nltaxonomie.nl/9.0/report/bd/abstracts/bd-abstracts#AssetsPrivateTitle";"sbr:presentationItem";1;0;0;;"0";"0";"0";"0";"xbrli:stringItemType";"string";"xbrli:stringItemType";"Abstract";"0";;;;;;;;;;;;"Duration";"None";1;0;"";"";"";"";""
158;"bd-burg:AssetBankAccountSavingsCertificatesEtcBalance";4;"         Saldi bankrekeningen, spaartegoeden, -bewijzen etc.";"         Asset bank account savings certificates etc balance";"";"AssetBankAccountSavingsCertificatesEtcBalance";"bd-burg";"AssetBankAccountSavingsCertificatesEtcBalance";"http://www.nltaxonomie.nl/9.0/basis/bd/items/bd-burgers#AssetBankAccountSavingsCertificatesEtcBalance";"xbrli:item";1;0;0;;"0";"0";"0";"0";"nl-types:nonNegativeMonetaryNoDecimalsItemType";"nonNegativeMonetaryNoDecimals";"xbrli:monetaryItemType";"Monetary";"0";"";"";"0";"";"";"";"";"0";"";"";"";"Duration";"None";0;0;"";"";"Het gemiddelde bedrag, gebaseerd op de begin- en eindstand van de saldi van bankrekeningen, spaartegoeden, spaarbewijzen etc.";"";"Article: 5.3, Name: Wet IB2001, Paragraph: 2|Name: belastingdienst taxonomie definities.pdf, Paragraph: 374, Chapter: mda definities"
159;"bd-burg:StockTotal";4;"         Totaal effectenbezit";"         Stock total";"";"StockTotal";"bd-burg";"StockTotal";"http://www.nltaxonomie.nl/9.0/basis/bd/items/bd-burgers#StockTotal";"xbrli:item";1;0;0;;"0";"0";"0";"0";"nl-types:nonNegativeMonetaryNoDecimalsItemType";"nonNegativeMonetaryNoDecimals";"xbrli:monetaryItemType";"Monetary";"0";"";"";"0";"";"";"";"";"0";"";"";"";"Duration";"None";0;0;"";"";"Het totaal van de waarde van het effecten (obligaties en aandelen niet behorend tot een aanmerkelijk belang) .";"";"Article: 5.3, Name: Wet IB2001, Paragraph: 2, Subparagraph: e|Name: belastingdienst taxonomie definities.pdf, Paragraph: 117599, Chapter: gsp definities|Article: 5.3, Name: Wet IB2001, Paragraph: 2, Subparagraph: f"
160;"bd-burg:ValueCashAndReceivablesTotal";4;"         Totale waarde contant geld en vorderingen";"         Value cash and receivables total";"";"ValueCashAndReceivablesTotal";"bd-burg";"ValueCashAndReceivablesTotal";"http://www.nltaxonomie.nl/9.0/basis/bd/items/bd-burgers#ValueCashAndReceivablesTotal";"xbrli:item";1;0;0;;"0";"0";"0";"0";"nl-types:nonNegativeMonetaryNoDecimalsItemType";"nonNegativeMonetaryNoDecimals";"xbrli:monetaryItemType";"Monetary";"0";"";"";"0";"";"";"";"";"0";"";"";"";"Duration";"None";0;0;"";"";"Totaal bedrag van contant geld en te ontvangen vorderingen.";"";"Article: 5.3, Name: Wet IB2001|Article: 5.19, Name: Wet IB2001|Name: belastingdienst taxonomie definities.pdf, Paragraph: 117602, Chapter: gsp definities"
161;"bd-burg:SecondHouseTotalValue";4;"         Waarde tweede woning(en)";"         Second house total value";"";"SecondHouseTotalValue";"bd-burg";"SecondHouseTotalValue";"http://www.nltaxonomie.nl/9.0/basis/bd/items/bd-burgers#SecondHouseTotalValue";"xbrli:item";1;0;0;;"0";"0";"0";"0";"nl-types:nonNegativeMonetaryNoDecimalsItemType";"nonNegativeMonetaryNoDecimals";"xbrli:monetaryItemType";"Monetary";"0";"";"";"0";"";"";"";"";"0";"";"";"";"Duration";"None";0;0;"";"";"De waarde van de woning(en) die de belastingplichtige bezit en niet gebruikt als hoofdverblijf. Het bedrag wordt bepaald door de WOZ-waarde(n).";"";"Name: belastingdienst taxonomie definities.pdf, Paragraph: 117603, Chapter: gsp definities|Article: 5.20, Name: Wet IB2001, Paragraph: 1"
162;"bd-burg:ImmovablePropertyOtherTotal";4;"         Totale waarde overig onroerend goed";"         Immovable property other total";"";"ImmovablePropertyOtherTotal";"bd-burg";"ImmovablePropertyOtherTotal";"http://www.nltaxonomie.nl/9.0/basis/bd/items/bd-burgers#ImmovablePropertyOtherTotal";"xbrli:item";1;0;0;;"0";"0";"0";"0";"nl-types:nonNegativeMonetaryNoDecimalsItemType";"nonNegativeMonetaryNoDecimals";"xbrli:monetaryItemType";"Monetary";"0";"";"";"0";"";"";"";"";"0";"";"";"";"Duration";"None";0;0;"";"";"Het totaalbedrag van de overige onroerende zaken.";"";"Article: 5.20, Name: Wet IB2001|Name: belastingdienst taxonomie definities.pdf, Paragraph: 117606, Chapter: gsp definities|Article: 5.19, Name: Wet IB2001|Article: 5.3, Name: Wet IB2001, Paragraph: 2"
163;"bd-burg:CapitalInsuranceNonExemptedPartTotal";4;"         Totaal niet vrijgesteld deel kapitaalverzekeringen";"         Capital insurance non exempted part total";"";"CapitalInsuranceNonExemptedPartTotal";"bd-burg";"CapitalInsuranceNonExemptedPartTotal";"http://www.nltaxonomie.nl/9.0/basis/bd/items/bd-burgers#CapitalInsuranceNonExemptedPartTotal";"xbrli:item";1;0;0;;"0";"0";"0";"0";"nl-types:nonNegativeMonetaryNoDecimalsItemType";"nonNegativeMonetaryNoDecimals";"xbrli:monetaryItemType";"Monetary";"0";"";"";"0";"";"";"";"";"0";"";"";"";"Duration";"None";0;0;"";"";"Het totaalbedrag van het niet vrijgestelde deel van kapitaalverzekering(en).";"";"Article: 5.19, Name: Wet IB2001|Name: belastingdienst taxonomie definities.pdf, Paragraph: 117609, Chapter: gsp definities"
164;"bd-burg:PeriodicPaymentsRightsValue";4;"         Rechten op periodieke uitkeringen en verstrekkingen";"         Periodic payments rights value";"";"PeriodicPaymentsRightsValue";"bd-burg";"PeriodicPaymentsRightsValue";"http://www.nltaxonomie.nl/9.0/basis/bd/items/bd-burgers#PeriodicPaymentsRightsValue";"xbrli:item";1;0;0;;"0";"0";"0";"0";"nl-types:nonNegativeMonetaryNoDecimalsItemType";"nonNegativeMonetaryNoDecimals";"xbrli:monetaryItemType";"Monetary";"0";"";"";"0";"";"";"";"";"0";"";"";"";"Duration";"None";0;0;"";"";"Het totaalbedrag van de rechten op periodieke uitkering(en) en verstrekking(en). De verstrekking vertegenwoordigt een bepaalde waarde.";"";"Article: 5.3, Name: Wet IB2001, Paragraph: 2, Subparagraph: f|Name: belastingdienst taxonomie definities.pdf, Paragraph: 117612, Chapter: gsp definities"
165;"bd-burg:AssetsOtherTotalValue";4;"         Totaal overige bezittingen";"         Assets other total value";"";"AssetsOtherTotalValue";"bd-burg";"AssetsOtherTotalValue";"http://www.nltaxonomie.nl/9.0/basis/bd/items/bd-burgers#AssetsOtherTotalValue";"xbrli:item";1;0;0;;"0";"0";"0";"0";"nl-types:nonNegativeMonetaryNoDecimalsItemType";"nonNegativeMonetaryNoDecimals";"xbrli:monetaryItemType";"Monetary";"0";"";"";"0";"";"";"";"";"0";"";"";"";"Duration";"None";0;0;"";"";"Het totaalbedrag van de overige bezittingen.";"";"Article: 5.3, Name: Wet IB2001, Paragraph: 2|Name: belastingdienst taxonomie definities.pdf, Paragraph: 117615, Chapter: gsp definities"
166;"bd-abstr:DebtsBox3Title";3;"      Saldi schulden";"      Debts box 3";"";"DebtsBox3Title";"bd-abstr";"DebtsBox3Title";"http://www.nltaxonomie.nl/9.0/report/bd/abstracts/bd-abstracts#DebtsBox3Title";"sbr:presentationItem";1;0;0;;"0";"0";"0";"0";"xbrli:stringItemType";"string";"xbrli:stringItemType";"Abstract";"0";;;;;;;;;;;;"Duration";"None";1;0;"";"";"";"";""
167;"bd-burg:DebtsBox3ThresholdAmount";4;"         Drempelbedrag schulden";"         Liabilities box 3 threshold amount";"";"DebtsBox3ThresholdAmount";"bd-burg";"DebtsBox3ThresholdAmount";"http://www.nltaxonomie.nl/9.0/basis/bd/items/bd-burgers#DebtsBox3ThresholdAmount";"xbrli:item";1;0;0;;"0";"0";"0";"0";"nl-types:nonNegativeMonetaryNoDecimalsItemType";"nonNegativeMonetaryNoDecimals";"xbrli:monetaryItemType";"Monetary";"0";"";"";"0";"";"";"";"";"0";"";"";"";"Duration";"None";0;0;"";"";"Het bedrag dat niet wordt aangemerkt als aftrekbare schulden.";"";"Name: belastingdienst taxonomie definities.pdf, Paragraph: 117580, Chapter: gsp definities|Article: 5.3, Name: Wet IB2001, Paragraph: 3, Subparagraph: e"
168;"bd-burg:DebtsBox3TotalAmount";4;"         Totaal schulden";"         Liabilities box 3 total amount";"";"DebtsBox3TotalAmount";"bd-burg";"DebtsBox3TotalAmount";"http://www.nltaxonomie.nl/9.0/basis/bd/items/bd-burgers#DebtsBox3TotalAmount";"xbrli:item";1;0;0;;"0";"0";"0";"0";"nl-types:nonNegativeMonetaryNoDecimalsItemType";"nonNegativeMonetaryNoDecimals";"xbrli:monetaryItemType";"Monetary";"0";"";"";"0";"";"";"";"";"0";"";"";"";"Duration";"None";0;0;"";"";"Het totaalbedrag van de schulden die de belastingplichtige is aangegaan, met uitzondering van de schulden aan de Belastingdienst.";"";"Article: 5.3, Name: Wet IB2001, Paragraph: 3|Name: belastingdienst taxonomie definities.pdf, Paragraph: 117581, Chapter: gsp definities"
169;"bd-abstr:SavingAndInvestmentResultsTitle";3;"      Voordeel uit sparen en beleggen";"      Saving and investment results";"";"SavingAndInvestmentResultsTitle";"bd-abstr";"SavingAndInvestmentResultsTitle";"http://www.nltaxonomie.nl/9.0/report/bd/abstracts/bd-abstracts#SavingAndInvestmentResultsTitle";"sbr:presentationItem";1;0;0;;"0";"0";"0";"0";"xbrli:stringItemType";"string";"xbrli:stringItemType";"Abstract";"0";;;;;;;;;;;;"Duration";"None";1;0;"";"";"";"";""
170;"bd-burg:SavingsAndInvestmentsTaxBasePartyShare";4;"         Aandeel aangever rendementsgrondslag";"         Savings and investments tax base party share";"";"SavingsAndInvestmentsTaxBasePartyShare";"bd-burg";"SavingsAndInvestmentsTaxBasePartyShare";"http://www.nltaxonomie.nl/9.0/basis/bd/items/bd-burgers#SavingsAndInvestmentsTaxBasePartyShare";"xbrli:item";1;0;0;;"0";"0";"0";"0";"nl-types:nonNegativeMonetaryNoDecimalsItemType";"nonNegativeMonetaryNoDecimals";"xbrli:monetaryItemType";"Monetary";"0";"";"";"0";"";"";"";"";"0";"";"";"";"Duration";"None";0;0;"";"";"Het aandeel van de aangever in de (gezamenlijke) grondslag sparen en beleggen.";"";"Article: 5.2, Name: Wet IB2001|Name: belastingdienst taxonomie definities.pdf, Paragraph: 520235, Chapter: gsp definities"
171;"bd-abstr:PersonDependentDeductionTitle";2;"   Persoonsgebonden aftrek";"   Person dependent deduction";"";"PersonDependentDeductionTitle";"bd-abstr";"PersonDependentDeductionTitle";"http://www.nltaxonomie.nl/9.0/report/bd/abstracts/bd-abstracts#PersonDependentDeductionTitle";"sbr:presentationItem";1;0;0;;"0";"0";"0";"0";"xbrli:stringItemType";"string";"xbrli:stringItemType";"Abstract";"0";;;;;;;;;;;;"Duration";"None";1;0;"";"";"";"";""
172;"bd-burg:MaintenanceObligationsPeriodicPaymentsPartyFilingTaxReturnPart";3;"      Aandeel uitgaven voor onderhoudsverplichtingen";"      Maintenance obligations periodic payments party filing tax return part";"";"MaintenanceObligationsPeriodicPaymentsPartyFilingTaxReturnPart";"bd-burg";"MaintenanceObligationsPeriodicPaymentsPartyFilingTaxReturnPart";"http://www.nltaxonomie.nl/9.0/basis/bd/items/bd-burgers#MaintenanceObligationsPeriodicPaymentsPartyFilingTaxReturnPart";"xbrli:item";1;0;0;;"0";"0";"0";"0";"nl-types:nonNegativeMonetaryNoDecimalsItemType";"nonNegativeMonetaryNoDecimals";"xbrli:monetaryItemType";"Monetary";"0";"";"";"0";"";"";"";"";"0";"";"";"";"Duration";"None";0;0;"";"";"Het deel van de uitgaven voor onderhoudsverplichtingen dat, als gevolg van de keuze van beide partners, bij de ondernemer in aanmerking wordt genomen.";"";"Article: 2.17, Name: Wet IB2001, Paragraph: 5|Name: belastingdienst taxonomie definities.pdf, Paragraph: 117649, Chapter: gsp definities|Article: 6.3, Name: Wet IB2001|Article: 2.17, Name: Wet IB2001, Paragraph: 2"
173;"bd-burg:VentureCapitalLoansInvestmentsLossPartyFilingTaxReturn";3;"      Aandeel verliezen op beleggingen in durfkapitaal";"      Venture capital loans investments loss party filing tax return";"";"VentureCapitalLoansInvestmentsLossPartyFilingTaxReturn";"bd-burg";"VentureCapitalLoansInvestmentsLossPartyFilingTaxReturn";"http://www.nltaxonomie.nl/9.0/basis/bd/items/bd-burgers#VentureCapitalLoansInvestmentsLossPartyFilingTaxReturn";"xbrli:item";1;0;0;;"0";"0";"0";"0";"nl-types:nonNegativeMonetaryNoDecimalsItemType";"nonNegativeMonetaryNoDecimals";"xbrli:monetaryItemType";"Monetary";"0";"";"";"0";"";"";"";"";"0";"";"";"";"Duration";"None";0;0;"";"";"Het bedrag van de verliezen op durfkapitaal (kapitaal dat aan nieuwe ondernemingen wordt verstrekt of aan bestaande ondernemingen voor nieuwe, afwijkende activiteiten voor onzekere markten) dat bij de belastingaangifte van de ondernemer in aanmerking wordt genomen.";"";"Name: belastingdienst taxonomie definities.pdf, Paragraph: 117784, Chapter: gsp definities|Article: 10a.9, Name: Wet IB2001, Paragraph: 2"
174;"bd-abstr:TaxCreditsTitle";2;"   Heffingskortingen";"   Tax credits";"";"TaxCreditsTitle";"bd-abstr";"TaxCreditsTitle";"http://www.nltaxonomie.nl/9.0/report/bd/abstracts/bd-abstracts#TaxCreditsTitle";"sbr:presentationItem";1;0;0;;"0";"0";"0";"0";"xbrli:stringItemType";"string";"xbrli:stringItemType";"Abstract";"0";;;;;;;;;;;;"Duration";"None";1;0;"";"";"";"";""
175;"bd-burg:GreenInvestmentExemption";3;"      Vrijstelling groene beleggingen";"      Green investment exemption";"";"GreenInvestmentExemption";"bd-burg";"GreenInvestmentExemption";"http://www.nltaxonomie.nl/9.0/basis/bd/items/bd-burgers#GreenInvestmentExemption";"xbrli:item";1;0;0;;"0";"0";"0";"0";"nl-types:nonNegativeMonetaryNoDecimalsItemType";"nonNegativeMonetaryNoDecimals";"xbrli:monetaryItemType";"Monetary";"0";"";"";"0";"";"";"";"";"0";"";"";"";"Duration";"None";0;0;"";"";"Het deel van de waarde van de groene beleggingen die zijn vrijgesteld in box 3 en als basis dient voor de Korting voor groene beleggingen.";"";"Article: 8.19, Name: Wet IB2001|Article: 2.17, Name: Wet IB2001, Paragraph: 2|Article: AV, Name: Invoeringswet Wet IB2001|Name: belastingdienst taxonomie definities.pdf, Paragraph: 635606, Chapter: gsp definities|Article: 5.13, Name: Wet IB2001"
