;"Generated by FINAN XBRL Taxonomy Viewer v4.4.1"
;"Taxonomy: BT11(FrcRptIhzPrognosePeriodiekAangifteMetWinstbijlageCategoriaal2016)"

"Sort";"ID";"Level";"Label en";"Label nl";"Label de";"Label fr";"PreferredLabelRole";"ElementName";"NamespaceAlias";"FinanVarName";"Url";"SubstitutionGroup";"UseCount";"IsTuple";"IsTupleKey";"IsInThisTuple";"TupleDepth";"TupleInstanceOrder";"MinTupleInstances";"MaxTupleInstances";"ElementType";"ShortElementType";"BaseType";"DataType (FMT4)";"InputRequired";"Pattern";"Enumeration";"FractionDigits";"TotalDigits";"Length";"MinLength";"MaxLength";"MinInclusive";"MaxInclusive";"MinExclusive";"MaxExclusive";"PeriodType";"Balance";"Abstract";"Nillable";"Documentation en";"Documentation nl";"Documentation de";"Documentation fr";"Ddef.Guidance en";"Ddef.Guidance nl";"Ddef.Guidance de";"Ddef.Guidance fr";"References"
1;"frc-abstr:IHZReportBanksTitle";1;"IHZ report [title]";"IHZ rapportage [titel]";"IHZ rapportage [titel]";"IHZ rapportage [titel]";"";"IHZReportBanksTitle";"frc-abstr";"IHZReportBanksTitle";"https://www.sbrbanken.nl/bt11/frc/20161209/presentation/frc-abstracts#IHZReportBanksTitle";"sbr:presentationItem";1;0;0;;"0";"0";"0";"0";"xbrli:stringItemType";"string";"xbrli:stringItemType";"Abstract";"0";;;;;;;;;;;;"Duration";"None";1;0;"";"";"";"";"";"";"";"";""
2;"frc-abstr:DocumentEntityInformationBanksTitle";2;"   Document and entity information [title]";"   Informatie over de rapportage en de rechtspersoon [titel]";"   Informatie over de rapportage en de rechtspersoon [titel]";"   Informatie over de rapportage en de rechtspersoon [titel]";"";"DocumentEntityInformationBanksTitle";"frc-abstr";"DocumentEntityInformationBanksTitle";"https://www.sbrbanken.nl/bt11/frc/20161209/presentation/frc-abstracts#DocumentEntityInformationBanksTitle";"sbr:presentationItem";1;0;0;;"0";"0";"0";"0";"xbrli:stringItemType";"string";"xbrli:stringItemType";"Abstract";"0";;;;;;;;;;;;"Duration";"None";1;0;"";"";"";"";"";"";"";"";""
3;"frc-abstr:EntityInformationBanksTitle";3;"      Entity information [title]";"      Informatie over de rechtspersoon [titel]";"      Informatie over de rechtspersoon [titel]";"      Informatie over de rechtspersoon [titel]";"";"EntityInformationBanksTitle";"frc-abstr";"EntityInformationBanksTitle";"https://www.sbrbanken.nl/bt11/frc/20161209/presentation/frc-abstracts#EntityInformationBanksTitle";"sbr:presentationItem";1;0;0;;"0";"0";"0";"0";"xbrli:stringItemType";"string";"xbrli:stringItemType";"Abstract";"0";;;;;;;;;;;;"Duration";"None";1;0;"";"";"";"";"";"";"";"";""
4;"frc-lr:EntityInformation";4;"         Information about the entity";"         Informatie over de rechtspersoon";"         Informatie over de rechtspersoon";"         Informatie over de rechtspersoon";"";"EntityInformation";"frc-lr";"EntityInformation";"https://www.sbrbanken.nl/bt11/frc/20161209/dictionary/frc-linkroles#EntityInformation";"";1;0;0;;"0";"0";"0";"0";"";"";"";"Abstract";"0";;;;;;;;;;;;"Other";"None";1;0;"";"";"";"";"";"";"";"";""
5;"EntityInformation_venj-bw2-i:ChamberOfCommerceRegistrationNumber";5;"            Registration number at the Chamber of Commerce";"            Registratienummer bij de Kamer van Koophandel";"            Registrierungsnummer bei der Handelskammer";"            Numéro d'enregistrement à la Chambre du commerce";"";"ChamberOfCommerceRegistrationNumber";"venj-bw2-i";"EntityInformation_ChamberOfCommerceRegistrationNumber";"EntityInformation_http://www.nltaxonomie.nl/nt11/venj/20161214/dictionary/venj-bw2-data#ChamberOfCommerceRegistrationNumber";"xbrli:item";1;0;0;;"0";"0";"0";"0";"venj-types:chamberOfCommerceRegistrationNumberItemType";"chamberOfCommerceRegistrationNumber";"xbrli:stringItemType";"String";"0";"([1-9][0-9]{7})|([0-9][1-9][0-9]{6})";"";"";"";"8";"";"";"";"";"";"";"Duration";"None";0;0;"";"Het registratienummer bij de kamer van koophandel.";"";"";"";"";"";"";"Article: 380b, IssueDate: 2016-01-01, Name: Burgerlijk wetboek boek 2, Paragraph: d|Chapter: 300, IssueDate: 2016-01-01, Name: Richtlijnen voor de jaarverslaggeving, Paragraph: 104a|Chapter: C1, IssueDate: 2016-01-01, Name: Richtlijnen voor de jaarverslaggeving voor kleine rechtspersonen, Paragraph: 303a"
6;"EntityInformation_venj-bw2-i:LegalEntityName";5;"            Name of the legal entity";"            Naam van de rechtspersoon";"            Name der Körperschaft";"            Nom de l'entité juridique";"";"LegalEntityName";"venj-bw2-i";"EntityInformation_LegalEntityName";"EntityInformation_http://www.nltaxonomie.nl/nt11/venj/20161214/dictionary/venj-bw2-data#LegalEntityName";"xbrli:item";1;0;0;;"0";"0";"0";"0";"nl-types:string100000ItemType";"string100000";"xbrli:stringItemType";"String";"0";"";"";"";"";"";"1";"100000";"";"";"";"";"Duration";"None";0;0;"";"De statutaire naam van de rechtspersoon.";"";"";"";"";"";"";"Article: 380b, IssueDate: 2016-01-01, Name: Burgerlijk wetboek boek 2, Paragraph: a|Chapter: 110, IssueDate: 2016-01-01, Name: Richtlijnen voor de jaarverslaggeving, Paragraph: 103, Subparagraph: a|Chapter: 300, IssueDate: 2016-01-01, Name: Richtlijnen voor de jaarverslaggeving, Paragraph: 104a|Chapter: 640, IssueDate: 2016-01-01, Name: Richtlijnen voor de jaarverslaggeving, Paragraph: 401a|Chapter: 650, IssueDate: 2016-01-01, Name: Richtlijnen voor de jaarverslaggeving, Paragraph: 436|Chapter: A1, IssueDate: 2016-01-01, Name: Richtlijnen voor de jaarverslaggeving voor kleine rechtspersonen, Paragraph: 306|Chapter: B18, IssueDate: 2016-01-01, Name: Richtlijnen voor de jaarverslaggeving voor kleine rechtspersonen, Paragraph: 104, Subparagraph: a|Chapter: C1, IssueDate: 2016-01-01, Name: Richtlijnen voor de jaarverslaggeving voor kleine rechtspersonen, Paragraph: 303a"
7;"EntityInformation_kvk-i:LegalSizeCriteriaClassification";5;"            Classification of the legal entity based on the legal size criteria";"            Classificatie van de rechtspersoon op basis van de wettelijke groottecriteria";"            Classificatie van de rechtspersoon op basis van de wettelijke groottecriteria";"            Classificatie van de rechtspersoon op basis van de wettelijke groottecriteria";"";"LegalSizeCriteriaClassification";"kvk-i";"EntityInformation_LegalSizeCriteriaClassification";"EntityInformation_http://www.nltaxonomie.nl/nt11/kvk/20161214/dictionary/kvk-data#LegalSizeCriteriaClassification";"xbrli:item";1;0;0;;"0";"0";"0";"0";"kvk-codes:legalSizeCriteriaItemType";"legalSizeCriteria";"xbrli:stringItemType";"Enumeration";"0";"";"Groot|Klein|Micro|Middelgroot";"";"";"";"";"";"";"";"";"";"Duration";"None";0;0;"";"";"";"";"";"";"";"";"Article: 396, IssueDate: 2015-01-01, Name: Burgerlijk wetboek boek 2, Paragraph: 1|Article: 397, IssueDate: 2015-01-01, Name: Burgerlijk wetboek boek 2, Paragraph: 1"
8;"EntityInformation_rj-i:BusinessNames";5;"            Business names";"            Handelsnamen";"            Handelsnamen";"            Handelsnamen";"";"BusinessNames";"rj-i";"EntityInformation_BusinessNames";"EntityInformation_http://www.nltaxonomie.nl/nt11/rj/20161214/dictionary/rj-data#BusinessNames";"xbrli:item";1;0;0;;"0";"0";"0";"0";"nl-types:string100000ItemType";"string100000";"xbrli:stringItemType";"String";"0";"";"";"";"";"";"1";"100000";"";"";"";"";"Duration";"None";0;0;"";"De vermelding van de verschillende handelsnamen waaronder de rechtspersoon opereert.";"";"";"";"";"";"";"Chapter: 110, IssueDate: 2016-01-01, Name: Richtlijnen voor de jaarverslaggeving, Paragraph: 103, Subparagraph: a"
9;"EntityInformation_venj-bw2-i:LegalEntityRegisteredOffice";5;"            Registered office";"            Zetel";"            Geschäftssitz der Körperschaft";"            Siège social de l'entité juridique";"";"LegalEntityRegisteredOffice";"venj-bw2-i";"EntityInformation_LegalEntityRegisteredOffice";"EntityInformation_http://www.nltaxonomie.nl/nt11/venj/20161214/dictionary/venj-bw2-data#LegalEntityRegisteredOffice";"xbrli:item";1;0;0;;"0";"0";"0";"0";"nl-types:string100000ItemType";"string100000";"xbrli:stringItemType";"String";"0";"";"";"";"";"";"1";"100000";"";"";"";"";"Duration";"None";0;0;"";"De statutaire vestigingsplaats van de rechtspersoon.";"";"";"";"";"";"";"Article: 380b, IssueDate: 2016-01-01, Name: Burgerlijk wetboek boek 2, Paragraph: c|Chapter: 300, IssueDate: 2016-01-01, Name: Richtlijnen voor de jaarverslaggeving, Paragraph: 104a|Chapter: 300, IssueDate: 2016-01-01, Name: Richtlijnen voor de jaarverslaggeving, Paragraph: 105, Subparagraph: a|Chapter: 640, IssueDate: 2016-01-01, Name: Richtlijnen voor de jaarverslaggeving, Paragraph: 401a|Chapter: 650, IssueDate: 2016-01-01, Name: Richtlijnen voor de jaarverslaggeving, Paragraph: 436|Chapter: B18, IssueDate: 2016-01-01, Name: Richtlijnen voor de jaarverslaggeving voor kleine rechtspersonen, Paragraph: 104, Subparagraph: a|Chapter: C1, IssueDate: 2016-01-01, Name: Richtlijnen voor de jaarverslaggeving voor kleine rechtspersonen, Paragraph: 303a"
10;"EntityInformation_frc-i:DateEstablishmentLegalEntity";5;"            Date establishment entity";"            Oprichtingsdatum onderneming";"            Oprichtingsdatum onderneming";"            Oprichtingsdatum onderneming";"";"DateEstablishmentLegalEntity";"frc-i";"EntityInformation_DateEstablishmentLegalEntity";"EntityInformation_https://www.sbrbanken.nl/bt11/frc/20161209/dictionary/frc-data#DateEstablishmentLegalEntity";"xbrli:item";1;0;0;;"0";"0";"0";"0";"xbrli:dateItemType";"date";"xbrli:dateItemType";"Date";"0";;;;;;;;;;;;"Duration";"None";0;0;"";"Oprichtingsdatum van de onderneming.";"";"";"";"Oprichtingsdatum van de onderneming.";"";"";""
11;"EntityInformation_frc-i:AgriculturalActivities";5;"            Agricultural activities";"            Agrarische activiteiten J/N";"            Agrarische activiteiten J/N";"            Agrarische activiteiten J/N";"";"AgriculturalActivities";"frc-i";"EntityInformation_AgriculturalActivities";"EntityInformation_https://www.sbrbanken.nl/bt11/frc/20161209/dictionary/frc-data#AgriculturalActivities";"xbrli:item";1;0;0;;"0";"0";"0";"0";"nl-codes:yesNoItemType";"yesNo";"xbrli:stringItemType";"Enumeration";"0";"";"Ja|Nee";"";"";"";"";"";"";"";"";"";"Duration";"None";0;0;"";"Indicatie of door de onderneming agrarische activiteiten worden ondernomen.";"";"";"";"Indicatie of door de onderneming agrarische activiteiten worden ondernomen.";"";"";""
12;"frc-abstr:DocumentInformationBanksTitle";3;"      Document information [title]";"      Informatie over de rapportage [titel]";"      Informatie over de rapportage [titel]";"      Informatie over de rapportage [titel]";"";"DocumentInformationBanksTitle";"frc-abstr";"DocumentInformationBanksTitle";"https://www.sbrbanken.nl/bt11/frc/20161209/presentation/frc-abstracts#DocumentInformationBanksTitle";"sbr:presentationItem";1;0;0;;"0";"0";"0";"0";"xbrli:stringItemType";"string";"xbrli:stringItemType";"Abstract";"0";;;;;;;;;;;;"Duration";"None";1;0;"";"";"";"";"";"";"";"";""
13;"frc-lr:DocumentEntityInformation";4;"         Information required for filing the document with the bank";"         Informatie ten behoeve van het deponeren van de rapportage bij de bank";"         Informatie ten behoeve van het deponeren van de rapportage bij de bank";"         Informatie ten behoeve van het deponeren van de rapportage bij de bank";"";"DocumentEntityInformation";"frc-lr";"DocumentEntityInformation";"https://www.sbrbanken.nl/bt11/frc/20161209/dictionary/frc-linkroles#DocumentEntityInformation";"";1;0;0;;"0";"0";"0";"0";"";"";"";"Abstract";"0";;;;;;;;;;;;"Other";"None";1;0;"";"";"";"";"";"";"";"";""
14;"DocumentEntityInformation_frc-i:PeriodicallyForecastReportIndicator";5;"            Periodically or forecast report indicator";"            Indicatie periodieke of prognose rapportage (Ja = Periodiek)";"            Indicatie periodieke of prognose rapportage (Ja = Periodiek)";"            Indicatie periodieke of prognose rapportage (Ja = Periodiek)";"";"PeriodicallyForecastReportIndicator";"frc-i";"DocumentEntityInformation_PeriodicallyForecastReportIndicator";"DocumentEntityInformation_https://www.sbrbanken.nl/bt11/frc/20161209/dictionary/frc-data#PeriodicallyForecastReportIndicator";"xbrli:item";1;0;0;;"0";"0";"0";"0";"nl-codes:yesNoItemType";"yesNo";"xbrli:stringItemType";"Enumeration";"0";"";"Ja|Nee";"";"";"";"";"";"";"";"";"";"Duration";"None";0;0;"";"De indicatie of het een periodieke rapportage betreft over een kortere periode dan een jaar met gerealiseerde feiten (indicator = Ja) of een prognose rapportage (indicator = Nee).";"";"";"";"De indicatie of het een periodieke rapportage betreft over een kortere periode dan een jaar met gerealiseerde feiten (indicator = Ja) of een prognose rapportage (indicator = Nee).";"";"";""
15;"DocumentEntityInformation_frc-i:ReasonDelivery";5;"            Reason delivery";"            Reden levering";"            Reden levering";"            Reden levering";"";"ReasonDelivery";"frc-i";"DocumentEntityInformation_ReasonDelivery";"DocumentEntityInformation_https://www.sbrbanken.nl/bt11/frc/20161209/dictionary/frc-data#ReasonDelivery";"xbrli:item";1;0;0;;"0";"0";"0";"0";"frc-codes:reasonDeliveryItemType";"reasonDelivery";"xbrli:stringItemType";"Enumeration";"0";"";"Bijzonder beheer|Juridische omzetting|Kredietwijziging|Nieuwe aanvraag|Overige redenen voor aflevering|Revisie";"";"";"";"";"";"";"";"";"";"Duration";"None";0;0;"";"De reden waarom de kredietrapportage wordt aangeleverd.";"";"";"";"De reden waarom de kredietrapportage wordt aangeleverd.";"";"";""
16;"DocumentEntityInformation_frc-i:FinancialReportingPeriodFirstPeriodStartDate";5;"            Start date of the first financial reporting period";"            Startdatum van de eerste financiële rapportageperiode";"            Startdatum van de eerste financiële rapportageperiode";"            Startdatum van de eerste financiële rapportageperiode";"";"FinancialReportingPeriodFirstPeriodStartDate";"frc-i";"DocumentEntityInformation_FinancialReportingPeriodFirstPeriodStartDate";"DocumentEntityInformation_https://www.sbrbanken.nl/bt11/frc/20161209/dictionary/frc-data#FinancialReportingPeriodFirstPeriodStartDate";"xbrli:item";1;0;0;;"0";"0";"0";"0";"xbrli:dateItemType";"date";"xbrli:dateItemType";"Date";"0";;;;;;;;;;;;"Duration";"None";0;0;"";"De startdatum van de huidige financiële rapportageperiode.";"";"";"";"";"";"";""
17;"DocumentEntityInformation_frc-i:FinancialReportingPeriodFirstPeriodEndDate";5;"            End date of the first financial reporting period";"            Einddatum van de eerste financiële rapportageperiode";"            Einddatum van de eerste financiële rapportageperiode";"            Einddatum van de eerste financiële rapportageperiode";"";"FinancialReportingPeriodFirstPeriodEndDate";"frc-i";"DocumentEntityInformation_FinancialReportingPeriodFirstPeriodEndDate";"DocumentEntityInformation_https://www.sbrbanken.nl/bt11/frc/20161209/dictionary/frc-data#FinancialReportingPeriodFirstPeriodEndDate";"xbrli:item";1;0;0;;"0";"0";"0";"0";"xbrli:dateItemType";"date";"xbrli:dateItemType";"Date";"0";;;;;;;;;;;;"Duration";"None";0;0;"";"De einddatum van de eerste financiële rapportageperiode.";"";"";"";"";"";"";""
18;"DocumentEntityInformation_frc-i:FinancialReportingPeriodSecondPeriodStartDate";5;"            Start date of the second financial reporting period";"            Startdatum van de tweede financiële rapportageperiode";"            Startdatum van de tweede financiële rapportageperiode";"            Startdatum van de tweede financiële rapportageperiode";"";"FinancialReportingPeriodSecondPeriodStartDate";"frc-i";"DocumentEntityInformation_FinancialReportingPeriodSecondPeriodStartDate";"DocumentEntityInformation_https://www.sbrbanken.nl/bt11/frc/20161209/dictionary/frc-data#FinancialReportingPeriodSecondPeriodStartDate";"xbrli:item";1;0;0;;"0";"0";"0";"0";"xbrli:dateItemType";"date";"xbrli:dateItemType";"Date";"0";;;;;;;;;;;;"Duration";"None";0;0;"";"De startdatum van de tweede financiële rapportageperiode.";"";"";"";"";"";"";""
19;"DocumentEntityInformation_frc-i:FinancialReportingPeriodSecondPeriodEndDate";5;"            End date of the second financial reporting period";"            Einddatum van de tweede financiële rapportageperiode";"            Einddatum van de tweede financiële rapportageperiode";"            Einddatum van de tweede financiële rapportageperiode";"";"FinancialReportingPeriodSecondPeriodEndDate";"frc-i";"DocumentEntityInformation_FinancialReportingPeriodSecondPeriodEndDate";"DocumentEntityInformation_https://www.sbrbanken.nl/bt11/frc/20161209/dictionary/frc-data#FinancialReportingPeriodSecondPeriodEndDate";"xbrli:item";1;0;0;;"0";"0";"0";"0";"xbrli:dateItemType";"date";"xbrli:dateItemType";"Date";"0";;;;;;;;;;;;"Duration";"None";0;0;"";"De einddatum van de tweede financiële rapportageperiode.";"";"";"";"";"";"";""
20;"DocumentEntityInformation_venj-bw2-i:BasisOfPreparation";5;"            Basis of preparation";"            Type grondslag";"            Grundlage der Erstellung";"            Base de préparation";"";"BasisOfPreparation";"venj-bw2-i";"DocumentEntityInformation_BasisOfPreparation";"DocumentEntityInformation_http://www.nltaxonomie.nl/nt11/venj/20161214/dictionary/venj-bw2-data#BasisOfPreparation";"xbrli:item";1;0;0;;"0";"0";"0";"0";"venj-codes:basisOfPreparationItemType";"basisOfPreparation";"xbrli:stringItemType";"Enumeration";"0";"";"Commercieel|Fiscaal";"";"";"";"";"";"";"";"";"";"Duration";"None";0;0;"";"De benoeming van de toepassing van de commerciële of fiscale grondslagen voor het opstellen van de jaarrekening.";"";"";"";"";"";"";"Article: 396, IssueDate: 2016-01-01, Name: Burgerlijk wetboek boek 2, Paragraph: 6|Chapter: D3, IssueDate: 2016-01-01, Name: Richtlijnen voor de jaarverslaggeving voor kleine rechtspersonen, Paragraph: 101|Chapter: A1, IssueDate: 2016-01-01, Name: Richtlijnen voor de jaarverslaggeving voor kleine rechtspersonen, Paragraph: 102a|Chapter: C2, IssueDate: 2016-01-01, Name: Richtlijnen voor de jaarverslaggeving voor kleine rechtspersonen, Paragraph: 104|Chapter: D3, IssueDate: 2016-01-01, Name: Richtlijnen voor de jaarverslaggeving voor kleine rechtspersonen, Paragraph: 309"
21;"DocumentEntityInformation_rj-i:DocumentPresentationCurrency";5;"            Presentation currency of the document";"            Rapporteringsvaluta van het document";"            Rapporteringsvaluta van het document";"            Rapporteringsvaluta van het document";"";"DocumentPresentationCurrency";"rj-i";"DocumentEntityInformation_DocumentPresentationCurrency";"DocumentEntityInformation_http://www.nltaxonomie.nl/nt11/rj/20161214/dictionary/rj-data#DocumentPresentationCurrency";"xbrli:item";1;0;0;;"0";"0";"0";"0";"iso4217-enum-sbr:isoCurrencyCodes4217ItemType";"isoCurrencyCodes4217";"xbrli:stringItemType";"Enumeration";"0";"";"AED|AFN|ALL|AMD|ANG|AOA|ARS|AUD|AWG|AZN|BAM|BBD|BDT|BGN|BHD|BIF|BMD|BND|BOB|BOV|BRL|BSD|BTN|BWP|BYR|BZD|CAD|CDF|CHE|CHF|CHW|CLF|CLP|CNY|COP|COU|CRC|CUC|CUP|CVE|CZK|DJF|DKK|DOP|DZD|EGP|ERN|ETB|EUR|FJD|FKP|GBP|GEL|GHS|GIP|GMD|GNF|GTQ|GYD|HKD|HNL|HRK|HTG|HUF|IDR|ILS|INR|IQD|IRR|ISK|JMD|JOD|JPY|KES|KGS|KHR|KMF|KPW|KRW|KWD|KYD|KZT|LAK|LBP|LKR|LRD|LSL|LTL|LYD|MAD|MDL|MGA|MKD|MMK|MNT|MOP|MRO|MUR|MVR|MWK|MXN|MXV|MYR|MZN|NAD|NGN|NIO|NOK|NPR|NZD|OMR|PAB|PEN|PGK|PHP|PKR|PLN|PYG|QAR|RON|RSD|RUB|RWF|SAR|SBD|SCR|SDG|SEK|SGD|SHP|SLL|SOS|SRD|SSP|STD|SYP|SZL|THB|TJS|TMT|TND|TOP|TRY|TTD|TWD|TZS|UAH|UGX|USD|USN|UYI|UYU|UZS|VEF|VND|VUV|WST|XAF|XAG|XAU|XBA|XBB|XBC|XBD|XCD|XDR|XFU|XOF|XPD|XPF|XPT|XSU|XTS|XUA|XXX|YER|ZAR|ZMW";"";"";"";"";"";"";"";"";"";"Duration";"None";0;0;"";"De valuta waarin de financiële informatie in het document wordt gepresenteerd.";"";"";"";"";"";"";"Chapter: 110, IssueDate: 2016-01-01, Name: Richtlijnen voor de jaarverslaggeving, Paragraph: 103, Subparagraph: d|Chapter: A1, IssueDate: 2016-01-01, Name: Richtlijnen voor de jaarverslaggeving voor kleine rechtspersonen, Paragraph: 306"
22;"DocumentEntityInformation_frc-abstr:BankInformationTitle";5;"            Bank information title";"            Bank informatie";"            Bank informatie";"            Bank informatie";"";"BankInformationTitle";"frc-abstr";"DocumentEntityInformation_BankInformationTitle";"DocumentEntityInformation_https://www.sbrbanken.nl/bt11/frc/20161209/presentation/frc-abstracts#BankInformationTitle";"sbr:presentationItem";2;0;0;;"0";"0";"0";"0";"xbrli:stringItemType";"string";"xbrli:stringItemType";"Abstract";"0";;;;;;;;;;;;"Duration";"None";1;0;"";"";"";"";"";"";"";"";""
23;"DocumentEntityInformation_frc-i:DestinationBank";6;"               Destination bank";"               Bestemmende bank";"               Bestemmende bank";"               Bestemmende bank";"";"DestinationBank";"frc-i";"DocumentEntityInformation_DestinationBank";"DocumentEntityInformation_https://www.sbrbanken.nl/bt11/frc/20161209/dictionary/frc-data#DestinationBank";"xbrli:item";1;0;0;;"0";"0";"0";"0";"frc-codes:destinationBankItemType";"destinationBank";"xbrli:stringItemType";"Enumeration";"0";"";"ABN AMRO Bank|ING Bank|Overige|Rabobank";"";"";"";"";"";"";"";"";"";"Duration";"None";0;0;"";"De naam van de bank waarvoor de rapportage bestemd is.";"";"";"";"De naam van de bank waarvoor de rapportage bestemd is. Indien de rapportage bestemd is voor een bank waarvan de naam niet is opgenomen in de gespecificeerde lijst dan ""Overig"" invullen.";"";"";""
24;"DocumentEntityInformation_kvk-t:ContactForDocumentPresentation";5;"            Contact for this document";"            Contactpersoon voor deze rapportage";"            Contactpersoon voor deze rapportage";"            Contactpersoon voor deze rapportage";"";"ContactForDocumentPresentation";"kvk-t";"DocumentEntityInformation_ContactForDocumentPresentation";"DocumentEntityInformation_http://www.nltaxonomie.nl/nt11/kvk/20161214/dictionary/kvk-tuples#ContactForDocumentPresentation";"sbr:presentationTuple";1;1;0;;"0";"0";"1";"1";"";"";"";"Abstract";"0";;;;;;;;;;;;"Other";"None";0;0;"The intention of this tuple is to record the contact details of the contact for this document. This contact can be a person from the organisation itself or from its intermediary.";"Deze tuple is bedoeld voor het opnemen van de contactgegevens van de contactpersoon van deze rapportage. Deze contactpersoon kan van de organisatie zelf zijn of van haar intermediair.";"";"";"";"";"";"";""
25;"DocumentEntityInformation_kvk-i:ContactType";6;"               Contact type";"               Soort contactpersoon";"               Soort contactpersoon";"               Soort contactpersoon";"";"ContactType";"kvk-i";"DocumentEntityInformation_ContactType";"DocumentEntityInformation_http://www.nltaxonomie.nl/nt11/kvk/20161214/dictionary/kvk-data#ContactType";"xbrli:item";1;0;0;"DocumentEntityInformation_kvk-t:ContactForDocumentPresentation";"1";"0";"0";"0";"kvk-codes:contactItemType";"contact";"xbrli:stringItemType";"Enumeration";"0";"";"Intermediair|Ondernemer";"";"";"";"";"";"";"";"";"";"Duration";"None";0;0;"The purpose of this concept is to categorise the contact for this report into either ""Intermediary"" or ""Entrepreneur"".";"Dit concept dient voor het classificeren van de contactpersoon van deze rapportage in de categorie ""ondernemer"" of ""intermediair"".";"";"";"";"";"";"";""
26;"DocumentEntityInformation_nl-cd:FirstName";6;"               First name";"               Voornamen";"               Voornamen";"               Voornamen";"";"FirstName";"nl-cd";"DocumentEntityInformation_FirstName";"DocumentEntityInformation_http://www.nltaxonomie.nl/nt11/sbr/20160610/dictionary/nl-common-data#FirstName";"xbrli:item";1;0;0;"DocumentEntityInformation_kvk-t:ContactForDocumentPresentation";"1";"1";"0";"0";"nl-types:string1000ItemType";"string1000";"xbrli:stringItemType";"String";"0";"";"";"";"";"";"1";"1000";"";"";"";"";"Duration";"None";0;0;"The collection of names, separated by spaces, which precede the family name stripped of predicates.";"De verzameling namen die, gescheiden door spaties, aan de geslachtsnaam voorafgaat. Indien aanwezig, wordt het predikaat afgesplitst.";"";"";"";"";"";"";"Name: LO3.9, Page: 234, Publisher: Gemeentelijke basisadministratie"
27;"DocumentEntityInformation_nl-cd:FamilyName";6;"               Family name";"               Geslachtsnaam";"               Geslachtsnaam";"               Geslachtsnaam";"";"FamilyName";"nl-cd";"DocumentEntityInformation_FamilyName";"DocumentEntityInformation_http://www.nltaxonomie.nl/nt11/sbr/20160610/dictionary/nl-common-data#FamilyName";"xbrli:item";1;0;0;"DocumentEntityInformation_kvk-t:ContactForDocumentPresentation";"1";"2";"0";"0";"nl-types:string1000ItemType";"string1000";"xbrli:stringItemType";"String";"0";"";"";"";"";"";"1";"1000";"";"";"";"";"Duration";"None";0;0;"The family name stripped of any prefixes and noble titles/predicates.";"De (geslachts)naam waarvan de eventueel aanwezige voorvoegsels en adellijke titel/predikaat zijn afgesplitst.";"";"";"";"";"";"";"Name: LO3.9, Page: 237, Publisher: Gemeentelijke basisadministratie"
28;"DocumentEntityInformation_kvk-i:OrganisationName";6;"               Name of the organisation represented by the contact";"               Naam van de organisatie vertegenwoordigd door de contactpersoon";"               Naam van de organisatie vertegenwoordigd door de contactpersoon";"               Naam van de organisatie vertegenwoordigd door de contactpersoon";"";"OrganisationName";"kvk-i";"DocumentEntityInformation_OrganisationName";"DocumentEntityInformation_http://www.nltaxonomie.nl/nt11/kvk/20161214/dictionary/kvk-data#OrganisationName";"xbrli:item";1;0;0;"DocumentEntityInformation_kvk-t:ContactForDocumentPresentation";"1";"3";"0";"0";"nl-types:string1000ItemType";"string1000";"xbrli:stringItemType";"String";"0";"";"";"";"";"";"1";"1000";"";"";"";"";"Duration";"None";0;0;"The name of the organisation to which the contactperson belongs.";"De naam van de organisatie waartoe de contactpersoon behoort.";"";"";"";"";"";"";""
