187;"NotesPrivateIntakesAndDepositsNaturalPersons_frc-i:PrivateDepositesNaturalPersons";7;"                  Private deposits natural persons";"                  Privé stortingen natuurlijke personen";"                  Privé stortingen natuurlijke personen";"                  Privé stortingen natuurlijke personen";"";"PrivateDepositesNaturalPersons";"frc-i";"NotesPrivateIntakesAndDepositsNaturalPersons_PrivateDepositesNaturalPersons";"NotesPrivateIntakesAndDepositsNaturalPersons_https://www.sbrbanken.nl/bt11/frc/20161209/dictionary/frc-data#PrivateDepositesNaturalPersons";"xbrli:item";1;0;0;;"0";"0";"0";"0";"nl-types:monetaryNoDecimalsItemType";"monetaryNoDecimals";"nl-types:monetary20ItemType";"Monetary";"0";"";"";"0";"";"";"";"";"";"";"";"";"Duration";"Credit";0;0;"";"Bedrag aan stortingen en ontvangen belastingen door de bestuurders of eigenaren van de organisatie op rekening van de onderneming.";"";"";"";"Het bedrag aan stortingen en ontvangen belastingen door de bestuurders of eigenaren van de organisatie als privé persoon ten gunste van de rekening van de onderneming.";"";"";""
188;"frc-abstr:ProvisionsDisclosureBanksTitle";5;"            Provisions, disclosure [title]";"            Voorzieningen, toelichting [titel]";"            Voorzieningen, toelichting [titel]";"            Voorzieningen, toelichting [titel]";"";"ProvisionsDisclosureBanksTitle";"frc-abstr";"ProvisionsDisclosureBanksTitle";"https://www.sbrbanken.nl/bt11/frc/20161209/presentation/frc-abstracts#ProvisionsDisclosureBanksTitle";"sbr:presentationItem";1;0;0;;"0";"0";"0";"0";"xbrli:stringItemType";"string";"xbrli:stringItemType";"Abstract";"0";;;;;;;;;;;;"Duration";"None";1;0;"";"";"";"";"";"";"";"";""
189;"frc-lr:NotesProvisionsBreakdown";6;"               Notes to the financial statements - Provisions: Breakdown [table]";"               Toelichting op de jaarrekening - Voorzieningen: Uitsplitsing [tabel]";"               Toelichting op de jaarrekening - Voorzieningen: Uitsplitsing [tabel]";"               Toelichting op de jaarrekening - Voorzieningen: Uitsplitsing [tabel]";"";"NotesProvisionsBreakdown";"frc-lr";"NotesProvisionsBreakdown";"https://www.sbrbanken.nl/bt11/frc/20161209/dictionary/frc-linkroles#NotesProvisionsBreakdown";"";1;0;0;;"0";"0";"0";"0";"";"";"";"Abstract";"0";;;;;;;;;;;;"Other";"None";1;0;"";"";"";"";"";"";"";"";""
190;"frc-lr:NotesProvisions";6;"               Notes to the financial statements - Provisions";"               Toelichting op de jaarrekening - Voorzieningen";"               Toelichting op de jaarrekening - Voorzieningen";"               Toelichting op de jaarrekening - Voorzieningen";"";"NotesProvisions";"frc-lr";"NotesProvisions";"https://www.sbrbanken.nl/bt11/frc/20161209/dictionary/frc-linkroles#NotesProvisions";"";1;0;0;;"0";"0";"0";"0";"";"";"";"Abstract";"0";;;;;;;;;;;;"Other";"None";1;0;"";"";"";"";"";"";"";"";""
191;"frc-abstr:LiabilitiesNoncurrentDisclosureBanksTitle";5;"            Non-current liabilities, disclosure [title]";"            Langlopende schulden, toelichting [titel]";"            Langlopende schulden, toelichting [titel]";"            Langlopende schulden, toelichting [titel]";"";"LiabilitiesNoncurrentDisclosureBanksTitle";"frc-abstr";"LiabilitiesNoncurrentDisclosureBanksTitle";"https://www.sbrbanken.nl/bt11/frc/20161209/presentation/frc-abstracts#LiabilitiesNoncurrentDisclosureBanksTitle";"sbr:presentationItem";1;0;0;;"0";"0";"0";"0";"xbrli:stringItemType";"string";"xbrli:stringItemType";"Abstract";"0";;;;;;;;;;;;"Duration";"None";1;0;"";"";"";"";"";"";"";"";""
192;"frc-lr:NotesNoncurrentLiabilitiesBreakdown";6;"               Notes to the financial statements - Non-current liabilities: Breakdown [table]";"               Toelichting op de jaarrekening - Langlopende schulden: Uitsplitsing [tabel]";"               Toelichting op de jaarrekening - Langlopende schulden: Uitsplitsing [tabel]";"               Toelichting op de jaarrekening - Langlopende schulden: Uitsplitsing [tabel]";"";"NotesNoncurrentLiabilitiesBreakdown";"frc-lr";"NotesNoncurrentLiabilitiesBreakdown";"https://www.sbrbanken.nl/bt11/frc/20161209/dictionary/frc-linkroles#NotesNoncurrentLiabilitiesBreakdown";"";1;0;0;;"0";"0";"0";"0";"";"";"";"Abstract";"0";;;;;;;;;;;;"Other";"None";1;0;"";"";"";"";"";"";"";"";""
193;"NotesNoncurrentLiabilitiesBreakdown_venj-bw2-i:LiabilitiesNoncurrent";7;"                  Non-current liabilities";"                  Langlopende schulden";"                  Langfristige Verbindlichkeiten";"                  Passif non exigible";"";"LiabilitiesNoncurrent";"venj-bw2-i";"NotesNoncurrentLiabilitiesBreakdown_LiabilitiesNoncurrent";"NotesNoncurrentLiabilitiesBreakdown_http://www.nltaxonomie.nl/nt11/venj/20161214/dictionary/venj-bw2-data#LiabilitiesNoncurrent";"xbrli:item";2;0;0;;"0";"0";"0";"0";"nl-types:monetaryNoDecimalsItemType";"monetaryNoDecimals";"nl-types:monetary20ItemType";"Monetary";"0";"";"";"0";"";"";"";"";"";"";"";"";"Instant";"Credit";0;0;"";"De nog te betalen bedragen aan derden die binnen een termijn van langer dan een jaar na balansdatum moeten zijn voldaan.";"";"";"";"";"";"";"Article: 1, IssueDate: 2015-01-01, Name: Besluit modellen jaarrekening, Paragraph: 2|Article: 5, IssueDate: 2015-01-01, Name: Besluit modellen jaarrekening, Paragraph: 1|Article: 16b, IssueDate: 2015-01-01, Name: Besluit modellen jaarrekening, Paragraph: 2|Article: 1, IssueDate: 2015-01-01, Name: Besluit modellen jaarrekening, Paragraph: 1|Article: 396, IssueDate: 2016-01-01, Name: Burgerlijk wetboek boek 2, Paragraph: 3|Chapter: 115, IssueDate: 2016-01-01, Name: Richtlijnen voor de jaarverslaggeving, Paragraph: 105|Chapter: 254, IssueDate: 2016-01-01, Name: Richtlijnen voor de jaarverslaggeving, Paragraph: 301|Chapter: 254, IssueDate: 2016-01-01, Name: Richtlijnen voor de jaarverslaggeving, Paragraph: 303|Chapter: 610, IssueDate: 2016-01-01, Name: Richtlijnen voor de jaarverslaggeving, Paragraph: 106|Chapter: 650, IssueDate: 2016-01-01, Name: Richtlijnen voor de jaarverslaggeving, Paragraph: 311|Chapter: 655, IssueDate: 2016-01-01, Name: Richtlijnen voor de jaarverslaggeving, Paragraph: 301|Chapter: 660, IssueDate: 2016-01-01, Name: Richtlijnen voor de jaarverslaggeving, Paragraph: 301|Chapter: 660, IssueDate: 2016-01-01, Name: Richtlijnen voor de jaarverslaggeving, Paragraph: 512|Chapter: B9, IssueDate: 2016-01-01, Name: Richtlijnen voor de jaarverslaggeving voor kleine rechtspersonen, Paragraph: 201"
194;"NotesNoncurrentLiabilitiesBreakdown_venj-bw2-i:SubordinatedLiabilitiesNoncurrent";8;"                     Subordinated liabilities (non-current)";"                     Achtergestelde schulden (langlopend)";"                     Nachrangige Verbindlichkeiten (langfristig)";"                     Passif subordonné (non-courant)";"";"SubordinatedLiabilitiesNoncurrent";"venj-bw2-i";"NotesNoncurrentLiabilitiesBreakdown_SubordinatedLiabilitiesNoncurrent";"NotesNoncurrentLiabilitiesBreakdown_http://www.nltaxonomie.nl/nt11/venj/20161214/dictionary/venj-bw2-data#SubordinatedLiabilitiesNoncurrent";"xbrli:item";1;0;0;;"0";"0";"0";"0";"nl-types:monetaryNoDecimalsItemType";"monetaryNoDecimals";"nl-types:monetary20ItemType";"Monetary";"0";"";"";"0";"";"";"";"";"";"";"";"";"Instant";"Credit";0;0;"";"De nog te betalen bedragen met betrekking tot vermogen dat is aangetrokken van derde partijen ter financiering van de bedrijfsactiviteiten, waarvan in rangorde is vastgesteld dat de schuldeisers niet als eerste worden uitbetaald bij faillissement van de rechtspersoon en waarover veelal een hogere rente dan gemiddeld wordt betaald voor het afdekken van het risico voor de schuldeisers die zijn achtergesteld. De schuld kan binnen een termijn van langer dan een jaar na balansdatum worden opgeëist.";"";"";"";"";"";"";"Article: 375, IssueDate: 2016-01-01, Name: Burgerlijk wetboek boek 2, Paragraph: 4|Chapter: 254, IssueDate: 2016-01-01, Name: Richtlijnen voor de jaarverslaggeving, Paragraph: 309"
195;"NotesNoncurrentLiabilitiesBreakdown_venj-bw2-i:ConvertibleBorrowingsNoncurrent";8;"                     Convertible borrowings (non-current)";"                     Converteerbare leningen (langlopend)";"                     Wandelanleihen (langfristig)";"                     Emprunts convertibles (non courants)";"";"ConvertibleBorrowingsNoncurrent";"venj-bw2-i";"NotesNoncurrentLiabilitiesBreakdown_ConvertibleBorrowingsNoncurrent";"NotesNoncurrentLiabilitiesBreakdown_http://www.nltaxonomie.nl/nt11/venj/20161214/dictionary/venj-bw2-data#ConvertibleBorrowingsNoncurrent";"xbrli:item";1;0;0;;"0";"0";"0";"0";"nl-types:monetaryNoDecimalsItemType";"monetaryNoDecimals";"nl-types:monetary20ItemType";"Monetary";"0";"";"";"0";"";"";"";"";"";"";"";"";"Instant";"Credit";0;0;"";"De leningen die hetzij naar keuze van de schuldeiser, hetzij naar keuze van de schuldenaar worden afgelost in contanten dan wel door middel van uit te geven aandelen (of certificaten daarvan). De bedragen moeten binnen een termijn van langer dan een jaar na balansdatum zijn voldaan.";"";"";"";"";"";"";"Article: 8, IssueDate: 2015-01-01, Name: Besluit modellen jaarrekening, Paragraph: 1|Article: 16b, IssueDate: 2015-01-01, Name: Besluit modellen jaarrekening, Paragraph: 2|Article: 1, IssueDate: 2015-01-01, Name: Besluit modellen jaarrekening, Paragraph: 1|Article: 375, IssueDate: 2016-01-01, Name: Burgerlijk wetboek boek 2, Paragraph: 1, Subparagraph: a|Chapter: 254, IssueDate: 2016-01-01, Name: Richtlijnen voor de jaarverslaggeving, Paragraph: 401|Chapter: 254, IssueDate: 2016-01-01, Name: Richtlijnen voor de jaarverslaggeving, Paragraph: 407|Chapter: B9, IssueDate: 2016-01-01, Name: Richtlijnen voor de jaarverslaggeving voor kleine rechtspersonen, Paragraph: 201"
196;"NotesNoncurrentLiabilitiesBreakdown_venj-bw2-i:DebenturesOtherPrivateLoansNoncurrent";8;"                     Other debentures and private loans (non-current)";"                     Andere obligaties en onderhandse leningen (langlopend)";"                     Sonstige Schuldverschreibungen und private Darlehen (langfristig)";"                     Autres obligations non garanties et emprunts privés (non courants)";"";"DebenturesOtherPrivateLoansNoncurrent";"venj-bw2-i";"NotesNoncurrentLiabilitiesBreakdown_DebenturesOtherPrivateLoansNoncurrent";"NotesNoncurrentLiabilitiesBreakdown_http://www.nltaxonomie.nl/nt11/venj/20161214/dictionary/venj-bw2-data#DebenturesOtherPrivateLoansNoncurrent";"xbrli:item";1;0;0;;"0";"0";"0";"0";"nl-types:monetaryNoDecimalsItemType";"monetaryNoDecimals";"nl-types:monetary20ItemType";"Monetary";"0";"";"";"0";"";"";"";"";"";"";"";"";"Instant";"Credit";0;0;"";"De nog te betalen bedragen met betrekking tot vermogen dat is aangetrokken van derde partijen ter financiering van de bedrijfsactiviteiten door uitgifte van verhandelbare schuldbewijzen of zonder tussenkomst van een kredietinstelling of effectenmarkt, die binnen een vooraf bepaalde termijn van langer dan een jaar na balansdatum moeten worden terugbetaald tegen een vaste vergoeding.";"";"";"";"";"";"";"Article: 8, IssueDate: 2015-01-01, Name: Besluit modellen jaarrekening, Paragraph: 1|Article: 16b, IssueDate: 2015-01-01, Name: Besluit modellen jaarrekening, Paragraph: 2|Article: 1, IssueDate: 2015-01-01, Name: Besluit modellen jaarrekening, Paragraph: 1|Article: 375, IssueDate: 2016-01-01, Name: Burgerlijk wetboek boek 2, Paragraph: 1, Subparagraph: a|Chapter: 254, IssueDate: 2016-01-01, Name: Richtlijnen voor de jaarverslaggeving, Paragraph: 401"
197;"NotesNoncurrentLiabilitiesBreakdown_rj-i:FinanceLeaseLiabilitiesNoncurrent";8;"                     Finance lease liabilities (non-current)";"                     Financiële lease verplichtingen (langlopend)";"                     Financiële lease verplichtingen (langlopend)";"                     Financiële lease verplichtingen (langlopend)";"";"FinanceLeaseLiabilitiesNoncurrent";"rj-i";"NotesNoncurrentLiabilitiesBreakdown_FinanceLeaseLiabilitiesNoncurrent";"NotesNoncurrentLiabilitiesBreakdown_http://www.nltaxonomie.nl/nt11/rj/20161214/dictionary/rj-data#FinanceLeaseLiabilitiesNoncurrent";"xbrli:item";1;0;0;;"0";"0";"0";"0";"nl-types:monetaryNoDecimalsItemType";"monetaryNoDecimals";"nl-types:monetary20ItemType";"Monetary";"0";"";"";"0";"";"";"";"";"";"";"";"";"Instant";"Credit";0;0;"";"De nog te betalen bedragen, die in een periode langer dan een jaar moeten zijn voldaan, voor overeenkomsten waarbij eigendom en gebruik worden opgesplitst, de rechtspersoon de gebruiker is en de eigenaar zelf de voor- en nadelen van het eigendom blijft dragen.";"";"";"";"";"";"";"Chapter: 292, IssueDate: 2016-01-01, Name: Richtlijnen voor de jaarverslaggeving, Paragraph: 208|Chapter: B11, IssueDate: 2016-01-01, Name: Richtlijnen voor de jaarverslaggeving voor kleine rechtspersonen, Paragraph: 107|Chapter: B11, IssueDate: 2016-01-01, Name: Richtlijnen voor de jaarverslaggeving voor kleine rechtspersonen, Paragraph: 112"
198;"NotesNoncurrentLiabilitiesBreakdown_venj-bw2-i:PayablesCreditInstitutionsNoncurrent";8;"                     Payables to credit institutions (non-current)";"                     Schulden aan kredietinstellingen (langlopend)";"                     Verbindlichkeiten bei Kreditinstituten (langfristig)";"                     Sommes à payer à des établissements de crédit (non-courantes)";"";"PayablesCreditInstitutionsNoncurrent";"venj-bw2-i";"NotesNoncurrentLiabilitiesBreakdown_PayablesCreditInstitutionsNoncurrent";"NotesNoncurrentLiabilitiesBreakdown_http://www.nltaxonomie.nl/nt11/venj/20161214/dictionary/venj-bw2-data#PayablesCreditInstitutionsNoncurrent";"xbrli:item";1;0;0;;"0";"0";"0";"0";"nl-types:monetaryNoDecimalsItemType";"monetaryNoDecimals";"nl-types:monetary20ItemType";"Monetary";"0";"";"";"0";"";"";"";"";"";"";"";"";"Instant";"Credit";0;0;"";"De nog te betalen bedragen aan banken die binnen een termijn van langer dan een jaar na balansdatum moeten zijn voldaan.";"";"";"";"";"";"";"Article: 8, IssueDate: 2015-01-01, Name: Besluit modellen jaarrekening, Paragraph: 1|Article: 16b, IssueDate: 2015-01-01, Name: Besluit modellen jaarrekening, Paragraph: 2|Article: 1, IssueDate: 2015-01-01, Name: Besluit modellen jaarrekening, Paragraph: 1|Article: 375, IssueDate: 2016-01-01, Name: Burgerlijk wetboek boek 2, Paragraph: 1, Subparagraph: b|Chapter: 254, IssueDate: 2016-01-01, Name: Richtlijnen voor de jaarverslaggeving, Paragraph: 401"
199;"NotesNoncurrentLiabilitiesBreakdown_venj-bw2-i:AdvancesReceivedNoncurrent";8;"                     Advances received (non-current)";"                     Vooruit ontvangen op bestellingen (langlopend)";"                     Erhaltene Anzahlungen (nicht aktuell)";"                     Avances reçues (non-courantes)";"";"AdvancesReceivedNoncurrent";"venj-bw2-i";"NotesNoncurrentLiabilitiesBreakdown_AdvancesReceivedNoncurrent";"NotesNoncurrentLiabilitiesBreakdown_http://www.nltaxonomie.nl/nt11/venj/20161214/dictionary/venj-bw2-data#AdvancesReceivedNoncurrent";"xbrli:item";1;0;0;;"0";"0";"0";"0";"nl-types:monetaryNoDecimalsItemType";"monetaryNoDecimals";"nl-types:monetary20ItemType";"Monetary";"0";"";"";"0";"";"";"";"";"";"";"";"";"Instant";"Credit";0;0;"";"De door klanten gedane betalingen, waarvoor de rechtspersoon de betreffende producten of diensten nog moet leveren. De leveringen dienen plaats te vinden binnen een termijn van langer dan een jaar na balansdatum.";"";"";"";"";"";"";"Article: 8, IssueDate: 2015-01-01, Name: Besluit modellen jaarrekening, Paragraph: 1|Article: 1, IssueDate: 2015-01-01, Name: Besluit modellen jaarrekening, Paragraph: 1|Article: 375, IssueDate: 2016-01-01, Name: Burgerlijk wetboek boek 2, Paragraph: 1, Subparagraph: c|Chapter: 254, IssueDate: 2016-01-01, Name: Richtlijnen voor de jaarverslaggeving, Paragraph: 401"
200;"NotesNoncurrentLiabilitiesBreakdown_venj-bw2-i:TradePayablesNoncurrent";8;"                     Trade payables (non-current)";"                     Schulden aan leveranciers en handelskredieten (langlopend)";"                     Verbindlichkeiten aus Lieferungen und Leistungen (langfristig)";"                     Créances commerciales (non-courantes)";"";"TradePayablesNoncurrent";"venj-bw2-i";"NotesNoncurrentLiabilitiesBreakdown_TradePayablesNoncurrent";"NotesNoncurrentLiabilitiesBreakdown_http://www.nltaxonomie.nl/nt11/venj/20161214/dictionary/venj-bw2-data#TradePayablesNoncurrent";"xbrli:item";1;0;0;;"0";"0";"0";"0";"nl-types:monetaryNoDecimalsItemType";"monetaryNoDecimals";"nl-types:monetary20ItemType";"Monetary";"0";"";"";"0";"";"";"";"";"";"";"";"";"Instant";"Credit";0;0;"";"De nog te betalen leveringen van producten of diensten aan de rechtspersoon, die binnen een termijn van langer dan een jaar moeten zijn voldaan.";"";"";"";"";"";"";"Article: 8, IssueDate: 2015-01-01, Name: Besluit modellen jaarrekening, Paragraph: 1|Article: 1, IssueDate: 2015-01-01, Name: Besluit modellen jaarrekening, Paragraph: 1|Article: 375, IssueDate: 2016-01-01, Name: Burgerlijk wetboek boek 2, Paragraph: 1, Subparagraph: d|Chapter: 254, IssueDate: 2016-01-01, Name: Richtlijnen voor de jaarverslaggeving, Paragraph: 401"
201;"NotesNoncurrentLiabilitiesBreakdown_venj-bw2-i:BillsExchangeChequesPayableNoncurrent";8;"                     Cheques and bills of exchange payables (non-current)";"                     Te betalen wissels en cheques (langlopend)";"                     Schecks und fällige Wechsel (nicht aktuell)";"                     Chèques et lettres de change à payer (non courants)";"";"BillsExchangeChequesPayableNoncurrent";"venj-bw2-i";"NotesNoncurrentLiabilitiesBreakdown_BillsExchangeChequesPayableNoncurrent";"NotesNoncurrentLiabilitiesBreakdown_http://www.nltaxonomie.nl/nt11/venj/20161214/dictionary/venj-bw2-data#BillsExchangeChequesPayableNoncurrent";"xbrli:item";1;0;0;;"0";"0";"0";"0";"nl-types:monetaryNoDecimalsItemType";"monetaryNoDecimals";"nl-types:monetary20ItemType";"Monetary";"0";"";"";"0";"";"";"";"";"";"";"";"";"Instant";"Credit";0;0;"";"De nog te betalen bedragen met betrekking tot wissels en cheques, die binnen een termijn van langer dan een jaar na balansdatum moeten zijn voldaan.";"";"";"";"";"";"";"Article: 8, IssueDate: 2015-01-01, Name: Besluit modellen jaarrekening, Paragraph: 1|Article: 16b, IssueDate: 2015-01-01, Name: Besluit modellen jaarrekening, Paragraph: 2|Article: 1, IssueDate: 2015-01-01, Name: Besluit modellen jaarrekening, Paragraph: 1|Article: 375, IssueDate: 2016-01-01, Name: Burgerlijk wetboek boek 2, Paragraph: 1, Subparagraph: e|Chapter: 254, IssueDate: 2016-01-01, Name: Richtlijnen voor de jaarverslaggeving, Paragraph: 401"
202;"NotesNoncurrentLiabilitiesBreakdown_venj-bw2-i:PayablesGroupCompaniesNoncurrent";8;"                     Payables to group companies (non-current)";"                     Schulden aan groepsmaatschappijen (langlopend)";"                     Verbindlichkeiten bei Konzerngesellschaften (langfristig)";"                     Sommes à payer à des sociétés apparentées (non-courantes)";"";"PayablesGroupCompaniesNoncurrent";"venj-bw2-i";"NotesNoncurrentLiabilitiesBreakdown_PayablesGroupCompaniesNoncurrent";"NotesNoncurrentLiabilitiesBreakdown_http://www.nltaxonomie.nl/nt11/venj/20161214/dictionary/venj-bw2-data#PayablesGroupCompaniesNoncurrent";"xbrli:item";1;0;0;;"0";"0";"0";"0";"nl-types:monetaryNoDecimalsItemType";"monetaryNoDecimals";"nl-types:monetary20ItemType";"Monetary";"0";"";"";"0";"";"";"";"";"";"";"";"";"Instant";"Credit";0;0;"";"Het langlopende deel van de schulden aan rechtspersonen en vennootschappen die met elkaar in een groep zijn verbonden. Onder langlopend wordt verstaan een periode langer dan één jaar.";"";"";"";"";"";"";"Article: 8, IssueDate: 2015-01-01, Name: Besluit modellen jaarrekening, Paragraph: 1|Article: 16b, IssueDate: 2015-01-01, Name: Besluit modellen jaarrekening, Paragraph: 2|Article: 1, IssueDate: 2015-01-01, Name: Besluit modellen jaarrekening, Paragraph: 1|Article: 375, IssueDate: 2016-01-01, Name: Burgerlijk wetboek boek 2, Paragraph: 1, Subparagraph: f|Chapter: 254, IssueDate: 2016-01-01, Name: Richtlijnen voor de jaarverslaggeving, Paragraph: 401"
203;"NotesNoncurrentLiabilitiesBreakdown_venj-bw2-i:PayablesOtherRelatedPartiesNoncurrent";8;"                     Payables to other related parties (non-current)";"                     Schulden aan overige verbonden maatschappijen (langlopend)";"                     Verbindlichkeiten bei anderen bezogenen Parteien (langfristig)";"                     Sommes à payer à d'autres parties liées (non-courantes)";"";"PayablesOtherRelatedPartiesNoncurrent";"venj-bw2-i";"NotesNoncurrentLiabilitiesBreakdown_PayablesOtherRelatedPartiesNoncurrent";"NotesNoncurrentLiabilitiesBreakdown_http://www.nltaxonomie.nl/nt11/venj/20161214/dictionary/venj-bw2-data#PayablesOtherRelatedPartiesNoncurrent";"xbrli:item";1;0;0;;"0";"0";"0";"0";"nl-types:monetaryNoDecimalsItemType";"monetaryNoDecimals";"nl-types:monetary20ItemType";"Monetary";"0";"";"";"0";"";"";"";"";"";"";"";"";"Instant";"Credit";0;0;"";"De schulden aan deelnemingen waarin de rechtspersoon invloed van betekening kan uitoefenen met een looptijd langer dan een jaar na balansdatum.";"";"";"";"";"";"";"Article: 361, IssueDate: 2016-01-01, Name: Burgerlijk wetboek boek 2, Paragraph: 4|Chapter: 254, IssueDate: 2016-01-01, Name: Richtlijnen voor de jaarverslaggeving, Paragraph: 410|Chapter: 660, IssueDate: 2016-01-01, Name: Richtlijnen voor de jaarverslaggeving, Paragraph: 302"
204;"NotesNoncurrentLiabilitiesBreakdown_venj-bw2-i:PayablesShareholdersParticipatingInterestsNoncurrent";8;"                     Payables to receivables shareholders and participating interests (non-current)";"                     Schulden aan participanten en aan maatschappijen waarin wordt deelgenomen (langlopend)";"                     Verbindlichkeiten für Forderungen gegen Aktionäre und Beteiligungen (langfristig)";"                     Sommes à verser aux actionnaires de sommes à recevoir et aux intérêts de participation (non-courantes)";"";"PayablesShareholdersParticipatingInterestsNoncurrent";"venj-bw2-i";"NotesNoncurrentLiabilitiesBreakdown_PayablesShareholdersParticipatingInterestsNoncurrent";"NotesNoncurrentLiabilitiesBreakdown_http://www.nltaxonomie.nl/nt11/venj/20161214/dictionary/venj-bw2-data#PayablesShareholdersParticipatingInterestsNoncurrent";"xbrli:item";1;0;0;;"0";"0";"0";"0";"nl-types:monetaryNoDecimalsItemType";"monetaryNoDecimals";"nl-types:monetary20ItemType";"Monetary";"0";"";"";"0";"";"";"";"";"";"";"";"";"Instant";"Credit";0;0;"";"Het langlopende deel van de per balansdatum bestaande en vaststaande verplichtingen van de onderneming aan participanten en maatschappijen waarin de onderneming een kapitaalbelang heeft. Onder langlopend wordt verstaan een periode langer dan één jaar.";"";"";"";"";"";"";"Article: 8, IssueDate: 2015-01-01, Name: Besluit modellen jaarrekening, Paragraph: 1|Article: 16b, IssueDate: 2015-01-01, Name: Besluit modellen jaarrekening, Paragraph: 2|Article: 1, IssueDate: 2015-01-01, Name: Besluit modellen jaarrekening, Paragraph: 1|Article: 375, IssueDate: 2016-01-01, Name: Burgerlijk wetboek boek 2, Paragraph: 1, Subparagraph: g|Chapter: 254, IssueDate: 2016-01-01, Name: Richtlijnen voor de jaarverslaggeving, Paragraph: 401"
205;"NotesNoncurrentLiabilitiesBreakdown_venj-bw2-i:TaxesSocialSecurityContributionsPayableNoncurrent";8;"                     Taxes payable and social security contributions payable (non-current)";"                     Belastingen en premies sociale verzekeringen (langlopend)";"                     Fällige Steuern und Sozialversicherungsbeiträge (langfristig)";"                     Impôts et cotisations de sécurité sociales à payer (non-courantes)";"";"TaxesSocialSecurityContributionsPayableNoncurrent";"venj-bw2-i";"NotesNoncurrentLiabilitiesBreakdown_TaxesSocialSecurityContributionsPayableNoncurrent";"NotesNoncurrentLiabilitiesBreakdown_http://www.nltaxonomie.nl/nt11/venj/20161214/dictionary/venj-bw2-data#TaxesSocialSecurityContributionsPayableNoncurrent";"xbrli:item";1;0;0;;"0";"0";"0";"0";"nl-types:monetaryNoDecimalsItemType";"monetaryNoDecimals";"nl-types:monetary20ItemType";"Monetary";"0";"";"";"0";"";"";"";"";"";"";"";"";"Instant";"Credit";0;0;"";"De nog te betalen bedragen aan de belastingdienst voor belastingen en premies sociale verzekeringen die binnen een termijn van langer dan een jaar na balansdatum moeten zijn voldaan.";"";"";"";"";"";"";"Article: 8, IssueDate: 2015-01-01, Name: Besluit modellen jaarrekening, Paragraph: 1|Article: 16b, IssueDate: 2015-01-01, Name: Besluit modellen jaarrekening, Paragraph: 2|Article: 1, IssueDate: 2015-01-01, Name: Besluit modellen jaarrekening, Paragraph: 1|Article: 375, IssueDate: 2016-01-01, Name: Burgerlijk wetboek boek 2, Paragraph: 1, Subparagraph: h|Chapter: 254, IssueDate: 2016-01-01, Name: Richtlijnen voor de jaarverslaggeving, Paragraph: 401"
206;"NotesNoncurrentLiabilitiesBreakdown_rj-i:TaxPayables";8;"                     Tax payables";"                     Schulden uit hoofde van belastingen";"                     Schulden uit hoofde van belastingen";"                     Schulden uit hoofde van belastingen";"";"TaxPayables";"rj-i";"NotesNoncurrentLiabilitiesBreakdown_TaxPayables";"NotesNoncurrentLiabilitiesBreakdown_http://www.nltaxonomie.nl/nt11/rj/20161214/dictionary/rj-data#TaxPayables";"xbrli:item";1;0;0;;"0";"0";"0";"0";"nl-types:monetaryNoDecimalsItemType";"monetaryNoDecimals";"nl-types:monetary20ItemType";"Monetary";"0";"";"";"0";"";"";"";"";"";"";"";"";"Instant";"Credit";0;0;"";"De nog te betalen bedragen uit hoofde van belastingen.";"";"";"";"";"";"";"Chapter: 272, IssueDate: 2016-01-01, Name: Richtlijnen voor de jaarverslaggeving, Paragraph: 601, Subparagraph: a"
