745;"AgroCattleFarm_frc-i:ProductionRightsLeaseCosts";8;"                     Production rights lease costs";"                     Leasekosten productierechten";"                     Leasekosten productierechten";"                     Leasekosten productierechten";"";"ProductionRightsLeaseCosts";"frc-i";"AgroCattleFarm_ProductionRightsLeaseCosts";"AgroCattleFarm_https://www.sbrbanken.nl/bt11/frc/20161209/dictionary/frc-data#ProductionRightsLeaseCosts";"xbrli:item";9;0;0;"AgroCattleFarm_frc-abstr:NotAllocatedCostsTitle";"0";"0";"0";"0";"nl-types:monetaryNoDecimalsItemType";"monetaryNoDecimals";"nl-types:monetary20ItemType";"Monetary";"0";"";"";"0";"";"";"";"";"";"";"";"";"Duration";"Debit";0;0;"";"De kosten voor de lease van productierechten. Productierechten zijn varkens-en pluimveerechten.";"";"";"";"De kosten voor de lease van productierechten. Productierechten zijn varkens-en pluimveerechten. (N.B. leasekosten van machines etc. vallen hier niet onder).";"";"";""
746;"AgroCattleFarm_frc-abstr:CattleFarmTitle";6;"               Cattle farm title";"               Specificatie melkveehouderij";"               Specificatie melkveehouderij";"               Specificatie melkveehouderij";"";"CattleFarmTitle";"frc-abstr";"AgroCattleFarm_CattleFarmTitle";"AgroCattleFarm_https://www.sbrbanken.nl/bt11/frc/20161209/presentation/frc-abstracts#CattleFarmTitle";"sbr:presentationItem";1;0;0;"AgroCattleFarm_frc-dim:CattleFarmTypedAxes";"0";"0";"0";"0";"xbrli:stringItemType";"string";"xbrli:stringItemType";"Abstract";"0";;;;;;;;;;;;"Duration";"None";1;0;"";"";"";"";"";"";"";"";""
747;"AgroCattleFarm_frc-i:RequirementsDerogation";7;"                  Requirements derogation Y/N";"                  Voldaan aan voorwaarden derogatie J/N";"                  Voldaan aan voorwaarden derogatie J/N";"                  Voldaan aan voorwaarden derogatie J/N";"";"RequirementsDerogation";"frc-i";"AgroCattleFarm_RequirementsDerogation";"AgroCattleFarm_https://www.sbrbanken.nl/bt11/frc/20161209/dictionary/frc-data#RequirementsDerogation";"xbrli:item";2;0;0;"AgroCattleFarm_frc-abstr:CattleFarmTitle";"0";"0";"0";"0";"nl-codes:yesNoItemType";"yesNo";"xbrli:stringItemType";"Enumeration";"0";"";"Ja|Nee";"";"";"";"";"";"";"";"";"";"Duration";"None";0;0;"";"Agrarische ondernemers hebben een gebruiksnorm voor dierlijke mest van 170 kg stikstof per hectare per jaar. Onder bepaalde voorwaarden mag u hiervan afwijken (derogatie). Dit element betreft de uitkomst van de beoordeling of aan deze voorwaarden wordt voldaan.";"";"";"";"Agrarische ondernemers hebben een gebruiksnorm voor dierlijke mest van 170 kg stikstof per hectare per jaar. Onder bepaalde voorwaarden mag u hiervan afwijken (derogatie). Dit gegeven betreft de uitkomst van de beoordeling of aan deze voorwaarden wordt voldaan: Ja als inderdaad is voldaan.";"";"";""
748;"AgroCattleFarm_frc-i:AverageNumberPresentMilkcows";7;"                  Average number present milkcows";"                  Gemiddeld aantal aanwezige melkkoeien";"                  Gemiddeld aantal aanwezige melkkoeien";"                  Gemiddeld aantal aanwezige melkkoeien";"";"AverageNumberPresentMilkcows";"frc-i";"AgroCattleFarm_AverageNumberPresentMilkcows";"AgroCattleFarm_https://www.sbrbanken.nl/bt11/frc/20161209/dictionary/frc-data#AverageNumberPresentMilkcows";"xbrli:item";1;0;0;"AgroCattleFarm_frc-abstr:CattleFarmTitle";"0";"0";"0";"0";"xbrli:integerItemType";"integer";"xbrli:integerItemType";"Number";"0";;;;;;;;;;;;"Duration";"None";0;0;"";"Het gemiddeld aantal aanwezige melkkoeien (vrouwelijk rundvee) gedurende de rapportageperiode.";"";"";"";"Het gemiddeld aantal aanwezige melkkoeien (vrouwelijk rundvee) gedurende de rapportageperiode.";"";"";""
749;"AgroCattleFarm_frc-i:AverageNumberPresentYoungCattle";7;"                  Average number present young cattle";"                  Gemiddeld aantal aanwezig stuks jongvee";"                  Gemiddeld aantal aanwezig stuks jongvee";"                  Gemiddeld aantal aanwezig stuks jongvee";"";"AverageNumberPresentYoungCattle";"frc-i";"AgroCattleFarm_AverageNumberPresentYoungCattle";"AgroCattleFarm_https://www.sbrbanken.nl/bt11/frc/20161209/dictionary/frc-data#AverageNumberPresentYoungCattle";"xbrli:item";1;0;0;"AgroCattleFarm_frc-abstr:CattleFarmTitle";"0";"0";"0";"0";"xbrli:integerItemType";"integer";"xbrli:integerItemType";"Number";"0";;;;;;;;;;;;"Duration";"None";0;0;"";"Het gemiddeld aantal aanwezige stuks vrouwelijk rundvee, nog niet melkgevend gedurende de rapportageperiode.";"";"";"";"Het gemiddeld aantal aanwezige stuks vrouwelijk rundvee, nog niet melkgevend gedurende de rapportageperiode.";"";"";""
750;"AgroCattleFarm_frc-i:MilkMoneyRevenue";7;"                  Milk money revenue";"                  Melkgeld";"                  Melkgeld";"                  Melkgeld";"";"MilkMoneyRevenue";"frc-i";"AgroCattleFarm_MilkMoneyRevenue";"AgroCattleFarm_https://www.sbrbanken.nl/bt11/frc/20161209/dictionary/frc-data#MilkMoneyRevenue";"xbrli:item";2;0;0;"AgroCattleFarm_frc-abstr:CattleFarmTitle";"0";"0";"0";"0";"nl-types:monetaryNoDecimalsItemType";"monetaryNoDecimals";"nl-types:monetary20ItemType";"Monetary";"0";"";"";"0";"";"";"";"";"";"";"";"";"Duration";"Credit";0;0;"";"Het voor geleverde melk ontvangen bedrag.";"";"";"";"Het voor geleverde melk ontvangen bedrag.";"";"";""
751;"AgroCattleFarm_frc-i:MilkDelivered";7;"                  Milk delivered";"                  Geleverde kg melk";"                  Geleverde kg melk";"                  Geleverde kg melk";"";"MilkDelivered";"frc-i";"AgroCattleFarm_MilkDelivered";"AgroCattleFarm_https://www.sbrbanken.nl/bt11/frc/20161209/dictionary/frc-data#MilkDelivered";"xbrli:item";2;0;0;"AgroCattleFarm_frc-abstr:CattleFarmTitle";"0";"0";"0";"0";"xbrli:integerItemType";"integer";"xbrli:integerItemType";"Number";"0";;;;;;;;;;;;"Duration";"None";0;0;"";"Het aantal geleverde kilogram melk.";"";"";"";"Het aantal geleverde kilogram melk.";"";"";""
752;"AgroCattleFarm_frc-i:ActualFatPercentage";8;"                     Percentage of actual fat";"                     Werkelijk vet (%)";"                     Werkelijk vet (%)";"                     Werkelijk vet (%)";"";"ActualFatPercentage";"frc-i";"AgroCattleFarm_ActualFatPercentage";"AgroCattleFarm_https://www.sbrbanken.nl/bt11/frc/20161209/dictionary/frc-data#ActualFatPercentage";"xbrli:item";2;0;0;"AgroCattleFarm_frc-i:MilkDelivered";"0";"0";"0";"0";"num:percentItemType";"percent";"xbrli:pureItemType";"Number";"0";"";"";"";"";"";"";"";"";"";"";"";"Duration";"None";0;0;"";"Het percentage vet in de geleverde KG melk over de rapportageperiode, 2 decimalen nauwkeurig.";"";"";"";"Het percentage vet in de geleverde KG melk over de rapportageperiode, 2 decimalen nauwkeurig.";"";"";""
753;"AgroCattleFarm_frc-i:ActualProteinPercentage";8;"                     Percentage of actual protein";"                     Werkelijk eiwit (%)";"                     Werkelijk eiwit (%)";"                     Werkelijk eiwit (%)";"";"ActualProteinPercentage";"frc-i";"AgroCattleFarm_ActualProteinPercentage";"AgroCattleFarm_https://www.sbrbanken.nl/bt11/frc/20161209/dictionary/frc-data#ActualProteinPercentage";"xbrli:item";2;0;0;"AgroCattleFarm_frc-i:MilkDelivered";"0";"0";"0";"0";"num:percentItemType";"percent";"xbrli:pureItemType";"Number";"0";"";"";"";"";"";"";"";"";"";"";"";"Duration";"None";0;0;"";"Het percentage eiwit in de geleverde KG melk over de rapportageperiode, 2 decimalen nauwkeurig.";"";"";"";"Het percentage eiwit in de geleverde KG melk over de rapportageperiode, 2 decimalen nauwkeurig.";"";"";""
754;"AgroCattleFarm_frc-abstr:FodderCostsTitle";7;"                  Fodder costs title";"                  Nadere specificatie voerkosten";"                  Nadere specificatie voerkosten";"                  Nadere specificatie voerkosten";"";"FodderCostsTitle";"frc-abstr";"AgroCattleFarm_FodderCostsTitle";"AgroCattleFarm_https://www.sbrbanken.nl/bt11/frc/20161209/presentation/frc-abstracts#FodderCostsTitle";"sbr:presentationItem";3;0;0;"AgroCattleFarm_frc-abstr:CattleFarmTitle";"0";"0";"0";"0";"xbrli:stringItemType";"string";"xbrli:stringItemType";"Abstract";"0";;;;;;;;;;;;"Duration";"None";1;0;"";"";"";"";"";"";"";"";""
755;"AgroCattleFarm_frc-i:ConcentratesCosts";8;"                     Concentrates costs";"                     Krachtvoerkosten";"                     Krachtvoerkosten";"                     Krachtvoerkosten";"";"ConcentratesCosts";"frc-i";"AgroCattleFarm_ConcentratesCosts";"AgroCattleFarm_https://www.sbrbanken.nl/bt11/frc/20161209/dictionary/frc-data#ConcentratesCosts";"xbrli:item";3;0;0;"AgroCattleFarm_frc-abstr:FodderCostsTitle";"0";"0";"0";"0";"nl-types:monetaryNoDecimalsItemType";"monetaryNoDecimals";"nl-types:monetary20ItemType";"Monetary";"0";"";"";"0";"";"";"";"";"";"";"";"";"Duration";"Debit";0;0;"";"De kosten voor krachtvoer, dit zijn diervoeders met een geconcentreerde voedingswaarde. Melkproducten worden onder krachtvoer geschaard.";"";"";"";"De kosten voor krachtvoer, dit zijn diervoeders met een geconcentreerde voedingswaarde. Melkproducten worden onder krachtvoer geschaard.";"";"";""
756;"AgroCattleFarm_frc-i:RoughageCosts";8;"                     Roughage costs";"                     Ruwvoerkosten";"                     Ruwvoerkosten";"                     Ruwvoerkosten";"";"RoughageCosts";"frc-i";"AgroCattleFarm_RoughageCosts";"AgroCattleFarm_https://www.sbrbanken.nl/bt11/frc/20161209/dictionary/frc-data#RoughageCosts";"xbrli:item";3;0;0;"AgroCattleFarm_frc-abstr:FodderCostsTitle";"0";"0";"0";"0";"nl-types:monetaryNoDecimalsItemType";"monetaryNoDecimals";"nl-types:monetary20ItemType";"Monetary";"0";"";"";"0";"";"";"";"";"";"";"";"";"Duration";"Debit";0;0;"";"De kosten voor ruwvoer, waaronder diervoeders worden verstaan met een geconcentreerde voedingswaarde.";"";"";"";"De kosten voor ruwvoer, waaronder diervoeders worden verstaan met een geconcentreerde voedingswaarde.";"";"";""
757;"AgroCattleFarm_frc-i:ByproductsCosts";8;"                     By-products costs";"                     Bijproducten kosten";"                     Bijproducten kosten";"                     Bijproducten kosten";"";"ByproductsCosts";"frc-i";"AgroCattleFarm_ByproductsCosts";"AgroCattleFarm_https://www.sbrbanken.nl/bt11/frc/20161209/dictionary/frc-data#ByproductsCosts";"xbrli:item";3;0;0;"AgroCattleFarm_frc-abstr:FodderCostsTitle";"0";"0";"0";"0";"nl-types:monetaryNoDecimalsItemType";"monetaryNoDecimals";"nl-types:monetary20ItemType";"Monetary";"0";"";"";"0";"";"";"";"";"";"";"";"";"Duration";"Debit";0;0;"";"De kosten voor producten, die onbedoeld ontstaan in een productieproces, maar wel een positieve waarde hebben of in ieder geval een nuttige toepassing kennen (bijproducten).";"";"";"";"Met bijproducten worden voerkosten bedoeld. Dit zijn onder andere de reststromen van de voedingsmiddelenindustrie welke in de veehouderij worden gebruikt. Komt voornamelijk voor bij melkvee en varkens .";"";"";""
758;"frc-lr:NotesAgroCattleFarm";4;"         Notes to the financial statements - Cattle farm";"         Toelichting op de jaarrekening - Melkveehouderij";"         Toelichting op de jaarrekening - Melkveehouderij";"         Toelichting op de jaarrekening - Melkveehouderij";"";"NotesAgroCattleFarm";"frc-lr";"NotesAgroCattleFarm";"https://www.sbrbanken.nl/bt11/frc/20161209/dictionary/frc-linkroles#NotesAgroCattleFarm";"";1;0;0;;"0";"0";"0";"0";"";"";"";"Abstract";"0";;;;;;;;;;;;"Other";"None";1;0;"";"";"";"";"";"";"";"";""
759;"NotesAgroCattleFarm_frc-dim:CattleFarmTypedAxes";5;"            Cattle farm [typed Axis]";"            Melkveehouderij [typed As]";"            Melkveehouderij [typed As]";"            Melkveehouderij [typed As]";"";"CattleFarmTypedAxes";"frc-dim";"NotesAgroCattleFarm_CattleFarmTypedAxes";"NotesAgroCattleFarm_https://www.sbrbanken.nl/bt11/frc/20161209/dictionary/frc-axes#CattleFarmTypedAxes";"xbrldt:dimensionItem";2;1;0;;"0";"0";"0";"0";"xbrli:stringItemType";"string";"xbrli:stringItemType";"Abstract";"0";;;;;;;;;;;;"Duration";"None";1;0;"";"";"";"";"";"";"";"";""
760;"NotesAgroCattleFarm_frc-dm:CattleFarmTypedMember";6;"               Cattle farm [typed member]";"               Melkveehouderij [typed member]";"               Melkveehouderij [typed member]";"               Melkveehouderij [typed member]";"";"CattleFarmTypedMember";"frc-dm";"NotesAgroCattleFarm_CattleFarmTypedMember";"NotesAgroCattleFarm_https://www.sbrbanken.nl/bt11/frc/20161209/dictionary/frc-domains#CattleFarmTypedMember";"";2;0;1;"NotesAgroCattleFarm_frc-dim:CattleFarmTypedAxes";"0";"0";"0";"0";"nl-types:string255";"string255";"nl-types:string255";"String";"1";;;;;;;;;;;;"Other";"None";0;0;"";"";"";"";"";"";"";"";""
761;"NotesAgroCattleFarm_frc-i:DivergenceOfRegulationsToGiveBetterInsight";6;"               Divergence of regulations to give better insight.";"               Afwijking van voorschriften voor het verschaffen van inzicht";"               Afwijking van voorschriften voor het verschaffen van inzicht";"               Afwijking van voorschriften voor het verschaffen van inzicht";"";"DivergenceOfRegulationsToGiveBetterInsight";"frc-i";"NotesAgroCattleFarm_DivergenceOfRegulationsToGiveBetterInsight";"NotesAgroCattleFarm_https://www.sbrbanken.nl/bt11/frc/20161209/dictionary/frc-data#DivergenceOfRegulationsToGiveBetterInsight";"xbrli:item";9;0;0;"NotesAgroCattleFarm_frc-dim:CattleFarmTypedAxes";"0";"0";"0";"0";"nl-codes:yesNoItemType";"yesNo";"xbrli:stringItemType";"Enumeration";"0";"";"Ja|Nee";"";"";"";"";"";"";"";"";"";"Duration";"None";0;0;"";"De keuze of er word afgeweken van de standaard voorschriften om een beter inzicht te geven.";"";"";"";"";"";"";"Article: 362, Name: Burgerlijk wetboek boek 2, Paragraph: 4|Chapter: 110, IssueDate: 2016-01-01, Name: Richtlijnen voor de jaarverslaggeving, Paragraph: 108"
762;"NotesAgroCattleFarm_frc-i:DivergenceOfRegulationsToGiveBetterInsightDisclosure";6;"               Disclosure of the divergence of regulations to give better insight";"               Informatieverschaffing op de afwijking van voorschriften voor het verschaffen van inzicht";"               Informatieverschaffing op de afwijking van voorschriften voor het verschaffen van inzicht";"               Informatieverschaffing op de afwijking van voorschriften voor het verschaffen van inzicht";"";"DivergenceOfRegulationsToGiveBetterInsightDisclosure";"frc-i";"NotesAgroCattleFarm_DivergenceOfRegulationsToGiveBetterInsightDisclosure";"NotesAgroCattleFarm_https://www.sbrbanken.nl/bt11/frc/20161209/dictionary/frc-data#DivergenceOfRegulationsToGiveBetterInsightDisclosure";"xbrli:item";9;0;0;"NotesAgroCattleFarm_frc-dim:CattleFarmTypedAxes";"0";"0";"0";"0";"nl-codes:yesNoItemType";"yesNo";"xbrli:stringItemType";"Enumeration";"0";"";"Ja|Nee";"";"";"";"";"";"";"";"";"";"Duration";"None";0;0;"";"De reden waarom er word afgeweken van de standaard voorschriften om een beter inzicht te geven.";"";"";"";"";"";"";"Article: 362, Name: Burgerlijk wetboek boek 2, Paragraph: 4|Chapter: 110, IssueDate: 2016-01-01, Name: Richtlijnen voor de jaarverslaggeving, Paragraph: 108"
763;"NotesAgroCattleFarm_frc-i:RevenuesAndAccretionDisclosure";6;"               Disclosure on the revenue, when the revenue holds both revenue and accretion";"               Toelichting op de omzet, indien de omzet zowel omzet als aanwas betreft.";"               Toelichting op de omzet, indien de omzet zowel omzet als aanwas betreft.";"               Toelichting op de omzet, indien de omzet zowel omzet als aanwas betreft.";"";"RevenuesAndAccretionDisclosure";"frc-i";"NotesAgroCattleFarm_RevenuesAndAccretionDisclosure";"NotesAgroCattleFarm_https://www.sbrbanken.nl/bt11/frc/20161209/dictionary/frc-data#RevenuesAndAccretionDisclosure";"xbrli:item";9;0;0;"NotesAgroCattleFarm_frc-dim:CattleFarmTypedAxes";"0";"0";"0";"0";"nl-codes:yesNoItemType";"yesNo";"xbrli:stringItemType";"Enumeration";"0";"";"Ja|Nee";"";"";"";"";"";"";"";"";"";"Duration";"None";0;0;"";"Toelichtig op de omzet, indien de omzet zowel omzet als aanwas betreft vul Ja in. Hierbij wijkt de rapporteur bewust af van BW2 titel 9.";"";"";"";"Toelichtig op de omzet, indien de omzet zowel omzet als aanwas betreft vul Ja in. Hierbij wijkt de rapporteur bewust af van BW9.";"";"";""
764;"NotesAgroCattleFarm_frc-i:RevenuesAndAccretionBreakdownDisclosure";6;"               Disclosure for the purpose of the breakdown of the revenue and accretion.";"               Toelichting om uitsplisting te geven op de omzet en aanwas.";"               Toelichting om uitsplisting te geven op de omzet en aanwas.";"               Toelichting om uitsplisting te geven op de omzet en aanwas.";"";"RevenuesAndAccretionBreakdownDisclosure";"frc-i";"NotesAgroCattleFarm_RevenuesAndAccretionBreakdownDisclosure";"NotesAgroCattleFarm_https://www.sbrbanken.nl/bt11/frc/20161209/dictionary/frc-data#RevenuesAndAccretionBreakdownDisclosure";"xbrli:item";9;0;0;"NotesAgroCattleFarm_frc-dim:CattleFarmTypedAxes";"0";"0";"0";"0";"nl-types:string100000ItemType";"string100000";"xbrli:stringItemType";"String";"0";"";"";"";"";"";"1";"100000";"";"";"";"";"Duration";"None";0;0;"";"Toelichting om uitsplisting te geven op de omzet en aanwas.";"";"";"";"Indien het concept omzet en aanwas is ingevuld kan dit concept gebruikt worden om een verdere tekstuele uitsplitsing te geven.";"";"";""
765;"frc-lr:AgroCalvesFarm";4;"         Agro, calves farm";"         Agro, kalverhouderij";"         Agro, kalverhouderij";"         Agro, kalverhouderij";"";"AgroCalvesFarm";"frc-lr";"AgroCalvesFarm";"https://www.sbrbanken.nl/bt11/frc/20161209/dictionary/frc-linkroles#AgroCalvesFarm";"";1;0;0;;"0";"0";"0";"0";"";"";"";"Abstract";"0";;;;;;;;;;;;"Other";"None";1;0;"";"";"";"";"";"";"";"";""
766;"AgroCalvesFarm_frc-dim:CalvesFarmTypedAxes";5;"            Calves farm [typed Axis]";"            Kalverhouderij [Typed Member]";"            Kalverhouderij [Typed Member]";"            Kalverhouderij [Typed Member]";"";"CalvesFarmTypedAxes";"frc-dim";"AgroCalvesFarm_CalvesFarmTypedAxes";"AgroCalvesFarm_https://www.sbrbanken.nl/bt11/frc/20161209/dictionary/frc-axes#CalvesFarmTypedAxes";"xbrldt:dimensionItem";2;1;0;;"0";"0";"0";"0";"xbrli:stringItemType";"string";"xbrli:stringItemType";"Abstract";"0";;;;;;;;;;;;"Duration";"None";1;0;"";"";"";"";"";"";"";"";""
767;"AgroCalvesFarm_frc-dm:CalvesFarmTypedMember";6;"               Calves farm [typed member]";"               Kalverhouderij [typed member]";"               Kalverhouderij [typed member]";"               Kalverhouderij [typed member]";"";"CalvesFarmTypedMember";"frc-dm";"AgroCalvesFarm_CalvesFarmTypedMember";"AgroCalvesFarm_https://www.sbrbanken.nl/bt11/frc/20161209/dictionary/frc-domains#CalvesFarmTypedMember";"";2;0;1;"AgroCalvesFarm_frc-dim:CalvesFarmTypedAxes";"0";"0";"0";"0";"nl-types:string255";"string255";"nl-types:string255";"String";"1";;;;;;;;;;;;"Other";"None";0;0;"";"";"";"";"";"";"";"";""
768;"AgroCalvesFarm_frc-abstr:CommonDataTitle";6;"               Common data title";"               Algemene gegevens";"               Algemene gegevens";"               Algemene gegevens";"";"CommonDataTitle";"frc-abstr";"AgroCalvesFarm_CommonDataTitle";"AgroCalvesFarm_https://www.sbrbanken.nl/bt11/frc/20161209/presentation/frc-abstracts#CommonDataTitle";"sbr:presentationItem";14;0;0;"AgroCalvesFarm_frc-dim:CalvesFarmTypedAxes";"0";"0";"0";"0";"xbrli:stringItemType";"string";"xbrli:stringItemType";"Abstract";"0";;;;;;;;;;;;"Duration";"None";1;0;"";"";"";"";"";"";"";"";""
769;"AgroCalvesFarm_frc-i:UtilisedFarmlandOwnProperty";7;"                  Utilised farmland own property";"                  Bouwgrond in eigendom";"                  Bouwgrond in eigendom";"                  Bouwgrond in eigendom";"";"UtilisedFarmlandOwnProperty";"frc-i";"AgroCalvesFarm_UtilisedFarmlandOwnProperty";"AgroCalvesFarm_https://www.sbrbanken.nl/bt11/frc/20161209/dictionary/frc-data#UtilisedFarmlandOwnProperty";"xbrli:item";14;0;0;"AgroCalvesFarm_frc-abstr:CommonDataTitle";"0";"0";"0";"0";"xbrli:integerItemType";"integer";"xbrli:integerItemType";"Number";"0";;;;;;;;;;;;"Duration";"None";0;0;"";"De totale oppervlakte bouwgrond in eigendom, die gedurende de rapportageperiode ten dienste is geweest aan de exploitatie (m²) ten behoeve van de uitoefening van de gespecificeerde veeteelt of de land- en tuinbouw.";"";"";"";"De totale oppervlakte bouwgrond in eigendom, die gedurende de rapportageperiode ten dienste is geweest aan de exploitatie (m²) ten behoeve van de uitoefening van de gespecificeerde veeteelt of de land- en tuinbouw.";"";"";""
770;"AgroCalvesFarm_frc-i:UtilisedFarmlandThirdParties";7;"                  Utilised farmland third parties";"                  Bouwgrond van derden";"                  Bouwgrond van derden";"                  Bouwgrond van derden";"";"UtilisedFarmlandThirdParties";"frc-i";"AgroCalvesFarm_UtilisedFarmlandThirdParties";"AgroCalvesFarm_https://www.sbrbanken.nl/bt11/frc/20161209/dictionary/frc-data#UtilisedFarmlandThirdParties";"xbrli:item";14;0;0;"AgroCalvesFarm_frc-abstr:CommonDataTitle";"0";"0";"0";"0";"xbrli:integerItemType";"integer";"xbrli:integerItemType";"Number";"0";;;;;;;;;;;;"Duration";"None";0;0;"";"De totale oppervlakte bouwgrond van derden, die gedurende de rapportageperiode ten dienste is geweest aan de exploitatie (m²) ten behoeve van de uitoefening van de gespecificeerde veeteelt of de land- en tuinbouw. De bouwgrond is bijvoorbeeld gehuurd of gepacht.";"";"";"";"De totale oppervlakte bouwgrond van derden, die gedurende de rapportageperiode ten dienste is geweest aan de exploitatie (m²) ten behoeve van de uitoefening van de gespecificeerde veeteelt of de land- en tuinbouw. De bouwgrond is bijvoorbeeld gehuurd of gepacht.";"";"";""
771;"AgroCalvesFarm_frc-abstr:AssetsBanksTitle";7;"                  Assets";"                  Activa";"                  Activa";"                  Activa";"";"AssetsBanksTitle";"frc-abstr";"AgroCalvesFarm_AssetsBanksTitle";"AgroCalvesFarm_https://www.sbrbanken.nl/bt11/frc/20161209/presentation/frc-abstracts#AssetsBanksTitle";"sbr:presentationItem";14;0;0;"AgroCalvesFarm_frc-abstr:CommonDataTitle";"0";"0";"0";"0";"xbrli:stringItemType";"string";"xbrli:stringItemType";"Abstract";"0";;;;;;;;;;;;"Duration";"None";1;0;"";"";"";"";"";"";"";"";""
772;"AgroCalvesFarm_frc-i:PropertyPlantEquipmentLivestock";8;"                     Property plant equipment livestock";"                     Materiële vaste activa: Gebruiksvee";"                     Materiële vaste activa: Gebruiksvee";"                     Materiële vaste activa: Gebruiksvee";"";"PropertyPlantEquipmentLivestock";"frc-i";"AgroCalvesFarm_PropertyPlantEquipmentLivestock";"AgroCalvesFarm_https://www.sbrbanken.nl/bt11/frc/20161209/dictionary/frc-data#PropertyPlantEquipmentLivestock";"xbrli:item";9;0;0;"AgroCalvesFarm_frc-abstr:AssetsBanksTitle";"0";"0";"0";"0";"xbrli:monetaryItemType";"monetary";"xbrli:monetaryItemType";"Monetary";"0";;;;;;;;;;;;"Duration";"None";0;0;"";"Het gedeelte van de materiële vaste activa dat betrekking heeft op het vee dat ter wille van zijn nut gehouden wordt.";"";"";"";"";"";"";""
773;"AgroCalvesFarm_frc-i:StockAssetsCurrentNonLivestock";8;"                     Stock assets current non livestock";"                     Voorraden (vlottende activa): Niet gebruiksvee";"                     Voorraden (vlottende activa): Niet gebruiksvee";"                     Voorraden (vlottende activa): Niet gebruiksvee";"";"StockAssetsCurrentNonLivestock";"frc-i";"AgroCalvesFarm_StockAssetsCurrentNonLivestock";"AgroCalvesFarm_https://www.sbrbanken.nl/bt11/frc/20161209/dictionary/frc-data#StockAssetsCurrentNonLivestock";"xbrli:item";9;0;0;"AgroCalvesFarm_frc-abstr:AssetsBanksTitle";"0";"0";"0";"0";"xbrli:monetaryItemType";"monetary";"xbrli:monetaryItemType";"Monetary";"0";;;;;;;;;;;;"Duration";"None";0;0;"";"Het deel van de voorraden dat betrekking heeft op het gedeelte dat niet tot het gebruiksvee behoort.";"";"";"";"";"";"";""
774;"AgroCalvesFarm_frc-abstr:AllocatedRevenuesTitle";7;"                  Allocated revenues title";"                  Toegerekende opbrengsten";"                  Toegerekende opbrengsten";"                  Toegerekende opbrengsten";"";"AllocatedRevenuesTitle";"frc-abstr";"AgroCalvesFarm_AllocatedRevenuesTitle";"AgroCalvesFarm_https://www.sbrbanken.nl/bt11/frc/20161209/presentation/frc-abstracts#AllocatedRevenuesTitle";"sbr:presentationItem";14;0;0;"AgroCalvesFarm_frc-abstr:CommonDataTitle";"0";"0";"0";"0";"xbrli:stringItemType";"string";"xbrli:stringItemType";"Abstract";"0";;;;;;;;;;;;"Duration";"None";1;0;"";"";"";"";"";"";"";"";""
775;"AgroCalvesFarm_frc-i:RevenueLivestock";8;"                     Revenue livestock";"                     Omzet vee";"                     Omzet vee";"                     Omzet vee";"";"RevenueLivestock";"frc-i";"AgroCalvesFarm_RevenueLivestock";"AgroCalvesFarm_https://www.sbrbanken.nl/bt11/frc/20161209/dictionary/frc-data#RevenueLivestock";"xbrli:item";9;0;0;"AgroCalvesFarm_frc-abstr:AllocatedRevenuesTitle";"0";"0";"0";"0";"nl-types:monetaryNoDecimalsItemType";"monetaryNoDecimals";"nl-types:monetary20ItemType";"Monetary";"0";"";"";"0";"";"";"";"";"";"";"";"";"Duration";"Credit";0;0;"";"De omzet voortkomend uit het houden van vee.";"";"";"";"De omzet voortkomend uit het houden van vee.";"";"";""
