459;"AgroMushroomCultivation_frc-dim:MushroomCultivationTypedAxis";5;"            Mushroom cultivation [typed Axis]";"            Champignon- en andere paddenstoelenteelt [typed As]";"            Champignon- en andere paddenstoelenteelt [typed As]";"            Champignon- en andere paddenstoelenteelt [typed As]";"";"MushroomCultivationTypedAxis";"frc-dim";"AgroMushroomCultivation_MushroomCultivationTypedAxis";"AgroMushroomCultivation_https://www.sbrbanken.nl/bt11/frc/20161209/dictionary/frc-axes#MushroomCultivationTypedAxis";"xbrldt:dimensionItem";1;1;0;;"0";"0";"0";"0";"xbrli:stringItemType";"string";"xbrli:stringItemType";"Abstract";"0";;;;;;;;;;;;"Duration";"None";1;0;"";"";"";"";"";"";"";"";""
460;"AgroMushroomCultivation_frc-dm:MushroomCultivationTypedMember";6;"               Mushroom cultivation [typed member]";"               Champignon- en andere paddenstoelenteelt [typed member]";"               Champignon- en andere paddenstoelenteelt [typed member]";"               Champignon- en andere paddenstoelenteelt [typed member]";"";"MushroomCultivationTypedMember";"frc-dm";"AgroMushroomCultivation_MushroomCultivationTypedMember";"AgroMushroomCultivation_https://www.sbrbanken.nl/bt11/frc/20161209/dictionary/frc-domains#MushroomCultivationTypedMember";"";1;0;1;"AgroMushroomCultivation_frc-dim:MushroomCultivationTypedAxis";"0";"0";"0";"0";"nl-types:string255";"string255";"nl-types:string255";"String";"1";;;;;;;;;;;;"Other";"None";0;0;"";"";"";"";"";"";"";"";""
461;"AgroMushroomCultivation_frc-abstr:CommonDataTitle";6;"               Common data title";"               Algemene gegevens";"               Algemene gegevens";"               Algemene gegevens";"";"CommonDataTitle";"frc-abstr";"AgroMushroomCultivation_CommonDataTitle";"AgroMushroomCultivation_https://www.sbrbanken.nl/bt11/frc/20161209/presentation/frc-abstracts#CommonDataTitle";"sbr:presentationItem";14;0;0;"AgroMushroomCultivation_frc-dim:MushroomCultivationTypedAxis";"0";"0";"0";"0";"xbrli:stringItemType";"string";"xbrli:stringItemType";"Abstract";"0";;;;;;;;;;;;"Duration";"None";1;0;"";"";"";"";"";"";"";"";""
462;"AgroMushroomCultivation_frc-i:UtilisedFarmlandOwnProperty";7;"                  Utilised farmland own property";"                  Bouwgrond in eigendom";"                  Bouwgrond in eigendom";"                  Bouwgrond in eigendom";"";"UtilisedFarmlandOwnProperty";"frc-i";"AgroMushroomCultivation_UtilisedFarmlandOwnProperty";"AgroMushroomCultivation_https://www.sbrbanken.nl/bt11/frc/20161209/dictionary/frc-data#UtilisedFarmlandOwnProperty";"xbrli:item";14;0;0;"AgroMushroomCultivation_frc-abstr:CommonDataTitle";"0";"0";"0";"0";"xbrli:integerItemType";"integer";"xbrli:integerItemType";"Number";"0";;;;;;;;;;;;"Duration";"None";0;0;"";"De totale oppervlakte bouwgrond in eigendom, die gedurende de rapportageperiode ten dienste is geweest aan de exploitatie (m²) ten behoeve van de uitoefening van de gespecificeerde veeteelt of de land- en tuinbouw.";"";"";"";"De totale oppervlakte bouwgrond in eigendom, die gedurende de rapportageperiode ten dienste is geweest aan de exploitatie (m²) ten behoeve van de uitoefening van de gespecificeerde veeteelt of de land- en tuinbouw.";"";"";""
463;"AgroMushroomCultivation_frc-i:UtilisedFarmlandThirdParties";7;"                  Utilised farmland third parties";"                  Bouwgrond van derden";"                  Bouwgrond van derden";"                  Bouwgrond van derden";"";"UtilisedFarmlandThirdParties";"frc-i";"AgroMushroomCultivation_UtilisedFarmlandThirdParties";"AgroMushroomCultivation_https://www.sbrbanken.nl/bt11/frc/20161209/dictionary/frc-data#UtilisedFarmlandThirdParties";"xbrli:item";14;0;0;"AgroMushroomCultivation_frc-abstr:CommonDataTitle";"0";"0";"0";"0";"xbrli:integerItemType";"integer";"xbrli:integerItemType";"Number";"0";;;;;;;;;;;;"Duration";"None";0;0;"";"De totale oppervlakte bouwgrond van derden, die gedurende de rapportageperiode ten dienste is geweest aan de exploitatie (m²) ten behoeve van de uitoefening van de gespecificeerde veeteelt of de land- en tuinbouw. De bouwgrond is bijvoorbeeld gehuurd of gepacht.";"";"";"";"De totale oppervlakte bouwgrond van derden, die gedurende de rapportageperiode ten dienste is geweest aan de exploitatie (m²) ten behoeve van de uitoefening van de gespecificeerde veeteelt of de land- en tuinbouw. De bouwgrond is bijvoorbeeld gehuurd of gepacht.";"";"";""
464;"AgroMushroomCultivation_frc-i:GrossCultivationSurfaceIndoor";7;"                  Gross cultivation surface indoor";"                  Teeltoppervlak overdekt";"                  Teeltoppervlak overdekt";"                  Teeltoppervlak overdekt";"";"GrossCultivationSurfaceIndoor";"frc-i";"AgroMushroomCultivation_GrossCultivationSurfaceIndoor";"AgroMushroomCultivation_https://www.sbrbanken.nl/bt11/frc/20161209/dictionary/frc-data#GrossCultivationSurfaceIndoor";"xbrli:item";5;0;0;"AgroMushroomCultivation_frc-abstr:CommonDataTitle";"0";"0";"0";"0";"xbrli:integerItemType";"integer";"xbrli:integerItemType";"Number";"0";;;;;;;;;;;;"Duration";"None";0;0;"";"Bruto overdekt teeltoppervlak, zoals kas, schuur of grot. Inclusief stapeling (buitenmaat, in hectare (= 10.000 m²).";"";"";"";"Bruto overdekt teeltoppervlak, zoals kas, schuur of grot. Inclusief stapeling (buitenmaat, in hectare (= 10.000 m²).";"";"";""
465;"AgroMushroomCultivation_frc-abstr:AssetsBanksTitle";7;"                  Assets";"                  Activa";"                  Activa";"                  Activa";"";"AssetsBanksTitle";"frc-abstr";"AgroMushroomCultivation_AssetsBanksTitle";"AgroMushroomCultivation_https://www.sbrbanken.nl/bt11/frc/20161209/presentation/frc-abstracts#AssetsBanksTitle";"sbr:presentationItem";14;0;0;"AgroMushroomCultivation_frc-abstr:CommonDataTitle";"0";"0";"0";"0";"xbrli:stringItemType";"string";"xbrli:stringItemType";"Abstract";"0";;;;;;;;;;;;"Duration";"None";1;0;"";"";"";"";"";"";"";"";""
466;"AgroMushroomCultivation_frc-i:PropertyPlantEquipmentMultipleYearsPlantStock";8;"                     Property plant equipment multiple years plant stock";"                     Materiële vaste activa: Meerjaren plantopstand";"                     Materiële vaste activa: Meerjaren plantopstand";"                     Materiële vaste activa: Meerjaren plantopstand";"";"PropertyPlantEquipmentMultipleYearsPlantStock";"frc-i";"AgroMushroomCultivation_PropertyPlantEquipmentMultipleYearsPlantStock";"AgroMushroomCultivation_https://www.sbrbanken.nl/bt11/frc/20161209/dictionary/frc-data#PropertyPlantEquipmentMultipleYearsPlantStock";"xbrli:item";5;0;0;"AgroMushroomCultivation_frc-abstr:AssetsBanksTitle";"0";"0";"0";"0";"xbrli:monetaryItemType";"monetary";"xbrli:monetaryItemType";"Monetary";"0";;;;;;;;;;;;"Duration";"None";0;0;"";"De meerjarige voorraden van te velde staande gewassen.";"";"";"";"";"";"";""
467;"AgroMushroomCultivation_frc-i:ReceivablesMembersLoans";8;"                     Receivables members loans";"                     Vorderingen: Ledenlening";"                     Vorderingen: Ledenlening";"                     Vorderingen: Ledenlening";"";"ReceivablesMembersLoans";"frc-i";"AgroMushroomCultivation_ReceivablesMembersLoans";"AgroMushroomCultivation_https://www.sbrbanken.nl/bt11/frc/20161209/dictionary/frc-data#ReceivablesMembersLoans";"xbrli:item";5;0;0;"AgroMushroomCultivation_frc-abstr:AssetsBanksTitle";"0";"0";"0";"0";"xbrli:monetaryItemType";"monetary";"xbrli:monetaryItemType";"Monetary";"0";;;;;;;;;;;;"Duration";"None";0;0;"";"De openstaande vorderingen die uitgezet zijn aan leden.";"";"";"";"";"";"";""
468;"AgroMushroomCultivation_frc-abstr:AllocatedRevenuesTitle";7;"                  Allocated revenues title";"                  Toegerekende opbrengsten";"                  Toegerekende opbrengsten";"                  Toegerekende opbrengsten";"";"AllocatedRevenuesTitle";"frc-abstr";"AgroMushroomCultivation_AllocatedRevenuesTitle";"AgroMushroomCultivation_https://www.sbrbanken.nl/bt11/frc/20161209/presentation/frc-abstracts#AllocatedRevenuesTitle";"sbr:presentationItem";14;0;0;"AgroMushroomCultivation_frc-abstr:CommonDataTitle";"0";"0";"0";"0";"xbrli:stringItemType";"string";"xbrli:stringItemType";"Abstract";"0";;;;;;;;;;;;"Duration";"None";1;0;"";"";"";"";"";"";"";"";""
469;"AgroMushroomCultivation_frc-i:GrossRevenueProduction";8;"                     Gross revenue production";"                     Productieomzet";"                     Productieomzet";"                     Productieomzet";"";"GrossRevenueProduction";"frc-i";"AgroMushroomCultivation_GrossRevenueProduction";"AgroMushroomCultivation_https://www.sbrbanken.nl/bt11/frc/20161209/dictionary/frc-data#GrossRevenueProduction";"xbrli:item";5;0;0;"AgroMushroomCultivation_frc-abstr:AllocatedRevenuesTitle";"0";"0";"0";"0";"nl-types:monetaryNoDecimalsItemType";"monetaryNoDecimals";"nl-types:monetary20ItemType";"Monetary";"0";"";"";"0";"";"";"";"";"";"";"";"";"Duration";"Credit";0;0;"";"Bruto omzet gegenereerd uit de productie.";"";"";"";"Dit betreft het totaal van de afzonderlijke uitvraag per type";"";"";""
470;"AgroMushroomCultivation_frc-i:StockChange";8;"                     Stock change";"                     Voorraadmutatie";"                     Voorraadmutatie";"                     Voorraadmutatie";"";"StockChange";"frc-i";"AgroMushroomCultivation_StockChange";"AgroMushroomCultivation_https://www.sbrbanken.nl/bt11/frc/20161209/dictionary/frc-data#StockChange";"xbrli:item";5;0;0;"AgroMushroomCultivation_frc-abstr:AllocatedRevenuesTitle";"0";"0";"0";"0";"xbrli:monetaryItemType";"monetary";"xbrli:monetaryItemType";"Monetary";"0";;;;;;;;;;;;"Duration";"Credit";0;0;"";"De wijziging in de voorraad.";"";"";"";"";"";"";""
471;"AgroMushroomCultivation_frc-i:PackagingFee";8;"                     Packaging fee";"                     Verpakkingsvergoeding";"                     Verpakkingsvergoeding";"                     Verpakkingsvergoeding";"";"PackagingFee";"frc-i";"AgroMushroomCultivation_PackagingFee";"AgroMushroomCultivation_https://www.sbrbanken.nl/bt11/frc/20161209/dictionary/frc-data#PackagingFee";"xbrli:item";5;0;0;"AgroMushroomCultivation_frc-abstr:AllocatedRevenuesTitle";"0";"0";"0";"0";"nl-types:monetaryNoDecimalsItemType";"monetaryNoDecimals";"nl-types:monetary20ItemType";"Monetary";"0";"";"";"0";"";"";"";"";"";"";"";"";"Duration";"Credit";0;0;"";"De verpakkingsvergoeding of een deelmarktvergoeding van de telersvereniging.";"";"";"";"De verpakkingsvergoeding of een deelmarktvergoeding van de telersvereniging.";"";"";""
472;"AgroMushroomCultivation_frc-i:GMOGrant";8;"                     GMO grant";"                     GMO subsidie";"                     GMO subsidie";"                     GMO subsidie";"";"GMOGrant";"frc-i";"AgroMushroomCultivation_GMOGrant";"AgroMushroomCultivation_https://www.sbrbanken.nl/bt11/frc/20161209/dictionary/frc-data#GMOGrant";"xbrli:item";5;0;0;"AgroMushroomCultivation_frc-abstr:AllocatedRevenuesTitle";"0";"0";"0";"0";"nl-types:monetaryNoDecimalsItemType";"monetaryNoDecimals";"nl-types:monetary20ItemType";"Monetary";"0";"";"";"0";"";"";"";"";"";"";"";"";"Duration";"Credit";0;0;"";"Subsidie verkregen vanuit de Gemeenschappelijke Markt Ordening (GMO).";"";"";"";"Subsidie verkregen vanuit de Gemeenschappelijke Markt Ordening (GMO). De Europese Unie beloont telersverenigingen die investeren in een sterkere marktpositie. Ze kunnen de helft van hun investering terugkrijgen via GMO-subsidies.";"";"";""
473;"AgroMushroomCultivation_frc-i:ElectricitySales";8;"                     Electricity sales";"                     Verkoop elektra";"                     Verkoop elektra";"                     Verkoop elektra";"";"ElectricitySales";"frc-i";"AgroMushroomCultivation_ElectricitySales";"AgroMushroomCultivation_https://www.sbrbanken.nl/bt11/frc/20161209/dictionary/frc-data#ElectricitySales";"xbrli:item";5;0;0;"AgroMushroomCultivation_frc-abstr:AllocatedRevenuesTitle";"0";"0";"0";"0";"nl-types:monetaryNoDecimalsItemType";"monetaryNoDecimals";"nl-types:monetary20ItemType";"Monetary";"0";"";"";"0";"";"";"";"";"";"";"";"";"Duration";"Credit";0;0;"";"Het totaalbedrag aan verkoop van elektra. Mogelijke MEP- ontvangsten kunnen hier ook onder worden opgenomen.";"";"";"";"Het totaalbedrag aan verkoop van elektra. Mogelijke MEP- ontvangsten kunnen hier ook onder worden opgenomen. MEP staat voor Milieukwaliteit van de Elektriciteitsproductie. ( N.B: niet salderen met de kosten voor elektra).";"";"";""
474;"AgroMushroomCultivation_frc-i:OtherRelatedIncome";8;"                     Other related income";"                     Overige niet toegerekende opbrengsten";"                     Overige niet toegerekende opbrengsten";"                     Overige niet toegerekende opbrengsten";"";"OtherRelatedIncome";"frc-i";"AgroMushroomCultivation_OtherRelatedIncome";"AgroMushroomCultivation_https://www.sbrbanken.nl/bt11/frc/20161209/dictionary/frc-data#OtherRelatedIncome";"xbrli:item";5;0;0;"AgroMushroomCultivation_frc-abstr:AllocatedRevenuesTitle";"0";"0";"0";"0";"nl-types:monetaryNoDecimalsItemType";"monetaryNoDecimals";"nl-types:monetary20ItemType";"Monetary";"0";"";"";"0";"";"";"";"";"";"";"";"";"Duration";"Credit";0;0;"";"Overige niet gedefinieerde niet toegerekende opbrengsten niet zijnde opbrengsten uit teelt of rente of GMO subsidie.";"";"";"";"Overige niet gedefinieerde niet toegerekende opbrengsten niet zijnde opbrengsten uit teelt of rente of GMO subsidie.";"";"";""
475;"AgroMushroomCultivation_frc-abstr:AllocatedCostsTitle";7;"                  Allocated costs title";"                  Toegerekende kosten";"                  Toegerekende kosten";"                  Toegerekende kosten";"";"AllocatedCostsTitle";"frc-abstr";"AgroMushroomCultivation_AllocatedCostsTitle";"AgroMushroomCultivation_https://www.sbrbanken.nl/bt11/frc/20161209/presentation/frc-abstracts#AllocatedCostsTitle";"sbr:presentationItem";14;0;0;"AgroMushroomCultivation_frc-abstr:CommonDataTitle";"0";"0";"0";"0";"xbrli:stringItemType";"string";"xbrli:stringItemType";"Abstract";"0";;;;;;;;;;;;"Duration";"None";1;0;"";"";"";"";"";"";"";"";""
476;"AgroMushroomCultivation_frc-i:CultivationCosts";8;"                     Cultivation costs";"                     Teeltkosten";"                     Teeltkosten";"                     Teeltkosten";"";"CultivationCosts";"frc-i";"AgroMushroomCultivation_CultivationCosts";"AgroMushroomCultivation_https://www.sbrbanken.nl/bt11/frc/20161209/dictionary/frc-data#CultivationCosts";"xbrli:item";14;0;0;"AgroMushroomCultivation_frc-abstr:AllocatedCostsTitle";"0";"0";"0";"0";"nl-types:monetaryNoDecimalsItemType";"monetaryNoDecimals";"nl-types:monetary20ItemType";"Monetary";"0";"";"";"0";"";"";"";"";"";"";"";"";"Duration";"Debit";0;0;"";"De kosten voor gewasbeschermingsmiddelen, meststoffen en zaad-, plant-, pootgoed en overige teeltkosten.";"";"";"";"De kosten voor gewasbeschermingsmiddelen, meststoffen en zaad-, plant-, pootgoed en overige teeltkosten.";"";"";""
477;"AgroMushroomCultivation_frc-i:SowingCosts";9;"                        Sowing costs";"                        Zaai, plant en pootgoedkosten";"                        Zaai, plant en pootgoedkosten";"                        Zaai, plant en pootgoedkosten";"";"SowingCosts";"frc-i";"AgroMushroomCultivation_SowingCosts";"AgroMushroomCultivation_https://www.sbrbanken.nl/bt11/frc/20161209/dictionary/frc-data#SowingCosts";"xbrli:item";5;0;0;"AgroMushroomCultivation_frc-i:CultivationCosts";"0";"0";"0";"0";"nl-types:monetaryNoDecimalsItemType";"monetaryNoDecimals";"nl-types:monetary20ItemType";"Monetary";"0";"";"";"0";"";"";"";"";"";"";"";"";"Duration";"Debit";0;0;"";"De kosten voor zaaizaad, plantkosten en pootgoed.";"";"";"";"De kosten voor zaaizaad, plantkosten en pootgoed.";"";"";""
478;"AgroMushroomCultivation_frc-i:SubstratumCosts";9;"                        Substratum costs";"                        Substraatmateriaalkosten";"                        Substraatmateriaalkosten";"                        Substraatmateriaalkosten";"";"SubstratumCosts";"frc-i";"AgroMushroomCultivation_SubstratumCosts";"AgroMushroomCultivation_https://www.sbrbanken.nl/bt11/frc/20161209/dictionary/frc-data#SubstratumCosts";"xbrli:item";5;0;0;"AgroMushroomCultivation_frc-i:CultivationCosts";"0";"0";"0";"0";"nl-types:monetaryNoDecimalsItemType";"monetaryNoDecimals";"nl-types:monetary20ItemType";"Monetary";"0";"";"";"0";"";"";"";"";"";"";"";"";"Duration";"Debit";0;0;"";"De kosten voor substraat bij teelten los van de ondergrond.";"";"";"";"De kosten voor substraat bij teelten los van de ondergrond.";"";"";""
479;"AgroMushroomCultivation_frc-i:ManuringCosts";9;"                        Manuring costs";"                        Bemestingskosten dierlijke mest";"                        Bemestingskosten dierlijke mest";"                        Bemestingskosten dierlijke mest";"";"ManuringCosts";"frc-i";"AgroMushroomCultivation_ManuringCosts";"AgroMushroomCultivation_https://www.sbrbanken.nl/bt11/frc/20161209/dictionary/frc-data#ManuringCosts";"xbrli:item";5;0;0;"AgroMushroomCultivation_frc-i:CultivationCosts";"0";"0";"0";"0";"nl-types:monetaryNoDecimalsItemType";"monetaryNoDecimals";"nl-types:monetary20ItemType";"Monetary";"0";"";"";"0";"";"";"";"";"";"";"";"";"Duration";"Debit";0;0;"";"De bemestingskosten voor dierlijke mest. Het kan ook een opbrengstpost vormen. Indien dat het geval is, hier een negatief getal invoeren.";"";"";"";"De bemestingskosten voor dierlijke mest. Het kan ook een opbrengstpost vormen. Indien dat het geval is, hier een negatief getal invoeren.";"";"";""
480;"AgroMushroomCultivation_frc-i:FertilizationCosts";9;"                        Fertilization costs";"                        Bemestingskosten kunstmest";"                        Bemestingskosten kunstmest";"                        Bemestingskosten kunstmest";"";"FertilizationCosts";"frc-i";"AgroMushroomCultivation_FertilizationCosts";"AgroMushroomCultivation_https://www.sbrbanken.nl/bt11/frc/20161209/dictionary/frc-data#FertilizationCosts";"xbrli:item";5;0;0;"AgroMushroomCultivation_frc-i:CultivationCosts";"0";"0";"0";"0";"nl-types:monetaryNoDecimalsItemType";"monetaryNoDecimals";"nl-types:monetary20ItemType";"Monetary";"0";"";"";"0";"";"";"";"";"";"";"";"";"Duration";"Debit";0;0;"";"De bemestingskosten voor kunstmest.";"";"";"";"De bemestingskosten voor kunstmest.";"";"";""
481;"AgroMushroomCultivation_frc-i:CropProtectionCosts";9;"                        Crop protection costs";"                        Gewasbeschermingskosten";"                        Gewasbeschermingskosten";"                        Gewasbeschermingskosten";"";"CropProtectionCosts";"frc-i";"AgroMushroomCultivation_CropProtectionCosts";"AgroMushroomCultivation_https://www.sbrbanken.nl/bt11/frc/20161209/dictionary/frc-data#CropProtectionCosts";"xbrli:item";5;0;0;"AgroMushroomCultivation_frc-i:CultivationCosts";"0";"0";"0";"0";"nl-types:monetaryNoDecimalsItemType";"monetaryNoDecimals";"nl-types:monetary20ItemType";"Monetary";"0";"";"";"0";"";"";"";"";"";"";"";"";"Duration";"Debit";0;0;"";"Kosten van chemische en biologische gewasbeschermingsmiddelen.";"";"";"";"Kosten van chemische en biologische gewasbeschermingsmiddelen.";"";"";""
482;"AgroMushroomCultivation_frc-i:CropInsuranceCosts";9;"                        Crop insurance costs";"                        Gewassenverzekeringskosten";"                        Gewassenverzekeringskosten";"                        Gewassenverzekeringskosten";"";"CropInsuranceCosts";"frc-i";"AgroMushroomCultivation_CropInsuranceCosts";"AgroMushroomCultivation_https://www.sbrbanken.nl/bt11/frc/20161209/dictionary/frc-data#CropInsuranceCosts";"xbrli:item";5;0;0;"AgroMushroomCultivation_frc-i:CultivationCosts";"0";"0";"0";"0";"nl-types:monetaryNoDecimalsItemType";"monetaryNoDecimals";"nl-types:monetary20ItemType";"Monetary";"0";"";"";"0";"";"";"";"";"";"";"";"";"Duration";"Debit";0;0;"";"De kosten voor de verzekering van gewassen.";"";"";"";"De kosten voor de verzekering van gewassen.";"";"";""
483;"AgroMushroomCultivation_frc-i:CultivationDisposalCosts";9;"                        Cultivation disposal costs";"                        Afvoerkosten teeltafval";"                        Afvoerkosten teeltafval";"                        Afvoerkosten teeltafval";"";"CultivationDisposalCosts";"frc-i";"AgroMushroomCultivation_CultivationDisposalCosts";"AgroMushroomCultivation_https://www.sbrbanken.nl/bt11/frc/20161209/dictionary/frc-data#CultivationDisposalCosts";"xbrli:item";5;0;0;"AgroMushroomCultivation_frc-i:CultivationCosts";"0";"0";"0";"0";"nl-types:monetaryNoDecimalsItemType";"monetaryNoDecimals";"nl-types:monetary20ItemType";"Monetary";"0";"";"";"0";"";"";"";"";"";"";"";"";"Duration";"Debit";0;0;"";"De kosten voor het afvoeren van teeltafval.";"";"";"";"De kosten voor het afvoeren van teeltafval.";"";"";""
484;"AgroMushroomCultivation_frc-i:CO2OCAPWaterCosts";9;"                        CO2 OCAP water costs";"                        CO2-, OCAP- en waterkosten";"                        CO2-, OCAP- en waterkosten";"                        CO2-, OCAP- en waterkosten";"";"CO2OCAPWaterCosts";"frc-i";"AgroMushroomCultivation_CO2OCAPWaterCosts";"AgroMushroomCultivation_https://www.sbrbanken.nl/bt11/frc/20161209/dictionary/frc-data#CO2OCAPWaterCosts";"xbrli:item";5;0;0;"AgroMushroomCultivation_frc-i:CultivationCosts";"0";"0";"0";"0";"nl-types:monetaryNoDecimalsItemType";"monetaryNoDecimals";"nl-types:monetary20ItemType";"Monetary";"0";"";"";"0";"";"";"";"";"";"";"";"";"Duration";"Debit";0;0;"";"De kosten voor het verbruik van CO2 , OCAP en water.";"";"";"";"De kosten voor het verbruik van CO2 , OCAP en water. OCAP staat voro Organic Carbondioxide for Assimilation of Plants.";"";"";""
485;"AgroMushroomCultivation_frc-i:CultivationCostsOther";9;"                        Cultivation costs other";"                        Overige teeltkosten";"                        Overige teeltkosten";"                        Overige teeltkosten";"";"CultivationCostsOther";"frc-i";"AgroMushroomCultivation_CultivationCostsOther";"AgroMushroomCultivation_https://www.sbrbanken.nl/bt11/frc/20161209/dictionary/frc-data#CultivationCostsOther";"xbrli:item";5;0;0;"AgroMushroomCultivation_frc-i:CultivationCosts";"0";"0";"0";"0";"nl-types:monetaryNoDecimalsItemType";"monetaryNoDecimals";"nl-types:monetary20ItemType";"Monetary";"0";"";"";"0";"";"";"";"";"";"";"";"";"Duration";"Debit";0;0;"";"De overige kosten die met de teelt verband houden en niet apart gedefinieerd zijn.";"";"";"";"Dit kunnen onder meer containerkosten, kosten voor dekmateriaal kwekers, licentiekosten, keurkosten en behandelingskosten zijn.";"";"";""
486;"AgroMushroomCultivation_frc-i:GasCosts";8;"                     Gas costs";"                     Gaskosten";"                     Gaskosten";"                     Gaskosten";"";"GasCosts";"frc-i";"AgroMushroomCultivation_GasCosts";"AgroMushroomCultivation_https://www.sbrbanken.nl/bt11/frc/20161209/dictionary/frc-data#GasCosts";"xbrli:item";5;0;0;"AgroMushroomCultivation_frc-abstr:AllocatedCostsTitle";"0";"0";"0";"0";"nl-types:monetaryNoDecimalsItemType";"monetaryNoDecimals";"nl-types:monetary20ItemType";"Monetary";"0";"";"";"0";"";"";"";"";"";"";"";"";"Duration";"Debit";0;0;"";"De kosten aan eigen verbruik gas of warmte, inclusief vastrecht.";"";"";"";"De kosten aan eigen verbruik gas of warmte, inclusief vastrecht.";"";"";""
487;"AgroMushroomCultivation_frc-i:ElectricityCosts";8;"                     Electricity costs";"                     Elektrakosten";"                     Elektrakosten";"                     Elektrakosten";"";"ElectricityCosts";"frc-i";"AgroMushroomCultivation_ElectricityCosts";"AgroMushroomCultivation_https://www.sbrbanken.nl/bt11/frc/20161209/dictionary/frc-data#ElectricityCosts";"xbrli:item";5;0;0;"AgroMushroomCultivation_frc-abstr:AllocatedCostsTitle";"0";"0";"0";"0";"nl-types:monetaryNoDecimalsItemType";"monetaryNoDecimals";"nl-types:monetary20ItemType";"Monetary";"0";"";"";"0";"";"";"";"";"";"";"";"";"Duration";"Debit";0;0;"";"De kosten voor eigen verbruik elektra, inclusief vastrecht.";"";"";"";"De kosten voor eigen verbruik elektra, inclusief vastrecht.";"";"";""
488;"AgroMushroomCultivation_frc-i:WKKMaintenanceCosts";8;"                     WKK maintenance costs";"                     Onderhoudskosten WKK";"                     Onderhoudskosten WKK";"                     Onderhoudskosten WKK";"";"WKKMaintenanceCosts";"frc-i";"AgroMushroomCultivation_WKKMaintenanceCosts";"AgroMushroomCultivation_https://www.sbrbanken.nl/bt11/frc/20161209/dictionary/frc-data#WKKMaintenanceCosts";"xbrli:item";5;0;0;"AgroMushroomCultivation_frc-abstr:AllocatedCostsTitle";"0";"0";"0";"0";"nl-types:monetaryNoDecimalsItemType";"monetaryNoDecimals";"nl-types:monetary20ItemType";"Monetary";"0";"";"";"0";"";"";"";"";"";"";"";"";"Duration";"Debit";0;0;"";"De kosten van onderhoud aan de WKK-installaties.";"";"";"";"De kosten van onderhoud aan de WKK-installaties. Warmtekrachtkoppeling (WKK) is een efficiënte manier van energieopwekking.";"";"";""
489;"AgroMushroomCultivation_frc-i:WKKLeaseCosts";8;"                     WKK lease costs";"                     Leasekosten WKK";"                     Leasekosten WKK";"                     Leasekosten WKK";"";"WKKLeaseCosts";"frc-i";"AgroMushroomCultivation_WKKLeaseCosts";"AgroMushroomCultivation_https://www.sbrbanken.nl/bt11/frc/20161209/dictionary/frc-data#WKKLeaseCosts";"xbrli:item";5;0;0;"AgroMushroomCultivation_frc-abstr:AllocatedCostsTitle";"0";"0";"0";"0";"nl-types:monetaryNoDecimalsItemType";"monetaryNoDecimals";"nl-types:monetary20ItemType";"Monetary";"0";"";"";"0";"";"";"";"";"";"";"";"";"Duration";"Debit";0;0;"";"De operationele leasekosten van de WKK-installatie(s). Warmtekrachtkoppeling (WKK) is een efficiënte manier van energieopwekking.";"";"";"";"De operationele leasekosten van de WKK-installatie(s). Warmtekrachtkoppeling (WKK) is een efficiënte manier van energieopwekking.";"";"";""
