312;"frc-abstr:AllocatedRevenuesTitle";3;"      Toegerekende opbrengsten";"      Allocated revenues title";"      Toegerekende opbrengsten";"      Toegerekende opbrengsten";"";"AllocatedRevenuesTitle";"frc-abstr";"AllocatedRevenuesTitle";"https://www.sbrbanken.nl/bt11/frc/20161209/presentation/frc-abstracts#AllocatedRevenuesTitle";"sbr:presentationItem";14;0;;"0";"0";"0";"0";"xbrli:stringItemType";"string";"xbrli:stringItemType";"Abstract";"0";;;;;;;;;;;;"Duration";"None";1;0;"";"";"";"";"";"";"";"";""
313;"frc-i:GrossRevenueProduction";4;"         Productieomzet";"         Gross revenue production";"         Productieomzet";"         Productieomzet";"";"GrossRevenueProduction";"frc-i";"GrossRevenueProduction";"https://www.sbrbanken.nl/bt11/frc/20161209/dictionary/frc-data#GrossRevenueProduction";"xbrli:item";5;0;;"0";"0";"0";"0";"nl-types:monetaryNoDecimalsItemType";"monetaryNoDecimals";"nl-types:monetary20ItemType";"Monetary";"0";"";"";"0";"";"";"";"";"";"";"";"";"Duration";"Credit";0;0;"Bruto omzet gegenereerd uit de productie.";"";"";"";"Dit betreft het totaal van de afzonderlijke uitvraag per type";"";"";"";""
314;"frc-i:StockChange";4;"         Voorraadmutatie";"         Stock change";"         Voorraadmutatie";"         Voorraadmutatie";"";"StockChange";"frc-i";"StockChange";"https://www.sbrbanken.nl/bt11/frc/20161209/dictionary/frc-data#StockChange";"xbrli:item";5;0;;"0";"0";"0";"0";"xbrli:monetaryItemType";"monetary";"xbrli:monetaryItemType";"Monetary";"0";;;;;;;;;;;;"Duration";"Credit";0;0;"De wijziging in de voorraad.";"";"";"";"";"";"";"";""
315;"frc-i:PackagingFee";4;"         Verpakkingsvergoeding";"         Packaging fee";"         Verpakkingsvergoeding";"         Verpakkingsvergoeding";"";"PackagingFee";"frc-i";"PackagingFee";"https://www.sbrbanken.nl/bt11/frc/20161209/dictionary/frc-data#PackagingFee";"xbrli:item";5;0;;"0";"0";"0";"0";"nl-types:monetaryNoDecimalsItemType";"monetaryNoDecimals";"nl-types:monetary20ItemType";"Monetary";"0";"";"";"0";"";"";"";"";"";"";"";"";"Duration";"Credit";0;0;"De verpakkingsvergoeding of een deelmarktvergoeding van de telersvereniging.";"";"";"";"De verpakkingsvergoeding of een deelmarktvergoeding van de telersvereniging.";"";"";"";""
316;"frc-i:GMOGrant";4;"         GMO subsidie";"         GMO grant";"         GMO subsidie";"         GMO subsidie";"";"GMOGrant";"frc-i";"GMOGrant";"https://www.sbrbanken.nl/bt11/frc/20161209/dictionary/frc-data#GMOGrant";"xbrli:item";5;0;;"0";"0";"0";"0";"nl-types:monetaryNoDecimalsItemType";"monetaryNoDecimals";"nl-types:monetary20ItemType";"Monetary";"0";"";"";"0";"";"";"";"";"";"";"";"";"Duration";"Credit";0;0;"Subsidie verkregen vanuit de Gemeenschappelijke Markt Ordening (GMO).";"";"";"";"Subsidie verkregen vanuit de Gemeenschappelijke Markt Ordening (GMO). De Europese Unie beloont telersverenigingen die investeren in een sterkere marktpositie. Ze kunnen de helft van hun investering terugkrijgen via GMO-subsidies.";"";"";"";""
317;"frc-i:ElectricitySales";4;"         Verkoop elektra";"         Electricity sales";"         Verkoop elektra";"         Verkoop elektra";"";"ElectricitySales";"frc-i";"ElectricitySales";"https://www.sbrbanken.nl/bt11/frc/20161209/dictionary/frc-data#ElectricitySales";"xbrli:item";5;0;;"0";"0";"0";"0";"nl-types:monetaryNoDecimalsItemType";"monetaryNoDecimals";"nl-types:monetary20ItemType";"Monetary";"0";"";"";"0";"";"";"";"";"";"";"";"";"Duration";"Credit";0;0;"Het totaalbedrag aan verkoop van elektra. Mogelijke MEP- ontvangsten kunnen hier ook onder worden opgenomen.";"";"";"";"Het totaalbedrag aan verkoop van elektra. Mogelijke MEP- ontvangsten kunnen hier ook onder worden opgenomen. MEP staat voor Milieukwaliteit van de Elektriciteitsproductie. ( N.B: niet salderen met de kosten voor elektra).";"";"";"";""
318;"frc-i:OtherRelatedIncome";4;"         Overige niet toegerekende opbrengsten";"         Other related income";"         Overige niet toegerekende opbrengsten";"         Overige niet toegerekende opbrengsten";"";"OtherRelatedIncome";"frc-i";"OtherRelatedIncome";"https://www.sbrbanken.nl/bt11/frc/20161209/dictionary/frc-data#OtherRelatedIncome";"xbrli:item";5;0;;"0";"0";"0";"0";"nl-types:monetaryNoDecimalsItemType";"monetaryNoDecimals";"nl-types:monetary20ItemType";"Monetary";"0";"";"";"0";"";"";"";"";"";"";"";"";"Duration";"Credit";0;0;"Overige niet gedefinieerde niet toegerekende opbrengsten niet zijnde opbrengsten uit teelt of rente of GMO subsidie.";"";"";"";"Overige niet gedefinieerde niet toegerekende opbrengsten niet zijnde opbrengsten uit teelt of rente of GMO subsidie.";"";"";"";""
319;"frc-abstr:AllocatedCostsTitle";3;"      Toegerekende kosten";"      Allocated costs title";"      Toegerekende kosten";"      Toegerekende kosten";"";"AllocatedCostsTitle";"frc-abstr";"AllocatedCostsTitle";"https://www.sbrbanken.nl/bt11/frc/20161209/presentation/frc-abstracts#AllocatedCostsTitle";"sbr:presentationItem";14;0;;"0";"0";"0";"0";"xbrli:stringItemType";"string";"xbrli:stringItemType";"Abstract";"0";;;;;;;;;;;;"Duration";"None";1;0;"";"";"";"";"";"";"";"";""
320;"frc-i:CultivationCosts";4;"         Teeltkosten";"         Cultivation costs";"         Teeltkosten";"         Teeltkosten";"";"CultivationCosts";"frc-i";"CultivationCosts";"https://www.sbrbanken.nl/bt11/frc/20161209/dictionary/frc-data#CultivationCosts";"xbrli:item";14;0;;"0";"0";"0";"0";"nl-types:monetaryNoDecimalsItemType";"monetaryNoDecimals";"nl-types:monetary20ItemType";"Monetary";"0";"";"";"0";"";"";"";"";"";"";"";"";"Duration";"Debit";0;0;"De kosten voor gewasbeschermingsmiddelen, meststoffen en zaad-, plant-, pootgoed en overige teeltkosten.";"";"";"";"De kosten voor gewasbeschermingsmiddelen, meststoffen en zaad-, plant-, pootgoed en overige teeltkosten.";"";"";"";""
321;"frc-i:SowingCosts";5;"            Zaai, plant en pootgoedkosten";"            Sowing costs";"            Zaai, plant en pootgoedkosten";"            Zaai, plant en pootgoedkosten";"";"SowingCosts";"frc-i";"SowingCosts";"https://www.sbrbanken.nl/bt11/frc/20161209/dictionary/frc-data#SowingCosts";"xbrli:item";5;0;;"0";"0";"0";"0";"nl-types:monetaryNoDecimalsItemType";"monetaryNoDecimals";"nl-types:monetary20ItemType";"Monetary";"0";"";"";"0";"";"";"";"";"";"";"";"";"Duration";"Debit";0;0;"De kosten voor zaaizaad, plantkosten en pootgoed.";"";"";"";"De kosten voor zaaizaad, plantkosten en pootgoed.";"";"";"";""
322;"frc-i:SubstratumCosts";5;"            Substraatmateriaalkosten";"            Substratum costs";"            Substraatmateriaalkosten";"            Substraatmateriaalkosten";"";"SubstratumCosts";"frc-i";"SubstratumCosts";"https://www.sbrbanken.nl/bt11/frc/20161209/dictionary/frc-data#SubstratumCosts";"xbrli:item";5;0;;"0";"0";"0";"0";"nl-types:monetaryNoDecimalsItemType";"monetaryNoDecimals";"nl-types:monetary20ItemType";"Monetary";"0";"";"";"0";"";"";"";"";"";"";"";"";"Duration";"Debit";0;0;"De kosten voor substraat bij teelten los van de ondergrond.";"";"";"";"De kosten voor substraat bij teelten los van de ondergrond.";"";"";"";""
323;"frc-i:ManuringCosts";5;"            Bemestingskosten dierlijke mest";"            Manuring costs";"            Bemestingskosten dierlijke mest";"            Bemestingskosten dierlijke mest";"";"ManuringCosts";"frc-i";"ManuringCosts";"https://www.sbrbanken.nl/bt11/frc/20161209/dictionary/frc-data#ManuringCosts";"xbrli:item";5;0;;"0";"0";"0";"0";"nl-types:monetaryNoDecimalsItemType";"monetaryNoDecimals";"nl-types:monetary20ItemType";"Monetary";"0";"";"";"0";"";"";"";"";"";"";"";"";"Duration";"Debit";0;0;"De bemestingskosten voor dierlijke mest. Het kan ook een opbrengstpost vormen. Indien dat het geval is, hier een negatief getal invoeren.";"";"";"";"De bemestingskosten voor dierlijke mest. Het kan ook een opbrengstpost vormen. Indien dat het geval is, hier een negatief getal invoeren.";"";"";"";""
324;"frc-i:FertilizationCosts";5;"            Bemestingskosten kunstmest";"            Fertilization costs";"            Bemestingskosten kunstmest";"            Bemestingskosten kunstmest";"";"FertilizationCosts";"frc-i";"FertilizationCosts";"https://www.sbrbanken.nl/bt11/frc/20161209/dictionary/frc-data#FertilizationCosts";"xbrli:item";5;0;;"0";"0";"0";"0";"nl-types:monetaryNoDecimalsItemType";"monetaryNoDecimals";"nl-types:monetary20ItemType";"Monetary";"0";"";"";"0";"";"";"";"";"";"";"";"";"Duration";"Debit";0;0;"De bemestingskosten voor kunstmest.";"";"";"";"De bemestingskosten voor kunstmest.";"";"";"";""
325;"frc-i:CropProtectionCosts";5;"            Gewasbeschermingskosten";"            Crop protection costs";"            Gewasbeschermingskosten";"            Gewasbeschermingskosten";"";"CropProtectionCosts";"frc-i";"CropProtectionCosts";"https://www.sbrbanken.nl/bt11/frc/20161209/dictionary/frc-data#CropProtectionCosts";"xbrli:item";5;0;;"0";"0";"0";"0";"nl-types:monetaryNoDecimalsItemType";"monetaryNoDecimals";"nl-types:monetary20ItemType";"Monetary";"0";"";"";"0";"";"";"";"";"";"";"";"";"Duration";"Debit";0;0;"Kosten van chemische en biologische gewasbeschermingsmiddelen.";"";"";"";"Kosten van chemische en biologische gewasbeschermingsmiddelen.";"";"";"";""
326;"frc-i:CropInsuranceCosts";5;"            Gewassenverzekeringskosten";"            Crop insurance costs";"            Gewassenverzekeringskosten";"            Gewassenverzekeringskosten";"";"CropInsuranceCosts";"frc-i";"CropInsuranceCosts";"https://www.sbrbanken.nl/bt11/frc/20161209/dictionary/frc-data#CropInsuranceCosts";"xbrli:item";5;0;;"0";"0";"0";"0";"nl-types:monetaryNoDecimalsItemType";"monetaryNoDecimals";"nl-types:monetary20ItemType";"Monetary";"0";"";"";"0";"";"";"";"";"";"";"";"";"Duration";"Debit";0;0;"De kosten voor de verzekering van gewassen.";"";"";"";"De kosten voor de verzekering van gewassen.";"";"";"";""
327;"frc-i:CultivationDisposalCosts";5;"            Afvoerkosten teeltafval";"            Cultivation disposal costs";"            Afvoerkosten teeltafval";"            Afvoerkosten teeltafval";"";"CultivationDisposalCosts";"frc-i";"CultivationDisposalCosts";"https://www.sbrbanken.nl/bt11/frc/20161209/dictionary/frc-data#CultivationDisposalCosts";"xbrli:item";5;0;;"0";"0";"0";"0";"nl-types:monetaryNoDecimalsItemType";"monetaryNoDecimals";"nl-types:monetary20ItemType";"Monetary";"0";"";"";"0";"";"";"";"";"";"";"";"";"Duration";"Debit";0;0;"De kosten voor het afvoeren van teeltafval.";"";"";"";"De kosten voor het afvoeren van teeltafval.";"";"";"";""
328;"frc-i:CO2OCAPWaterCosts";5;"            CO2-, OCAP- en waterkosten";"            CO2 OCAP water costs";"            CO2-, OCAP- en waterkosten";"            CO2-, OCAP- en waterkosten";"";"CO2OCAPWaterCosts";"frc-i";"CO2OCAPWaterCosts";"https://www.sbrbanken.nl/bt11/frc/20161209/dictionary/frc-data#CO2OCAPWaterCosts";"xbrli:item";5;0;;"0";"0";"0";"0";"nl-types:monetaryNoDecimalsItemType";"monetaryNoDecimals";"nl-types:monetary20ItemType";"Monetary";"0";"";"";"0";"";"";"";"";"";"";"";"";"Duration";"Debit";0;0;"De kosten voor het verbruik van CO2 , OCAP en water.";"";"";"";"De kosten voor het verbruik van CO2 , OCAP en water. OCAP staat voro Organic Carbondioxide for Assimilation of Plants.";"";"";"";""
329;"frc-i:CultivationCostsOther";5;"            Overige teeltkosten";"            Cultivation costs other";"            Overige teeltkosten";"            Overige teeltkosten";"";"CultivationCostsOther";"frc-i";"CultivationCostsOther";"https://www.sbrbanken.nl/bt11/frc/20161209/dictionary/frc-data#CultivationCostsOther";"xbrli:item";5;0;;"0";"0";"0";"0";"nl-types:monetaryNoDecimalsItemType";"monetaryNoDecimals";"nl-types:monetary20ItemType";"Monetary";"0";"";"";"0";"";"";"";"";"";"";"";"";"Duration";"Debit";0;0;"De overige kosten die met de teelt verband houden en niet apart gedefinieerd zijn.";"";"";"";"Dit kunnen onder meer containerkosten, kosten voor dekmateriaal kwekers, licentiekosten, keurkosten en behandelingskosten zijn.";"";"";"";""
330;"frc-i:GasCosts";4;"         Gaskosten";"         Gas costs";"         Gaskosten";"         Gaskosten";"";"GasCosts";"frc-i";"GasCosts";"https://www.sbrbanken.nl/bt11/frc/20161209/dictionary/frc-data#GasCosts";"xbrli:item";5;0;;"0";"0";"0";"0";"nl-types:monetaryNoDecimalsItemType";"monetaryNoDecimals";"nl-types:monetary20ItemType";"Monetary";"0";"";"";"0";"";"";"";"";"";"";"";"";"Duration";"Debit";0;0;"De kosten aan eigen verbruik gas of warmte, inclusief vastrecht.";"";"";"";"De kosten aan eigen verbruik gas of warmte, inclusief vastrecht.";"";"";"";""
331;"frc-i:ElectricityCosts";4;"         Elektrakosten";"         Electricity costs";"         Elektrakosten";"         Elektrakosten";"";"ElectricityCosts";"frc-i";"ElectricityCosts";"https://www.sbrbanken.nl/bt11/frc/20161209/dictionary/frc-data#ElectricityCosts";"xbrli:item";5;0;;"0";"0";"0";"0";"nl-types:monetaryNoDecimalsItemType";"monetaryNoDecimals";"nl-types:monetary20ItemType";"Monetary";"0";"";"";"0";"";"";"";"";"";"";"";"";"Duration";"Debit";0;0;"De kosten voor eigen verbruik elektra, inclusief vastrecht.";"";"";"";"De kosten voor eigen verbruik elektra, inclusief vastrecht.";"";"";"";""
332;"frc-i:WKKMaintenanceCosts";4;"         Onderhoudskosten WKK";"         WKK maintenance costs";"         Onderhoudskosten WKK";"         Onderhoudskosten WKK";"";"WKKMaintenanceCosts";"frc-i";"WKKMaintenanceCosts";"https://www.sbrbanken.nl/bt11/frc/20161209/dictionary/frc-data#WKKMaintenanceCosts";"xbrli:item";5;0;;"0";"0";"0";"0";"nl-types:monetaryNoDecimalsItemType";"monetaryNoDecimals";"nl-types:monetary20ItemType";"Monetary";"0";"";"";"0";"";"";"";"";"";"";"";"";"Duration";"Debit";0;0;"De kosten van onderhoud aan de WKK-installaties.";"";"";"";"De kosten van onderhoud aan de WKK-installaties. Warmtekrachtkoppeling (WKK) is een efficiënte manier van energieopwekking.";"";"";"";""
333;"frc-i:WKKLeaseCosts";4;"         Leasekosten WKK";"         WKK lease costs";"         Leasekosten WKK";"         Leasekosten WKK";"";"WKKLeaseCosts";"frc-i";"WKKLeaseCosts";"https://www.sbrbanken.nl/bt11/frc/20161209/dictionary/frc-data#WKKLeaseCosts";"xbrli:item";5;0;;"0";"0";"0";"0";"nl-types:monetaryNoDecimalsItemType";"monetaryNoDecimals";"nl-types:monetary20ItemType";"Monetary";"0";"";"";"0";"";"";"";"";"";"";"";"";"Duration";"Debit";0;0;"De operationele leasekosten van de WKK-installatie(s). Warmtekrachtkoppeling (WKK) is een efficiënte manier van energieopwekking.";"";"";"";"De operationele leasekosten van de WKK-installatie(s). Warmtekrachtkoppeling (WKK) is een efficiënte manier van energieopwekking.";"";"";"";""
334;"frc-i:AuctionCosts";4;"         Veilingkosten";"         Auction Costs";"         Veilingkosten";"         Veilingkosten";"";"AuctionCosts";"frc-i";"AuctionCosts";"https://www.sbrbanken.nl/bt11/frc/20161209/dictionary/frc-data#AuctionCosts";"xbrli:item";5;0;;"0";"0";"0";"0";"nl-types:monetaryNoDecimalsItemType";"monetaryNoDecimals";"nl-types:monetary20ItemType";"Monetary";"0";"";"";"0";"";"";"";"";"";"";"";"";"Duration";"Debit";0;0;"Het bedrag aan veilingkosten.";"";"";"";"Het bedrag aan veilingkosten.";"";"";"";""
335;"frc-i:SalesPackackingFustCosts";4;"         Afzet-, verpakking- en fustkosten";"         Sales, packacking and fust costs";"         Afzet-, verpakking- en fustkosten";"         Afzet-, verpakking- en fustkosten";"";"SalesPackackingFustCosts";"frc-i";"SalesPackackingFustCosts";"https://www.sbrbanken.nl/bt11/frc/20161209/dictionary/frc-data#SalesPackackingFustCosts";"xbrli:item";5;0;;"0";"0";"0";"0";"nl-types:monetaryNoDecimalsItemType";"monetaryNoDecimals";"nl-types:monetary20ItemType";"Monetary";"0";"";"";"0";"";"";"";"";"";"";"";"";"Duration";"Debit";0;0;"Het totaalbedrag aan kosten voor afzet (verkoop), verpakking en fust. Hier onder vallen bijvoorbeeld ook stickers en bedrukkingen, keramiek etc.";"";"";"";"Het totaalbedrag aan kosten voor afzet (verkoop), verpakking en fust. Hier onder vallen bijvoorbeeld ook stickers en bedrukkingen, keramiek etc.";"";"";"";""
336;"frc-i:TransportCosts";4;"         Transportkosten";"         Transport Costs";"         Transportkosten";"         Transportkosten";"";"TransportCosts";"frc-i";"TransportCosts";"https://www.sbrbanken.nl/bt11/frc/20161209/dictionary/frc-data#TransportCosts";"xbrli:item";5;0;;"0";"0";"0";"0";"nl-types:monetaryNoDecimalsItemType";"monetaryNoDecimals";"nl-types:monetary20ItemType";"Monetary";"0";"";"";"0";"";"";"";"";"";"";"";"";"Duration";"Debit";0;0;"De kosten aan transport. Kosten voor een personenauto vallen hier niet onder.";"";"";"";"De kosten aan transport. Kosten voor een personenauto vallen hier niet onder.";"";"";"";""
337;"frc-abstr:PotTreeCultivationTitle";2;"   Specificatie potplanten- en boomteelt";"   Pot and tree cultivation title";"   Specificatie potplanten- en boomteelt";"   Specificatie potplanten- en boomteelt";"";"PotTreeCultivationTitle";"frc-abstr";"PotTreeCultivationTitle";"https://www.sbrbanken.nl/bt11/frc/20161209/presentation/frc-abstracts#PotTreeCultivationTitle";"sbr:presentationItem";1;0;;"0";"0";"0";"0";"xbrli:stringItemType";"string";"xbrli:stringItemType";"Abstract";"0";;;;;;;;;;;;"Duration";"None";1;0;"";"";"";"";"";"";"";"";""
338;"frc-i:PurchaseCostsPottedPlantsPropagation";3;"      Inkoopkosten planten opkweek";"      Purchase costs potted plants propagation";"      Inkoopkosten planten opkweek";"      Inkoopkosten planten opkweek";"";"PurchaseCostsPottedPlantsPropagation";"frc-i";"PurchaseCostsPottedPlantsPropagation";"https://www.sbrbanken.nl/bt11/frc/20161209/dictionary/frc-data#PurchaseCostsPottedPlantsPropagation";"xbrli:item";1;0;;"0";"0";"0";"0";"nl-types:monetaryNoDecimalsItemType";"monetaryNoDecimals";"nl-types:monetary20ItemType";"Monetary";"0";"";"";"0";"";"";"";"";"";"";"";"";"Duration";"Debit";0;0;"De inkoopkosten voor afgeteelde potplanten voor opkweek.";"";"";"";"De inkoopkosten voor afgeteelde potplanten voor opkweek.";"";"";"";""
339;"frc-i:PurchaseCostsPottedPlantsSale";3;"      Inkoopkosten planten handel";"      Purchase costs potted plants sale";"      Inkoopkosten planten handel";"      Inkoopkosten planten handel";"";"PurchaseCostsPottedPlantsSale";"frc-i";"PurchaseCostsPottedPlantsSale";"https://www.sbrbanken.nl/bt11/frc/20161209/dictionary/frc-data#PurchaseCostsPottedPlantsSale";"xbrli:item";1;0;;"0";"0";"0";"0";"nl-types:monetaryNoDecimalsItemType";"monetaryNoDecimals";"nl-types:monetary20ItemType";"Monetary";"0";"";"";"0";"";"";"";"";"";"";"";"";"Duration";"Debit";0;0;"De inkoopkosten voor afgeteelde potplanten voor de verkoop.";"";"";"";"De inkoopkosten voor afgeteelde potplanten voor de verkoop.";"";"";"";""
340;"frc-i:PurchaseCostsPots";3;"      Inkoopkosten potten";"      Purchase costs pots";"      Inkoopkosten potten";"      Inkoopkosten potten";"";"PurchaseCostsPots";"frc-i";"PurchaseCostsPots";"https://www.sbrbanken.nl/bt11/frc/20161209/dictionary/frc-data#PurchaseCostsPots";"xbrli:item";1;0;;"0";"0";"0";"0";"nl-types:monetaryNoDecimalsItemType";"monetaryNoDecimals";"nl-types:monetary20ItemType";"Monetary";"0";"";"";"0";"";"";"";"";"";"";"";"";"Duration";"Debit";0;0;"De inkoopkosten voor potten in de teelt van potplanten en bomen.";"";"";"";"De inkoopkosten voor potten in de teelt van potplanten en bomen.";"";"";"";""
341;"frc-i:PurchaseCostsPottingSoil";3;"      Inkoopkosten potgrond";"      Purchase costs potting soil";"      Inkoopkosten potgrond";"      Inkoopkosten potgrond";"";"PurchaseCostsPottingSoil";"frc-i";"PurchaseCostsPottingSoil";"https://www.sbrbanken.nl/bt11/frc/20161209/dictionary/frc-data#PurchaseCostsPottingSoil";"xbrli:item";1;0;;"0";"0";"0";"0";"nl-types:monetaryNoDecimalsItemType";"monetaryNoDecimals";"nl-types:monetary20ItemType";"Monetary";"0";"";"";"0";"";"";"";"";"";"";"";"";"Duration";"Debit";0;0;"De inkoopkosten voor potgrond, in de teelt van potplanten en bomen.";"";"";"";"De inkoopkosten voor potgrond, in de teelt van potplanten en bomen.";"";"";"";""
342;"frc-abstr:LivestockBreedingSpecificationTitle";1;"Veeteelt specificatie [Titel]";"Livestock breeding specification [Title]";"Veeteelt specificatie [Titel]";"Veeteelt specificatie [Titel]";"";"LivestockBreedingSpecificationTitle";"frc-abstr";"LivestockBreedingSpecificationTitle";"https://www.sbrbanken.nl/bt11/frc/20161209/presentation/frc-abstracts#LivestockBreedingSpecificationTitle";"sbr:presentationItem";9;0;;"0";"0";"0";"0";"xbrli:stringItemType";"string";"xbrli:stringItemType";"Abstract";"0";;;;;;;;;;;;"Duration";"None";1;0;"";"";"";"";"";"";"";"";""
343;"frc-abstr:CommonDataTitle";2;"   Algemene gegevens";"   Common data title";"   Algemene gegevens";"   Algemene gegevens";"";"CommonDataTitle";"frc-abstr";"CommonDataTitle";"https://www.sbrbanken.nl/bt11/frc/20161209/presentation/frc-abstracts#CommonDataTitle";"sbr:presentationItem";14;0;;"0";"0";"0";"0";"xbrli:stringItemType";"string";"xbrli:stringItemType";"Abstract";"0";;;;;;;;;;;;"Duration";"None";1;0;"";"";"";"";"";"";"";"";""
344;"frc-i:UtilisedFarmlandOwnProperty";3;"      Bouwgrond in eigendom";"      Utilised farmland own property";"      Bouwgrond in eigendom";"      Bouwgrond in eigendom";"";"UtilisedFarmlandOwnProperty";"frc-i";"UtilisedFarmlandOwnProperty";"https://www.sbrbanken.nl/bt11/frc/20161209/dictionary/frc-data#UtilisedFarmlandOwnProperty";"xbrli:item";14;0;;"0";"0";"0";"0";"xbrli:integerItemType";"integer";"xbrli:integerItemType";"Number";"0";;;;;;;;;;;;"Duration";"None";0;0;"De totale oppervlakte bouwgrond in eigendom, die gedurende de rapportageperiode ten dienste is geweest aan de exploitatie (m²) ten behoeve van de uitoefening van de gespecificeerde veeteelt of de land- en tuinbouw.";"";"";"";"De totale oppervlakte bouwgrond in eigendom, die gedurende de rapportageperiode ten dienste is geweest aan de exploitatie (m²) ten behoeve van de uitoefening van de gespecificeerde veeteelt of de land- en tuinbouw.";"";"";"";""
345;"frc-i:UtilisedFarmlandThirdParties";3;"      Bouwgrond van derden";"      Utilised farmland third parties";"      Bouwgrond van derden";"      Bouwgrond van derden";"";"UtilisedFarmlandThirdParties";"frc-i";"UtilisedFarmlandThirdParties";"https://www.sbrbanken.nl/bt11/frc/20161209/dictionary/frc-data#UtilisedFarmlandThirdParties";"xbrli:item";14;0;;"0";"0";"0";"0";"xbrli:integerItemType";"integer";"xbrli:integerItemType";"Number";"0";;;;;;;;;;;;"Duration";"None";0;0;"De totale oppervlakte bouwgrond van derden, die gedurende de rapportageperiode ten dienste is geweest aan de exploitatie (m²) ten behoeve van de uitoefening van de gespecificeerde veeteelt of de land- en tuinbouw. De bouwgrond is bijvoorbeeld gehuurd of gepacht.";"";"";"";"De totale oppervlakte bouwgrond van derden, die gedurende de rapportageperiode ten dienste is geweest aan de exploitatie (m²) ten behoeve van de uitoefening van de gespecificeerde veeteelt of de land- en tuinbouw. De bouwgrond is bijvoorbeeld gehuurd of gepacht.";"";"";"";""
346;"frc-abstr:AssetsBanksTitle";3;"      Activa";"      Assets";"      Activa";"      Activa";"";"AssetsBanksTitle";"frc-abstr";"AssetsBanksTitle";"https://www.sbrbanken.nl/bt11/frc/20161209/presentation/frc-abstracts#AssetsBanksTitle";"sbr:presentationItem";14;0;;"0";"0";"0";"0";"xbrli:stringItemType";"string";"xbrli:stringItemType";"Abstract";"0";;;;;;;;;;;;"Duration";"None";1;0;"";"";"";"";"";"";"";"";""
347;"frc-i:PropertyPlantEquipmentLivestock";4;"         Materiële vaste activa: Gebruiksvee";"         Property plant equipment livestock";"         Materiële vaste activa: Gebruiksvee";"         Materiële vaste activa: Gebruiksvee";"";"PropertyPlantEquipmentLivestock";"frc-i";"PropertyPlantEquipmentLivestock";"https://www.sbrbanken.nl/bt11/frc/20161209/dictionary/frc-data#PropertyPlantEquipmentLivestock";"xbrli:item";9;0;;"0";"0";"0";"0";"xbrli:monetaryItemType";"monetary";"xbrli:monetaryItemType";"Monetary";"0";;;;;;;;;;;;"Duration";"None";0;0;"Het gedeelte van de materiële vaste activa dat betrekking heeft op het vee dat ter wille van zijn nut gehouden wordt.";"";"";"";"";"";"";"";""
348;"frc-i:StockAssetsCurrentNonLivestock";4;"         Voorraden (vlottende activa): Niet gebruiksvee";"         Stock assets current non livestock";"         Voorraden (vlottende activa): Niet gebruiksvee";"         Voorraden (vlottende activa): Niet gebruiksvee";"";"StockAssetsCurrentNonLivestock";"frc-i";"StockAssetsCurrentNonLivestock";"https://www.sbrbanken.nl/bt11/frc/20161209/dictionary/frc-data#StockAssetsCurrentNonLivestock";"xbrli:item";9;0;;"0";"0";"0";"0";"xbrli:monetaryItemType";"monetary";"xbrli:monetaryItemType";"Monetary";"0";;;;;;;;;;;;"Duration";"None";0;0;"Het deel van de voorraden dat betrekking heeft op het gedeelte dat niet tot het gebruiksvee behoort.";"";"";"";"";"";"";"";""
349;"frc-abstr:AllocatedRevenuesTitle";3;"      Toegerekende opbrengsten";"      Allocated revenues title";"      Toegerekende opbrengsten";"      Toegerekende opbrengsten";"";"AllocatedRevenuesTitle";"frc-abstr";"AllocatedRevenuesTitle";"https://www.sbrbanken.nl/bt11/frc/20161209/presentation/frc-abstracts#AllocatedRevenuesTitle";"sbr:presentationItem";14;0;;"0";"0";"0";"0";"xbrli:stringItemType";"string";"xbrli:stringItemType";"Abstract";"0";;;;;;;;;;;;"Duration";"None";1;0;"";"";"";"";"";"";"";"";""
350;"frc-i:RevenueLivestock";4;"         Omzet vee";"         Revenue livestock";"         Omzet vee";"         Omzet vee";"";"RevenueLivestock";"frc-i";"RevenueLivestock";"https://www.sbrbanken.nl/bt11/frc/20161209/dictionary/frc-data#RevenueLivestock";"xbrli:item";9;0;;"0";"0";"0";"0";"nl-types:monetaryNoDecimalsItemType";"monetaryNoDecimals";"nl-types:monetary20ItemType";"Monetary";"0";"";"";"0";"";"";"";"";"";"";"";"";"Duration";"Credit";0;0;"De omzet voortkomend uit het houden van vee.";"";"";"";"De omzet voortkomend uit het houden van vee.";"";"";"";""
