431;"frc-i:SinglePaymentScheme";4;"         Bedrijfstoeslag";"         Single payment scheme";"         Bedrijfstoeslag";"         Bedrijfstoeslag";"";"SinglePaymentScheme";"frc-i";"SinglePaymentScheme";"https://www.sbrbanken.nl/bt11/frc/20161209/dictionary/frc-data#SinglePaymentScheme";"xbrli:item";9;0;;"0";"0";"0";"0";"nl-types:monetaryNoDecimalsItemType";"monetaryNoDecimals";"nl-types:monetary20ItemType";"Monetary";"0";"";"";"0";"";"";"";"";"";"";"";"";"Duration";"Credit";0;0;"Het totaal aan verkregen bedrijfstoeslag.";"";"";"";"Het totaal aan verkregen bedrijfstoeslag.";"";"";"";""
432;"frc-abstr:AllocatedCostsTitle";3;"      Toegerekende kosten";"      Allocated costs title";"      Toegerekende kosten";"      Toegerekende kosten";"";"AllocatedCostsTitle";"frc-abstr";"AllocatedCostsTitle";"https://www.sbrbanken.nl/bt11/frc/20161209/presentation/frc-abstracts#AllocatedCostsTitle";"sbr:presentationItem";14;0;;"0";"0";"0";"0";"xbrli:stringItemType";"string";"xbrli:stringItemType";"Abstract";"0";;;;;;;;;;;;"Duration";"None";1;0;"";"";"";"";"";"";"";"";""
433;"frc-i:FodderCosts";4;"         Voerkosten";"         Fodder costs";"         Voerkosten";"         Voerkosten";"";"FodderCosts";"frc-i";"FodderCosts";"https://www.sbrbanken.nl/bt11/frc/20161209/dictionary/frc-data#FodderCosts";"xbrli:item";9;0;;"0";"0";"0";"0";"nl-types:monetaryNoDecimalsItemType";"monetaryNoDecimals";"nl-types:monetary20ItemType";"Monetary";"0";"";"";"0";"";"";"";"";"";"";"";"";"Duration";"Debit";0;0;"De kosten voor het voer van vee voor krachtvoer, ruwvoer, bijproducten en ander voer.";"";"";"";"De kosten voor het voer van vee voor krachtvoer, ruwvoer, bijproducten en ander voer.";"";"";"";""
434;"frc-i:HealthcareCosts";4;"         Gezondheidszorgkosten";"         Healthcare costs";"         Gezondheidszorgkosten";"         Gezondheidszorgkosten";"";"HealthcareCosts";"frc-i";"HealthcareCosts";"https://www.sbrbanken.nl/bt11/frc/20161209/dictionary/frc-data#HealthcareCosts";"xbrli:item";9;0;;"0";"0";"0";"0";"nl-types:monetaryNoDecimalsItemType";"monetaryNoDecimals";"nl-types:monetary20ItemType";"Monetary";"0";"";"";"0";"";"";"";"";"";"";"";"";"Duration";"Debit";0;0;"De kosten voor de medische verzorging van het vee.";"";"";"";"De kosten voor de medische verzorging van het vee.";"";"";"";""
435;"frc-i:BreedingCosts";4;"         K.I./Fokkerijkosten";"         Breeding costs";"         K.I./Fokkerijkosten";"         K.I./Fokkerijkosten";"";"BreedingCosts";"frc-i";"BreedingCosts";"https://www.sbrbanken.nl/bt11/frc/20161209/dictionary/frc-data#BreedingCosts";"xbrli:item";9;0;;"0";"0";"0";"0";"nl-types:monetaryNoDecimalsItemType";"monetaryNoDecimals";"nl-types:monetary20ItemType";"Monetary";"0";"";"";"0";"";"";"";"";"";"";"";"";"Duration";"Debit";0;0;"De kosten voor kunstmatige inseminatie (K.I.) en andere fokkosten.";"";"";"";"De kosten voor kunstmatige inseminatie (K.I.) en andere fokkosten.";"";"";"";""
436;"frc-i:CultivationCosts";4;"         Teeltkosten";"         Cultivation costs";"         Teeltkosten";"         Teeltkosten";"";"CultivationCosts";"frc-i";"CultivationCosts";"https://www.sbrbanken.nl/bt11/frc/20161209/dictionary/frc-data#CultivationCosts";"xbrli:item";14;0;;"0";"0";"0";"0";"nl-types:monetaryNoDecimalsItemType";"monetaryNoDecimals";"nl-types:monetary20ItemType";"Monetary";"0";"";"";"0";"";"";"";"";"";"";"";"";"Duration";"Debit";0;0;"De kosten voor gewasbeschermingsmiddelen, meststoffen en zaad-, plant-, pootgoed en overige teeltkosten.";"";"";"";"De kosten voor gewasbeschermingsmiddelen, meststoffen en zaad-, plant-, pootgoed en overige teeltkosten.";"";"";"";""
437;"frc-i:LitterCosts";4;"         Strooiselkosten";"         Litter costs";"         Strooiselkosten";"         Strooiselkosten";"";"LitterCosts";"frc-i";"LitterCosts";"https://www.sbrbanken.nl/bt11/frc/20161209/dictionary/frc-data#LitterCosts";"xbrli:item";9;0;;"0";"0";"0";"0";"nl-types:monetaryNoDecimalsItemType";"monetaryNoDecimals";"nl-types:monetary20ItemType";"Monetary";"0";"";"";"0";"";"";"";"";"";"";"";"";"Duration";"Debit";0;0;"De kosten voor het aanschaffen van strooisel.";"";"";"";"De kosten voor het aanschaffen van strooisel.";"";"";"";""
438;"frc-i:EnergyCosts";4;"         Energiekosten";"         Energy costs";"         Energiekosten";"         Energiekosten";"";"EnergyCosts";"frc-i";"EnergyCosts";"https://www.sbrbanken.nl/bt11/frc/20161209/dictionary/frc-data#EnergyCosts";"xbrli:item";9;0;;"0";"0";"0";"0";"nl-types:monetaryNoDecimalsItemType";"monetaryNoDecimals";"nl-types:monetary20ItemType";"Monetary";"0";"";"";"0";"";"";"";"";"";"";"";"";"Duration";"Debit";0;0;"De kosten van energie (gas en electra) en water, verbruikt voor de aandrijving van een krachtbron, voor verlichting en/of voor verwarming.";"";"";"";"De kosten van energie (gas en electra) en water, verbruikt voor de aandrijving van een krachtbron, voor verlichting en/of voor verwarming.";"";"";"";""
439;"frc-i:LivestockCostsOther";4;"         Overige veekosten";"         Livestock costs other";"         Overige veekosten";"         Overige veekosten";"";"LivestockCostsOther";"frc-i";"LivestockCostsOther";"https://www.sbrbanken.nl/bt11/frc/20161209/dictionary/frc-data#LivestockCostsOther";"xbrli:item";9;0;;"0";"0";"0";"0";"nl-types:monetaryNoDecimalsItemType";"monetaryNoDecimals";"nl-types:monetary20ItemType";"Monetary";"0";"";"";"0";"";"";"";"";"";"";"";"";"Duration";"Debit";0;0;"Overige veekosten, die direct zijn te relateren aan het houden van vee.";"";"";"";"Overige veekosten, die direct zijn te relateren aan het houden van vee.";"";"";"";""
440;"frc-abstr:NotAllocatedCostsTitle";3;"      Niet-toegerekende kosten";"      Not allocated costs title";"      Niet-toegerekende kosten";"      Niet-toegerekende kosten";"";"NotAllocatedCostsTitle";"frc-abstr";"NotAllocatedCostsTitle";"https://www.sbrbanken.nl/bt11/frc/20161209/presentation/frc-abstracts#NotAllocatedCostsTitle";"sbr:presentationItem";9;0;;"0";"0";"0";"0";"xbrli:stringItemType";"string";"xbrli:stringItemType";"Abstract";"0";;;;;;;;;;;;"Duration";"None";1;0;"";"";"";"";"";"";"";"";""
441;"frc-i:ManureDisposalCosts";4;"         Mestafzetkosten";"         Manure disposal costs";"         Mestafzetkosten";"         Mestafzetkosten";"";"ManureDisposalCosts";"frc-i";"ManureDisposalCosts";"https://www.sbrbanken.nl/bt11/frc/20161209/dictionary/frc-data#ManureDisposalCosts";"xbrli:item";9;0;;"0";"0";"0";"0";"nl-types:monetaryNoDecimalsItemType";"monetaryNoDecimals";"nl-types:monetary20ItemType";"Monetary";"0";"";"";"0";"";"";"";"";"";"";"";"";"Duration";"Debit";0;0;"De kosten voor de afzet van mest.";"";"";"";"Mestafzetkosten zijn toegerekende kosten, maar in de gehanteerde definitie van het saldo worden ze niet meegenomen.";"";"";"";""
442;"frc-i:ProductionRightsLeaseCosts";4;"         Leasekosten productierechten";"         Production rights lease costs";"         Leasekosten productierechten";"         Leasekosten productierechten";"";"ProductionRightsLeaseCosts";"frc-i";"ProductionRightsLeaseCosts";"https://www.sbrbanken.nl/bt11/frc/20161209/dictionary/frc-data#ProductionRightsLeaseCosts";"xbrli:item";9;0;;"0";"0";"0";"0";"nl-types:monetaryNoDecimalsItemType";"monetaryNoDecimals";"nl-types:monetary20ItemType";"Monetary";"0";"";"";"0";"";"";"";"";"";"";"";"";"Duration";"Debit";0;0;"De kosten voor de lease van productierechten. Productierechten zijn varkens-en pluimveerechten.";"";"";"";"De kosten voor de lease van productierechten. Productierechten zijn varkens-en pluimveerechten. (N.B. leasekosten van machines etc. vallen hier niet onder).";"";"";"";""
443;"frc-abstr:NestlingsFarmTitle";2;"   Specificatie vleeskuikenshouderij";"   Nestlings farm title";"   Specificatie vleeskuikenshouderij";"   Specificatie vleeskuikenshouderij";"";"NestlingsFarmTitle";"frc-abstr";"NestlingsFarmTitle";"https://www.sbrbanken.nl/bt11/frc/20161209/presentation/frc-abstracts#NestlingsFarmTitle";"sbr:presentationItem";1;0;;"0";"0";"0";"0";"xbrli:stringItemType";"string";"xbrli:stringItemType";"Abstract";"0";;;;;;;;;;;;"Duration";"None";1;0;"";"";"";"";"";"";"";"";""
444;"frc-i:NetSquareMeterStableSurface";3;"      Netto staloppervlakte (m²)";"      Net square meter stable surface";"      Netto staloppervlakte (m²)";"      Netto staloppervlakte (m²)";"";"NetSquareMeterStableSurface";"frc-i";"NetSquareMeterStableSurface";"https://www.sbrbanken.nl/bt11/frc/20161209/dictionary/frc-data#NetSquareMeterStableSurface";"xbrli:item";4;0;;"0";"0";"0";"0";"xbrli:integerItemType";"integer";"xbrli:integerItemType";"Number";"0";;;;;;;;;;;;"Duration";"None";0;0;"De netto oppervlakte (in m²), waarop de vleeskuikens leven.";"";"";"";"De netto oppervlakte (in m²), waarop de vleeskuikens leven.";"";"";"";""
445;"frc-i:AverageNumberBroilersPerRound";3;"      Gemiddeld aantal vleeskuikens per ronde";"      Average number broilers per round";"      Gemiddeld aantal vleeskuikens per ronde";"      Gemiddeld aantal vleeskuikens per ronde";"";"AverageNumberBroilersPerRound";"frc-i";"AverageNumberBroilersPerRound";"https://www.sbrbanken.nl/bt11/frc/20161209/dictionary/frc-data#AverageNumberBroilersPerRound";"xbrli:item";1;0;;"0";"0";"0";"0";"xbrli:integerItemType";"integer";"xbrli:integerItemType";"Number";"0";;;;;;;;;;;;"Duration";"None";0;0;"Het gemiddeld aantal vleeskuikens dat binnen de onderneming per ronde is opgehokt.";"";"";"";"Het gemiddeld aantal vleeskuikens dat binnen de onderneming per ronde is opgehokt.";"";"";"";""
446;"frc-i:EmptyingCatchLoadingCosts";3;"      Inzet- vang- en laadkosten";"      Emptying catch loading costs";"      Inzet- vang- en laadkosten";"      Inzet- vang- en laadkosten";"";"EmptyingCatchLoadingCosts";"frc-i";"EmptyingCatchLoadingCosts";"https://www.sbrbanken.nl/bt11/frc/20161209/dictionary/frc-data#EmptyingCatchLoadingCosts";"xbrli:item";4;0;;"0";"0";"0";"0";"nl-types:monetaryNoDecimalsItemType";"monetaryNoDecimals";"nl-types:monetary20ItemType";"Monetary";"0";"";"";"0";"";"";"";"";"";"";"";"";"Duration";"Debit";0;0;"De kosten voor de inzet, het vangen en het laden van het vee.";"";"";"";"Deze kosten hebben betrekking op de kosten voor externe arbeid om pluimveestallen leeg te maken en in te laden.";"";"";"";""
447;"frc-abstr:PartyFilingTaxReturnTitle";1;"Belastingplichtige [titel]";"Party filing tax return [title]";"Belastingplichtige [titel]";"Belastingplichtige [titel]";"";"PartyFilingTaxReturnTitle";"frc-abstr";"PartyFilingTaxReturnTitle";"https://www.sbrbanken.nl/bt11/frc/20161209/presentation/frc-abstracts#PartyFilingTaxReturnTitle";"sbr:presentationItem";1;0;;"0";"0";"0";"0";"xbrli:stringItemType";"string";"xbrli:stringItemType";"Abstract";"0";;;;;;;;;;;;"Duration";"None";1;0;"";"";"";"";"";"";"";"";""
448;"bd-alg:Initials";2;"   Voorletters";"   Initials";"   Initials";"   Initials";"";"Initials";"bd-alg";"Initials";"http://www.nltaxonomie.nl/nt11/bd/20161207/dictionary/bd-algemeen#Initials";"xbrli:item";2;0;;"0";"0";"0";"0";"bd-types:anstring10VItemType";"anstring10V";"xbrli:tokenItemType";"String";"0";"";"";"";"";"";"1";"10";"";"";"";"";"Duration";"None";0;0;"";"";"";"";"";"";"";"";"Chapter: mda definities, Name: belastingdienst taxonomie definities.pdf, Paragraph: 9"
449;"bd-alg:Prefix";2;"   Tussenvoegsel";"   Prefix";"   Prefix";"   Prefix";"";"Prefix";"bd-alg";"Prefix";"http://www.nltaxonomie.nl/nt11/bd/20161207/dictionary/bd-algemeen#Prefix";"xbrli:item";2;0;;"0";"0";"0";"0";"bd-types:anstring10VItemType";"anstring10V";"xbrli:tokenItemType";"String";"0";"";"";"";"";"";"1";"10";"";"";"";"";"Duration";"None";0;0;"";"";"";"";"";"";"";"";"Chapter: mda definities, Name: belastingdienst taxonomie definities.pdf, Paragraph: 10"
450;"bd-alg:Surname";2;"   Achternaam";"   Surname";"   Surname";"   Surname";"";"Surname";"bd-alg";"Surname";"http://www.nltaxonomie.nl/nt11/bd/20161207/dictionary/bd-algemeen#Surname";"xbrli:item";2;0;;"0";"0";"0";"0";"bd-types:anstring200VItemType";"anstring200V";"xbrli:tokenItemType";"String";"0";"";"";"";"";"";"1";"200";"";"";"";"";"Duration";"None";0;0;"";"";"";"";"";"";"";"";"Chapter: mda definities, Name: belastingdienst taxonomie definities.pdf, Paragraph: 11"
451;"nl-cd:DateOfBirth";2;"   Geboortedatum";"   Date of birth";"   Geboortedatum";"   Geboortedatum";"";"DateOfBirth";"nl-cd";"DateOfBirth";"http://www.nltaxonomie.nl/nt11/sbr/20160610/dictionary/nl-common-data#DateOfBirth";"xbrli:item";2;0;;"0";"0";"0";"0";"xbrli:dateItemType";"date";"xbrli:dateItemType";"Date";"0";;;;;;;;;;;;"Duration";"None";0;0;"De datum waarop de persoon is geboren.";"The date on which a person is born.";"";"";"";"";"";"";"Name: LO3.9, Page: 238, Publisher: Gemeentelijke basisadministratie"
452;"frc-abstr:HomeAddressBanksTitle";2;"   Huisadres belastingplichtige [Titel]";"   Home address [Title]";"   Huisadres belastingplichtige [Titel]";"   Huisadres belastingplichtige [Titel]";"";"HomeAddressBanksTitle";"frc-abstr";"HomeAddressBanksTitle";"https://www.sbrbanken.nl/bt11/frc/20161209/presentation/frc-abstracts#HomeAddressBanksTitle";"sbr:presentationItem";1;0;;"0";"0";"0";"0";"xbrli:stringItemType";"string";"xbrli:stringItemType";"Abstract";"0";;;;;;;;;;;;"Duration";"None";1;0;"";"";"";"";"";"";"";"";""
453;"nl-cd:DescriptionLocationNL";3;"      Locatieomschrijving NL";"      Description of location NL";"      Locatieomschrijving NL";"      Locatieomschrijving NL";"";"DescriptionLocationNL";"nl-cd";"DescriptionLocationNL";"http://www.nltaxonomie.nl/nt11/sbr/20160610/dictionary/nl-common-data#DescriptionLocationNL";"xbrli:item";1;0;;"0";"0";"0";"0";"nl-types:string1000ItemType";"string1000";"xbrli:stringItemType";"String";"0";"";"";"";"";"";"1";"1000";"";"";"";"";"Duration";"None";0;0;"Een nadere aanduiding bij de adresgegevens om de plaats aan te duiden waar de persoon dan wel een organisatie bereikbaar is.";"More information on address to identify the location where the person or organisation is located.";"";"";"";"";"";"";"IssueDate: 2002, Name: NEN5825"
454;"nl-cd:StreetNameNL";3;"      Straatnaam NL";"      Street name NL";"      Straatnaam NL";"      Straatnaam NL";"";"StreetNameNL";"nl-cd";"StreetNameNL";"http://www.nltaxonomie.nl/nt11/sbr/20160610/dictionary/nl-common-data#StreetNameNL";"xbrli:item";2;0;;"0";"0";"0";"0";"nl-types:string1000ItemType";"string1000";"xbrli:stringItemType";"String";"0";"";"";"";"";"";"1";"1000";"";"";"";"";"Duration";"None";0;0;"De officiële door de gemeente vastgestelde naam van een straat.";"The official registered name of a street as determined by the city council.";"";"";"";"";"";"";"IssueDate: 2002, Name: NEN5825"
455;"nl-cd:HouseNumberNL";3;"      Huisnummer";"      House number";"      Huisnummer";"      Huisnummer";"";"HouseNumberNL";"nl-cd";"HouseNumberNL";"http://www.nltaxonomie.nl/nt11/sbr/20160610/dictionary/nl-common-data#HouseNumberNL";"xbrli:item";2;0;;"0";"0";"0";"0";"nl-types:nonNegative20ItemType";"nonNegative20";"xbrli:stringItemType";"Number";"0";"([0-9]{1,20})";"";"";"";"";"";"";"";"";"";"";"Duration";"None";0;0;"De numerieke aanduiding zoals deze door de gemeente aan het object is toegekend.";"The numeric part of the object as designated by the municipality.";"";"";"";"";"";"";"IssueDate: 2002, Name: NEN5825"
456;"nl-cd:HouseNumberAddition";3;"      Huisnummer toevoeging";"      House number addition";"      Huisnummer toevoeging";"      Huisnummer toevoeging";"";"HouseNumberAddition";"nl-cd";"HouseNumberAddition";"http://www.nltaxonomie.nl/nt11/sbr/20160610/dictionary/nl-common-data#HouseNumberAddition";"xbrli:item";2;0;;"0";"0";"0";"0";"nl-types:string1000ItemType";"string1000";"xbrli:stringItemType";"String";"0";"";"";"";"";"";"1";"1000";"";"";"";"";"Duration";"None";0;0;"De huisnummertoevoeging zoals deze door de gemeente aan het object is toegekend.";"The house number addition as designated by the municipality.";"";"";"";"";"";"";"IssueDate: 2002, Name: NEN5825"
457;"nl-cd:PostalCodeNL";3;"      Postcode NL";"      Postal code NL";"      Postcode NL";"      Postcode NL";"";"PostalCodeNL";"nl-cd";"PostalCodeNL";"http://www.nltaxonomie.nl/nt11/sbr/20160610/dictionary/nl-common-data#PostalCodeNL";"xbrli:item";2;0;;"0";"0";"0";"0";"nl-types:nlzipItemType";"nlzip";"xbrli:stringItemType";"String";"0";"([1-9]{1}[0-9]{3}[A-Z]{2})";"";"";"";"";"";"";"";"";"";"";"Duration";"None";0;0;"De officiële codering van PostNL voor een Nederlands postadres, bestaande uit een numeriek deel en een alfabetisch deel.";"The official coding of PostNL for a Dutch postal address, consisting of a numeric part and an alphabetic part.";"";"";"";"";"";"";"IssueDate: 2002, Name: NEN5825|Article: 37, Name: Wet op de omzetbelasting 1968, Paragraph: a"
458;"nl-cd:PlaceOfResidenceNL";3;"      Woonplaats NL";"      Place of residence NL";"      Woonplaats NL";"      Woonplaats NL";"";"PlaceOfResidenceNL";"nl-cd";"PlaceOfResidenceNL";"http://www.nltaxonomie.nl/nt11/sbr/20160610/dictionary/nl-common-data#PlaceOfResidenceNL";"xbrli:item";2;0;;"0";"0";"0";"0";"nl-types:string1000ItemType";"string1000";"xbrli:stringItemType";"String";"0";"";"";"";"";"";"1";"1000";"";"";"";"";"Duration";"None";0;0;"De officiële door de gemeente vastgestelde gemeentenaam.";"The official municipality name as designated by the municipality.";"";"";"";"";"";"";"Name: LO3.9, Page: 253, Publisher: Gemeentelijke basisadministratie|IssueDate: 2002, Name: NEN5825|Article: 37, Name: Wet op de omzetbelasting 1968, Paragraph: a"
459;"nl-cd:NameRegion";3;"      Regionaam";"      Name region";"      Regionaam";"      Regionaam";"";"NameRegion";"nl-cd";"NameRegion";"http://www.nltaxonomie.nl/nt11/sbr/20160610/dictionary/nl-common-data#NameRegion";"xbrli:item";2;0;;"0";"0";"0";"0";"nl-types:string1000ItemType";"string1000";"xbrli:stringItemType";"String";"0";"";"";"";"";"";"1";"1000";"";"";"";"";"Duration";"None";0;0;"Adres element dat het geografische of administratieve gebied specificeert waarin een stad is opgenomen.";"Address element specifying the geographic or administrative area of the country in which the town is situated.";"";"";"";"";"";"";"IssueDate: 2011, Name: NEN14142-1"
460;"nl-cd:CountryName";3;"      Landnaam, ISO";"      Country name, ISO";"      Landnaam, ISO";"      Landnaam, ISO";"";"CountryName";"nl-cd";"CountryName";"http://www.nltaxonomie.nl/nt11/sbr/20160610/dictionary/nl-common-data#CountryName";"xbrli:item";2;0;;"0";"0";"0";"0";"nl-types:string1000ItemType";"string1000";"xbrli:stringItemType";"String";"0";"";"";"";"";"";"1";"1000";"";"";"";"";"Duration";"None";0;0;"Adres element gebruik makend van de ISO 3166-1 code voor landen, territorium of gebied met geopolitieke belangen, waarin een leveringspunt is gelokaliseerd of hoe het leveringspunt bereikt kan worden.";"Address element designating the country, dependency or area of geopolitical interest, in which a delivery point is located or via which the delivery point is accessed.";"";"";"";"";"";"";"IssueDate: 2011, Name: NEN14142-1"
461;"bd-abstr:TaxReturnIncomeTaxTitle";1;"Aangifte inkomstenbelasting";"Tax return income tax";"Tax return income tax";"Tax return income tax";"";"TaxReturnIncomeTaxTitle";"bd-abstr";"TaxReturnIncomeTaxTitle";"http://www.nltaxonomie.nl/nt11/bd/20161207/presentation/bd-abstracts#TaxReturnIncomeTaxTitle";"sbr:presentationItem";1;0;;"0";"0";"0";"0";"xbrli:stringItemType";"string";"xbrli:stringItemType";"Abstract";"0";;;;;;;;;;;;"Duration";"None";1;0;"";"";"";"";"";"";"";"";""
462;"bd-abstr:SectionIncomeTaxSocialInsurancePremiumTitle";2;"   Inkomstenbelasting en premies volksverzekeringen";"   Section income tax and social insurance premium";"   Section income tax and social insurance premium";"   Section income tax and social insurance premium";"";"SectionIncomeTaxSocialInsurancePremiumTitle";"bd-abstr";"SectionIncomeTaxSocialInsurancePremiumTitle";"http://www.nltaxonomie.nl/nt11/bd/20161207/presentation/bd-abstracts#SectionIncomeTaxSocialInsurancePremiumTitle";"sbr:presentationItem";1;0;;"0";"0";"0";"0";"xbrli:stringItemType";"string";"xbrli:stringItemType";"Abstract";"0";;;;;;;;;;;;"Duration";"None";1;0;"";"";"";"";"";"";"";"";""
463;"frc-t:FiscalPartnerDataSpecification";3;"      Fiscale partner";"      Fiscal partner data specification";"      Fiscale partner";"      Fiscale partner";"";"FiscalPartnerDataSpecification";"frc-t";"FiscalPartnerDataSpecification";"https://www.sbrbanken.nl/bt11/frc/20161209/dictionary/frc-tuples#FiscalPartnerDataSpecification";"sbr:specificationTuple";1;1;;"0";"0";"0";"-1";"";"";"";"Abstract";"0";;;;;;;;;;;;"Other";"None";0;0;"";"";"";"";"";"";"";"";""
464;"bd-alg:Prefix";4;"         Tussenvoegsel";"         Prefix";"         Prefix";"         Prefix";"";"Prefix";"bd-alg";"Prefix";"http://www.nltaxonomie.nl/nt11/bd/20161207/dictionary/bd-algemeen#Prefix";"xbrli:item";2;0;"frc-t:FiscalPartnerDataSpecification";"1";"0";"0";"0";"bd-types:anstring10VItemType";"anstring10V";"xbrli:tokenItemType";"String";"0";"";"";"";"";"";"1";"10";"";"";"";"";"Duration";"None";0;0;"";"";"";"";"";"";"";"";"Chapter: mda definities, Name: belastingdienst taxonomie definities.pdf, Paragraph: 10"
465;"bd-alg:Initials";4;"         Voorletters";"         Initials";"         Initials";"         Initials";"";"Initials";"bd-alg";"Initials";"http://www.nltaxonomie.nl/nt11/bd/20161207/dictionary/bd-algemeen#Initials";"xbrli:item";2;0;"frc-t:FiscalPartnerDataSpecification";"1";"1";"0";"0";"bd-types:anstring10VItemType";"anstring10V";"xbrli:tokenItemType";"String";"0";"";"";"";"";"";"1";"10";"";"";"";"";"Duration";"None";0;0;"";"";"";"";"";"";"";"";"Chapter: mda definities, Name: belastingdienst taxonomie definities.pdf, Paragraph: 9"
466;"bd-alg:Surname";4;"         Achternaam";"         Surname";"         Surname";"         Surname";"";"Surname";"bd-alg";"Surname";"http://www.nltaxonomie.nl/nt11/bd/20161207/dictionary/bd-algemeen#Surname";"xbrli:item";2;0;"frc-t:FiscalPartnerDataSpecification";"1";"2";"0";"0";"bd-types:anstring200VItemType";"anstring200V";"xbrli:tokenItemType";"String";"1";"";"";"";"";"";"1";"200";"";"";"";"";"Duration";"None";0;0;"";"";"";"";"";"";"";"";"Chapter: mda definities, Name: belastingdienst taxonomie definities.pdf, Paragraph: 11"
467;"nl-cd:DateOfBirth";4;"         Geboortedatum";"         Date of birth";"         Geboortedatum";"         Geboortedatum";"";"DateOfBirth";"nl-cd";"DateOfBirth";"http://www.nltaxonomie.nl/nt11/sbr/20160610/dictionary/nl-common-data#DateOfBirth";"xbrli:item";2;0;"frc-t:FiscalPartnerDataSpecification";"1";"3";"0";"0";"xbrli:dateItemType";"date";"xbrli:dateItemType";"Date";"0";;;;;;;;;;;;"Duration";"None";0;0;"De datum waarop de persoon is geboren.";"The date on which a person is born.";"";"";"";"";"";"";"Name: LO3.9, Page: 238, Publisher: Gemeentelijke basisadministratie"
468;"bd-burg:LivingTogetherSpousesExists";3;"      Huisgenoot / echtgenoot J/N";"      Living together spouses exists Y/N";"      Huisgenoot / echtgenoot J/N";"      Huisgenoot / echtgenoot J/N";"http://www.nltaxonomie.nl/2016/labelrole/industrySpecificLabel";"LivingTogetherSpousesExists";"bd-burg";"LivingTogetherSpousesExists";"http://www.nltaxonomie.nl/nt11/bd/20161207/dictionary/bd-burgers#LivingTogetherSpousesExists";"xbrli:item";1;0;;"0";"0";"0";"0";"xbrli:booleanItemType";"boolean";"xbrli:booleanItemType";"Boolean";"0";;;;;;;;;;;;"Duration";"None";0;0;"";"";"";"";"";"";"";"";"Article: 1.2, Name: Wet IB2001|Chapter: gsp definities, Name: belastingdienst taxonomie definities.pdf, Paragraph: 308997|Article: 5a, Name: AWR"
469;"bd-burg:MarriedEntireTaxYear";3;"      Heel belastingjaar gehuwd J/N";"      Married entire tax year Y/N";"      Heel belastingjaar gehuwd J/N";"      Heel belastingjaar gehuwd J/N";"http://www.nltaxonomie.nl/2016/labelrole/industrySpecificLabel";"MarriedEntireTaxYear";"bd-burg";"MarriedEntireTaxYear";"http://www.nltaxonomie.nl/nt11/bd/20161207/dictionary/bd-burgers#MarriedEntireTaxYear";"xbrli:item";1;0;;"0";"0";"0";"0";"xbrli:booleanItemType";"boolean";"xbrli:booleanItemType";"Boolean";"0";;;;;;;;;;;;"Duration";"None";0;0;"";"";"";"";"";"";"";"";"Chapter: gsp definities, Name: belastingdienst taxonomie definities.pdf, Paragraph: 117308|Article: 5a, Name: AWR, Paragraph: 3|Article: 5a, Name: AWR, Paragraph: 1, Subparagraph: a|Article: 5a, Name: AWR, Paragraph: 4"
470;"bd-burg:MarriedPartOfTaxYear";3;"      Deel belastingjaar gehuwd J/N";"      Married part of tax year Y/N";"      Deel belastingjaar gehuwd J/N";"      Deel belastingjaar gehuwd J/N";"http://www.nltaxonomie.nl/2016/labelrole/industrySpecificLabel";"MarriedPartOfTaxYear";"bd-burg";"MarriedPartOfTaxYear";"http://www.nltaxonomie.nl/nt11/bd/20161207/dictionary/bd-burgers#MarriedPartOfTaxYear";"xbrli:item";1;0;;"0";"0";"0";"0";"xbrli:booleanItemType";"boolean";"xbrli:booleanItemType";"Boolean";"0";;;;;;;;;;;;"Duration";"None";0;0;"";"";"";"";"";"";"";"";"Article: 5a, Name: AWR, Paragraph: 1, Subparagraph: a|Article: 5a, Name: AWR, Paragraph: 4|Chapter: gsp definities, Name: belastingdienst taxonomie definities.pdf, Paragraph: 117310|Article: 5a, Name: AWR, Paragraph: 3"
471;"bd-abstr:EarningsPositionQualifyingForeignTaxpayerAndPartnerTitle";3;"      Inkomensopstelling kwalificerende buitenlandse belastingplichtige en partner";"      Earnings position qualifying foreign taxpayer and partner";"      Earnings position qualifying foreign taxpayer and partner";"      Earnings position qualifying foreign taxpayer and partner";"";"EarningsPositionQualifyingForeignTaxpayerAndPartnerTitle";"bd-abstr";"EarningsPositionQualifyingForeignTaxpayerAndPartnerTitle";"http://www.nltaxonomie.nl/nt11/bd/20161207/presentation/bd-abstracts#EarningsPositionQualifyingForeignTaxpayerAndPartnerTitle";"sbr:presentationItem";1;0;;"0";"0";"0";"0";"xbrli:stringItemType";"string";"xbrli:stringItemType";"Abstract";"0";;;;;;;;;;;;"Duration";"None";1;0;"";"";"";"";"";"";"";"";""
