234;"frc-i:ActualFatPercentage";4;"         Werkelijk vet (%)";"         Percentage of actual fat";"         Werkelijk vet (%)";"         Werkelijk vet (%)";"";"ActualFatPercentage";"frc-i";"ActualFatPercentage";"https://www.sbrbanken.nl/bt11/frc/20161209/dictionary/frc-data#ActualFatPercentage";"xbrli:item";2;0;;"0";"0";"0";"0";"num:percentItemType";"percent";"xbrli:pureItemType";"Number";"0";"";"";"";"";"";"";"";"";"";"";"";"Duration";"None";0;0;"Het percentage vet in de geleverde KG melk over de rapportageperiode, 2 decimalen nauwkeurig.";"";"";"";"Het percentage vet in de geleverde KG melk over de rapportageperiode, 2 decimalen nauwkeurig.";"";"";"";""
235;"frc-i:ActualProteinPercentage";4;"         Werkelijk eiwit (%)";"         Percentage of actual protein";"         Werkelijk eiwit (%)";"         Werkelijk eiwit (%)";"";"ActualProteinPercentage";"frc-i";"ActualProteinPercentage";"https://www.sbrbanken.nl/bt11/frc/20161209/dictionary/frc-data#ActualProteinPercentage";"xbrli:item";2;0;;"0";"0";"0";"0";"num:percentItemType";"percent";"xbrli:pureItemType";"Number";"0";"";"";"";"";"";"";"";"";"";"";"";"Duration";"None";0;0;"Het percentage eiwit in de geleverde KG melk over de rapportageperiode, 2 decimalen nauwkeurig.";"";"";"";"Het percentage eiwit in de geleverde KG melk over de rapportageperiode, 2 decimalen nauwkeurig.";"";"";"";""
236;"frc-abstr:FodderCostsTitle";3;"      Nadere specificatie voerkosten";"      Fodder costs title";"      Nadere specificatie voerkosten";"      Nadere specificatie voerkosten";"";"FodderCostsTitle";"frc-abstr";"FodderCostsTitle";"https://www.sbrbanken.nl/bt11/frc/20161209/presentation/frc-abstracts#FodderCostsTitle";"sbr:presentationItem";3;0;;"0";"0";"0";"0";"xbrli:stringItemType";"string";"xbrli:stringItemType";"Abstract";"0";;;;;;;;;;;;"Duration";"None";1;0;"";"";"";"";"";"";"";"";""
237;"frc-i:ConcentratesCosts";4;"         Krachtvoerkosten";"         Concentrates costs";"         Krachtvoerkosten";"         Krachtvoerkosten";"";"ConcentratesCosts";"frc-i";"ConcentratesCosts";"https://www.sbrbanken.nl/bt11/frc/20161209/dictionary/frc-data#ConcentratesCosts";"xbrli:item";3;0;;"0";"0";"0";"0";"nl-types:monetaryNoDecimalsItemType";"monetaryNoDecimals";"nl-types:monetary20ItemType";"Monetary";"0";"";"";"0";"";"";"";"";"";"";"";"";"Duration";"Debit";0;0;"De kosten voor krachtvoer, dit zijn diervoeders met een geconcentreerde voedingswaarde. Melkproducten worden onder krachtvoer geschaard.";"";"";"";"De kosten voor krachtvoer, dit zijn diervoeders met een geconcentreerde voedingswaarde. Melkproducten worden onder krachtvoer geschaard.";"";"";"";""
238;"frc-i:RoughageCosts";4;"         Ruwvoerkosten";"         Roughage costs";"         Ruwvoerkosten";"         Ruwvoerkosten";"";"RoughageCosts";"frc-i";"RoughageCosts";"https://www.sbrbanken.nl/bt11/frc/20161209/dictionary/frc-data#RoughageCosts";"xbrli:item";3;0;;"0";"0";"0";"0";"nl-types:monetaryNoDecimalsItemType";"monetaryNoDecimals";"nl-types:monetary20ItemType";"Monetary";"0";"";"";"0";"";"";"";"";"";"";"";"";"Duration";"Debit";0;0;"De kosten voor ruwvoer, waaronder diervoeders worden verstaan met een geconcentreerde voedingswaarde.";"";"";"";"De kosten voor ruwvoer, waaronder diervoeders worden verstaan met een geconcentreerde voedingswaarde.";"";"";"";""
239;"frc-i:ByproductsCosts";4;"         Bijproducten kosten";"         By-products costs";"         Bijproducten kosten";"         Bijproducten kosten";"";"ByproductsCosts";"frc-i";"ByproductsCosts";"https://www.sbrbanken.nl/bt11/frc/20161209/dictionary/frc-data#ByproductsCosts";"xbrli:item";3;0;;"0";"0";"0";"0";"nl-types:monetaryNoDecimalsItemType";"monetaryNoDecimals";"nl-types:monetary20ItemType";"Monetary";"0";"";"";"0";"";"";"";"";"";"";"";"";"Duration";"Debit";0;0;"De kosten voor producten, die onbedoeld ontstaan in een productieproces, maar wel een positieve waarde hebben of in ieder geval een nuttige toepassing kennen (bijproducten).";"";"";"";"Met bijproducten worden voerkosten bedoeld. Dit zijn onder andere de reststromen van de voedingsmiddelenindustrie welke in de veehouderij worden gebruikt. Komt voornamelijk voor bij melkvee en varkens .";"";"";"";""
240;"frc-abstr:LivestockBreedingSpecificationTitle";1;"Veeteelt specificatie [Titel]";"Livestock breeding specification [Title]";"Veeteelt specificatie [Titel]";"Veeteelt specificatie [Titel]";"";"LivestockBreedingSpecificationTitle";"frc-abstr";"LivestockBreedingSpecificationTitle";"https://www.sbrbanken.nl/bt11/frc/20161209/presentation/frc-abstracts#LivestockBreedingSpecificationTitle";"sbr:presentationItem";9;0;;"0";"0";"0";"0";"xbrli:stringItemType";"string";"xbrli:stringItemType";"Abstract";"0";;;;;;;;;;;;"Duration";"None";1;0;"";"";"";"";"";"";"";"";""
241;"frc-abstr:CommonDataTitle";2;"   Algemene gegevens";"   Common data title";"   Algemene gegevens";"   Algemene gegevens";"";"CommonDataTitle";"frc-abstr";"CommonDataTitle";"https://www.sbrbanken.nl/bt11/frc/20161209/presentation/frc-abstracts#CommonDataTitle";"sbr:presentationItem";14;0;;"0";"0";"0";"0";"xbrli:stringItemType";"string";"xbrli:stringItemType";"Abstract";"0";;;;;;;;;;;;"Duration";"None";1;0;"";"";"";"";"";"";"";"";""
242;"frc-i:UtilisedFarmlandOwnProperty";3;"      Bouwgrond in eigendom";"      Utilised farmland own property";"      Bouwgrond in eigendom";"      Bouwgrond in eigendom";"";"UtilisedFarmlandOwnProperty";"frc-i";"UtilisedFarmlandOwnProperty";"https://www.sbrbanken.nl/bt11/frc/20161209/dictionary/frc-data#UtilisedFarmlandOwnProperty";"xbrli:item";14;0;;"0";"0";"0";"0";"xbrli:integerItemType";"integer";"xbrli:integerItemType";"Number";"0";;;;;;;;;;;;"Duration";"None";0;0;"De totale oppervlakte bouwgrond in eigendom, die gedurende de rapportageperiode ten dienste is geweest aan de exploitatie (m²) ten behoeve van de uitoefening van de gespecificeerde veeteelt of de land- en tuinbouw.";"";"";"";"De totale oppervlakte bouwgrond in eigendom, die gedurende de rapportageperiode ten dienste is geweest aan de exploitatie (m²) ten behoeve van de uitoefening van de gespecificeerde veeteelt of de land- en tuinbouw.";"";"";"";""
243;"frc-i:UtilisedFarmlandThirdParties";3;"      Bouwgrond van derden";"      Utilised farmland third parties";"      Bouwgrond van derden";"      Bouwgrond van derden";"";"UtilisedFarmlandThirdParties";"frc-i";"UtilisedFarmlandThirdParties";"https://www.sbrbanken.nl/bt11/frc/20161209/dictionary/frc-data#UtilisedFarmlandThirdParties";"xbrli:item";14;0;;"0";"0";"0";"0";"xbrli:integerItemType";"integer";"xbrli:integerItemType";"Number";"0";;;;;;;;;;;;"Duration";"None";0;0;"De totale oppervlakte bouwgrond van derden, die gedurende de rapportageperiode ten dienste is geweest aan de exploitatie (m²) ten behoeve van de uitoefening van de gespecificeerde veeteelt of de land- en tuinbouw. De bouwgrond is bijvoorbeeld gehuurd of gepacht.";"";"";"";"De totale oppervlakte bouwgrond van derden, die gedurende de rapportageperiode ten dienste is geweest aan de exploitatie (m²) ten behoeve van de uitoefening van de gespecificeerde veeteelt of de land- en tuinbouw. De bouwgrond is bijvoorbeeld gehuurd of gepacht.";"";"";"";""
244;"frc-i:PhosphateRightsDisclosure";3;"      Informatieverschaffing over de fosfaatrechten";"      Disclosure of the phosephate rights";"      Informatieverschaffing over de fosfaatrechten";"      Informatieverschaffing over de fosfaatrechten";"";"PhosphateRightsDisclosure";"frc-i";"PhosphateRightsDisclosure";"https://www.sbrbanken.nl/bt11/frc/20161209/dictionary/frc-data#PhosphateRightsDisclosure";"xbrli:item";1;0;;"0";"0";"0";"0";"nl-types:string100000ItemType";"string100000";"xbrli:stringItemType";"String";"0";"";"";"";"";"";"1";"100000";"";"";"";"";"Duration";"None";0;0;"Informatieverschaffing op de fosfaatrechten";"";"";"";"";"";"";"";""
245;"frc-abstr:AssetsBanksTitle";3;"      Activa";"      Assets";"      Activa";"      Activa";"";"AssetsBanksTitle";"frc-abstr";"AssetsBanksTitle";"https://www.sbrbanken.nl/bt11/frc/20161209/presentation/frc-abstracts#AssetsBanksTitle";"sbr:presentationItem";14;0;;"0";"0";"0";"0";"xbrli:stringItemType";"string";"xbrli:stringItemType";"Abstract";"0";;;;;;;;;;;;"Duration";"None";1;0;"";"";"";"";"";"";"";"";""
246;"frc-i:PropertyPlantEquipmentLivestock";4;"         Materiële vaste activa: Gebruiksvee";"         Property plant equipment livestock";"         Materiële vaste activa: Gebruiksvee";"         Materiële vaste activa: Gebruiksvee";"";"PropertyPlantEquipmentLivestock";"frc-i";"PropertyPlantEquipmentLivestock";"https://www.sbrbanken.nl/bt11/frc/20161209/dictionary/frc-data#PropertyPlantEquipmentLivestock";"xbrli:item";9;0;;"0";"0";"0";"0";"xbrli:monetaryItemType";"monetary";"xbrli:monetaryItemType";"Monetary";"0";;;;;;;;;;;;"Duration";"None";0;0;"Het gedeelte van de materiële vaste activa dat betrekking heeft op het vee dat ter wille van zijn nut gehouden wordt.";"";"";"";"";"";"";"";""
247;"frc-i:StockAssetsCurrentNonLivestock";4;"         Voorraden (vlottende activa): Niet gebruiksvee";"         Stock assets current non livestock";"         Voorraden (vlottende activa): Niet gebruiksvee";"         Voorraden (vlottende activa): Niet gebruiksvee";"";"StockAssetsCurrentNonLivestock";"frc-i";"StockAssetsCurrentNonLivestock";"https://www.sbrbanken.nl/bt11/frc/20161209/dictionary/frc-data#StockAssetsCurrentNonLivestock";"xbrli:item";9;0;;"0";"0";"0";"0";"xbrli:monetaryItemType";"monetary";"xbrli:monetaryItemType";"Monetary";"0";;;;;;;;;;;;"Duration";"None";0;0;"Het deel van de voorraden dat betrekking heeft op het gedeelte dat niet tot het gebruiksvee behoort.";"";"";"";"";"";"";"";""
248;"frc-abstr:AllocatedRevenuesTitle";3;"      Toegerekende opbrengsten";"      Allocated revenues title";"      Toegerekende opbrengsten";"      Toegerekende opbrengsten";"";"AllocatedRevenuesTitle";"frc-abstr";"AllocatedRevenuesTitle";"https://www.sbrbanken.nl/bt11/frc/20161209/presentation/frc-abstracts#AllocatedRevenuesTitle";"sbr:presentationItem";14;0;;"0";"0";"0";"0";"xbrli:stringItemType";"string";"xbrli:stringItemType";"Abstract";"0";;;;;;;;;;;;"Duration";"None";1;0;"";"";"";"";"";"";"";"";""
249;"frc-i:RevenueLivestock";4;"         Omzet vee";"         Revenue livestock";"         Omzet vee";"         Omzet vee";"";"RevenueLivestock";"frc-i";"RevenueLivestock";"https://www.sbrbanken.nl/bt11/frc/20161209/dictionary/frc-data#RevenueLivestock";"xbrli:item";9;0;;"0";"0";"0";"0";"nl-types:monetaryNoDecimalsItemType";"monetaryNoDecimals";"nl-types:monetary20ItemType";"Monetary";"0";"";"";"0";"";"";"";"";"";"";"";"";"Duration";"Credit";0;0;"De omzet voortkomend uit het houden van vee.";"";"";"";"De omzet voortkomend uit het houden van vee.";"";"";"";""
250;"frc-i:RevenueAndAccretionLivestock";4;"         Omzet en Aanwas vee";"         Revenue and accretion livestock";"         Omzet en Aanwas vee";"         Omzet en Aanwas vee";"";"RevenueAndAccretionLivestock";"frc-i";"RevenueAndAccretionLivestock";"https://www.sbrbanken.nl/bt11/frc/20161209/dictionary/frc-data#RevenueAndAccretionLivestock";"xbrli:item";9;0;;"0";"0";"0";"0";"nl-types:monetaryNoDecimalsItemType";"monetaryNoDecimals";"nl-types:monetary20ItemType";"Monetary";"0";"";"";"0";"";"";"";"";"";"";"";"";"Duration";"Credit";0;0;"De omzet en aanwas van vee voortkomend uit het houden van vee.";"";"";"";"De omzet en aanwas van vee voortkomend uit het houden van vee.";"";"";"";""
251;"frc-i:SinglePaymentScheme";4;"         Bedrijfstoeslag";"         Single payment scheme";"         Bedrijfstoeslag";"         Bedrijfstoeslag";"";"SinglePaymentScheme";"frc-i";"SinglePaymentScheme";"https://www.sbrbanken.nl/bt11/frc/20161209/dictionary/frc-data#SinglePaymentScheme";"xbrli:item";9;0;;"0";"0";"0";"0";"nl-types:monetaryNoDecimalsItemType";"monetaryNoDecimals";"nl-types:monetary20ItemType";"Monetary";"0";"";"";"0";"";"";"";"";"";"";"";"";"Duration";"Credit";0;0;"Het totaal aan verkregen bedrijfstoeslag.";"";"";"";"Het totaal aan verkregen bedrijfstoeslag.";"";"";"";""
252;"frc-abstr:AllocatedCostsTitle";3;"      Toegerekende kosten";"      Allocated costs title";"      Toegerekende kosten";"      Toegerekende kosten";"";"AllocatedCostsTitle";"frc-abstr";"AllocatedCostsTitle";"https://www.sbrbanken.nl/bt11/frc/20161209/presentation/frc-abstracts#AllocatedCostsTitle";"sbr:presentationItem";14;0;;"0";"0";"0";"0";"xbrli:stringItemType";"string";"xbrli:stringItemType";"Abstract";"0";;;;;;;;;;;;"Duration";"None";1;0;"";"";"";"";"";"";"";"";""
253;"frc-i:PurchasesLivestock";4;"         Aankopen vee";"         Purchases livestock";"         Aankopen vee";"         Aankopen vee";"";"PurchasesLivestock";"frc-i";"PurchasesLivestock";"https://www.sbrbanken.nl/bt11/frc/20161209/dictionary/frc-data#PurchasesLivestock";"xbrli:item";1;0;;"0";"0";"0";"0";"nl-types:monetaryNoDecimalsItemType";"monetaryNoDecimals";"nl-types:monetary20ItemType";"Monetary";"0";"";"";"0";"";"";"";"";"";"";"";"";"Duration";"Debit";0;0;"De kosten voor de aankoop van vee.";"";"";"";"De kosten voor de aankoop van vee.";"";"";"";""
254;"frc-i:PurchasesDairyCows";5;"            Aankopen melkkoeien";"            Purchases dairy cows";"            Aankopen melkkoeien";"            Aankopen melkkoeien";"";"PurchasesDairyCows";"frc-i";"PurchasesDairyCows";"https://www.sbrbanken.nl/bt11/frc/20161209/dictionary/frc-data#PurchasesDairyCows";"xbrli:item";1;0;;"0";"0";"0";"0";"nl-types:monetaryNoDecimalsItemType";"monetaryNoDecimals";"nl-types:monetary20ItemType";"Monetary";"0";"";"";"0";"";"";"";"";"";"";"";"";"Duration";"Debit";0;0;"De kosten voor de aankoop van melkkoeien.";"";"";"";"De kosten voor de aankoop van melkkoeien.";"";"";"";""
255;"frc-i:PurchasesYoungStockOlderThanOneYear";5;"            Aankopen jongvee ouder dan 1 jaar";"            Purchases young stock older than one year";"            Aankopen jongvee ouder dan 1 jaar";"            Aankopen jongvee ouder dan 1 jaar";"";"PurchasesYoungStockOlderThanOneYear";"frc-i";"PurchasesYoungStockOlderThanOneYear";"https://www.sbrbanken.nl/bt11/frc/20161209/dictionary/frc-data#PurchasesYoungStockOlderThanOneYear";"xbrli:item";1;0;;"0";"0";"0";"0";"nl-types:monetaryNoDecimalsItemType";"monetaryNoDecimals";"nl-types:monetary20ItemType";"Monetary";"0";"";"";"0";"";"";"";"";"";"";"";"";"Duration";"Debit";0;0;"De kosten voor de aankoop van jongvee ouder dan 1 jaar.";"";"";"";"De kosten voor de aankoop van jongvee ouder dan 1 jaar.";"";"";"";""
256;"frc-i:FodderCosts";4;"         Voerkosten";"         Fodder costs";"         Voerkosten";"         Voerkosten";"";"FodderCosts";"frc-i";"FodderCosts";"https://www.sbrbanken.nl/bt11/frc/20161209/dictionary/frc-data#FodderCosts";"xbrli:item";9;0;;"0";"0";"0";"0";"nl-types:monetaryNoDecimalsItemType";"monetaryNoDecimals";"nl-types:monetary20ItemType";"Monetary";"0";"";"";"0";"";"";"";"";"";"";"";"";"Duration";"Debit";0;0;"De kosten voor het voer van vee voor krachtvoer, ruwvoer, bijproducten en ander voer.";"";"";"";"De kosten voor het voer van vee voor krachtvoer, ruwvoer, bijproducten en ander voer.";"";"";"";""
257;"frc-i:HealthcareCosts";4;"         Gezondheidszorgkosten";"         Healthcare costs";"         Gezondheidszorgkosten";"         Gezondheidszorgkosten";"";"HealthcareCosts";"frc-i";"HealthcareCosts";"https://www.sbrbanken.nl/bt11/frc/20161209/dictionary/frc-data#HealthcareCosts";"xbrli:item";9;0;;"0";"0";"0";"0";"nl-types:monetaryNoDecimalsItemType";"monetaryNoDecimals";"nl-types:monetary20ItemType";"Monetary";"0";"";"";"0";"";"";"";"";"";"";"";"";"Duration";"Debit";0;0;"De kosten voor de medische verzorging van het vee.";"";"";"";"De kosten voor de medische verzorging van het vee.";"";"";"";""
258;"frc-i:BreedingCosts";4;"         K.I./Fokkerijkosten";"         Breeding costs";"         K.I./Fokkerijkosten";"         K.I./Fokkerijkosten";"";"BreedingCosts";"frc-i";"BreedingCosts";"https://www.sbrbanken.nl/bt11/frc/20161209/dictionary/frc-data#BreedingCosts";"xbrli:item";9;0;;"0";"0";"0";"0";"nl-types:monetaryNoDecimalsItemType";"monetaryNoDecimals";"nl-types:monetary20ItemType";"Monetary";"0";"";"";"0";"";"";"";"";"";"";"";"";"Duration";"Debit";0;0;"De kosten voor kunstmatige inseminatie (K.I.) en andere fokkosten.";"";"";"";"De kosten voor kunstmatige inseminatie (K.I.) en andere fokkosten.";"";"";"";""
259;"frc-i:CultivationCosts";4;"         Teeltkosten";"         Cultivation costs";"         Teeltkosten";"         Teeltkosten";"";"CultivationCosts";"frc-i";"CultivationCosts";"https://www.sbrbanken.nl/bt11/frc/20161209/dictionary/frc-data#CultivationCosts";"xbrli:item";14;0;;"0";"0";"0";"0";"nl-types:monetaryNoDecimalsItemType";"monetaryNoDecimals";"nl-types:monetary20ItemType";"Monetary";"0";"";"";"0";"";"";"";"";"";"";"";"";"Duration";"Debit";0;0;"De kosten voor gewasbeschermingsmiddelen, meststoffen en zaad-, plant-, pootgoed en overige teeltkosten.";"";"";"";"De kosten voor gewasbeschermingsmiddelen, meststoffen en zaad-, plant-, pootgoed en overige teeltkosten.";"";"";"";""
260;"frc-i:LitterCosts";4;"         Strooiselkosten";"         Litter costs";"         Strooiselkosten";"         Strooiselkosten";"";"LitterCosts";"frc-i";"LitterCosts";"https://www.sbrbanken.nl/bt11/frc/20161209/dictionary/frc-data#LitterCosts";"xbrli:item";9;0;;"0";"0";"0";"0";"nl-types:monetaryNoDecimalsItemType";"monetaryNoDecimals";"nl-types:monetary20ItemType";"Monetary";"0";"";"";"0";"";"";"";"";"";"";"";"";"Duration";"Debit";0;0;"De kosten voor het aanschaffen van strooisel.";"";"";"";"De kosten voor het aanschaffen van strooisel.";"";"";"";""
261;"frc-i:EnergyCosts";4;"         Energiekosten";"         Energy costs";"         Energiekosten";"         Energiekosten";"";"EnergyCosts";"frc-i";"EnergyCosts";"https://www.sbrbanken.nl/bt11/frc/20161209/dictionary/frc-data#EnergyCosts";"xbrli:item";9;0;;"0";"0";"0";"0";"nl-types:monetaryNoDecimalsItemType";"monetaryNoDecimals";"nl-types:monetary20ItemType";"Monetary";"0";"";"";"0";"";"";"";"";"";"";"";"";"Duration";"Debit";0;0;"De kosten van energie (gas en electra) en water, verbruikt voor de aandrijving van een krachtbron, voor verlichting en/of voor verwarming.";"";"";"";"De kosten van energie (gas en electra) en water, verbruikt voor de aandrijving van een krachtbron, voor verlichting en/of voor verwarming.";"";"";"";""
262;"frc-i:LivestockCostsOther";4;"         Overige veekosten";"         Livestock costs other";"         Overige veekosten";"         Overige veekosten";"";"LivestockCostsOther";"frc-i";"LivestockCostsOther";"https://www.sbrbanken.nl/bt11/frc/20161209/dictionary/frc-data#LivestockCostsOther";"xbrli:item";9;0;;"0";"0";"0";"0";"nl-types:monetaryNoDecimalsItemType";"monetaryNoDecimals";"nl-types:monetary20ItemType";"Monetary";"0";"";"";"0";"";"";"";"";"";"";"";"";"Duration";"Debit";0;0;"Overige veekosten, die direct zijn te relateren aan het houden van vee.";"";"";"";"Overige veekosten, die direct zijn te relateren aan het houden van vee.";"";"";"";""
263;"frc-abstr:NotAllocatedCostsTitle";3;"      Niet-toegerekende kosten";"      Not allocated costs title";"      Niet-toegerekende kosten";"      Niet-toegerekende kosten";"";"NotAllocatedCostsTitle";"frc-abstr";"NotAllocatedCostsTitle";"https://www.sbrbanken.nl/bt11/frc/20161209/presentation/frc-abstracts#NotAllocatedCostsTitle";"sbr:presentationItem";9;0;;"0";"0";"0";"0";"xbrli:stringItemType";"string";"xbrli:stringItemType";"Abstract";"0";;;;;;;;;;;;"Duration";"None";1;0;"";"";"";"";"";"";"";"";""
264;"frc-i:ManureDisposalCosts";4;"         Mestafzetkosten";"         Manure disposal costs";"         Mestafzetkosten";"         Mestafzetkosten";"";"ManureDisposalCosts";"frc-i";"ManureDisposalCosts";"https://www.sbrbanken.nl/bt11/frc/20161209/dictionary/frc-data#ManureDisposalCosts";"xbrli:item";9;0;;"0";"0";"0";"0";"nl-types:monetaryNoDecimalsItemType";"monetaryNoDecimals";"nl-types:monetary20ItemType";"Monetary";"0";"";"";"0";"";"";"";"";"";"";"";"";"Duration";"Debit";0;0;"De kosten voor de afzet van mest.";"";"";"";"Mestafzetkosten zijn toegerekende kosten, maar in de gehanteerde definitie van het saldo worden ze niet meegenomen.";"";"";"";""
265;"frc-i:ProductionRightsLeaseCosts";4;"         Leasekosten productierechten";"         Production rights lease costs";"         Leasekosten productierechten";"         Leasekosten productierechten";"";"ProductionRightsLeaseCosts";"frc-i";"ProductionRightsLeaseCosts";"https://www.sbrbanken.nl/bt11/frc/20161209/dictionary/frc-data#ProductionRightsLeaseCosts";"xbrli:item";9;0;;"0";"0";"0";"0";"nl-types:monetaryNoDecimalsItemType";"monetaryNoDecimals";"nl-types:monetary20ItemType";"Monetary";"0";"";"";"0";"";"";"";"";"";"";"";"";"Duration";"Debit";0;0;"De kosten voor de lease van productierechten. Productierechten zijn varkens-en pluimveerechten.";"";"";"";"De kosten voor de lease van productierechten. Productierechten zijn varkens-en pluimveerechten. (N.B. leasekosten van machines etc. vallen hier niet onder).";"";"";"";""
266;"frc-abstr:CattleFarmTitle";2;"   Specificatie melkveehouderij";"   Cattle farm title";"   Specificatie melkveehouderij";"   Specificatie melkveehouderij";"";"CattleFarmTitle";"frc-abstr";"CattleFarmTitle";"https://www.sbrbanken.nl/bt11/frc/20161209/presentation/frc-abstracts#CattleFarmTitle";"sbr:presentationItem";1;0;;"0";"0";"0";"0";"xbrli:stringItemType";"string";"xbrli:stringItemType";"Abstract";"0";;;;;;;;;;;;"Duration";"None";1;0;"";"";"";"";"";"";"";"";""
267;"frc-i:RequirementsDerogation";3;"      Voldaan aan voorwaarden derogatie J/N";"      Requirements derogation Y/N";"      Voldaan aan voorwaarden derogatie J/N";"      Voldaan aan voorwaarden derogatie J/N";"";"RequirementsDerogation";"frc-i";"RequirementsDerogation";"https://www.sbrbanken.nl/bt11/frc/20161209/dictionary/frc-data#RequirementsDerogation";"xbrli:item";2;0;;"0";"0";"0";"0";"nl-codes:yesNoItemType";"yesNo";"xbrli:stringItemType";"Enumeration";"0";"";"Ja|Nee";"";"";"";"";"";"";"";"";"";"Duration";"None";0;0;"Agrarische ondernemers hebben een gebruiksnorm voor dierlijke mest van 170 kg stikstof per hectare per jaar. Onder bepaalde voorwaarden mag u hiervan afwijken (derogatie). Dit element betreft de uitkomst van de beoordeling of aan deze voorwaarden wordt voldaan.";"";"";"";"Agrarische ondernemers hebben een gebruiksnorm voor dierlijke mest van 170 kg stikstof per hectare per jaar. Onder bepaalde voorwaarden mag u hiervan afwijken (derogatie). Dit gegeven betreft de uitkomst van de beoordeling of aan deze voorwaarden wordt voldaan: Ja als inderdaad is voldaan.";"";"";"";""
268;"frc-i:AverageNumberPresentMilkcows";3;"      Gemiddeld aantal aanwezige melkkoeien";"      Average number present milkcows";"      Gemiddeld aantal aanwezige melkkoeien";"      Gemiddeld aantal aanwezige melkkoeien";"";"AverageNumberPresentMilkcows";"frc-i";"AverageNumberPresentMilkcows";"https://www.sbrbanken.nl/bt11/frc/20161209/dictionary/frc-data#AverageNumberPresentMilkcows";"xbrli:item";1;0;;"0";"0";"0";"0";"xbrli:integerItemType";"integer";"xbrli:integerItemType";"Number";"0";;;;;;;;;;;;"Duration";"None";0;0;"Het gemiddeld aantal aanwezige melkkoeien (vrouwelijk rundvee) gedurende de rapportageperiode.";"";"";"";"Het gemiddeld aantal aanwezige melkkoeien (vrouwelijk rundvee) gedurende de rapportageperiode.";"";"";"";""
269;"frc-i:AverageNumberPresentYoungCattle";3;"      Gemiddeld aantal aanwezig stuks jongvee";"      Average number present young cattle";"      Gemiddeld aantal aanwezig stuks jongvee";"      Gemiddeld aantal aanwezig stuks jongvee";"";"AverageNumberPresentYoungCattle";"frc-i";"AverageNumberPresentYoungCattle";"https://www.sbrbanken.nl/bt11/frc/20161209/dictionary/frc-data#AverageNumberPresentYoungCattle";"xbrli:item";1;0;;"0";"0";"0";"0";"xbrli:integerItemType";"integer";"xbrli:integerItemType";"Number";"0";;;;;;;;;;;;"Duration";"None";0;0;"Het gemiddeld aantal aanwezige stuks vrouwelijk rundvee, nog niet melkgevend gedurende de rapportageperiode.";"";"";"";"Het gemiddeld aantal aanwezige stuks vrouwelijk rundvee, nog niet melkgevend gedurende de rapportageperiode.";"";"";"";""
270;"frc-i:MilkMoneyRevenue";3;"      Melkgeld";"      Milk money revenue";"      Melkgeld";"      Melkgeld";"";"MilkMoneyRevenue";"frc-i";"MilkMoneyRevenue";"https://www.sbrbanken.nl/bt11/frc/20161209/dictionary/frc-data#MilkMoneyRevenue";"xbrli:item";2;0;;"0";"0";"0";"0";"nl-types:monetaryNoDecimalsItemType";"monetaryNoDecimals";"nl-types:monetary20ItemType";"Monetary";"0";"";"";"0";"";"";"";"";"";"";"";"";"Duration";"Credit";0;0;"Het voor geleverde melk ontvangen bedrag.";"";"";"";"Het voor geleverde melk ontvangen bedrag.";"";"";"";""
271;"frc-i:MilkDelivered";3;"      Geleverde kg melk";"      Milk delivered";"      Geleverde kg melk";"      Geleverde kg melk";"";"MilkDelivered";"frc-i";"MilkDelivered";"https://www.sbrbanken.nl/bt11/frc/20161209/dictionary/frc-data#MilkDelivered";"xbrli:item";2;0;;"0";"0";"0";"0";"xbrli:integerItemType";"integer";"xbrli:integerItemType";"Number";"0";;;;;;;;;;;;"Duration";"None";0;0;"Het aantal geleverde kilogram melk.";"";"";"";"Het aantal geleverde kilogram melk.";"";"";"";""
272;"frc-i:ActualFatPercentage";4;"         Werkelijk vet (%)";"         Percentage of actual fat";"         Werkelijk vet (%)";"         Werkelijk vet (%)";"";"ActualFatPercentage";"frc-i";"ActualFatPercentage";"https://www.sbrbanken.nl/bt11/frc/20161209/dictionary/frc-data#ActualFatPercentage";"xbrli:item";2;0;;"0";"0";"0";"0";"num:percentItemType";"percent";"xbrli:pureItemType";"Number";"0";"";"";"";"";"";"";"";"";"";"";"";"Duration";"None";0;0;"Het percentage vet in de geleverde KG melk over de rapportageperiode, 2 decimalen nauwkeurig.";"";"";"";"Het percentage vet in de geleverde KG melk over de rapportageperiode, 2 decimalen nauwkeurig.";"";"";"";""
