710;"frc-i:ClosingDateContractsOperatingLease";2;"   Einddatum";"   Closing date contracts operating lease";"   Einddatum leasecontract";"   Einddatum leasecontract";"http://www.xbrl.org/2003/role/terseLabel";"ClosingDateContractsOperatingLease";"frc-i";"ClosingDateContractsOperatingLease";"https://www.sbrbanken.nl/bt11/frc/20161209/dictionary/frc-data#ClosingDateContractsOperatingLease";"xbrli:item";1;0;"frc-abstr:ContractsOperatingLeaseSpecificationTitle";"0";"0";"0";"0";"xbrli:dateItemType";"date";"xbrli:dateItemType";"Date";"0";;;;;;;;;;;;"Duration";"None";0;0;"De einddatum van het operationele leasecontract waarbij de oorspronkelijke waarde van het activum meer dan  50.000 bedraagt. Dit veld kan leeg gelaten worden indien er sprake is van een looptijd van onbepaalde tijd.";"";"";"";"De einddatum van het operationele leasecontract waarbij de totale waarde van het oorspronkelijke activum meer dan  50.000 bedraagt. Dit veld kan leeg gelaten worden indien er sprake is van een looptijd van onbepaalde tijd.";"";"";"";""
711;"frc-abstr:ContractsOperatingLeaseTitle";1;"Operationele leasecontracten";"Contracts operating lease title";"Operationele leasecontracten";"Operationele leasecontracten";"";"ContractsOperatingLeaseTitle";"frc-abstr";"ContractsOperatingLeaseTitle";"https://www.sbrbanken.nl/bt11/frc/20161209/presentation/frc-abstracts#ContractsOperatingLeaseTitle";"sbr:presentationItem";2;0;;"0";"0";"0";"0";"xbrli:stringItemType";"string";"xbrli:stringItemType";"Abstract";"0";;;;;;;;;;;;"Duration";"None";1;0;"";"";"";"";"";"";"";"";""
712;"frc-i:ContractsOperatingLease";2;"   Operationele leasecontracten";"   Contract operating lease";"   Operationele leasecontracten";"   Operationele leasecontracten";"";"ContractsOperatingLease";"frc-i";"ContractsOperatingLease";"https://www.sbrbanken.nl/bt11/frc/20161209/dictionary/frc-data#ContractsOperatingLease";"xbrli:item";1;0;"frc-abstr:ContractsOperatingLeaseTitle";"0";"0";"0";"0";"nl-types:monetaryNoDecimalsItemType";"monetaryNoDecimals";"nl-types:monetary20ItemType";"Monetary";"0";"";"";"0";"";"";"";"";"";"";"";"";"Duration";"Credit";0;0;"Het totaal aan verplichtingen dat voortvloeit uit de operationele leasecontracten.";"";"";"";"Het totaal aan verplichtingen dat voortvloeit uit de operationele leasecontracten.";"";"";"";""
713;"frc-i:NumberOperatingLeaseContracts";2;"   Aantal leasecontracten";"   Number operating lease contracts";"   Aantal leasecontracten";"   Aantal leasecontracten";"";"NumberOperatingLeaseContracts";"frc-i";"NumberOperatingLeaseContracts";"https://www.sbrbanken.nl/bt11/frc/20161209/dictionary/frc-data#NumberOperatingLeaseContracts";"xbrli:item";1;0;"frc-abstr:ContractsOperatingLeaseTitle";"0";"0";"0";"0";"xbrli:integerItemType";"integer";"xbrli:integerItemType";"Number";"0";;;;;;;;;;;;"Duration";"None";0;0;"Het totaal aantal lopende leasecontracten, ook indien de oorspronkelijke waarde van het activum minder dan  50.000,- bedraagt.";"";"";"";"Het totaal aantal lopende leasecontracten, ook indien de oorspronkelijke waarde van het activum (het object dat geleased wordt) minder dan  50.000,- bedraagt.";"";"";"";""
714;"frc-abstr:OperationExpenseOtherTitle";1;"Overige bedrijfskosten";"Operation expense other title";"Overige bedrijfskosten";"Overige bedrijfskosten";"";"OperationExpenseOtherTitle";"frc-abstr";"OperationExpenseOtherTitle";"https://www.sbrbanken.nl/bt11/frc/20161209/presentation/frc-abstracts#OperationExpenseOtherTitle";"sbr:presentationItem";2;0;;"0";"0";"0";"0";"xbrli:stringItemType";"string";"xbrli:stringItemType";"Abstract";"0";;;;;;;;;;;;"Duration";"None";1;0;"";"";"";"";"";"";"";"";""
715;"frc-i:OperationalLeaseCosts";2;"   Operationele leasekosten";"   Operational lease costs";"   Operationele leasekosten";"   Operationele leasekosten";"";"OperationalLeaseCosts";"frc-i";"OperationalLeaseCosts";"https://www.sbrbanken.nl/bt11/frc/20161209/dictionary/frc-data#OperationalLeaseCosts";"xbrli:item";1;0;"frc-abstr:OperationExpenseOtherTitle";"0";"0";"0";"0";"nl-types:monetaryNoDecimalsItemType";"monetaryNoDecimals";"nl-types:monetary20ItemType";"Monetary";"0";"";"";"0";"";"";"";"";"";"";"";"";"Duration";"Debit";0;0;"Het totaalbedrag aan operationele leasekosten van het jaar waarover gerapporteerd wordt.";"";"";"";"Het totaalbedrag aan operationele leasekosten, de jaarlijkse verplichting voor de huur van een goed, inclusief de kosten van onderhoud, reparaties en verzekeringen. Het eigendom van het goed blijft liggen bij de verhuurder.";"";"";"";""
716;"frc-i:ExpensesResearchAndDevelopment";2;"   Kosten onderzoek en ontwikkeling";"   Expenses research and development";"   Kosten onderzoek en ontwikkeling";"   Kosten onderzoek en ontwikkeling";"";"ExpensesResearchAndDevelopment";"frc-i";"ExpensesResearchAndDevelopment";"https://www.sbrbanken.nl/bt11/frc/20161209/dictionary/frc-data#ExpensesResearchAndDevelopment";"xbrli:item";1;0;"frc-abstr:OperationExpenseOtherTitle";"0";"0";"0";"0";"nl-types:monetaryNoDecimalsItemType";"monetaryNoDecimals";"nl-types:monetary20ItemType";"Monetary";"0";"";"";"0";"";"";"";"";"";"";"";"";"Duration";"Debit";0;0;"Het totaalbedrag aan kosten voor onderzoek en ontwikkeling van het jaar waarover gerapporteerd wordt.";"";"";"";"Het totaalbedrag aan kosten voor onderzoek en ontwikkeling van het jaar waarover gerapporteerd wordt.";"";"";"";""
717;"frc-i:FranchiseFee";2;"   Franchisefee";"   Franchise fee";"   Franchisefee";"   Franchisefee";"";"FranchiseFee";"frc-i";"FranchiseFee";"https://www.sbrbanken.nl/bt11/frc/20161209/dictionary/frc-data#FranchiseFee";"xbrli:item";1;0;"frc-abstr:OperationExpenseOtherTitle";"0";"0";"0";"0";"nl-types:monetaryNoDecimalsItemType";"monetaryNoDecimals";"nl-types:monetary20ItemType";"Monetary";"0";"";"";"0";"";"";"";"";"";"";"";"";"Duration";"Debit";0;0;"De vergoeding die de franchisenemer betaalt aan de franchisegever voor het gebruik van de formule.";"";"";"";"De vergoeding voor het gebruik van de door de franchisegever ontwikkelde/beschikbaar gestelde formule.";"";"";"";""
718;"frc-i:ManagementFee";2;"   Managementfee";"   Management fee";"   Managementfee";"   Managementfee";"";"ManagementFee";"frc-i";"ManagementFee";"https://www.sbrbanken.nl/bt11/frc/20161209/dictionary/frc-data#ManagementFee";"xbrli:item";1;0;"frc-abstr:OperationExpenseOtherTitle";"0";"0";"0";"0";"nl-types:monetaryNoDecimalsItemType";"monetaryNoDecimals";"nl-types:monetary20ItemType";"Monetary";"0";"";"";"0";"";"";"";"";"";"";"";"";"Duration";"Debit";0;0;"De vergoeding voor het ""ter beschikking stellen"" van de directeur, administratieve ondersteuning etc.";"";"";"";"Vergoeding vanuit de onderneming (vaak een werkmaatschappij) aan het management (van de holding).";"";"";"";""
719;"frc-abstr:OperationExpenseOtherTitle";1;"Overige bedrijfskosten";"Operation expense other title";"Overige bedrijfskosten";"Overige bedrijfskosten";"";"OperationExpenseOtherTitle";"frc-abstr";"OperationExpenseOtherTitle";"https://www.sbrbanken.nl/bt11/frc/20161209/presentation/frc-abstracts#OperationExpenseOtherTitle";"sbr:presentationItem";2;0;;"0";"0";"0";"0";"xbrli:stringItemType";"string";"xbrli:stringItemType";"Abstract";"0";;;;;;;;;;;;"Duration";"None";1;0;"";"";"";"";"";"";"";"";""
720;"venj-bw2-i:OperatingExpensesOther";2;"   Overige bedrijfskosten";"   Other operating expenses";"   Sonstige Betriebsausgaben";"   Autres frais de fonctionnement";"";"OperatingExpensesOther";"venj-bw2-i";"OperatingExpensesOther";"http://www.nltaxonomie.nl/nt11/venj/20161214/dictionary/venj-bw2-data#OperatingExpensesOther";"xbrli:item";2;0;;"0";"0";"0";"0";"nl-types:monetaryNoDecimalsItemType";"monetaryNoDecimals";"nl-types:monetary20ItemType";"Monetary";"0";"";"";"0";"";"";"";"";"";"";"";"";"Duration";"Debit";0;0;"De lasten die voortvloeien uit of samenhangen met gebeurtenissen of transacties die behoren tot de normale bedrijfsactiviteiten en die niet in een andere categorie in te delen zijn.";"";"";"";"";"";"";"";"Article: 9, IssueDate: 2015-01-01, Name: Besluit jaarrekening banken|Article: 1, IssueDate: 2015-01-01, Name: Besluit modellen jaarrekening, Paragraph: 2|Article: 16, IssueDate: 2015-01-01, Name: Besluit modellen jaarrekening, Paragraph: 2|Article: 16, IssueDate: 2015-01-01, Name: Besluit modellen jaarrekening, Paragraph: 3|Article: 16b, IssueDate: 2015-01-01, Name: Besluit modellen jaarrekening, Paragraph: 2|Article: 1, IssueDate: 2015-01-01, Name: Besluit modellen jaarrekening, Paragraph: 1|Article: 8, IssueDate: 2015-01-01, Name: Besluit modellen jaarrekening, Paragraph: 2|Article: 377, IssueDate: 2016-01-01, Name: Burgerlijk wetboek boek 2, Paragraph: 3, Subparagraph: j|Article: 384, IssueDate: 2016-01-01, Name: Burgerlijk wetboek boek 2, Paragraph: 5|Article: 395a, IssueDate: 2016-01-01, Name: Burgerlijk wetboek boek 2, Paragraph: 5|Chapter: 270, IssueDate: 2016-01-01, Name: Richtlijnen voor de jaarverslaggeving, Paragraph: 503|Chapter: 600, IssueDate: 2016-01-01, Name: Richtlijnen voor de jaarverslaggeving, Paragraph: 108|Chapter: 620, IssueDate: 2016-01-01, Name: Richtlijnen voor de jaarverslaggeving, Paragraph: 301|Chapter: 655, IssueDate: 2016-01-01, Name: Richtlijnen voor de jaarverslaggeving, Paragraph: 301|Chapter: B13, IssueDate: 2016-01-01, Name: Richtlijnen voor de jaarverslaggeving voor kleine rechtspersonen, Paragraph: 110|Chapter: C2, IssueDate: 2016-01-01, Name: Richtlijnen voor de jaarverslaggeving voor kleine rechtspersonen, Paragraph: 205"
721;"rj-i:PersonnelRelatedOtherExpenses";3;"      Overige personeelsgerelateerde kosten";"      Other personnel related expenses";"      Overige personeelsgerelateerde kosten";"      Overige personeelsgerelateerde kosten";"";"PersonnelRelatedOtherExpenses";"rj-i";"PersonnelRelatedOtherExpenses";"http://www.nltaxonomie.nl/nt11/rj/20161214/dictionary/rj-data#PersonnelRelatedOtherExpenses";"xbrli:item";1;0;;"0";"0";"0";"0";"nl-types:monetaryNoDecimalsItemType";"monetaryNoDecimals";"nl-types:monetary20ItemType";"Monetary";"0";"";"";"0";"";"";"";"";"";"";"";"";"Duration";"Debit";0;0;"De kosten die voortvloeien uit of samenhangen met gebeurtenissen of transacties die behoren tot de arbeid van werknemers die in dienstverband van de rechtspersoon zijn. Deze kosten zijn niet in te delen in categorieën salarislasten, sociale lasten of pensioenlasten.";"";"";"";"";"";"";"";"Chapter: 270, IssueDate: 2016-01-01, Name: Richtlijnen voor de jaarverslaggeving, Paragraph: 503"
722;"rj-i:AccommodationCosts";3;"      Huisvestingskosten";"      Accommodation costs";"      Huisvestingskosten";"      Huisvestingskosten";"";"AccommodationCosts";"rj-i";"AccommodationCosts";"http://www.nltaxonomie.nl/nt11/rj/20161214/dictionary/rj-data#AccommodationCosts";"xbrli:item";1;0;;"0";"0";"0";"0";"nl-types:monetaryNoDecimalsItemType";"monetaryNoDecimals";"nl-types:monetary20ItemType";"Monetary";"0";"";"";"0";"";"";"";"";"";"";"";"";"Duration";"Debit";0;0;"De kosten die voortvloeien of samenhangen met de gebeurtenissen of transacties die behoren tot de huisvesting van de rechtspersoon.";"";"";"";"";"";"";"";"Chapter: 270, IssueDate: 2016-01-01, Name: Richtlijnen voor de jaarverslaggeving, Paragraph: 503|Chapter: 615, IssueDate: 2016-01-01, Name: Richtlijnen voor de jaarverslaggeving, Paragraph: 306|Chapter: 660, IssueDate: 2016-01-01, Name: Richtlijnen voor de jaarverslaggeving, Paragraph: 301|Chapter: 660, IssueDate: 2016-01-01, Name: Richtlijnen voor de jaarverslaggeving, Paragraph: 512|Chapter: 650, IssueDate: 2016-01-01, Name: Richtlijnen voor de jaarverslaggeving, Paragraph: 422"
723;"rj-i:SalesRelatedExpenses";3;"      Verkoop gerelateerde kosten";"      Sales related expenses";"      Verkoop gerelateerde kosten";"      Verkoop gerelateerde kosten";"";"SalesRelatedExpenses";"rj-i";"SalesRelatedExpenses";"http://www.nltaxonomie.nl/nt11/rj/20161214/dictionary/rj-data#SalesRelatedExpenses";"xbrli:item";1;0;;"0";"0";"0";"0";"nl-types:monetaryNoDecimalsItemType";"monetaryNoDecimals";"nl-types:monetary20ItemType";"Monetary";"0";"";"";"0";"";"";"";"";"";"";"";"";"Duration";"Debit";0;0;"De kosten die voortvloeien of samenhangen met de gebeurtenissen of transacties die behoren tot de verkoopactiviteiten van de rechtspersoon.";"";"";"";"";"";"";"";"Chapter: 270, IssueDate: 2016-01-01, Name: Richtlijnen voor de jaarverslaggeving, Paragraph: 503"
724;"rj-i:CarAndTransportCosts";3;"      Auto- en transportkosten";"      Car and transport costs";"      Auto- en transportkosten";"      Auto- en transportkosten";"";"CarAndTransportCosts";"rj-i";"CarAndTransportCosts";"http://www.nltaxonomie.nl/nt11/rj/20161214/dictionary/rj-data#CarAndTransportCosts";"xbrli:item";1;0;;"0";"0";"0";"0";"nl-types:monetaryNoDecimalsItemType";"monetaryNoDecimals";"nl-types:monetary20ItemType";"Monetary";"0";"";"";"0";"";"";"";"";"";"";"";"";"Duration";"Debit";0;0;"De kosten die voortvloeien of samenhangen met de gebeurtenissen of transacties die behoren tot vervoer van personen en goederen.";"";"";"";"";"";"";"";"Chapter: 270, IssueDate: 2016-01-01, Name: Richtlijnen voor de jaarverslaggeving, Paragraph: 503"
725;"rj-i:OfficeRelatedExpenses";3;"      Kantoorkosten";"      Office related expenses";"      Kantoorkosten";"      Kantoorkosten";"";"OfficeRelatedExpenses";"rj-i";"OfficeRelatedExpenses";"http://www.nltaxonomie.nl/nt11/rj/20161214/dictionary/rj-data#OfficeRelatedExpenses";"xbrli:item";1;0;;"0";"0";"0";"0";"nl-types:monetaryNoDecimalsItemType";"monetaryNoDecimals";"nl-types:monetary20ItemType";"Monetary";"0";"";"";"0";"";"";"";"";"";"";"";"";"Duration";"Debit";0;0;"De kosten die voortvloeien of samenhangen met de gebeurtenissen of transacties die betrekking hebben op administratieve handelingen van de rechtspersoon.";"";"";"";"";"";"";"";"Chapter: 270, IssueDate: 2016-01-01, Name: Richtlijnen voor de jaarverslaggeving, Paragraph: 503"
726;"rj-i:GeneralExpenses";3;"      Algemene kosten";"      General expenses";"      Algemene kosten";"      Algemene kosten";"";"GeneralExpenses";"rj-i";"GeneralExpenses";"http://www.nltaxonomie.nl/nt11/rj/20161214/dictionary/rj-data#GeneralExpenses";"xbrli:item";1;0;;"0";"0";"0";"0";"nl-types:monetaryNoDecimalsItemType";"monetaryNoDecimals";"nl-types:monetary20ItemType";"Monetary";"0";"";"";"0";"";"";"";"";"";"";"";"";"Duration";"Debit";0;0;"De kosten die voortvloeien uit of samenhangen met gebeurtenissen of transacties die behoren tot de normale bedrijfsactiviteiten van de rechtspersonen en die niet in een andere categorie zijn in te delen.";"";"";"";"";"";"";"";"Chapter: 270, IssueDate: 2016-01-01, Name: Richtlijnen voor de jaarverslaggeving, Paragraph: 503|Chapter: 655, IssueDate: 2016-01-01, Name: Richtlijnen voor de jaarverslaggeving, Paragraph: 402a"
727;"rj-i:OperationalExpenses";3;"      Exploitatiekosten";"      Operational expenses";"      Exploitatiekosten";"      Exploitatiekosten";"";"OperationalExpenses";"rj-i";"OperationalExpenses";"http://www.nltaxonomie.nl/nt11/rj/20161214/dictionary/rj-data#OperationalExpenses";"xbrli:item";1;0;;"0";"0";"0";"0";"nl-types:monetaryNoDecimalsItemType";"monetaryNoDecimals";"nl-types:monetary20ItemType";"Monetary";"0";"";"";"0";"";"";"";"";"";"";"";"";"Duration";"Debit";0;0;"De kosten die voortvloeien uit of samenhangen met gebeurtenissen of transacties die behoren tot de activiteiten om een onderneming te exploiteren.";"";"";"";"";"";"";"";"Chapter: 270, IssueDate: 2016-01-01, Name: Richtlijnen voor de jaarverslaggeving, Paragraph: 503"
728;"rj-i:UndefinedOtherExpenses";3;"      Andere kosten";"      Other undefined expenses";"      Andere kosten";"      Andere kosten";"";"UndefinedOtherExpenses";"rj-i";"UndefinedOtherExpenses";"http://www.nltaxonomie.nl/nt11/rj/20161214/dictionary/rj-data#UndefinedOtherExpenses";"xbrli:item";1;0;;"0";"0";"0";"0";"nl-types:monetaryNoDecimalsItemType";"monetaryNoDecimals";"nl-types:monetary20ItemType";"Monetary";"0";"";"";"0";"";"";"";"";"";"";"";"";"Duration";"Debit";0;0;"De kosten die voortvloeien uit of samenhangen met gebeurtenissen of transacties die indirect behoren tot de normale bedrijfsactiviteiten van de rechtspersonen en die niet in een andere categorie zijn in te delen.";"";"";"";"";"";"";"";"Chapter: 270, IssueDate: 2016-01-01, Name: Richtlijnen voor de jaarverslaggeving, Paragraph: 503"
729;"frc-abstr:OperatingIncomeOtherDisclosureBanksTitle";1;"Overige bedrijfsopbrengsten, toelichting [titel]";"Other operating income, disclosure [title]";"Overige bedrijfsopbrengsten, toelichting [titel]";"Overige bedrijfsopbrengsten, toelichting [titel]";"";"OperatingIncomeOtherDisclosureBanksTitle";"frc-abstr";"OperatingIncomeOtherDisclosureBanksTitle";"https://www.sbrbanken.nl/bt11/frc/20161209/presentation/frc-abstracts#OperatingIncomeOtherDisclosureBanksTitle";"sbr:presentationItem";1;0;;"0";"0";"0";"0";"xbrli:stringItemType";"string";"xbrli:stringItemType";"Abstract";"0";;;;;;;;;;;;"Duration";"None";1;0;"";"";"";"";"";"";"";"";""
730;"venj-bw2-i:OperatingIncomeOther";2;"   Overige bedrijfsopbrengsten";"   Other operating income";"   Sonstige betriebliche Erträge";"   Autres résultats d'exploitation";"";"OperatingIncomeOther";"venj-bw2-i";"OperatingIncomeOther";"http://www.nltaxonomie.nl/nt11/venj/20161214/dictionary/venj-bw2-data#OperatingIncomeOther";"xbrli:item";2;0;;"0";"0";"0";"0";"nl-types:monetaryNoDecimalsItemType";"monetaryNoDecimals";"nl-types:monetary20ItemType";"Monetary";"0";"";"";"0";"";"";"";"";"";"";"";"";"Duration";"Credit";0;0;"De baten die voortvloeien uit of samenhangen met gebeurtenissen of transacties die behoren tot de normale bedrijfsactiviteiten van de rechtspersoon en die niet in een andere categorie in te delen zijn.";"";"";"";"";"";"";"";"Article: 9, IssueDate: 2015-01-01, Name: Besluit jaarrekening banken|Article: 16, IssueDate: 2015-01-01, Name: Besluit modellen jaarrekening, Paragraph: 2|Article: 16, IssueDate: 2015-01-01, Name: Besluit modellen jaarrekening, Paragraph: 3|Article: 16b, IssueDate: 2015-01-01, Name: Besluit modellen jaarrekening, Paragraph: 2|Article: 1, IssueDate: 2015-01-01, Name: Besluit modellen jaarrekening, Paragraph: 1|Article: 8, IssueDate: 2015-01-01, Name: Besluit modellen jaarrekening, Paragraph: 2|Article: 377, IssueDate: 2016-01-01, Name: Burgerlijk wetboek boek 2, Paragraph: 3, Subparagraph: d|Article: 377, IssueDate: 2016-01-01, Name: Burgerlijk wetboek boek 2, Paragraph: 4, Subparagraph: f|Article: 384, IssueDate: 2016-01-01, Name: Burgerlijk wetboek boek 2, Paragraph: 5|Article: 395a, IssueDate: 2016-01-01, Name: Burgerlijk wetboek boek 2, Paragraph: 5|Chapter: 270, IssueDate: 2016-01-01, Name: Richtlijnen voor de jaarverslaggeving, Paragraph: 505|Chapter: 600, IssueDate: 2016-01-01, Name: Richtlijnen voor de jaarverslaggeving, Paragraph: 108|Chapter: 620, IssueDate: 2016-01-01, Name: Richtlijnen voor de jaarverslaggeving, Paragraph: 301|Chapter: 655, IssueDate: 2016-01-01, Name: Richtlijnen voor de jaarverslaggeving, Paragraph: 301|Chapter: 655, IssueDate: 2016-01-01, Name: Richtlijnen voor de jaarverslaggeving, Paragraph: 402a|Chapter: C2, IssueDate: 2016-01-01, Name: Richtlijnen voor de jaarverslaggeving voor kleine rechtspersonen, Paragraph: 205"
731;"frc-i:RentalRevenues";3;"      Verhuuropbrengsten";"      Rental revenues";"      Verhuuropbrengsten";"      Verhuuropbrengsten";"";"RentalRevenues";"frc-i";"RentalRevenues";"https://www.sbrbanken.nl/bt11/frc/20161209/dictionary/frc-data#RentalRevenues";"xbrli:item";1;0;;"0";"0";"0";"0";"nl-types:monetaryNoDecimalsItemType";"monetaryNoDecimals";"nl-types:monetary20ItemType";"Monetary";"0";"";"";"0";"";"";"";"";"";"";"";"";"Duration";"Credit";0;0;"De opbrengsten uit de verhuur.";"";"";"";"De totale opbrengst van verhuur aan derden.";"";"";"";""
732;"frc-i:RemainingOperatingIncome";3;"      Andere bedrijfsopbrengsten";"      Remaining operating income";"      Andere bedrijfsopbrengsten";"      Andere bedrijfsopbrengsten";"";"RemainingOperatingIncome";"frc-i";"RemainingOperatingIncome";"https://www.sbrbanken.nl/bt11/frc/20161209/dictionary/frc-data#RemainingOperatingIncome";"xbrli:item";1;0;;"0";"0";"0";"0";"nl-types:monetaryNoDecimalsItemType";"monetaryNoDecimals";"nl-types:monetary20ItemType";"Monetary";"0";"";"";"0";"";"";"";"";"";"";"";"";"Duration";"Credit";0;0;"Het totaal aan andere 'overige bedrijfsopbrengsten'.";"";"";"";"Het totaal aan andere 'overige bedrijfsopbrengsten', die niet onder andere bedrijfsopbrengsten zijn gespecificeerd.";"";"";"";""
733;"frc-abstr:MultiannualFinancialLiabilitiesOtherTitle";1;"Overige meerjarige financiële verplichtingen [titel]";"Other multiannual financial liabilities [title]";"Overige meerjarige financiële verplichtingen [titel]";"Overige meerjarige financiële verplichtingen [titel]";"";"MultiannualFinancialLiabilitiesOtherTitle";"frc-abstr";"MultiannualFinancialLiabilitiesOtherTitle";"https://www.sbrbanken.nl/bt11/frc/20161209/presentation/frc-abstracts#MultiannualFinancialLiabilitiesOtherTitle";"sbr:presentationItem";1;0;;"0";"0";"0";"0";"xbrli:stringItemType";"string";"xbrli:stringItemType";"Abstract";"0";;;;;;;;;;;;"Duration";"None";1;0;"";"";"";"";"";"";"";"";""
734;"frc-i:MultiannualFinancialLiabilitiesOtherDisclosure";2;"   Overige meerjarige financiële verplichtingen, toelichting";"   Multiannual financial liabilities other disclosure";"   Overige meerjarige financiële verplichtingen, toelichting";"   Overige meerjarige financiële verplichtingen, toelichting";"";"MultiannualFinancialLiabilitiesOtherDisclosure";"frc-i";"MultiannualFinancialLiabilitiesOtherDisclosure";"https://www.sbrbanken.nl/bt11/frc/20161209/dictionary/frc-data#MultiannualFinancialLiabilitiesOtherDisclosure";"xbrli:item";1;0;"frc-abstr:MultiannualFinancialLiabilitiesOtherTitle";"0";"0";"0";"0";"nl-types:string100000ItemType";"string100000";"xbrli:stringItemType";"String";"0";"";"";"";"";"";"1";"100000";"";"";"";"";"Duration";"None";0;0;"Overige verplichtingen waaraan de onderneming een aantal toekomstige jaren verbonden is.";"";"";"";"Overige verplichtingen waaraan de onderneming een aantal toekomstige jaren verbonden is.";"";"";"";""
735;"frc-abstr:ContingentLiabilitiesOtherTitle";1;"Overige niet uit de balans blijkende verplichtingen [titel]";"Other contingent liabilities [title]";"Overige niet uit de balans blijkende verplichtingen [titel]";"Overige niet uit de balans blijkende verplichtingen [titel]";"";"ContingentLiabilitiesOtherTitle";"frc-abstr";"ContingentLiabilitiesOtherTitle";"https://www.sbrbanken.nl/bt11/frc/20161209/presentation/frc-abstracts#ContingentLiabilitiesOtherTitle";"sbr:presentationItem";1;0;;"0";"0";"0";"0";"xbrli:stringItemType";"string";"xbrli:stringItemType";"Abstract";"0";;;;;;;;;;;;"Duration";"None";1;0;"";"";"";"";"";"";"";"";""
736;"venj-bw2-i:ContingentLiabilitiesOther";2;"   Overige voorwaardelijke schulden";"   Other contingent liabilities";"   Sonstige Eventualverbindlichkeiten";"   Autres obligations éventuelles";"";"ContingentLiabilitiesOther";"venj-bw2-i";"ContingentLiabilitiesOther";"http://www.nltaxonomie.nl/nt11/venj/20161214/dictionary/venj-bw2-data#ContingentLiabilitiesOther";"xbrli:item";1;0;"frc-abstr:ContingentLiabilitiesOtherTitle";"0";"0";"0";"0";"nl-types:monetaryNoDecimalsItemType";"monetaryNoDecimals";"nl-types:monetary20ItemType";"Monetary";"0";"";"";"0";"";"";"";"";"";"";"";"";"Instant";"Credit";0;0;"De financiële verplichtingen van de rechtspersoon waarvan passivering in de balans niet vereist is en voor zover opgave daarvan relevant is voor de beoordeling van de financiële positie van de rechtspersoon, die niet in een andere categorie zijn in te delen.";"";"";"";"";"";"";"";"Article: 7, IssueDate: 2015-01-01, Name: Besluit jaarrekening banken|Article: 1, IssueDate: 2015-01-01, Name: Besluit modellen jaarrekening|Article: 16, IssueDate: 2015-01-01, Name: Besluit modellen jaarrekening, Paragraph: 2|Article: 16, IssueDate: 2015-01-01, Name: Besluit modellen jaarrekening, Paragraph: 9|Chapter: 600, IssueDate: 2016-01-01, Name: Richtlijnen voor de jaarverslaggeving, Paragraph: 108"
737;"frc-abstr:PayablesOtherSpecificationTitle";1;"Overige schulden, specificatie [titel]";"Payables other, specification [title]";"Overige schulden, specificatie [titel]";"Overige schulden, specificatie [titel]";"";"PayablesOtherSpecificationTitle";"frc-abstr";"PayablesOtherSpecificationTitle";"https://www.sbrbanken.nl/bt11/frc/20161209/presentation/frc-abstracts#PayablesOtherSpecificationTitle";"sbr:presentationItem";1;0;;"0";"0";"0";"0";"xbrli:stringItemType";"string";"xbrli:stringItemType";"Abstract";"0";;;;;;;;;;;;"Duration";"None";1;0;"";"";"";"";"";"";"";"";""
738;"frc-i:NameCounterpartyPayables";2;"   Naam tegenpartij";"   Name counterparty payables";"   Naam tegenpartij schuld";"   Naam tegenpartij schuld";"http://www.xbrl.org/2003/role/terseLabel";"NameCounterpartyPayables";"frc-i";"NameCounterpartyPayables";"https://www.sbrbanken.nl/bt11/frc/20161209/dictionary/frc-data#NameCounterpartyPayables";"xbrli:item";4;0;"frc-abstr:PayablesOtherSpecificationTitle";"0";"0";"0";"0";"xbrli:stringItemType";"string";"xbrli:stringItemType";"String";"0";;;;;;;;;;;;"Instant";"None";0;0;"De naam van de tegenpartij van de schuld / verplichting. In het geval het een schuld aan een kredietinstelling betreft, is dit altijd de naam van de desbetreffende bank.";"";"";"";"De naam van de tegenpartij van de schuld / verplichting. In het geval het een schuld aan een kredietinstelling betreft, is dit altijd de naam van de desbetreffende bank.";"";"";"";""
