;"Generated by FINAN XBRL Taxonomy Viewer v4.4.1"
;"Taxonomy: BT2016(BankRptWoz)"

"Sort";"ID";"Level";"Label nl";"Label en";"PreferredLabelRole";"ElementName";"NamespaceAlias";"FinanVarName";"Url";"SubstitutionGroup";"UseCount";"IsTuple";"IsTupleKey";"IsInThisTuple";"TupleDepth";"TupleInstanceOrder";"MinTupleInstances";"MaxTupleInstances";"ElementType";"ShortElementType";"BaseType";"DataType (FMT4)";"InputRequired";"Pattern";"Enumeration";"FractionDigits";"TotalDigits";"Length";"MinLength";"MaxLength";"MinInclusive";"MaxInclusive";"MinExclusive";"MaxExclusive";"PeriodType";"Balance";"Abstract";"Nillable";"Documentation nl";"Documentation en";"Ddef.Guidance nl";"Ddef.Guidance en";"References"
1;"bank-abstracts:ReportTitle";1;"Rapportage";"Report";"";"ReportTitle";"bank-abstracts";"ReportTitle";"https://www.sbrbanken.nl/BT2016/report/bank/abstracts/bank-abstracts#ReportTitle";"xbrli:item";1;0;0;;"0";"0";"0";"0";"xbrli:stringItemType";"string";"xbrli:stringItemType";"Abstract";"0";;;;;;;;;;;;"Duration";"None";1;0;"";"";"";"";""
2;"bank-abstracts:ImmovablePropertyLawSpecificationReportTitle";2;"   WOZ rapportage";"   Immovable property law specification report";"";"ImmovablePropertyLawSpecificationReportTitle";"bank-abstracts";"ImmovablePropertyLawSpecificationReportTitle";"https://www.sbrbanken.nl/BT2016/report/bank/abstracts/bank-abstracts#ImmovablePropertyLawSpecificationReportTitle";"xbrli:item";1;0;0;;"0";"0";"0";"0";"xbrli:stringItemType";"string";"xbrli:stringItemType";"Abstract";"0";;;;;;;;;;;;"Duration";"None";1;0;"";"";"";"";""
3;"bank-abstracts:BankCommonDataTitle";1;"Algemene gegevens";"Bank common data title";"";"BankCommonDataTitle";"bank-abstracts";"BankCommonDataTitle";"https://www.sbrbanken.nl/BT2016/report/bank/abstracts/bank-abstracts#BankCommonDataTitle";"xbrli:item";1;0;0;;"0";"0";"0";"0";"xbrli:stringItemType";"string";"xbrli:stringItemType";"Abstract";"0";;;;;;;;;;;;"Duration";"None";1;0;"";"";"";"";""
4;"kvk-abstr:DocumentInformationTitle";2;"   Informatie over de rapportage";"   Document information";"urn:bank:preflabel:label";"DocumentInformationTitle";"kvk-abstr";"DocumentInformationTitle";"http://www.nltaxonomie.nl/10.0/report/kvk/abstracts/kvk-abstracts#DocumentInformationTitle";"sbr:presentationItem";1;0;0;;"0";"0";"0";"0";"xbrli:stringItemType";"string";"xbrli:stringItemType";"Abstract";"0";;;;;;;;;;;;"Duration";"None";1;0;"";"";"";"";""
5;"bank-cd:ReasonDelivery";3;"      Reden levering";"      Reason delivery";"";"ReasonDelivery";"bank-cd";"ReasonDelivery";"https://www.sbrbanken.nl/BT2016/basis/bank/items/bank-common-data#ReasonDelivery";"xbrli:item";1;0;0;;"0";"0";"0";"0";"bank-codes:ReasonDeliveryItemType";"ReasonDelivery";"xbrli:stringItemType";"Enumeration";"0";"";"Bijzonder Beheer|Juridische omzetting|Kredietwijziging|Nieuwe Aanvraag|Revisie|Overig";"";"";"";"";"";"";"";"";"";"Duration";"None";0;0;"De reden waarom de kredietrapportage wordt aangeleverd.";"";"De reden waarom de kredietrapportage wordt aangeleverd.";"";""
6;"nl-cd:DocumentCreationDate";3;"      Datum van opmaak van het document";"      Document creation date";"";"DocumentCreationDate";"nl-cd";"DocumentCreationDate";"http://www.nltaxonomie.nl/10.0/basis/sbr/items/nl-common-data#DocumentCreationDate";"xbrli:item";1;0;0;;"0";"0";"0";"0";"xbrli:dateItemType";"date";"xbrli:dateItemType";"Date";"0";;;;;;;;;;;;"Duration";"None";0;0;"De datum van opmaak van het document volgens ISO 8601 in het formaat: jjjj-mm-dd";"The date of document formatting, according to ISO 8601 with the format: yyyy-mm-dd.";"De datum waarop de rapportage is gemaakt.";"";""
7;"kvk-abstr:EntityInformationTitle";2;"   Informatie met betrekking tot de onderneming";"   Entity information";"urn:bank:preflabel:label";"EntityInformationTitle";"kvk-abstr";"EntityInformationTitle";"http://www.nltaxonomie.nl/10.0/report/kvk/abstracts/kvk-abstracts#EntityInformationTitle";"sbr:presentationItem";1;0;0;;"0";"0";"0";"0";"xbrli:stringItemType";"string";"xbrli:stringItemType";"Abstract";"0";;;;;;;;;;;;"Duration";"None";1;0;"";"";"";"";""
8;"venj-bw2-i:ChamberOfCommerceRegistrationNumber";3;"      Registratienummer bij de Kamer van Koophandel";"      Registration number at the Chamber of Commerce";"";"ChamberOfCommerceRegistrationNumber";"venj-bw2-i";"ChamberOfCommerceRegistrationNumber";"http://www.nltaxonomie.nl/10.0/basis/venj/items/venj-bw2-data#ChamberOfCommerceRegistrationNumber";"xbrli:item";1;0;0;;"0";"0";"0";"0";"venj-types:chamberOfCommerceRegistrationNumberItemType";"chamberOfCommerceRegistrationNumber";"xbrli:stringItemType";"String";"0";"([1-9][0-9]{7})|([0-9][1-9][0-9]{6})";"";"";"";"8";"";"";"";"";"";"";"Duration";"None";0;0;"";"";"";"";"Article: 380a, IssueDate: 2016-01-01, Name: Burgerlijk wetboek boek 2"
9;"venj-bw2-i:LegalEntityName";3;"      Naam van de rechtspersoon";"      Legal entity name";"";"LegalEntityName";"venj-bw2-i";"LegalEntityName";"http://www.nltaxonomie.nl/10.0/basis/venj/items/venj-bw2-data#LegalEntityName";"xbrli:item";1;0;0;;"0";"0";"0";"0";"xbrli:stringItemType";"string";"xbrli:stringItemType";"String";"0";;;;;;;;;;;;"Duration";"None";0;0;"";"";"";"";"Article: 380a, IssueDate: 2016-01-01, Name: Burgerlijk wetboek boek 2|Chapter: 110, IssueDate: 2015-01-01, Name: Richtlijnen voor de jaarverslaggeving, Paragraph: 103|Chapter: 300, IssueDate: 2015-01-01, Name: Richtlijnen voor de jaarverslaggeving, Paragraph: 105, Subparagraph: a"
10;"rj-i:BusinessNames";3;"      Handelsnamen";"      Business names";"";"BusinessNames";"rj-i";"BusinessNames";"http://www.nltaxonomie.nl/10.0/basis/rj/items/rj-data#BusinessNames";"xbrli:item";1;0;0;;"0";"0";"0";"0";"xbrli:stringItemType";"string";"xbrli:stringItemType";"String";"0";;;;;;;;;;;;"Duration";"None";0;0;"";"";"";"";"Chapter: 110, IssueDate: 2015-01-01, Name: Richtlijnen voor de jaarverslaggeving, Paragraph: 103, Subparagraph: a"
11;"nl-cd:HouseNumberNL";3;"      Huisnummer";"      House number";"urn:bank:preflabel:label";"HouseNumberNL";"nl-cd";"HouseNumberNL";"http://www.nltaxonomie.nl/10.0/basis/sbr/items/nl-common-data#HouseNumberNL";"xbrli:item";1;0;0;;"0";"0";"0";"0";"nl-types:nonNegative20ItemType";"nonNegative20";"xbrli:stringItemType";"String";"0";"([0-9]{1,20})";"";"";"";"";"";"";"";"";"";"";"Duration";"None";0;0;"De numerieke aanduiding zoals deze door de gemeente aan het object is toegekend.";"The numeric part of the object as designated by the municipality.";"Het huisnummer.";"";"IssueDate: 2002, Name: NEN5825"
12;"nl-cd:PostalCodeNL";3;"      Postcode";"      Postal code";"http://www.xbrl.org/2003/role/terseLabel";"PostalCodeNL";"nl-cd";"PostalCodeNL";"http://www.nltaxonomie.nl/10.0/basis/sbr/items/nl-common-data#PostalCodeNL";"xbrli:item";1;0;0;;"0";"0";"0";"0";"nl-types:nlzipItemType";"nlzip";"xbrli:stringItemType";"String";"0";"([1-9]{1}[0-9]{3}[A-Z]{2})";"";"";"";"";"";"";"";"";"";"";"Duration";"None";0;0;"De officiële codering van PostNL voor een Nederlands postadres, bestaande uit een numeriek deel en een alfabetisch deel.";"The official coding of PostNL for a Dutch postal address, consisting of a numeric part and an alphabetic part.";"De postcode van het adres.";"";"IssueDate: 2002, Name: NEN5825|Article: 37, Name: Wet op de omzetbelasting 1968, Paragraph: a"
13;"nl-cd:PlaceOfResidenceNL";3;"      Vestigingsplaats";"      Place of residence";"http://www.xbrl.org/2003/role/terseLabel";"PlaceOfResidenceNL";"nl-cd";"PlaceOfResidenceNL";"http://www.nltaxonomie.nl/10.0/basis/sbr/items/nl-common-data#PlaceOfResidenceNL";"xbrli:item";1;0;0;;"0";"0";"0";"0";"nl-types:string1000ItemType";"string1000";"xbrli:tokenItemType";"String";"0";"";"";"";"";"";"1";"1000";"";"";"";"";"Duration";"None";0;0;"De officiële door de gemeente vastgestelde gemeentenaam.";"The official municipality name as designated by the municipality.";"De plaats van vestiging van de onderneming.";"";"Name: LO3.9, Page: 253, Publisher: Gemeentelijke basisadministratie|IssueDate: 2002, Name: NEN5825|Article: 37, Name: Wet op de omzetbelasting 1968, Paragraph: a"
14;"kvk-t:ContactForDocumentPresentation";3;"      Contactpersoon voor deze rapportage";"      Contact for this document";"urn:bank:preflabel:label";"ContactForDocumentPresentation";"kvk-t";"ContactForDocumentPresentation";"http://www.nltaxonomie.nl/10.0/domein/kvk/tuples/kvk-tuples#ContactForDocumentPresentation";"sbr:presentationTuple";1;1;0;;"0";"0";"1";"1";"";"";"";"Abstract";"0";;;;;;;;;;;;"Other";"None";0;0;"Deze tuple is bedoeld voor het opnemen van de contactgegevens van de contactpersoon van deze rapportage. Deze contactpersoon kan van de organisatie zelf zijn of van haar intermediair.";"The intention of this tuple is to record the contact details of the contact for this document. This contact can be a person from the organisation itself or from its intermediary.";"De gegevens van de contactpersoon betreffende deze rapportage.";"";""
15;"kvk-i:ContactType";4;"         Soort contactpersoon";"         Contact type";"";"ContactType";"kvk-i";"ContactType";"http://www.nltaxonomie.nl/10.0/basis/kvk/items/kvk-data#ContactType";"xbrli:item";1;0;0;"kvk-t:ContactForDocumentPresentation";"1";"0";"0";"0";"kvk-codes:contactItemType";"contact";"xbrli:stringItemType";"Enumeration";"0";"";"Intermediair|Ondernemer";"";"";"";"";"";"";"";"";"";"Duration";"None";0;0;"Dit concept dient voor het classificeren van de contactpersoon van deze rapportage in de categorie ""ondernemer"" of ""intermediair"".";"The purpose of this concept is to categorise the contact for this report into either ""Intermediary"" or ""Entrepreneur"".";"";"";""
16;"nl-cd:FirstName";4;"         Voornamen";"         First name";"";"FirstName";"nl-cd";"FirstName";"http://www.nltaxonomie.nl/10.0/basis/sbr/items/nl-common-data#FirstName";"xbrli:item";1;0;0;"kvk-t:ContactForDocumentPresentation";"1";"1";"0";"0";"nl-types:string1000ItemType";"string1000";"xbrli:tokenItemType";"String";"0";"";"";"";"";"";"1";"1000";"";"";"";"";"Duration";"None";0;0;"De verzameling namen die, gescheiden door spaties, aan de geslachtsnaam voorafgaat. Indien aanwezig, wordt het predikaat afgesplitst.";"The collection of names, separated by spaces, which precede the family name stripped of predicates.";"De voornaam.";"";"Name: LO3.9, Page: 234, Publisher: Gemeentelijke basisadministratie"
17;"nl-cd:FamilyName";4;"         Geslachtsnaam";"         Family name";"";"FamilyName";"nl-cd";"FamilyName";"http://www.nltaxonomie.nl/10.0/basis/sbr/items/nl-common-data#FamilyName";"xbrli:item";1;0;0;"kvk-t:ContactForDocumentPresentation";"1";"2";"0";"0";"nl-types:string1000ItemType";"string1000";"xbrli:tokenItemType";"String";"0";"";"";"";"";"";"1";"1000";"";"";"";"";"Duration";"None";0;0;"De (geslachts)naam waarvan de eventueel aanwezige voorvoegsels en adellijke titel/predikaat zijn afgesplitst.";"The family name stripped of any prefixes and noble titles/predicates.";"De achternaam van de persoon.";"";"Name: LO3.9, Page: 237, Publisher: Gemeentelijke basisadministratie"
18;"venj-bw2-i:OrganisationName";4;"         Naam van de organisatie";"         Name of the organisation";"http://www.xbrl.org/2003/role/terseLabel";"OrganisationName";"venj-bw2-i";"OrganisationName";"http://www.nltaxonomie.nl/10.0/basis/venj/items/venj-bw2-data#OrganisationName";"xbrli:item";1;0;0;"kvk-t:ContactForDocumentPresentation";"1";"3";"0";"0";"xbrli:stringItemType";"string";"xbrli:stringItemType";"String";"0";;;;;;;;;;;;"Duration";"None";0;0;"Naam van de organisatie of rechtspersoon die in casu wordt vertegenwoordigd.";"Name of the organisation or legal entity that is being represented in this situation.";"";"";"Article: 15, IssueDate: 2015-01-01, Name: Besluit modellen jaarrekening"
19;"nl-cd:TelephoneNumber";4;"         Telefoonnummer";"         Telephone number";"";"TelephoneNumber";"nl-cd";"TelephoneNumber";"http://www.nltaxonomie.nl/10.0/basis/sbr/items/nl-common-data#TelephoneNumber";"xbrli:item";1;0;0;"kvk-t:ContactForDocumentPresentation";"1";"4";"0";"0";"nl-types:string1000ItemType";"string1000";"xbrli:tokenItemType";"String";"0";"";"";"";"";"";"1";"1000";"";"";"";"";"Duration";"None";0;0;"Het nummer waaronder een persoon of organisatie telefonisch te bereiken is, bestaande uit een netnummer en een abonneenummer.";"The number on which a person or organisation can be reached by telephone, consisting of an area code and a subscriber number.";"Het telefoonnummer.";"";"IssueDate: 2002, Name: NEN5825|Article: 37, Name: Wet op de omzetbelasting 1968, Paragraph: a"
20;"nl-cd:EmailAddressFull";4;"         E-mailadres";"         Email address";"http://www.xbrl.org/2003/role/terseLabel";"EmailAddressFull";"nl-cd";"EmailAddressFull";"http://www.nltaxonomie.nl/10.0/basis/sbr/items/nl-common-data#EmailAddressFull";"xbrli:item";1;0;0;"kvk-t:ContactForDocumentPresentation";"1";"5";"0";"0";"nl-types:emailItemType";"email";"xbrli:stringItemType";"String";"0";"[^@]+@[^@]+";"";"";"";"";"6";"254";"";"";"";"";"Duration";"None";0;0;"Het adres waaronder een persoon of organisatie via het internet per elektronische post te bereiken is.";"The address with which the person or organisation is contacted through the internet electronic mail.";"Het (volledige) email adres.";"";"IssueDate: 2002, Name: NEN5825"
21;"bank-abstracts:IntermediaryTitle";2;"   Intermediair";"   Intermediary title";"";"IntermediaryTitle";"bank-abstracts";"IntermediaryTitle";"https://www.sbrbanken.nl/BT2016/report/bank/abstracts/bank-abstracts#IntermediaryTitle";"xbrli:item";1;0;0;;"0";"0";"0";"0";"xbrli:stringItemType";"string";"xbrli:stringItemType";"Abstract";"0";;;;;;;;;;;;"Duration";"None";1;0;"";"";"";"";""
22;"bank-cd:NameIntermediary";3;"      Naam";"      Name intermediary";"http://www.xbrl.org/2003/role/terseLabel";"NameIntermediary";"bank-cd";"NameIntermediary";"https://www.sbrbanken.nl/BT2016/basis/bank/items/bank-common-data#NameIntermediary";"xbrli:item";1;0;0;;"0";"0";"0";"0";"xbrli:stringItemType";"string";"xbrli:stringItemType";"String";"0";;;;;;;;;;;;"Duration";"None";0;0;"Naam kantoor intermediair.";"";"Naam van het kantoor van de financiële intermediair (accountant, fiscalist, boekhoudkantoor).";"";""
23;"bank-cd:DomicileIntermediary";3;"      Vestigingsplaats";"      Domicile intermediary";"http://www.xbrl.org/2003/role/terseLabel";"DomicileIntermediary";"bank-cd";"DomicileIntermediary";"https://www.sbrbanken.nl/BT2016/basis/bank/items/bank-common-data#DomicileIntermediary";"xbrli:item";1;0;0;;"0";"0";"0";"0";"xbrli:stringItemType";"string";"xbrli:stringItemType";"String";"0";;;;;;;;;;;;"Duration";"None";0;0;"Vestigingsplaats intermediair.";"";"De vestigingsplaats van de financiële intermediair (accountant, fiscalist, boekhoudkantoor).";"";""
24;"bank-cd:NameCompiler";3;"      Naam opsteller";"      Name compiler";"";"NameCompiler";"bank-cd";"NameCompiler";"https://www.sbrbanken.nl/BT2016/basis/bank/items/bank-common-data#NameCompiler";"xbrli:item";1;0;0;;"0";"0";"0";"0";"xbrli:stringItemType";"string";"xbrli:stringItemType";"String";"0";;;;;;;;;;;;"Duration";"None";0;0;"De naam van de opsteller (natuurlijk persoon) met toevoeging van (relevante) titels.";"";"De naam van de opsteller (natuurlijk persoon) van de rapportage met toevoeging van (relevante) titels.";"";""
25;"bank-cd:EmailAddressIntermediary";3;"      E-mailadres";"      Email address intermediary";"http://www.xbrl.org/2003/role/terseLabel";"EmailAddressIntermediary";"bank-cd";"EmailAddressIntermediary";"https://www.sbrbanken.nl/BT2016/basis/bank/items/bank-common-data#EmailAddressIntermediary";"xbrli:item";1;0;0;;"0";"0";"0";"0";"xbrli:stringItemType";"string";"xbrli:stringItemType";"String";"0";;;;;;;;;;;;"Duration";"None";0;0;"Het e-mailadres van de intermediair.";"";"Het e-mailadres van de financiële intermediair.";"";""
26;"bank-abstracts:BankInformationTitle";2;"   Bank informatie";"   Bank information title";"";"BankInformationTitle";"bank-abstracts";"BankInformationTitle";"https://www.sbrbanken.nl/BT2016/report/bank/abstracts/bank-abstracts#BankInformationTitle";"xbrli:item";1;0;0;;"0";"0";"0";"0";"xbrli:stringItemType";"string";"xbrli:stringItemType";"Abstract";"0";;;;;;;;;;;;"Duration";"None";1;0;"";"";"";"";""
27;"bank-cd:DestinationBank";3;"      Bestemmende bank";"      Destination bank";"";"DestinationBank";"bank-cd";"DestinationBank";"https://www.sbrbanken.nl/BT2016/basis/bank/items/bank-common-data#DestinationBank";"xbrli:item";1;0;0;;"0";"0";"0";"0";"bank-codes:DestinationBankItemType";"DestinationBank";"xbrli:stringItemType";"Enumeration";"0";"";"ABN AMRO Bank|ING Bank|Rabobank|Overig";"";"";"";"";"";"";"";"";"";"Duration";"None";0;0;"De naam van de bank waarvoor de rapportage bestemd is.";"";"De naam van de bank waarvoor de rapportage bestemd is. Indien de rapportage bestemd is voor een bank waarvan de naam niet is opgenomen in de gespecificeerde lijst dan ""Overig"" invullen.";"";""
28;"bank-tuples:BankAccountsSpecification";3;"      Bankrekening gegevens";"      Bank accounts";"http://www.xbrl.org/2003/role/terseLabel";"BankAccountsSpecification";"bank-tuples";"BankAccountsSpecification";"https://www.sbrbanken.nl/BT2016/domein/bank/tuples/bank-tuples#BankAccountsSpecification";"xbrli:tuple";1;1;0;;"0";"0";"0";"-1";"";"";"";"Abstract";"0";;;;;;;;;;;;"Other";"None";0;0;"";"";"";"";""
29;"bank-cd:BankName";4;"         Naam bank";"         Bank name";"";"BankName";"bank-cd";"BankName";"https://www.sbrbanken.nl/BT2016/basis/bank/items/bank-common-data#BankName";"xbrli:item";1;0;0;"bank-tuples:BankAccountsSpecification";"1";"0";"0";"0";"xbrli:stringItemType";"string";"xbrli:stringItemType";"String";"1";;;;;;;;;;;;"Duration";"None";0;0;"De naam van de bank.";"";"De naam van de bank.";"";""
30;"bank-cd:AccountNumberBank";4;"         Zakelijk rekeningnummer";"         Account number bank";"";"AccountNumberBank";"bank-cd";"AccountNumberBank";"https://www.sbrbanken.nl/BT2016/basis/bank/items/bank-common-data#AccountNumberBank";"xbrli:item";1;0;0;"bank-tuples:BankAccountsSpecification";"1";"1";"0";"0";"bank-types:nlIbanItemType";"nlIban";"xbrli:stringItemType";"String";"1";"(NL[0-9]{2}[a-zA-Z]{4}[0-9]{10})";"";"";"";"";"";"";"";"";"";"";"Duration";"None";0;0;"18-tekens (cijfers en letters) tellend IBAN nummer.";"";"Het rekeningnummer van de bankrekening dat door de onderneming wordt gebruikt in relatie tot het te verstrekken/verstrekte krediet. Het uit 18 tekens (cijfers en letters) bestaande IBAN nummer moet hier worden ingevuld.";"";""
31;"bank-cd:PrivateAccountNumberBank";4;"         Privé rekeningnummer";"         Private account number bank";"";"PrivateAccountNumberBank";"bank-cd";"PrivateAccountNumberBank";"https://www.sbrbanken.nl/BT2016/basis/bank/items/bank-common-data#PrivateAccountNumberBank";"xbrli:item";1;0;0;"bank-tuples:BankAccountsSpecification";"1";"2";"0";"0";"bank-types:nlIbanItemType";"nlIban";"xbrli:stringItemType";"String";"0";"(NL[0-9]{2}[a-zA-Z]{4}[0-9]{10})";"";"";"";"";"";"";"";"";"";"";"Duration";"None";0;0;"18-tekens (cijfers en letters) IBAN nummer.";"";"Het nummer van de privé rekening, hier moet het uit 18 tekens (cijfers en letters) bestaande IBAN nummer worden ingevuld.";"";""
32;"bank-abstracts:ImmovablePropertyLawSpecificationTitle";1;"WOZ specificatie";"Immovable property law specification";"";"ImmovablePropertyLawSpecificationTitle";"bank-abstracts";"ImmovablePropertyLawSpecificationTitle";"https://www.sbrbanken.nl/BT2016/report/bank/abstracts/bank-abstracts#ImmovablePropertyLawSpecificationTitle";"xbrli:item";1;0;0;;"0";"0";"0";"0";"xbrli:stringItemType";"string";"xbrli:stringItemType";"Abstract";"0";;;;;;;;;;;;"Duration";"None";1;0;"";"";"";"";""
33;"bank-tuples:LandAndBuildingsSpecification";2;"   Bedrijfsgebouwen en -terreinen";"   Land and buildings";"http://www.xbrl.org/2003/role/terseLabel";"LandAndBuildingsSpecification";"bank-tuples";"LandAndBuildingsSpecification";"https://www.sbrbanken.nl/BT2016/domein/bank/tuples/bank-tuples#LandAndBuildingsSpecification";"xbrli:tuple";1;1;0;;"0";"0";"0";"-1";"";"";"";"Abstract";"0";;;;;;;;;;;;"Other";"None";0;0;"Het registergoed onroerend goed.";"";"";"";""
34;"bank-cd:RegistryNumberRegisterBoundGood";3;"      Registernummer";"      Registry number register bound good";"";"RegistryNumberRegisterBoundGood";"bank-cd";"RegistryNumberRegisterBoundGood";"https://www.sbrbanken.nl/BT2016/basis/bank/items/bank-common-data#RegistryNumberRegisterBoundGood";"xbrli:item";1;0;0;"bank-tuples:LandAndBuildingsSpecification";"1";"0";"0";"0";"xbrli:stringItemType";"string";"xbrli:stringItemType";"String";"1";;;;;;;;;;;;"Duration";"None";0;0;"Nummer waaronder het registergoed in het register staat ingeschreven.";"";"Nummer waaronder het registergoed in het register staat ingeschreven.";"";""
35;"bank:PurchaseValueRegisterBoundGood";3;"      Aanschafwaarde";"      Purchase value register bound good";"http://www.xbrl.org/2003/role/terseLabel";"PurchaseValueRegisterBoundGood";"bank";"PurchaseValueRegisterBoundGood";"https://www.sbrbanken.nl/BT2016/basis/bank/items/bank#PurchaseValueRegisterBoundGood";"xbrli:item";1;0;0;"bank-tuples:LandAndBuildingsSpecification";"1";"1";"0";"0";"nl-types:monetaryNoDecimalsItemType";"monetaryNoDecimals";"nl-types:monetary20ItemType";"Monetary";"0";"";"";"0";"";"";"";"";"";"";"";"";"Instant";"Debit";0;0;"De ondergrens van de aanschafwaarde van het registergoed bedraagt €10.000,-.";"";"De waarde waarvoor een registergoed is aangeschaft. Alleen registergoederen met een aanschafwaarde van €10.000,- of meer behoeven hier te worden ingevuld.";"";""
36;"bank-cd:PurchaseYearRegisterBoundGood";3;"      Aanschafjaar";"      Purchase year register bound good";"http://www.xbrl.org/2003/role/terseLabel";"PurchaseYearRegisterBoundGood";"bank-cd";"PurchaseYearRegisterBoundGood";"https://www.sbrbanken.nl/BT2016/basis/bank/items/bank-common-data#PurchaseYearRegisterBoundGood";"xbrli:item";1;0;0;"bank-tuples:LandAndBuildingsSpecification";"1";"2";"0";"0";"xbrli:gYearItemType";"gYear";"xbrli:tokenItemType";"String";"0";"[0-9][0-9][0-9][0-9]";"";"";"";"";"";"";"";"";"";"";"Duration";"None";0;0;"Het aanschafjaar van het registergoed.";"";"Het aanschafjaar van het registergoed.";"";""
37;"bank-cd:BuildingIndicator";3;"      Gebouw (eventueel inclusief terrein) J/N";"      Building indicator Y/N";"";"BuildingIndicator";"bank-cd";"BuildingIndicator";"https://www.sbrbanken.nl/BT2016/basis/bank/items/bank-common-data#BuildingIndicator";"xbrli:item";1;0;0;"bank-tuples:LandAndBuildingsSpecification";"1";"3";"0";"0";"xbrli:booleanItemType";"boolean";"xbrli:booleanItemType";"Boolean";"1";;;;;;;;;;;;"Duration";"None";0;0;"Indicatie of het alhier gespecificeerde registergoed een gebouw is, indien gebouw (eventueel inclusief terrein) dan is de WOZ-waarde verplicht.";"";"Indicatie of het alhier gespecificeerde registergoed een gebouw is, indien gebouw (eventueel inclusief terrein) dan is de WOZ-waarde verplicht.";"";""
38;"bank:ValuePurposesValuationOfImmovablePropertyActRegisterBoundGood";3;"      WOZ-waarde";"      Value purposes valuation of immovable property act register bound good";"http://www.xbrl.org/2003/role/terseLabel";"ValuePurposesValuationOfImmovablePropertyActRegisterBoundGood";"bank";"ValuePurposesValuationOfImmovablePropertyActRegisterBoundGood";"https://www.sbrbanken.nl/BT2016/basis/bank/items/bank#ValuePurposesValuationOfImmovablePropertyActRegisterBoundGood";"xbrli:item";1;0;0;"bank-tuples:LandAndBuildingsSpecification";"1";"4";"0";"0";"nl-types:monetaryNoDecimalsItemType";"monetaryNoDecimals";"nl-types:monetary20ItemType";"Monetary";"0";"";"";"0";"";"";"";"";"";"";"";"";"Instant";"Debit";0;0;"Waarde van het registergoed zoals het bij het register is geregistreerd.";"";"De waarde van een onroerende zaak op de laatste peildatum zoals deze in het kader van de Wet Waardering Onroerende Zaken (WOZ) wordt bepaald (Artikel 18, lid 2 van de Wet WOZ).";"";""
39;"bank-cd:DateOfAdoptionForValueOfImmovablePropertyActRegisterBoundGood";3;"      Datum vaststelling WOZ-waarde";"      Date of adoption for value of immovable property act register bound good";"http://www.xbrl.org/2003/role/terseLabel";"DateOfAdoptionForValueOfImmovablePropertyActRegisterBoundGood";"bank-cd";"DateOfAdoptionForValueOfImmovablePropertyActRegisterBoundGood";"https://www.sbrbanken.nl/BT2016/basis/bank/items/bank-common-data#DateOfAdoptionForValueOfImmovablePropertyActRegisterBoundGood";"xbrli:item";1;0;0;"bank-tuples:LandAndBuildingsSpecification";"1";"5";"0";"0";"xbrli:dateItemType";"date";"xbrli:dateItemType";"Date";"0";;;;;;;;;;;;"Duration";"None";0;0;"De datum waarop de WOZ-waarde van het registergoed is vastgesteld.";"";"De datum waarop de WOZ-waarde van het registergoed is vastgesteld.";"";""
40;"bank:BalanceSheetValueRegisterBoundGood";3;"      Boekwaarde";"      Balance sheet value register bound good";"http://www.xbrl.org/2003/role/terseLabel";"BalanceSheetValueRegisterBoundGood";"bank";"BalanceSheetValueRegisterBoundGood";"https://www.sbrbanken.nl/BT2016/basis/bank/items/bank#BalanceSheetValueRegisterBoundGood";"xbrli:item";1;0;0;"bank-tuples:LandAndBuildingsSpecification";"1";"6";"0";"0";"nl-types:monetaryNoDecimalsItemType";"monetaryNoDecimals";"nl-types:monetary20ItemType";"Monetary";"1";"";"";"0";"";"";"";"";"";"";"";"";"Instant";"Debit";0;0;"Boekwaarde van het registergoed.";"";"De boekwaarde van een goed dat volgens de wet moet worden ingeschreven in de daarvoor bestemde openbare registers: grond, huizen, schepen, vliegtuigen. Door de inschrijving kan iedereen zien aan wie het toebehoort en of er een ander zakelijk recht(bijvoorbeeld een hypotheek) op rust (zie BW 3:10).";"";""
