336;"bank-abstracts:DepreciationPropertyPlantEquipmentAmortisationIntangibleAssetsTitle";4;"         Depreciation tangible assets amortisation intangible assets title";"         Afschrijvingen op immateriële en materiële vaste activa";"";"DepreciationPropertyPlantEquipmentAmortisationIntangibleAssetsTitle";"bank-abstracts";"DepreciationPropertyPlantEquipmentAmortisationIntangibleAssetsTitle";"https://www.sbrbanken.nl/BT2016/report/bank/abstracts/bank-abstracts#DepreciationPropertyPlantEquipmentAmortisationIntangibleAssetsTitle";"xbrli:item";1;0;0;;"0";"0";"0";"0";"xbrli:stringItemType";"string";"xbrli:stringItemType";"Abstract";"0";;;;;;;;;;;;"Duration";"None";1;0;"";"";"";"";""
337;"venj-bw2-i:AmortisationIntangibleAssets";5;"            Amortisation of intangible assets";"            Afschrijvingen op immateriële vaste activa";"";"AmortisationIntangibleAssets";"venj-bw2-i";"AmortisationIntangibleAssets";"http://www.nltaxonomie.nl/10.0/basis/venj/items/venj-bw2-data#AmortisationIntangibleAssets";"xbrli:item";1;0;0;;"0";"0";"0";"0";"nl-types:monetaryNoDecimalsItemType";"monetaryNoDecimals";"nl-types:monetary20ItemType";"Monetary";"0";"";"";"0";"";"";"";"";"";"";"";"";"Duration";"Debit";0;0;"";"";"";"De afschrijvingen en de waardeverminderingen ten laste van de immateriële vaste activa.";"Article: 377, IssueDate: 2015-01-01, Name: Burgerlijk wetboek boek 2, Paragraph: 3, Subparagraph: h"
338;"venj-bw2-i:DepreciationPropertyPlantEquipment";5;"            Depreciation of tangible assets, total";"            Afschrijving op materiele vaste activa, totaal";"";"DepreciationPropertyPlantEquipment";"venj-bw2-i";"DepreciationPropertyPlantEquipment";"http://www.nltaxonomie.nl/10.0/basis/venj/items/venj-bw2-data#DepreciationPropertyPlantEquipment";"xbrli:item";1;0;0;;"0";"0";"0";"0";"nl-types:monetaryNoDecimalsItemType";"monetaryNoDecimals";"nl-types:monetary20ItemType";"Monetary";"0";"";"";"0";"";"";"";"";"";"";"";"";"Duration";"Debit";0;0;"";"";"";"De afschrijvingen en de waardeverminderingen van de materiële vaste activa.";"Article: 377, IssueDate: 2015-01-01, Name: Burgerlijk wetboek boek 2, Paragraph: 3, Subparagraph: h"
339;"bank-abstracts:OperationExpenseOtherTitle";4;"         Operation expense other title";"         Overige bedrijfskosten";"";"OperationExpenseOtherTitle";"bank-abstracts";"OperationExpenseOtherTitle";"https://www.sbrbanken.nl/BT2016/report/bank/abstracts/bank-abstracts#OperationExpenseOtherTitle";"xbrli:item";1;0;0;;"0";"0";"0";"0";"xbrli:stringItemType";"string";"xbrli:stringItemType";"Abstract";"0";;;;;;;;;;;;"Duration";"None";1;0;"";"";"";"";""
340;"rj-i:PersonnelRelatedOtherExpenses";5;"            Other personnel related expenses";"            Overige personeelsgerelateerde kosten";"";"PersonnelRelatedOtherExpenses";"rj-i";"PersonnelRelatedOtherExpenses";"http://www.nltaxonomie.nl/10.0/basis/rj/items/rj-data#PersonnelRelatedOtherExpenses";"xbrli:item";1;0;0;;"0";"0";"0";"0";"xbrli:monetaryItemType";"monetary";"xbrli:monetaryItemType";"Monetary";"0";;;;;;;;;;;;"Duration";"Debit";0;0;"";"";"";"De kosten die gedurende het boekjaar zijn gemaakt voor personeelsaangelegenheden.";"Chapter: 270, IssueDate: 2015-01-01, Name: Richtlijnen voor de jaarverslaggeving, Paragraph: 503"
341;"rj-i:AccommodationCosts";5;"            Accommodation costs";"            Huisvestingskosten";"";"AccommodationCosts";"rj-i";"AccommodationCosts";"http://www.nltaxonomie.nl/10.0/basis/rj/items/rj-data#AccommodationCosts";"xbrli:item";1;0;0;;"0";"0";"0";"0";"xbrli:monetaryItemType";"monetary";"xbrli:monetaryItemType";"Monetary";"0";;;;;;;;;;;;"Duration";"Debit";0;0;"";"";"";"De kosten die gedurende het boekjaar zijn betaald ter vergoeding van huur, pacht of andere huisvestingskosten.";"Article: 362, IssueDate: 2015-01-01, Name: Burgerlijk wetboek boek 2, Paragraph: 3|Chapter: 270, IssueDate: 2015-01-01, Name: Richtlijnen voor de jaarverslaggeving, Paragraph: 503"
342;"rj-i:SalesRelatedExpenses";5;"            Sales related expenses";"            Verkoop gerelateerde kosten";"";"SalesRelatedExpenses";"rj-i";"SalesRelatedExpenses";"http://www.nltaxonomie.nl/10.0/basis/rj/items/rj-data#SalesRelatedExpenses";"xbrli:item";1;0;0;;"0";"0";"0";"0";"xbrli:monetaryItemType";"monetary";"xbrli:monetaryItemType";"Monetary";"0";;;;;;;;;;;;"Duration";"Debit";0;0;"";"";"";"Het totaalbedrag aan de verkoop gerelateerde kosten van het jaar waarover gerapporteerd wordt.";"Chapter: 270, IssueDate: 2015-01-01, Name: Richtlijnen voor de jaarverslaggeving, Paragraph: 503"
343;"rj-i:CarAndTransportCosts";5;"            Car and transport costs";"            Auto- en transportkosten";"";"CarAndTransportCosts";"rj-i";"CarAndTransportCosts";"http://www.nltaxonomie.nl/10.0/basis/rj/items/rj-data#CarAndTransportCosts";"xbrli:item";1;0;0;;"0";"0";"0";"0";"xbrli:monetaryItemType";"monetary";"xbrli:monetaryItemType";"Monetary";"0";;;;;;;;;;;;"Duration";"Debit";0;0;"";"";"";"Het totaalbedrag aan auto- en transportkosten van het jaar waarover gerapporteerd wordt.";"Article: 362, IssueDate: 2015-01-01, Name: Burgerlijk wetboek boek 2, Paragraph: 3|Chapter: 270, IssueDate: 2015-01-01, Name: Richtlijnen voor de jaarverslaggeving, Paragraph: 503"
344;"bank:OperationalLeaseCosts";5;"            Operational lease costs";"            Operationele leasekosten";"";"OperationalLeaseCosts";"bank";"OperationalLeaseCosts";"https://www.sbrbanken.nl/BT2016/basis/bank/items/bank#OperationalLeaseCosts";"xbrli:item";1;0;0;;"0";"0";"0";"0";"nl-types:monetaryNoDecimalsItemType";"monetaryNoDecimals";"nl-types:monetary20ItemType";"Monetary";"0";"";"";"0";"";"";"";"";"";"";"";"";"Duration";"Debit";0;0;"";"Het totaalbedrag aan operationele leasekosten van het jaar waarover gerapporteerd wordt.";"";"Het totaalbedrag aan operationele leasekosten, de jaarlijkse verplichting voor de huur van een goed, inclusief de kosten van onderhoud, reparaties en verzekeringen.  Het eigendom van het goed blijft liggen bij de verhuurder.";""
345;"rj-i:OfficeRelatedExpenses";5;"            Office related expenses";"            Kantoorkosten";"";"OfficeRelatedExpenses";"rj-i";"OfficeRelatedExpenses";"http://www.nltaxonomie.nl/10.0/basis/rj/items/rj-data#OfficeRelatedExpenses";"xbrli:item";1;0;0;;"0";"0";"0";"0";"xbrli:monetaryItemType";"monetary";"xbrli:monetaryItemType";"Monetary";"0";;;;;;;;;;;;"Duration";"Debit";0;0;"";"";"";"De kosten die gedurende het boekjaar zijn betaald ter vergoeding van kantoorkosten.";"Chapter: 270, IssueDate: 2015-01-01, Name: Richtlijnen voor de jaarverslaggeving, Paragraph: 503"
346;"rj-i:GeneralExpenses";5;"            General expenses";"            Algemene kosten";"";"GeneralExpenses";"rj-i";"GeneralExpenses";"http://www.nltaxonomie.nl/10.0/basis/rj/items/rj-data#GeneralExpenses";"xbrli:item";1;0;0;;"0";"0";"0";"0";"xbrli:monetaryItemType";"monetary";"xbrli:monetaryItemType";"Monetary";"0";;;;;;;;;;;;"Duration";"Debit";0;0;"";"";"";"De algemene kosten die gedurende het boekjaar zijn betaald.";"Chapter: 270, IssueDate: 2015-01-01, Name: Richtlijnen voor de jaarverslaggeving, Paragraph: 503"
347;"rj-i:OperationalExpenses";5;"            Operational expenses";"            Exploitatiekosten";"";"OperationalExpenses";"rj-i";"OperationalExpenses";"http://www.nltaxonomie.nl/10.0/basis/rj/items/rj-data#OperationalExpenses";"xbrli:item";1;0;0;;"0";"0";"0";"0";"xbrli:monetaryItemType";"monetary";"xbrli:monetaryItemType";"Monetary";"0";;;;;;;;;;;;"Duration";"Debit";0;0;"";"";"";"Het totaalbedrag aan exploitatiekosten van het jaar waarover gerapporteerd wordt.";"Chapter: 270, IssueDate: 2015-01-01, Name: Richtlijnen voor de jaarverslaggeving, Paragraph: 503"
348;"venj-bw2-i:ForeignCurrencyExchangeRateResults";5;"            Foreign currency exchange rate results";"            Valutakoersverschillen";"";"ForeignCurrencyExchangeRateResults";"venj-bw2-i";"ForeignCurrencyExchangeRateResults";"http://www.nltaxonomie.nl/10.0/basis/venj/items/venj-bw2-data#ForeignCurrencyExchangeRateResults";"xbrli:item";1;0;0;;"0";"0";"0";"0";"nl-types:monetaryNoDecimalsItemType";"monetaryNoDecimals";"nl-types:monetary20ItemType";"Monetary";"0";"";"";"0";"";"";"";"";"";"";"";"";"Duration";"Debit";0;0;"";"";"";"De kosten die zijn ontstaan als gevolg van koersverschillen.";"Chapter: 122, IssueDate: 2015-01-01, Name: Richtlijnen voor de jaarverslaggeving, Paragraph: 503, Subparagraph: a"
349;"bank:ExpensesResearchAndDevelopment";5;"            Expenses research and development";"            Kosten onderzoek en ontwikkeling";"";"ExpensesResearchAndDevelopment";"bank";"ExpensesResearchAndDevelopment";"https://www.sbrbanken.nl/BT2016/basis/bank/items/bank#ExpensesResearchAndDevelopment";"xbrli:item";1;0;0;;"0";"0";"0";"0";"nl-types:monetaryNoDecimalsItemType";"monetaryNoDecimals";"nl-types:monetary20ItemType";"Monetary";"0";"";"";"0";"";"";"";"";"";"";"";"";"Duration";"Debit";0;0;"";"Het totaalbedrag aan kosten voor onderzoek en ontwikkeling van het jaar waarover gerapporteerd wordt.";"";"Het totaalbedrag aan kosten voor onderzoek en ontwikkeling van het jaar waarover gerapporteerd wordt.";""
350;"bank:FranchiseFee";5;"            Franchise fee";"            Franchisefee";"";"FranchiseFee";"bank";"FranchiseFee";"https://www.sbrbanken.nl/BT2016/basis/bank/items/bank#FranchiseFee";"xbrli:item";1;0;0;;"0";"0";"0";"0";"nl-types:monetaryNoDecimalsItemType";"monetaryNoDecimals";"nl-types:monetary20ItemType";"Monetary";"0";"";"";"0";"";"";"";"";"";"";"";"";"Duration";"Debit";0;0;"";"De vergoeding die de franchisenemer betaalt aan de franchisegever voor het gebruik van de formule.";"";"De vergoeding voor het gebruik van de door de franchisegever ontwikkelde/beschikbaar gestelde formule.";""
351;"bank:ManagementFee";5;"            Management fee";"            Managementfee";"";"ManagementFee";"bank";"ManagementFee";"https://www.sbrbanken.nl/BT2016/basis/bank/items/bank#ManagementFee";"xbrli:item";1;0;0;;"0";"0";"0";"0";"nl-types:monetaryNoDecimalsItemType";"monetaryNoDecimals";"nl-types:monetary20ItemType";"Monetary";"0";"";"";"0";"";"";"";"";"";"";"";"";"Duration";"Debit";0;0;"";"De vergoeding voor het ""ter beschikking stellen"" van de directeur, administratieve ondersteuning etc.";"";"Vergoeding vanuit de onderneming (vaak een werkmaatschappij) aan het management (van de holding).";""
352;"bank:CostOther";5;"            Cost other";"            Andere kosten";"";"CostOther";"bank";"CostOther";"https://www.sbrbanken.nl/BT2016/basis/bank/items/bank#CostOther";"xbrli:item";1;0;0;;"0";"0";"0";"0";"nl-types:monetaryNoDecimalsItemType";"monetaryNoDecimals";"nl-types:monetary20ItemType";"Monetary";"0";"";"";"0";"";"";"";"";"";"";"";"";"Duration";"Debit";0;0;"";"Andere (of overige) bedrijfskosten.";"";"Andere (of overige) bedrijfskosten die nog niet op een andere plek zijn opgevoerd.";""
353;"venj-bw2-i:ResultBeforeTaxOrdinaryActivitiesDisclosure";2;"   Result from ordinary activities before tax, disclosure";"   Resultaat uit gewone bedrijfsuitoefening voor belastingen, toelichting";"";"ResultBeforeTaxOrdinaryActivitiesDisclosure";"venj-bw2-i";"ResultBeforeTaxOrdinaryActivitiesDisclosure";"http://www.nltaxonomie.nl/10.0/basis/venj/items/venj-bw2-data#ResultBeforeTaxOrdinaryActivitiesDisclosure";"xbrli:item";1;0;0;;"0";"0";"0";"0";"xbrli:stringItemType";"string";"xbrli:stringItemType";"String";"0";;;;;;;;;;;;"Duration";"None";0;0;"";"";"";"De toelichting op het resultaat uit gewone bedrijfsuitoefening voor belastingen.";"Article: 362, IssueDate: 2015-01-01, Name: Burgerlijk wetboek boek 2, Paragraph: 3"
354;"kvk-abstr:FinancialIncomeExpensesDisclosureTitle";3;"      Financial income and expense, disclosure";"      Financiële baten en lasten, toelichting";"";"FinancialIncomeExpensesDisclosureTitle";"kvk-abstr";"FinancialIncomeExpensesDisclosureTitle";"http://www.nltaxonomie.nl/10.0/report/kvk/abstracts/kvk-abstracts#FinancialIncomeExpensesDisclosureTitle";"sbr:presentationItem";1;0;0;;"0";"0";"0";"0";"xbrli:stringItemType";"string";"xbrli:stringItemType";"Abstract";"0";;;;;;;;;;;;"Duration";"None";1;0;"";"";"";"";""
355;"venj-bw2-i:InterestIncomeRelatedIncomeDisclosure";4;"         Other interest income and related income, disclosure";"         Andere rentebaten en soortgelijke opbrengsten, toelichting";"";"InterestIncomeRelatedIncomeDisclosure";"venj-bw2-i";"InterestIncomeRelatedIncomeDisclosure";"http://www.nltaxonomie.nl/10.0/basis/venj/items/venj-bw2-data#InterestIncomeRelatedIncomeDisclosure";"xbrli:item";1;0;0;;"0";"0";"0";"0";"xbrli:stringItemType";"string";"xbrli:stringItemType";"String";"0";;;;;;;;;;;;"Duration";"None";0;0;"";"";"";"De toelichting op de rentebaten en soortgelijke opbrengsten.";"Article: 362, IssueDate: 2015-01-01, Name: Burgerlijk wetboek boek 2, Paragraph: 3|Chapter: 300, IssueDate: 2015-01-01, Name: Richtlijnen voor de jaarverslaggeving, Paragraph: 106|Chapter: B18, IssueDate: 2015-01-01, Name: Richtlijnen voor de jaarverslaggeving voor kleine rechtspersonen, Paragraph: 105"
356;"venj-bw2-i:InterestExpensesRelatedExpensesDisclosure";4;"         Interest expenses and related expenses, disclosure";"         Rentelasten en soortgelijke kosten, toelichting";"";"InterestExpensesRelatedExpensesDisclosure";"venj-bw2-i";"InterestExpensesRelatedExpensesDisclosure";"http://www.nltaxonomie.nl/10.0/basis/venj/items/venj-bw2-data#InterestExpensesRelatedExpensesDisclosure";"xbrli:item";1;0;0;;"0";"0";"0";"0";"xbrli:stringItemType";"string";"xbrli:stringItemType";"String";"0";;;;;;;;;;;;"Duration";"None";0;0;"";"";"";"De toelichting op de rentelasten en soortgelijke kosten.";"Article: 362, IssueDate: 2015-01-01, Name: Burgerlijk wetboek boek 2, Paragraph: 3|Chapter: 273, IssueDate: 2015-01-01, Name: Richtlijnen voor de jaarverslaggeving, Paragraph: 302|Chapter: 300, IssueDate: 2015-01-01, Name: Richtlijnen voor de jaarverslaggeving, Paragraph: 106|Chapter: B18, IssueDate: 2015-01-01, Name: Richtlijnen voor de jaarverslaggeving voor kleine rechtspersonen, Paragraph: 105"
357;"venj-bw2-i:IncomeTaxExpenseOrdinaryActivitiesDisclosure";2;"   Income tax expense from ordinary activities, disclosure";"   Belastingen resultaat uit gewone bedrijfsuitoefening, toelichting";"";"IncomeTaxExpenseOrdinaryActivitiesDisclosure";"venj-bw2-i";"IncomeTaxExpenseOrdinaryActivitiesDisclosure";"http://www.nltaxonomie.nl/10.0/basis/venj/items/venj-bw2-data#IncomeTaxExpenseOrdinaryActivitiesDisclosure";"xbrli:item";1;0;0;;"0";"0";"0";"0";"xbrli:stringItemType";"string";"xbrli:stringItemType";"String";"0";;;;;;;;;;;;"Duration";"None";0;0;"";"";"";"";"Article: 362, IssueDate: 2015-01-01, Name: Burgerlijk wetboek boek 2, Paragraph: 3"
358;"venj-bw2-i:ResultAttributableNoncontrollingInterestDisclosure";2;"   Result attributable to non-controlling interest, disclosure";"   Resultaat aandeel van derden, toelichting";"";"ResultAttributableNoncontrollingInterestDisclosure";"venj-bw2-i";"ResultAttributableNoncontrollingInterestDisclosure";"http://www.nltaxonomie.nl/10.0/basis/venj/items/venj-bw2-data#ResultAttributableNoncontrollingInterestDisclosure";"xbrli:item";1;0;0;;"0";"0";"0";"0";"xbrli:stringItemType";"string";"xbrli:stringItemType";"String";"0";;;;;;;;;;;;"Duration";"None";0;0;"";"";"";"De toelichting op het resultaat aandeel van derden.";"Article: 362, IssueDate: 2015-01-01, Name: Burgerlijk wetboek boek 2, Paragraph: 3"
359;"venj-bw2-i:ResultAfterTaxDisclosure";2;"   Result after tax, disclosure";"   Resultaat na belastingen, toelichting";"";"ResultAfterTaxDisclosure";"venj-bw2-i";"ResultAfterTaxDisclosure";"http://www.nltaxonomie.nl/10.0/basis/venj/items/venj-bw2-data#ResultAfterTaxDisclosure";"xbrli:item";1;0;0;;"0";"0";"0";"0";"xbrli:stringItemType";"string";"xbrli:stringItemType";"String";"0";;;;;;;;;;;;"Duration";"None";0;0;"";"";"";"";"Article: 362, IssueDate: 2015-01-01, Name: Burgerlijk wetboek boek 2, Paragraph: 3"
360;"bank-abstracts:DisclosuresOtherTitle";1;"Disclosures other title";"Overige toelichtingen";"";"DisclosuresOtherTitle";"bank-abstracts";"DisclosuresOtherTitle";"https://www.sbrbanken.nl/BT2016/report/bank/abstracts/bank-abstracts#DisclosuresOtherTitle";"xbrli:item";1;0;0;;"0";"0";"0";"0";"xbrli:stringItemType";"string";"xbrli:stringItemType";"Abstract";"0";;;;;;;;;;;;"Duration";"None";1;0;"";"";"";"";""
361;"venj-bw2-i:DeviationsRegulationsBasedTrueAndFairViewDisclosure";2;"   Deviations from regulations based on true and fair view requirements, disclosure";"   Afwijkingen van de voorschriften op basis van het inzichtvereiste, toelichting";"";"DeviationsRegulationsBasedTrueAndFairViewDisclosure";"venj-bw2-i";"DeviationsRegulationsBasedTrueAndFairViewDisclosure";"http://www.nltaxonomie.nl/10.0/basis/venj/items/venj-bw2-data#DeviationsRegulationsBasedTrueAndFairViewDisclosure";"xbrli:item";1;0;0;;"0";"0";"0";"0";"xbrli:stringItemType";"string";"xbrli:stringItemType";"String";"0";;;;;;;;;;;;"Duration";"None";0;0;"";"";"";"Indien het noodzakelijk is voor het verschaffen van inzicht, wijkt de rechtspersoon van deze voorschriften af. De reden van de afwijking moet in een toelichting worden uiteengezet.";"Article: 362, IssueDate: 2015-01-01, Name: Burgerlijk wetboek boek 2, Paragraph: 4|Chapter: 110, IssueDate: 2015-01-01, Name: Richtlijnen voor de jaarverslaggeving, Paragraph: 106"
362;"kvk-abstr:AverageNumberEmployeesDisclosureTitle";2;"   Average number of employees during the period, disclosure";"   Gemiddeld aantal werknemers, toelichting";"urn:bank:preflabel:label";"AverageNumberEmployeesDisclosureTitle";"kvk-abstr";"AverageNumberEmployeesDisclosureTitle";"http://www.nltaxonomie.nl/10.0/report/kvk/abstracts/kvk-abstracts#AverageNumberEmployeesDisclosureTitle";"sbr:presentationItem";1;0;0;;"0";"0";"0";"0";"xbrli:stringItemType";"string";"xbrli:stringItemType";"Abstract";"0";;;;;;;;;;;;"Duration";"None";1;0;"";"";"";"";""
363;"venj-bw2-i:AverageNumberEmployeesDisclosure";3;"      Average number of employees during the period, disclosure";"      Gemiddeld aantal werknemers over de periode, toelichting";"";"AverageNumberEmployeesDisclosure";"venj-bw2-i";"AverageNumberEmployeesDisclosure";"http://www.nltaxonomie.nl/10.0/basis/venj/items/venj-bw2-data#AverageNumberEmployeesDisclosure";"xbrli:item";1;0;0;;"0";"0";"0";"0";"xbrli:stringItemType";"string";"xbrli:stringItemType";"String";"0";;;;;;;;;;;;"Duration";"None";0;0;"";"";"";"Nadere toelichting op het gemiddelde aantal werknemers in dienst bij de onderneming gedurende de rapportageperiode.";"Article: 382, IssueDate: 2015-01-01, Name: Burgerlijk wetboek boek 2"
364;"venj-bw2-i:AverageNumberEmployees";3;"      Average number of employees during the period, total";"      Gemiddeld aantal werknemers over de periode, totaal";"urn:bank:preflabel:label";"AverageNumberEmployees";"venj-bw2-i";"AverageNumberEmployees";"http://www.nltaxonomie.nl/10.0/basis/venj/items/venj-bw2-data#AverageNumberEmployees";"xbrli:item";1;0;0;;"0";"0";"0";"0";"venj-types:nonNegativeDecimalItemType";"nonNegativeDecimal";"xbrli:decimalItemType";"Number";"0";"";"";"";"";"";"";"";"0";"";"";"";"Duration";"None";0;0;"";"";"";"Het gemiddelde aantal werknemers in dienst bij de onderneming gedurende de rapportageperiode.";"Article: 382, IssueDate: 2015-01-01, Name: Burgerlijk wetboek boek 2"
365;"venj-bw2-i:AverageNumberEmployeesNetherlands";4;"         Average number of employees during the period, active within the Netherlands";"         Gemiddeld aantal werknemers over de periode, werkzaam binnen Nederland";"";"AverageNumberEmployeesNetherlands";"venj-bw2-i";"AverageNumberEmployeesNetherlands";"http://www.nltaxonomie.nl/10.0/basis/venj/items/venj-bw2-data#AverageNumberEmployeesNetherlands";"xbrli:item";1;0;0;;"0";"0";"0";"0";"venj-types:nonNegativeDecimalItemType";"nonNegativeDecimal";"xbrli:decimalItemType";"Number";"0";"";"";"";"";"";"";"";"0";"";"";"";"Duration";"None";0;0;"";"";"";"Het gemiddelde aantal werknemers in dienst bij de onderneming gedurende de rapportageperiode, die werkzaam zijn in Nederland.";"Article: 382, IssueDate: 2015-01-01, Name: Burgerlijk wetboek boek 2"
366;"venj-bw2-i:AverageNumberEmployeesAbroad";4;"         Average number of employees during the period, active outside the Netherlands";"         Gemiddeld aantal werknemers over de periode, werkzaam buiten Nederland";"";"AverageNumberEmployeesAbroad";"venj-bw2-i";"AverageNumberEmployeesAbroad";"http://www.nltaxonomie.nl/10.0/basis/venj/items/venj-bw2-data#AverageNumberEmployeesAbroad";"xbrli:item";1;0;0;;"0";"0";"0";"0";"venj-types:nonNegativeDecimalItemType";"nonNegativeDecimal";"xbrli:decimalItemType";"Number";"0";"";"";"";"";"";"";"";"0";"";"";"";"Duration";"None";0;0;"";"";"";"Het gemiddelde aantal werknemers in dienst bij de onderneming gedurende de rapportageperiode, die werkzaam zijn buiten Nederland.";"Article: 382, IssueDate: 2015-01-01, Name: Burgerlijk wetboek boek 2|Chapter: B18, IssueDate: 2015-01-01, Name: Richtlijnen voor de jaarverslaggeving voor kleine rechtspersonen, Paragraph: 105"
367;"bank-abstracts:InformationOtherTitle";1;"Information other title";"Overige gegevens";"";"InformationOtherTitle";"bank-abstracts";"InformationOtherTitle";"https://www.sbrbanken.nl/BT2016/report/bank/abstracts/bank-abstracts#InformationOtherTitle";"xbrli:item";1;0;0;;"0";"0";"0";"0";"xbrli:stringItemType";"string";"xbrli:stringItemType";"Abstract";"0";;;;;;;;;;;;"Duration";"None";1;0;"";"";"";"";""
368;"bank-abstracts:IntermediaryReportTitle";2;"   Intermediary report title";"   Toelichting intermediair";"";"IntermediaryReportTitle";"bank-abstracts";"IntermediaryReportTitle";"https://www.sbrbanken.nl/BT2016/report/bank/abstracts/bank-abstracts#IntermediaryReportTitle";"xbrli:item";1;0;0;;"0";"0";"0";"0";"xbrli:stringItemType";"string";"xbrli:stringItemType";"Abstract";"0";;;;;;;;;;;;"Duration";"None";1;0;"";"";"";"";""
369;"bank-cd:IntermediaryReportType";3;"      Report type";"      Type toelichting";"http://www.xbrl.org/2003/role/terseLabel";"IntermediaryReportType";"bank-cd";"IntermediaryReportType";"https://www.sbrbanken.nl/BT2016/basis/bank/items/bank-common-data#IntermediaryReportType";"xbrli:item";1;0;0;;"0";"0";"0";"0";"bank-codes:IntermediaryReportTypeItemType";"IntermediaryReportType";"xbrli:stringItemType";"Enumeration";"0";"";"Controle|Beoordeling|Samenstel|Overig";"";"";"";"";"";"";"";"";"";"Duration";"None";0;0;"";"Het type toelichting dat door de intermediair wordt gegeven bij deze rapportage.";"";"Het type toelichting dat door de intermediair wordt gegeven bij deze rapportage.";""
370;"bank-cd:IntermediaryReport";3;"      Intermediary report";"      Toelichting intermediair";"";"IntermediaryReport";"bank-cd";"IntermediaryReport";"https://www.sbrbanken.nl/BT2016/basis/bank/items/bank-common-data#IntermediaryReport";"xbrli:item";1;0;0;;"0";"0";"0";"0";"xbrli:stringItemType";"string";"xbrli:stringItemType";"String";"0";;;;;;;;;;;;"Duration";"None";0;0;"";"De nadere toelichting van de intermediair op de rapportage.";"";"De nadere toelichting van de intermediair op de rapportage.";""
371;"bank-agro-tuples:AgricultureSpecification";1;"Agriculture specification";"Land- en tuinbouw";"";"AgricultureSpecification";"bank-agro-tuples";"AgricultureSpecification";"https://www.sbrbanken.nl/BT2016/domein/bank/tuples/bank-agro-tuples#AgricultureSpecification";"xbrli:tuple";1;1;0;;"0";"0";"0";"-1";"";"";"";"Abstract";"0";;;;;;;;;;;;"Other";"None";0;0;"";"";"";"";""
372;"bank-agro-abstracts:CommonDataTitle";2;"   Common data title";"   Algemene gegevens";"";"CommonDataTitle";"bank-agro-abstracts";"CommonDataTitle";"https://www.sbrbanken.nl/BT2016/report/bank/abstracts/bank-agro-abstracts#CommonDataTitle";"xbrli:item";2;0;0;"bank-agro-tuples:AgricultureSpecification";"1";"0";"0";"0";"xbrli:stringItemType";"string";"xbrli:stringItemType";"Abstract";"0";;;;;;;;;;;;"Duration";"None";1;0;"";"";"";"";""
373;"bank-agro:AgricultureType";3;"      Agriculture type";"      Land- en tuinbouwtype";"";"AgricultureType";"bank-agro";"AgricultureType";"https://www.sbrbanken.nl/BT2016/basis/bank/items/bank-agro#AgricultureType";"xbrli:item";1;0;0;"bank-agro-tuples:AgricultureSpecification";"1";"0";"0";"0";"bank-codes:AgricultureItemType";"Agriculture";"xbrli:stringItemType";"Enumeration";"0";"";"Akkerbouw|Bloembollenteelt|Champignon- en andere paddenstoelenteelt|Fruitteelt|Potplanten- en bomenteelt";"";"";"";"";"";"";"";"";"";"Duration";"None";0;0;"";"Het type land- en tuinbouw dat doorde rapporterende onderneming wordt uitgevoerd.";"";"Het type land- en tuinbouw dat doorde rapporterende onderneming wordt uitgevoerd.";""
374;"bank-agro:UtilisedFarmlandOwnProperty";3;"      Utilised farmland own property";"      Bouwgrond in eigendom";"";"UtilisedFarmlandOwnProperty";"bank-agro";"UtilisedFarmlandOwnProperty";"https://www.sbrbanken.nl/BT2016/basis/bank/items/bank-agro#UtilisedFarmlandOwnProperty";"xbrli:item";2;0;0;"bank-agro-tuples:AgricultureSpecification";"1";"0";"0";"0";"xbrli:integerItemType";"integer";"xbrli:integerItemType";"Number";"0";;;;;;;;;;;;"Duration";"None";0;0;"";"De totale oppervlakte bouwgrond in eigendom, die gedurende de rapportageperiode ten dienste is geweest aan de exploitatie (m²) ten behoeve van de uitoefening van de gespecificeerde veeteelt of de land- en tuinbouw.";"";"De totale oppervlakte bouwgrond in eigendom, die gedurende de rapportageperiode ten dienste is geweest aan de exploitatie (m²) ten behoeve van de uitoefening van de gespecificeerde veeteelt of de land- en tuinbouw.";""
