125;"bank:InvestmentPropertiesRevaluations";3;"      Revaluations of investment property";"      Waardeveranderingen van vastgoedbeleggingen";"";"InvestmentPropertiesRevaluations";"bank";"InvestmentPropertiesRevaluations";"https://www.sbrbanken.nl/BT2016/basis/bank/items/bank#InvestmentPropertiesRevaluations";"xbrli:item";1;0;0;;"0";"0";"0";"0";"nl-types:monetaryNoDecimalsItemType";"monetaryNoDecimals";"nl-types:monetary20ItemType";"Monetary";"0";"";"";"0";"";"";"";"";"";"";"";"";"Duration";"Debit";0;0;"";"Waardeveranderingen van vastgoedbeleggingen.";"";"Waardeveranderingen van vastgoedbeleggingen.";"Name: Richtlijnen voor de Jaarverslaggeving, Article: 213, Paragraph: 605|Name: Richtlijnen voor de Jaarverslaggeving, Article: 213, Paragraph: 803, Subparagraph: d|Name: Richtlijnen voor de Jaarverslaggeving voor kleine rechtspersonen, Article: B2, Paragraph: 213"
126;"venj-bw2-i:RevaluationReserveRelease";3;"      Release from revaluation reserve";"      Vrijval uit herwaarderingsreserve";"";"RevaluationReserveRelease";"venj-bw2-i";"RevaluationReserveRelease";"http://www.nltaxonomie.nl/10.0/basis/venj/items/venj-bw2-data#RevaluationReserveRelease";"xbrli:item";1;0;0;;"0";"0";"0";"0";"nl-types:monetaryNoDecimalsItemType";"monetaryNoDecimals";"nl-types:monetary20ItemType";"Monetary";"0";"";"";"0";"";"";"";"";"";"";"";"";"Duration";"Credit";0;0;"";"";"";"De verminderingen van de herwaarderingsreserve die ten gunste van de winst- en verliesrekening worden gebracht.";"Article: 390, IssueDate: 2015-01-01, Name: Burgerlijk wetboek boek 2, Paragraph: 4|Chapter: 220, IssueDate: 2015-01-01, Name: Richtlijnen voor de jaarverslaggeving, Paragraph: 504"
127;"venj-bw2-i:GovernmentGrants";3;"      Government grants";"      Overheidssubsidies";"";"GovernmentGrants";"venj-bw2-i";"GovernmentGrants";"http://www.nltaxonomie.nl/10.0/basis/venj/items/venj-bw2-data#GovernmentGrants";"xbrli:item";1;0;0;;"0";"0";"0";"0";"nl-types:monetaryNoDecimalsItemType";"monetaryNoDecimals";"nl-types:monetary20ItemType";"Monetary";"0";"";"";"0";"";"";"";"";"";"";"";"";"Duration";"Credit";0;0;"";"";"";"De subsidies van de overheid.";"Article: 3, IssueDate: 2015-01-01, Name: Besluit uitvoering publicatieverplichtingen richtlijn kapitaalvereisten"
128;"venj-bw2-i:InterestIncomeRelatedIncome";3;"      Other interest income and related income";"      Andere rentebaten en soortgelijke opbrengsten";"";"InterestIncomeRelatedIncome";"venj-bw2-i";"InterestIncomeRelatedIncome";"http://www.nltaxonomie.nl/10.0/basis/venj/items/venj-bw2-data#InterestIncomeRelatedIncome";"xbrli:item";1;0;0;;"0";"0";"0";"0";"nl-types:monetaryNoDecimalsItemType";"monetaryNoDecimals";"nl-types:monetary20ItemType";"Monetary";"0";"";"";"0";"";"";"";"";"";"";"";"";"Duration";"Credit";0;0;"";"";"";"Andere rentebaten en soortgelijke opbrengsten zijn opbrengsten die verkregen worden voor het ter beschikking stellen van een bepaalde geldlening, alsmede andere opbrengsten die daarmee verband houden.";"Article: 9, IssueDate: 2015-01-01, Name: Besluit jaarrekening banken|Article: 1, IssueDate: 2015-01-01, Name: Besluit modellen jaarrekening|Article: 377, IssueDate: 2015-01-01, Name: Burgerlijk wetboek boek 2, Paragraph: 3, Subparagraph: m|Article: 377, IssueDate: 2015-01-01, Name: Burgerlijk wetboek boek 2, Paragraph: 4, Subparagraph: i|Chapter: 270, IssueDate: 2015-01-01, Name: Richtlijnen voor de jaarverslaggeving, Paragraph: 124"
129;"venj-bw2-i:ChangesValueFinancialAssetsSecurities";3;"      Changes in value of financial assets and of securities";"      Waardeveranderingen van financiële vaste activa en van effecten";"";"ChangesValueFinancialAssetsSecurities";"venj-bw2-i";"ChangesValueFinancialAssetsSecurities";"http://www.nltaxonomie.nl/10.0/basis/venj/items/venj-bw2-data#ChangesValueFinancialAssetsSecurities";"xbrli:item";1;0;0;;"0";"0";"0";"0";"nl-types:monetaryNoDecimalsItemType";"monetaryNoDecimals";"nl-types:monetary20ItemType";"Monetary";"0";"";"";"0";"";"";"";"";"";"";"";"";"Duration";"Debit";0;0;"";"";"";"De waardeveranderingen van vorderingen die tot de vaste activa behoren en van effecten betreffen alle gerealiseerde en ongerealiseerde waardeveranderingen van vorderingen die tot de vaste activa behoren en van effecten. Dit zullen veelal  de waardeverminderingen op verstrekte langdurige leningen en de verschillen in waardering van de effecten zijn.";"Article: 1, IssueDate: 2015-01-01, Name: Besluit modellen jaarrekening|Article: 377, IssueDate: 2015-01-01, Name: Burgerlijk wetboek boek 2, Paragraph: 3, Subparagraph: n|Article: 377, IssueDate: 2015-01-01, Name: Burgerlijk wetboek boek 2, Paragraph: 4, Subparagraph: j|Article: 387, IssueDate: 2015-01-01, Name: Burgerlijk wetboek boek 2|Chapter: 645, IssueDate: 2015-01-01, Name: Richtlijnen voor de jaarverslaggeving, Paragraph: 501"
130;"venj-bw2-i:InterestExpensesRelatedExpenses";3;"      Interest expenses and related expenses";"      Rentelasten en soortgelijke kosten";"";"InterestExpensesRelatedExpenses";"venj-bw2-i";"InterestExpensesRelatedExpenses";"http://www.nltaxonomie.nl/10.0/basis/venj/items/venj-bw2-data#InterestExpensesRelatedExpenses";"xbrli:item";1;0;0;;"0";"0";"0";"0";"nl-types:monetaryNoDecimalsItemType";"monetaryNoDecimals";"nl-types:monetary20ItemType";"Monetary";"0";"";"";"0";"";"";"";"";"";"";"";"";"Duration";"Debit";0;0;"";"";"";"De kosten die dienen te worden vergoed voor het ter beschikking krijgen van een bepaalde geldlening, alsmede andere kosten die daarmee verband houden.";"Article: 9, IssueDate: 2015-01-01, Name: Besluit jaarrekening banken|Article: 1, IssueDate: 2015-01-01, Name: Besluit modellen jaarrekening|Article: 377, IssueDate: 2015-01-01, Name: Burgerlijk wetboek boek 2, Paragraph: 3, Subparagraph: o|Article: 377, IssueDate: 2015-01-01, Name: Burgerlijk wetboek boek 2, Paragraph: 4, Subparagraph: k|Chapter: 273, IssueDate: 2015-01-01, Name: Richtlijnen voor de jaarverslaggeving, Paragraph: 301|Chapter: B16, IssueDate: 2015-01-01, Name: Richtlijnen voor de jaarverslaggeving voor kleine rechtspersonen, Paragraph: 104"
131;"bank:ForeignCurrencyExchangeDifferences";3;"      Foreign currency exchange differences";"      Wisselkoersverschillen";"";"ForeignCurrencyExchangeDifferences";"bank";"ForeignCurrencyExchangeDifferences";"https://www.sbrbanken.nl/BT2016/basis/bank/items/bank#ForeignCurrencyExchangeDifferences";"xbrli:item";1;0;0;;"0";"0";"0";"0";"nl-types:monetaryNoDecimalsItemType";"monetaryNoDecimals";"nl-types:monetary20ItemType";"Monetary";"0";"";"";"0";"";"";"";"";"";"";"";"";"Duration";"Debit";0;0;"";"Wisselkoersverschillen.";"";"Wisselkoersverschillen.";"Name: Richtlijnen voor de Jaarverslaggeving, Article: 122, Paragraph: 503, Subparagraph: a"
132;"venj-bw2-i:ResultBeforeTaxOrdinaryActivities";3;"      Result from ordinary activities before tax";"      Resultaat uit gewone bedrijfsuitoefening voor belastingen";"";"ResultBeforeTaxOrdinaryActivities";"venj-bw2-i";"ResultBeforeTaxOrdinaryActivities";"http://www.nltaxonomie.nl/10.0/basis/venj/items/venj-bw2-data#ResultBeforeTaxOrdinaryActivities";"xbrli:item";1;0;0;;"0";"0";"0";"0";"nl-types:monetaryNoDecimalsItemType";"monetaryNoDecimals";"nl-types:monetary20ItemType";"Monetary";"0";"";"";"0";"";"";"";"";"";"";"";"";"Duration";"Credit";0;0;"";"";"";"Het saldo van de winst of het verlies dat voorkomt uit de productie of dienstverlening die de organisatie verzorgt voor de verwerking van de belastingen hierover.";"Article: 9, IssueDate: 2015-01-01, Name: Besluit jaarrekening banken|Article: 1, IssueDate: 2015-01-01, Name: Besluit modellen jaarrekening|Article: 377, IssueDate: 2015-01-01, Name: Burgerlijk wetboek boek 2, Paragraph: 1, Subparagraph: a|Chapter: 270, IssueDate: 2015-01-01, Name: Richtlijnen voor de jaarverslaggeving, Paragraph: 402"
133;"bank-abstracts:ResultAfterTaxTitle";2;"   Result after tax title";"   Resultaat na belastingen";"";"ResultAfterTaxTitle";"bank-abstracts";"ResultAfterTaxTitle";"https://www.sbrbanken.nl/BT2016/report/bank/abstracts/bank-abstracts#ResultAfterTaxTitle";"xbrli:item";1;0;0;;"0";"0";"0";"0";"xbrli:stringItemType";"string";"xbrli:stringItemType";"Abstract";"0";;;;;;;;;;;;"Duration";"None";1;0;"";"";"";"";""
134;"venj-bw2-i:IncomeTaxExpenseOrdinaryActivities";3;"      Income tax expense from ordinary activities";"      Belastingen resultaat uit gewone bedrijfsuitoefening";"";"IncomeTaxExpenseOrdinaryActivities";"venj-bw2-i";"IncomeTaxExpenseOrdinaryActivities";"http://www.nltaxonomie.nl/10.0/basis/venj/items/venj-bw2-data#IncomeTaxExpenseOrdinaryActivities";"xbrli:item";1;0;0;;"0";"0";"0";"0";"nl-types:monetaryNoDecimalsItemType";"monetaryNoDecimals";"nl-types:monetary20ItemType";"Monetary";"0";"";"";"0";"";"";"";"";"";"";"";"";"Duration";"Debit";0;0;"";"";"";"Bedrag aan belasting dat wordt geheven van de onderneming over het resultaat dat behaald wordt uit gewone bedrijfsuitoefening door deel te nemen aan het economisch verkeer.";"Article: 9, IssueDate: 2015-01-01, Name: Besluit jaarrekening banken|Article: 1, IssueDate: 2015-01-01, Name: Besluit modellen jaarrekening|Article: 377, IssueDate: 2015-01-01, Name: Burgerlijk wetboek boek 2, Paragraph: 1, Subparagraph: a|Article: 437, IssueDate: 2015-01-01, Name: Burgerlijk wetboek boek 2|Chapter: 270, IssueDate: 2015-01-01, Name: Richtlijnen voor de jaarverslaggeving, Paragraph: 402|Chapter: 272, IssueDate: 2015-01-01, Name: Richtlijnen voor de jaarverslaggeving, Paragraph: 608|Chapter: B15, IssueDate: 2015-01-01, Name: Richtlijnen voor de jaarverslaggeving voor kleine rechtspersonen, Paragraph: 101|Chapter: B15, IssueDate: 2015-01-01, Name: Richtlijnen voor de jaarverslaggeving voor kleine rechtspersonen, Paragraph: 119"
135;"venj-bw2-i:ShareInResultsParticipatingInterests";3;"      Share in results of participating interests";"      Aandeel in winst (verlies) van ondernemingen waarin wordt deelgenomen";"";"ShareInResultsParticipatingInterests";"venj-bw2-i";"ShareInResultsParticipatingInterests";"http://www.nltaxonomie.nl/10.0/basis/venj/items/venj-bw2-data#ShareInResultsParticipatingInterests";"xbrli:item";1;0;0;;"0";"0";"0";"0";"nl-types:monetaryNoDecimalsItemType";"monetaryNoDecimals";"nl-types:monetary20ItemType";"Monetary";"0";"";"";"0";"";"";"";"";"";"";"";"";"Duration";"Credit";0;0;"";"";"";"Het deel van het resultaat van een deelneming dat direct of indirect aan de onderneming toekomt.";"Article: 16, IssueDate: 2015-01-01, Name: Besluit modellen jaarrekening|Article: 1, IssueDate: 2015-01-01, Name: Besluit modellen jaarrekening|Article: 6, IssueDate: 2015-01-01, Name: Besluit modellen jaarrekening|Article: 377, IssueDate: 2015-01-01, Name: Burgerlijk wetboek boek 2, Paragraph: 3, Subparagraph: k|Article: 377, IssueDate: 2015-01-01, Name: Burgerlijk wetboek boek 2, Paragraph: 4, Subparagraph: g|Article: 402, IssueDate: 2015-01-01, Name: Burgerlijk wetboek boek 2"
136;"venj-bw2-i:ResultAfterTax";3;"      Result after tax";"      Resultaat na belastingen";"";"ResultAfterTax";"venj-bw2-i";"ResultAfterTax";"http://www.nltaxonomie.nl/10.0/basis/venj/items/venj-bw2-data#ResultAfterTax";"xbrli:item";1;0;0;;"0";"0";"0";"0";"nl-types:monetaryNoDecimalsItemType";"monetaryNoDecimals";"nl-types:monetary20ItemType";"Monetary";"0";"";"";"0";"";"";"";"";"";"";"";"";"Duration";"Credit";0;0;"";"";"";"Het resultaat na verwerking van alle lasten, na aftrek van de berekende belastingen.";"Article: 9, IssueDate: 2015-01-01, Name: Besluit jaarrekening banken|Article: 1, IssueDate: 2015-01-01, Name: Besluit modellen jaarrekening|Article: 377, IssueDate: 2015-01-01, Name: Burgerlijk wetboek boek 2, Paragraph: 1, Subparagraph: d|Article: 437, IssueDate: 2015-01-01, Name: Burgerlijk wetboek boek 2|Chapter: 270, IssueDate: 2015-01-01, Name: Richtlijnen voor de jaarverslaggeving, Paragraph: 402|Chapter: B15, IssueDate: 2015-01-01, Name: Richtlijnen voor de jaarverslaggeving voor kleine rechtspersonen, Paragraph: 101"
137;"venj-bw2-i:ResultAttributableNoncontrollingInterest";2;"   Result attributable to non-controlling interest";"   Resultaat aandeel van derden";"";"ResultAttributableNoncontrollingInterest";"venj-bw2-i";"ResultAttributableNoncontrollingInterest";"http://www.nltaxonomie.nl/10.0/basis/venj/items/venj-bw2-data#ResultAttributableNoncontrollingInterest";"xbrli:item";1;0;0;;"0";"0";"0";"0";"nl-types:monetaryNoDecimalsItemType";"monetaryNoDecimals";"nl-types:monetary20ItemType";"Monetary";"0";"";"";"0";"";"";"";"";"";"";"";"";"Duration";"Credit";0;0;"";"";"";"Het deel van het nettoresultaat van een geconsolideerde entiteit dat niet direct of indirect aan de onderneming toekomt, maar aan derden toerekenbaar is.";"Article: 10, IssueDate: 2015-01-01, Name: Besluit modellen jaarrekening, Paragraph: 3|Article: 411, IssueDate: 2015-01-01, Name: Burgerlijk wetboek boek 2, Paragraph: 2|Chapter: 240, IssueDate: 2015-01-01, Name: Richtlijnen voor de jaarverslaggeving, Paragraph: 301"
138;"venj-bw2-i:NetResultAfterTax";2;"   Net result after tax";"   Nettoresultaat na belastingen";"";"NetResultAfterTax";"venj-bw2-i";"NetResultAfterTax";"http://www.nltaxonomie.nl/10.0/basis/venj/items/venj-bw2-data#NetResultAfterTax";"xbrli:item";1;0;0;;"0";"0";"0";"0";"nl-types:monetaryNoDecimalsItemType";"monetaryNoDecimals";"nl-types:monetary20ItemType";"Monetary";"0";"";"";"0";"";"";"";"";"";"";"";"";"Duration";"Credit";0;0;"";"";"";"Het resultaat dat overblijft na aftrek van alle kosten en na betaling van belasting.";"Article: 10, IssueDate: 2015-01-01, Name: Besluit modellen jaarrekening, Paragraph: 1|Article: 411, IssueDate: 2015-01-01, Name: Burgerlijk wetboek boek 2, Paragraph: 2|Chapter: 265, IssueDate: 2015-01-01, Name: Richtlijnen voor de jaarverslaggeving, Paragraph: 201"
139;"bank-abstracts:GeneralDisclosureTitle";1;"General disclosure title";"Algemene toelichting";"";"GeneralDisclosureTitle";"bank-abstracts";"GeneralDisclosureTitle";"https://www.sbrbanken.nl/BT2016/report/bank/abstracts/bank-abstracts#GeneralDisclosureTitle";"xbrli:item";1;0;0;;"0";"0";"0";"0";"xbrli:stringItemType";"string";"xbrli:stringItemType";"Abstract";"0";;;;;;;;;;;;"Duration";"None";1;0;"";"";"";"";""
140;"kvk-abstr:GoingConcernTitle";2;"   Going concern";"   Informatie met betrekking tot de continuïteit";"urn:bank:preflabel:label";"GoingConcernTitle";"kvk-abstr";"GoingConcernTitle";"http://www.nltaxonomie.nl/10.0/report/kvk/abstracts/kvk-abstracts#GoingConcernTitle";"sbr:presentationItem";1;0;0;;"0";"0";"0";"0";"xbrli:stringItemType";"string";"xbrli:stringItemType";"Abstract";"0";;;;;;;;;;;;"Duration";"None";1;0;"";"";"";"";""
141;"venj-bw2-i:GoingConcernDisclosure";3;"      Going concern, disclosure";"      Continuïteit, toelichting";"";"GoingConcernDisclosure";"venj-bw2-i";"GoingConcernDisclosure";"http://www.nltaxonomie.nl/10.0/basis/venj/items/venj-bw2-data#GoingConcernDisclosure";"xbrli:item";1;0;0;;"0";"0";"0";"0";"xbrli:stringItemType";"string";"xbrli:stringItemType";"String";"0";;;;;;;;;;;;"Duration";"None";0;0;"";"";"";"Een nadere toelichting op de continuïteit van de onderneming.";"Article: 384, IssueDate: 2015-01-01, Name: Burgerlijk wetboek boek 2, Paragraph: 3|Chapter: 170, IssueDate: 2015-01-01, Name: Richtlijnen voor de jaarverslaggeving, Paragraph: 101|Chapter: 170, IssueDate: 2015-01-01, Name: Richtlijnen voor de jaarverslaggeving|Chapter: A2, IssueDate: 2015-01-01, Name: Richtlijnen voor de jaarverslaggeving voor kleine rechtspersonen, Paragraph: 211"
142;"venj-bw2-i:GoingConcernUncertaintiesEntitysAbilityToContinueAsGoingConcern";3;"      Going concern, uncertainties of entity's ability to continue as going concern";"      Continuïteit, ernstige onzekerheden omtrent de continuïteit van de organisatie";"";"GoingConcernUncertaintiesEntitysAbilityToContinueAsGoingConcern";"venj-bw2-i";"GoingConcernUncertaintiesEntitysAbilityToContinueAsGoingConcern";"http://www.nltaxonomie.nl/10.0/basis/venj/items/venj-bw2-data#GoingConcernUncertaintiesEntitysAbilityToContinueAsGoingConcern";"xbrli:item";1;0;0;;"0";"0";"0";"0";"xbrli:stringItemType";"string";"xbrli:stringItemType";"String";"0";;;;;;;;;;;;"Duration";"None";0;0;"";"";"";"Een nadere toelichting waarom er sprake is van ernstige onzekerheden omtrent de continuïteit van de organisatie.";"Article: 384, IssueDate: 2015-01-01, Name: Burgerlijk wetboek boek 2, Paragraph: 3|Chapter: 170, IssueDate: 2015-01-01, Name: Richtlijnen voor de jaarverslaggeving, Paragraph: 305|Chapter: A2, IssueDate: 2015-01-01, Name: Richtlijnen voor de jaarverslaggeving voor kleine rechtspersonen, Paragraph: 214|Chapter: B8, IssueDate: 2015-01-01, Name: Richtlijnen voor de jaarverslaggeving voor kleine rechtspersonen, Paragraph: 131"
143;"venj-bw2-i:GoingConcernBasisForPreparationFinancialStatementsWhenNotGoingConcernBasis";3;"      Going concern, basis for preparation of financial statements when not going concern basis";"      Continuïteit, grondslag van waardering wanneer dit niet op continuïteitsbasis is";"";"GoingConcernBasisForPreparationFinancialStatementsWhenNotGoingConcernBasis";"venj-bw2-i";"GoingConcernBasisForPreparationFinancialStatementsWhenNotGoingConcernBasis";"http://www.nltaxonomie.nl/10.0/basis/venj/items/venj-bw2-data#GoingConcernBasisForPreparationFinancialStatementsWhenNotGoingConcernBasis";"xbrli:item";1;0;0;;"0";"0";"0";"0";"xbrli:stringItemType";"string";"xbrli:stringItemType";"String";"0";;;;;;;;;;;;"Duration";"None";0;0;"";"";"";"Bij de waardering van de activa en passiva wordt verondersteld dat de onderneming wordt voortgezet (gecontinueerd). Indien deze veronderstelling onjuist is of aan de continuïteit van de onderneming wordt getwijfeld dan wordt hier vermeld welke grondslag is gehanteerd voor de waardering van de onderneming.";"Article: 384, IssueDate: 2015-01-01, Name: Burgerlijk wetboek boek 2, Paragraph: 3|Chapter: 170, IssueDate: 2015-01-01, Name: Richtlijnen voor de jaarverslaggeving, Paragraph: 201|Chapter: A2, IssueDate: 2015-01-01, Name: Richtlijnen voor de jaarverslaggeving voor kleine rechtspersonen, Paragraph: 213"
144;"venj-bw2-i:GoingConcernEffectNotGoingConcernBasisOnEquityAndResults";3;"      Going concern, effect of not applying going concern basis on equity and results";"      Continuïteit, invloed van het niet waarderen op continuïteitsbasis op het vermogen en resultaat";"";"GoingConcernEffectNotGoingConcernBasisOnEquityAndResults";"venj-bw2-i";"GoingConcernEffectNotGoingConcernBasisOnEquityAndResults";"http://www.nltaxonomie.nl/10.0/basis/venj/items/venj-bw2-data#GoingConcernEffectNotGoingConcernBasisOnEquityAndResults";"xbrli:item";1;0;0;;"0";"0";"0";"0";"xbrli:stringItemType";"string";"xbrli:stringItemType";"String";"0";;;;;;;;;;;;"Duration";"None";0;0;"";"";"";"Een nadere toelichting van de invloed van het niet waarderen op continuïteitsbasis op het vermogen en resultaat.";"Article: 384, IssueDate: 2015-01-01, Name: Burgerlijk wetboek boek 2, Paragraph: 3|Chapter: 170, IssueDate: 2015-01-01, Name: Richtlijnen voor de jaarverslaggeving, Paragraph: 205|Chapter: 170, IssueDate: 2015-01-01, Name: Richtlijnen voor de jaarverslaggeving, Paragraph: 206|Chapter: A2, IssueDate: 2015-01-01, Name: Richtlijnen voor de jaarverslaggeving voor kleine rechtspersonen, Paragraph: 213"
145;"bank-abstracts:BalanceSheetDisclosureTitle";1;"Balance sheet disclosure title";"Toelichting op de balans";"";"BalanceSheetDisclosureTitle";"bank-abstracts";"BalanceSheetDisclosureTitle";"https://www.sbrbanken.nl/BT2016/report/bank/abstracts/bank-abstracts#BalanceSheetDisclosureTitle";"xbrli:item";1;0;0;;"0";"0";"0";"0";"xbrli:stringItemType";"string";"xbrli:stringItemType";"Abstract";"0";;;;;;;;;;;;"Duration";"None";1;0;"";"";"";"";""
146;"bank-abstracts:AssetsDisclosureTitle";2;"   Assets disclosure title";"   Activa, toelichting";"";"AssetsDisclosureTitle";"bank-abstracts";"AssetsDisclosureTitle";"https://www.sbrbanken.nl/BT2016/report/bank/abstracts/bank-abstracts#AssetsDisclosureTitle";"xbrli:item";1;0;0;;"0";"0";"0";"0";"xbrli:stringItemType";"string";"xbrli:stringItemType";"Abstract";"0";;;;;;;;;;;;"Duration";"None";1;0;"";"";"";"";""
147;"venj-bw2-i:IntangibleAssetsDisclosure";3;"      Intangible assets, disclosure";"      Immateriële vaste activa, toelichting";"";"IntangibleAssetsDisclosure";"venj-bw2-i";"IntangibleAssetsDisclosure";"http://www.nltaxonomie.nl/10.0/basis/venj/items/venj-bw2-data#IntangibleAssetsDisclosure";"xbrli:item";1;0;0;;"0";"0";"0";"0";"xbrli:stringItemType";"string";"xbrli:stringItemType";"String";"0";;;;;;;;;;;;"Duration";"None";0;0;"";"";"";"De toelichting op de immateriële vaste activa.";"Article: 362, IssueDate: 2015-01-01, Name: Burgerlijk wetboek boek 2, Paragraph: 2|Chapter: 210, IssueDate: 2015-01-01, Name: Richtlijnen voor de jaarverslaggeving, Paragraph: 501|Chapter: 300, IssueDate: 2015-01-01, Name: Richtlijnen voor de jaarverslaggeving, Paragraph: 106|Chapter: B18, IssueDate: 2015-01-01, Name: Richtlijnen voor de jaarverslaggeving voor kleine rechtspersonen, Paragraph: 105|Chapter: B1, IssueDate: 2015-01-01, Name: Richtlijnen voor de jaarverslaggeving voor kleine rechtspersonen, Paragraph: 119"
148;"venj-bw2-i:PropertyPlantEquipmentDisclosure";3;"      Property, plant and equipment, disclosure";"      Materiële vaste activa, toelichting";"";"PropertyPlantEquipmentDisclosure";"venj-bw2-i";"PropertyPlantEquipmentDisclosure";"http://www.nltaxonomie.nl/10.0/basis/venj/items/venj-bw2-data#PropertyPlantEquipmentDisclosure";"xbrli:item";1;0;0;;"0";"0";"0";"0";"xbrli:stringItemType";"string";"xbrli:stringItemType";"String";"0";;;;;;;;;;;;"Duration";"None";0;0;"";"";"";"De toelichting op de vermelde materiële vaste activa.";"Article: 362, IssueDate: 2015-01-01, Name: Burgerlijk wetboek boek 2, Paragraph: 2|Chapter: 212, IssueDate: 2015-01-01, Name: Richtlijnen voor de jaarverslaggeving, Paragraph: 701"
149;"rj-i:PurchasePropertyPlantAndEquipment";4;"         Purchase of property, plant and equipment";"         Investeringen in materiële vaste activa";"";"PurchasePropertyPlantAndEquipment";"rj-i";"PurchasePropertyPlantAndEquipment";"http://www.nltaxonomie.nl/10.0/basis/rj/items/rj-data#PurchasePropertyPlantAndEquipment";"xbrli:item";1;0;0;;"0";"0";"0";"0";"nl-types:monetaryNoDecimalsItemType";"monetaryNoDecimals";"nl-types:monetary20ItemType";"Monetary";"0";"";"";"0";"";"";"";"";"";"";"";"";"Duration";"Credit";0;0;"";"";"";"De investeringen in materiële vaste activa.";"Chapter: 360, IssueDate: 2015-01-01, Name: Richtlijnen voor de jaarverslaggeving, Paragraph: 217"
150;"bank:ReplacementPurchasePropertyPlantAndEquipment";5;"            Replacement purchase of property, plant and equipment";"            Vervangingsinvesteringen materiële vaste activa";"";"ReplacementPurchasePropertyPlantAndEquipment";"bank";"ReplacementPurchasePropertyPlantAndEquipment";"https://www.sbrbanken.nl/BT2016/basis/bank/items/bank#ReplacementPurchasePropertyPlantAndEquipment";"xbrli:item";1;0;0;;"0";"0";"0";"0";"nl-types:monetaryNoDecimalsItemType";"monetaryNoDecimals";"nl-types:monetary20ItemType";"Monetary";"0";"";"";"0";"";"";"";"";"";"";"";"";"Duration";"Credit";0;0;"";"De investeringen in materiële vaste activa ter vervanging van bestaande materiële vaste activa.";"";"De investeringen in materiële vaste activa ter vervanging van bestaande materiële vaste activa.";""
151;"bank:ExpansionPurchasePropertyPlantAndEquipment";5;"            Expansion purchase of property, plant and equipment";"            Uitbreidingsinvesteringen materiële vaste activa";"";"ExpansionPurchasePropertyPlantAndEquipment";"bank";"ExpansionPurchasePropertyPlantAndEquipment";"https://www.sbrbanken.nl/BT2016/basis/bank/items/bank#ExpansionPurchasePropertyPlantAndEquipment";"xbrli:item";1;0;0;;"0";"0";"0";"0";"nl-types:monetaryNoDecimalsItemType";"monetaryNoDecimals";"nl-types:monetary20ItemType";"Monetary";"0";"";"";"0";"";"";"";"";"";"";"";"";"Duration";"Credit";0;0;"";"De investeringen in materiële vaste activa als uitbreiding op de materiële vaste activa.";"";"De investeringen in materiële vaste activa als uitbreiding op de materiële vaste activa.";""
152;"venj-bw2-i:FinancialAssetsDisclosure";3;"      Financial assets, disclosure";"      Financiële vaste activa, toelichting";"";"FinancialAssetsDisclosure";"venj-bw2-i";"FinancialAssetsDisclosure";"http://www.nltaxonomie.nl/10.0/basis/venj/items/venj-bw2-data#FinancialAssetsDisclosure";"xbrli:item";1;0;0;;"0";"0";"0";"0";"xbrli:stringItemType";"string";"xbrli:stringItemType";"String";"0";;;;;;;;;;;;"Duration";"None";0;0;"";"";"";"De toelichting op de  financiële vaste activa.";"Article: 362, IssueDate: 2015-01-01, Name: Burgerlijk wetboek boek 2, Paragraph: 2|Chapter: 214, IssueDate: 2015-01-01, Name: Richtlijnen voor de jaarverslaggeving, Paragraph: 601|Chapter: 300, IssueDate: 2015-01-01, Name: Richtlijnen voor de jaarverslaggeving, Paragraph: 106|Chapter: B18, IssueDate: 2015-01-01, Name: Richtlijnen voor de jaarverslaggeving voor kleine rechtspersonen, Paragraph: 105"
153;"bank-abstracts:CurrentAssetsDisclosureTitle";3;"      Current assets disclosure title";"      Vlottende activa, toelichting";"";"CurrentAssetsDisclosureTitle";"bank-abstracts";"CurrentAssetsDisclosureTitle";"https://www.sbrbanken.nl/BT2016/report/bank/abstracts/bank-abstracts#CurrentAssetsDisclosureTitle";"xbrli:item";1;0;0;;"0";"0";"0";"0";"xbrli:stringItemType";"string";"xbrli:stringItemType";"Abstract";"0";;;;;;;;;;;;"Duration";"None";1;0;"";"";"";"";""
